romanized	name_jp	text_jp	name_en	text_en	name_zh-CN	text_zh-CN	name_zh-TW	text_zh-TW
Resna	レスナ	よし、できた！	Resna	There, finished!	蕾斯娜	好，完成了！	蕾斯娜	好，完成了！
Valeria	ヴァレリア	……ふう。よかった	Valeria	Phew, thank goodness.	瓦莱莉娅	……呼，太好了。	瓦萊莉婭	……呼，太好了。
Wilbell	ウィルベル	ほほー、これが冷気の爆弾ね	Wilbell	Oh, so that's a chilling bomb?	薇尔贝儿	哦，这就是冷气炸弹啊。	薇爾貝兒	哦～這就是寒氣炸彈啊。
Nio	ニオ	この中に冷気が凝縮されてるんですね	Nio	It's got cooled, condensed air inside, right?	妮欧	里面凝缩了冷气呢。	妮歐	寒氣被凝聚在裡面呢。
Izana	イザナ	"運動して身体が熱い～ってなったときにも
使えたりしないかな？"	Izana	Could I use it if, say, I was feeling really warm after a workout?	伊札娜	运动完想给身体降降温的时候能用它吗？	伊札娜	"如果運動結束後覺得全身發熱，
也可以使用嗎？"
Resna	レスナ	多分、一瞬で身体が凍り付いちゃうと思う……	Resna	Um, I think it might turn your whole body into ice.	蕾斯娜	那恐怕瞬间就会把你整个人冻住……	蕾斯娜	身體可能會瞬間結凍……
Regina	レジナ	溶岩冷やすくらいの威力だもんねえ	Regina	Since it's strong enough to freeze lava and all.	瑞吉娜	毕竟它的威力可是足以冷却熔岩啊。	瑞吉娜	畢竟它的威力足以讓岩漿冷卻嘛。
Heidi	ハイディ	んじゃ早速、威力のほどを見てみるとしますかね	Heidi	Okay! Let's go see this thing in action!	海蒂	那就赶快试试它有多厉害吧。	海蒂	那就快點讓大家見識它的威力吧。
Resna	レスナ	そうですね。ハイディさん、案内お願いします！	Resna	Yeah! Lead the way, Heidi!	蕾斯娜	好啊。海蒂小姐，麻烦你带路了！	蕾斯娜	說得也是。海蒂小姐，麻煩妳帶路了！
