romanized	name_jp	text_jp	name_en	text_en	name_zh-CN	text_zh-CN	name_zh-TW	text_zh-TW
Ryza	ライザ	"あ、来た。待ってたよ、レスナ！
例の依頼、受けに来たんでしょ？"	Ryza	There you are, Resna! I've been waiting for you! You're here to take on that request, right?	莱莎	"啊，来了。等你好久了，蕾斯娜！
你是来接那个委托的对吧？"	萊莎	"啊，來了。我等妳很久了，蕾斯娜！
妳是來承接那份委託的吧？"
Resna	レスナ	"はい。ルクルク州からの、指名の依頼があるそうですが
どんな内容ですか？"	Resna	Yep! I heard that Lukluk Province asked for me specifically, but what do they need help with?	蕾斯娜	"是的。听说路克尔克州那边
有指名要我去的委托，内容是？"	蕾斯娜	"對。聽說有份來自盧庫魯克州，還指名要我處理的委託，
那是什麼樣的內容呢？"
Ryza	ライザ	"この頃、ルクルク州の峡谷地帯で、
落石事故が相次いで起こってるらしいんだよね"	Ryza	Lately, there's been a series of landslides in the canyon.	莱莎	最近路克尔克州的峡谷地带发生了多起落石事故。	萊莎	"這陣子在盧庫魯克州的峽谷地帶
接連發生了落石意外。"
Ryza	ライザ	"すでに負傷者も何人か出てて、
これ以上大きな被害が出る前に対策してほしいみたい"	Ryza	That's led to a bunch of injured people, so they want to figure out a way to prevent a worse disaster from happening.	莱莎	"目前已经有数人受伤。对方希望尽快采取措施，
避免更多的伤亡。"	萊莎	"已經有幾個人受傷了，他們希望在發生
更嚴重的災情之前找出解決的對策。"
Resna	レスナ	"なるほど。事故の原因を突き止めて、
落石が起こらないようにすればいいんですね"	Resna	That makes sense. If we can pinpoint the cause, then we can help stop the landslides.	蕾斯娜	"原来如此。只要查明事故原因，
解决落石问题就可以了对吧。"	蕾斯娜	"原來如此。只要查出原因，
阻止落石意外繼續發生就可以了吧？"
Ryza	ライザ	"そういうこと。こんな時こそ錬金術士の出番だよね。
ってことで、今回の依頼はあたしも同行するよ"	Ryza	And that sort of fix calls for an alchemist! More than one, actually, because I'll be joining you.	莱莎	"没错。这种时候就该炼金术士出场啦。
所以说，这次委托我也会一起去。"	萊莎	"沒錯，這種時候就輪到鍊金術士出場了。
所以，這次的委託我也會一起同行。"
Resna	レスナ	えっ、ライザ先輩が！？	Resna	Huh? You will?!	蕾斯娜	咦，莱莎前辈也去吗？！	蕾斯娜	咦？萊莎前輩也會去嗎！？
Ryza	ライザ	"へへっ。ルクルク州には行ったことがないからさ、
どんな所か気になっちゃって"	Ryza	Hehe. I've never been to Lukluk before, so I want to see what kind of place it is.	莱莎	"嘿嘿。因为我没去过路克尔克州嘛，
很好奇那里是个怎样的地方。"	萊莎	"嘿嘿。我還沒去過盧庫魯克州，
很好奇那裡是什麼樣的地方。"
Resna	レスナ	"わあ、ライザ先輩が一緒なんて心強いです！
ぜひとも、よろしくお願いいたしますっ"	Resna	Yay! Having you around would be really reassuring, Ryza! I can't wait to tackle this one together!	蕾斯娜	"哇，有莱莎前辈在也太让人安心了！
还请多多关照。"	蕾斯娜	"哇，有萊莎前輩一起同行真令人安心！
還請妳多多指教了！"
Ryza	ライザ	うん、こちらこそ！	Ryza	Thanks, me too!	莱莎	嗯，也请你多多关照！	萊莎	嗯，彼此彼此！
Ryza	ライザ	"……実を言うと、ついていきたい理由が
もう一つあるんだよね"	Ryza	But to be honest, I actually do have a decent reason to tag along.	莱莎	其实……我想去那里还有另一个理由。	萊莎	……老實說，我想跟妳去還有一個理由。
Ryza	ライザ	"最近、うちに来てる錬金術士宛ての
依頼が取り下げられるってことが多いんだ"	Ryza	A lot of people have been coming by lately to withdraw their requests for alchemist help.	莱莎	"最近，有很多顾客取消了
我们这里的炼金术士的委托。"	萊莎	"最近我這裡有很多
要給鍊金術士的委託都被撤回了。"
Resna	レスナ	それって……この間の事件の影響、ですよね	Resna	That's...not too surprising, after what happened.	蕾斯娜	是因为……那件事的影响对吧。	蕾斯娜	那是因為……受到上次事件的影響，對吧？
Ryza	ライザ	"うん。錬金術は危ないんじゃないかって考えてる人が
結構いるみたい。仕方ないとはいえ、寂しいよね……"	Ryza	Yeah. I know it's not surprising that some people think alchemists are dangerous, but it makes me kind of sad.	莱莎	"嗯。似乎有很多人在质疑炼金术的安全性。
虽然我能理解，但还是会觉得失落……"	萊莎	"嗯。似乎有不少人都覺得鍊金術很危險。
雖然這是沒辦法的事，但還是讓人難過……"
Ryza	ライザ	"だからこそ、こうやって錬金術士を信じて頼ってくれる
人のために、あたしも頑張りたいなと思ってさ"	Ryza	So I want to do everything I can for the folks who are putting their trust in us.	莱莎	"正因如此，为了仍旧相信炼金术士的人们，
我想要出一份力！"	萊莎	"正因為如此，我才想要為了這些相信鍊金術士，
並願意委託我們的人而努力。"
Resna	レスナ	右に同じくです！	Resna	Yeah! Me too!	蕾斯娜	我也是！	蕾斯娜	我也一樣！
Lara	ララ	"――まあ、なんということでしょう！
信じられませんわ！"	Lara	My word! I simply cannot believe this!	拉拉	天啊！真令人难以置信！	拉拉	──哎呀，這真是太驚人了！不敢置信！
Izana	イザナ	ん？　今の声って……	Izana	Hm? Was that...?	伊札娜	咦？刚才的声音是……？	伊札娜	嗯？那個聲音是……
Lara	ララ	"これほどまで美味なパイは、
わたくし食べたことがありませんわ！"	Lara	I have never had a pie even half as delicious as this!	拉拉	我从未品尝过这么美味的派！	拉拉	我從沒吃過如此美味的派！
Rorona	ロロナ	えへへ……ありがとうございます	Rorona	Ehehe... Thank you!	萝乐娜	嘿嘿……谢谢夸奖。	蘿樂娜	嘿嘿……謝謝妳。
Lara	ララ	"ロロライナ・フリクセルさん。
その才能、わたくしのために使いませんこと？"	Lara	Miss Rorolina Frixell. Would you care to lend me your brilliance?	拉拉	"萝乐莱娜·菲立克塞尔小姐，
你愿意让你的天赋为我所用吗？"	拉拉	"蘿樂萊娜‧菲立克塞爾，
妳的才能可以為我所用嗎？"
Rorona	ロロナ	へっ？	Rorona	Sorry?	萝乐娜	啊？	蘿樂娜	咦？
Lara	ララ	"あなたをララ・キングダムのパイ職人として
お迎えいたしますわ！"	Lara	The Kingdom of Lara requires the services of such a splendid patissiere!	拉拉	我要聘请你做拉拉王国的烤派师傅！	拉拉	我想邀請妳成為拉拉王國的烤派師傅！
Rorona	ロロナ	ふぇぇっ！？	Rorona	Huuuh?!	萝乐娜	咦？！	蘿樂娜	什麼！？
Resna	レスナ	"あの、ララさん。ロロナ先輩も錬金術士なので
パイ職人というのは……"	Resna	Um, Lara? Rorona's an alchemist too, so she's not just a pie maker.	蕾斯娜	"那个，拉拉小姐，萝乐娜前辈也是一名炼金术士，
让她做烤派师傅有点……"	蕾斯娜	"那個、拉拉小姐。蘿樂娜前輩也是名鍊金術士，
做烤派師傅有點……"
Lara	ララ	では、錬金術士兼パイ職人として……	Lara	Very well. The kingdom has plenty of room for a patissiere who moonlights as an alchemist, or vice versa.	拉拉	那就做炼金术士兼烤派师傅……	拉拉	那麼，就當鍊金術士兼烤派師傅……
Geron	ジェロン	"おい……ララ、それぐらいにしておけ。
ここに来た目的を忘れたのか？"	Geron	Save the recruiting for later, Lara. Or did you already forget what we came here for?	杰隆	"喂……拉拉，差不多得了。
你忘了我们来这里的目的了吗？"	傑隆	"喂……拉拉，妳就適可而止吧。
妳忘記我們來這裡的目的了嗎？"
Lara	ララ	"ララ・キングダムの王として
常に自国のことを考えるのは当然でしてよ"	Lara	As queen, it's only natural that I should use every opportunity to bolster my kingdom's talents.	拉拉	"身为拉拉王国的国王，
当然要时刻心系王国的利益。"	拉拉	"我身為拉拉王國的君主，
時刻掛念自己的國家也是理所當然的吧。"
Lara	ララ	"……でも、そうですわね。
今は、その目的を優先いたしましょう"	Lara	Though, I suppose our original goal might trump that. For the time being.	拉拉	不过，你说得对……现在应该优先考虑那件事。	拉拉	"……不過，說的也是。
現在還是以我們的目的為優先吧。"
Lara	ララ	"レスナ、ロマン。ルクルク州には
わたくしとジェロンも同行いたしますわ"	Lara	Resna. Roman. Geron and I shall be accompanying you to Lukluk.	拉拉	"蕾斯娜，罗曼，
我和杰隆也要一起去路克尔克州。"	拉拉	"蕾斯娜、羅曼。
我和傑隆要和你們一起前往盧庫魯克州。"
Resna	レスナ	おぉ！？	Resna	Whoa!	蕾斯娜	哦？！	蕾斯娜	哦！？
Geron	ジェロン	"依頼もそうだが、今の情勢を考えれば
戦力は一人でも多いほうがいいだろう"	Geron	Considering the circumstances, you'll need as many battle-ready companions as you can get.	杰隆	"考虑到委托内容和现在的情况，
战力应该是越多越好吧。"	傑隆	"考量到委託以及現在的情勢，
戰力還是越多越好吧。"
Roman	ロマン	"そうだね。極夜の錬金党のほうは動きがないとはいえ、
いつまた襲撃してくるか分からない"	Roman	That's true enough. The Polar Night Alchemists might be lying low for now, but who knows when they'll strike again?	罗曼	"是啊。虽说极夜的炼金党目前还没有动作，
但指不定什么时候又会发动袭击。"	羅曼	"也對。雖然極夜的鍊金黨那邊沒什麼動靜，
但不知道什麼時候又會來襲。"
Roman	ロマン	"特に、ある程度相手の手の内を知っている
君たちが一緒なら、我々も心強い"	Roman	And you already know most of their moves, which is even better. I couldn't think of better people to have joining us.	罗曼	"你们对对方的手段有一定程度的了解。
能和你们同行的话，我们也能放心不少。"	羅曼	"尤其是你們在某種程度上已掌握對方底牌，
如果能一起同行，我們也會比較安心。"
Resna	レスナ	"ララさん！　ジェロンさん！　その力、お借りします！
よろしくお願いいたします！"	Resna	Lara! Geron! We'd really appreciate it if you could lend us your strength!	蕾斯娜	"拉拉小姐！杰隆先生！
请借给我们力量！拜托了！"	蕾斯娜	"拉拉小姐！傑隆先生！
請助我們一臂之力吧！麻煩兩位了！"
Ryza	ライザ	"そうと決まれば早速、準備しないとね！
えーと、必要なものは……"	Ryza	Right! Now that that's all settled, we've got to start getting things ready! Let's see, we're going to need...	莱莎	"决定好了就早做准备吧！
我想想，要准备的有……"	萊莎	"既然決定好了，就得盡快準備才行！
我看看，需要的物品有……"
Roman	ロマン	"――イザナ。
この後、二人だけで話したいことがある"	Roman	Izana. There's something that I'd like to talk with you about, just between the two of us.	罗曼	——伊札娜，之后我有点事想和你单独商量。	羅曼	"──伊札娜。
在這之後，我有事情想和妳單獨談談。"
Izana	イザナ	えっ？	Izana	Huh?	伊札娜	嗯？	伊札娜	咦？
