romanized	name_jp	text_jp	name_en	text_en	name_zh-CN	text_zh-CN	name_zh-TW	text_zh-TW
Ryza	ライザ	"すごい、順調だね！　他にも依頼はいっぱいあるから
どんどん受けてくれると助かるよ！"	Ryza	You're burning right through those jobs! But we've still got tons, so keep taking them off our hands!	莱莎	"好棒，很顺利呢！除此之外还有很多，
你多接受委托也是帮我们的忙！"	萊莎	"真厲害，很順利呢！還有不少其他委託，
如果妳能不斷地接下工作，就太好了！"
Resna	レスナ	"分かりました！　貼り出してある依頼が
無くなっちゃうぐらい頑張りますね！"	Resna	You can count on me! I'll keep going until there's not a single job left on the board!	蕾斯娜	"好的！我会努力工作，
解决所有张贴的委托的！"	蕾斯娜	"沒問題！
我會努力把貼出來的委託都變不見的！"
Ryza	ライザ	"その意気だよ！　……っとと、そういえば
新しく来た依頼をまだ貼り出してなかったんだ"	Ryza	That's the spirit! Oh, that reminds me, I've got some new requests that I still haven't pinned up yet.	莱莎	"就是这股劲！啊……这么说来，
新收到的委托还没有贴出来。"	萊莎	"就是這股氣勢！……等等，這麼說來，
我還沒把新來的委託貼出來呢。"
Ryza	ライザ	"全部貼っちゃうから、ちょっと時間を潰して
戻ってきてくれる？"	Ryza	I'll go put them up, so why don't you come back in a bit?	莱莎	"我会全都贴出来的，在我张贴完委托之前，
你要不打发一下时间再回来？"	萊莎	"我會全部都貼出來的，
妳可以先去打發一下時間再回來嗎？"
