romanized	name_jp	text_jp	name_en	text_en	name_zh-CN	text_zh-CN	name_zh-TW	text_zh-TW
Crow	鴉	"はぁっ！
ち……敵の数が多いな"	Crow	Haah! Tch... Why are there so many?	鸦	"喝——！
啧……敌人太多了。"	烏鴉	"喝啊！
嘖……敵人的數量還真多。"
Crow	鴉	くっ……	Crow	Ngh...	鸦	唔……	烏鴉	唔……
Resna	レスナ	あ、あの	Resna	Um...	蕾斯娜	你、你听我说……	蕾斯娜	那、那個。
Crow	鴉	なんだ	Crow	What?	鸦	什么事。	烏鴉	怎樣？
Resna	レスナ	"傷の手当てをします。今のままだと
出口を見つける前に倒れてしまいますから"	Resna	Let me treat your wounds. If we don't do something, you'll collapse before we find an exit.	蕾斯娜	"让我帮你包扎伤口吧。
不然可能还没找到出口，你就会撑不住的。"	蕾斯娜	"我幫妳包紮。
再這樣下去，還沒找到出口妳就會倒下了。"
Crow	鴉	……分かった	Crow	...Fine.	鸦	……好吧。	烏鴉	……好吧。
Resna	レスナ	はい、これで大丈夫です	Resna	There, all done.	蕾斯娜	好了，这样就没问题了。	蕾斯娜	好，這樣就沒問題了。
Crow	鴉	礼は言わない	Crow	Don't expect thanks.	鸦	我不会感谢你的。	烏鴉	我不會道謝的。
Resna	レスナ	"構いません。その代わり、教えてください。
オリバーという方は何がしたいんですか？"	Resna	That's fine. Maybe you can tell me what Oliver wants with me instead?	蕾斯娜	"不用道谢，不过请你告诉我，
你所说的奥利弗究竟想做什么？"	蕾斯娜	"沒關係，但請妳告訴我，
那位奧利弗到底想做什麼呢？"
Crow	鴉	"……オリバー様は、お前の錬金術で
ご自身の病を治そうとしていらっしゃる"	Crow	Lord Oliver wants to use your alchemy to cure his illness.	鸦	"……奥利弗大人有病在身，
想找你用炼金术来治疗。"	烏鴉	"……奧利弗大人說，
他打算用妳的鍊金術來治療自己的病。"
Resna	レスナ	"病を？　そういう理由なら、こんな強引に
攫わなくても協力したかもしれないのに……"	Resna	His illness? If that's all he wants, why kidnap me? I might have helped if he asked...	蕾斯娜	"是为了治病啊？那你们不用这样强行抓人，
本来我也可能答应帮忙的……"	蕾斯娜	"治病？如果是這種理由，
不用這麼強硬地抓我，我應該也會幫忙的……"
Crow	鴉	"お前のお節介な仲間たちが許さないだろう。
それに……"	Crow	Your annoying comrades wouldn't allow it. Plus...	鸦	"你那些爱管闲事的伙伴才不会答应吧。
况且……"	烏鴉	妳那群愛管閒事的夥伴不會答應吧。況且……
Crow	鴉	"病を治した後は、オリバー様の若さを
取り戻すために錬金術を使わせるつもりだ"	Crow	After curing his illness, Lord Oliver wants to use alchemy to regain his youth.	鸦	"除了治病，我们还需要你使用炼金术，
让奥利弗大人恢复青春。"	烏鴉	"病治好後，
我還打算讓妳用鍊金術把奧利弗大人變年輕。"
Crow	鴉	"そのためには、どんな手を使ってでも
お前を連れていかなければならない"	Crow	In order to fulfill that, I must do whatever is needed to bring you to him.	鸦	为此，我会不择手段将你带回去。	烏鴉	"為此，無論使用任何手段，
我都必須帶妳走。"
Resna	レスナ	そんな一方的な……	Resna	That's all so one-sided...	蕾斯娜	真是任性妄为……	蕾斯娜	這樣太自私了……
Resna	レスナ	"でも……
あなたにとっては大切な方なんですね"	Resna	But I suppose...he's important to you?	蕾斯娜	不过……那个人对你来说一定非常重要吧。	蕾斯娜	不過……他對妳來說是很重要的人吧。
Crow	鴉	そうだ。あの方は私に――	Crow	Yes. He gave me everything—	鸦	没错。那位大人……	烏鴉	沒錯，那位大人對我──
	システム	――５年前	System	5 years ago...	系统	——5年前。	系統	──5年前。
Johanna	ヨハナ	ねぇ、私もすごいけど、おじいちゃんもすごいね	Johanna	Hey, hey! I know I'm amazing, but Grandpa, you're amazing too!	约翰娜	爷爷，我知道我很厉害，不过爷爷其实也很厉害吧。	約翰娜	爺爺，我雖然很厲害，但爺爺也很厲害吧？
	オリバー	どうした、急に？	Oliver	Oh? What brought this on?	奥利弗	怎么突然这么说？	奧利弗	怎麼突然問這個？
Johanna	ヨハナ	だって誰もがみんな、おじいちゃんに頭を下げてる	Johanna	Well, everyone bows when they see you.	约翰娜	因为我看到所有人都对爷爷点头哈腰啊。	約翰娜	因為每個人都會對爺爺低頭。
	オリバー	"あぁ。儂はヨハナみたいに強くはないが、
頭がいいからね。だから、みんながついてきてくれる"	Oliver	Indeed. I may not be strong like you, Johanna, but I'm smart. That is why people follow me.	奥利弗	"是啊，约翰娜，我虽然不如你那么身手矫健，
但脑袋很灵光，所以那些人都愿意追随我。"	奧利弗	"是啊，我雖然不像妳那麼強大，
但頭腦很聰明，所以大家都會跟隨我。"
	オリバー	"ヨハナも儂の言うことを聞いておけば、
間違いないからな"	Oliver	If you listen to me, I promise that I'll never lead you astray.	奥利弗	只要听我的话，你将来也会万事顺遂的。	奧利弗	約翰娜妳也是，只要照著我的話做，就不會有錯。
Johanna	ヨハナ	うん！	Johanna	Yeah!	约翰娜	嗯！	約翰娜	嗯！
	システム	――２年前	System	2 years ago...	系统	——2年前。	系統	──2年前。
	オリバー	"ヨハナ、お前には儂の組織で、
恐怖の象徴として働いてもらいたい"	Oliver	Johanna, I want you to be the symbol of fear in my organization.	奥利弗	"约翰娜，我希望你加入我的组织，
为我当一个恐怖的象征。"	奧利弗	"約翰娜，
我想讓妳在我的組織裡工作，成為恐懼的象徵。"
Johanna	ヨハナ	うん、いいよ！	Johanna	Sure, I can do that!	约翰娜	嗯，好啊！	約翰娜	嗯，好啊！
	オリバー	"組織の中では、上下関係があるから、
少し厳しい言葉使いをするけどな"	Oliver	But there's a hierarchy in the organization, so you'll need to start sounding harsher.	奥利弗	"组织当中上下级关系严格，
所以到时候要用比较严肃的说话方式。"	奧利弗	"但組織內有上下關係，
所以我對妳說話時會比較嚴厲就是了。"
Johanna	ヨハナ	"ええー……。でも、私がそうなれば、
おじいちゃん嬉しい？"	Johanna	Aww, that's no fun. But if I do that, will it make you happy?	约翰娜	"怎么这样……
不过，我答应的话，爷爷就会开心吗"	約翰娜	咦咦……不過，我照做的話，爺爺就會開心嗎？
	オリバー	こんなに嬉しいことはない	Oliver	Nothing would make me happier.	奥利弗	没有比这更开心的事了。	奧利弗	沒有比這更開心的事了。
Johanna	ヨハナ	しょうがないなー。でも、恐怖の象徴って？	Johanna	All right then. But what do you mean by symbol of fear?	约翰娜	好吧，真拿你没办法。不过恐怖的象征是什么啊？	約翰娜	真拿爺爺沒辦法～不過，恐懼的象徵是什麼？
	オリバー	"うむ。ヨハナは天才の上に、かわいすぎるからな。
その姿のままでは恐怖になりえまい"	Oliver	You're a genius, but you're also just too sweet at the moment. You wouldn't be feared as you are.	奥利弗	"唔……约翰娜不仅是个天才，长得还这么可爱，
你现在的样子可没法让人害怕。"	奧利弗	"嗯，妳雖然是天才，但太可愛了。
這副模樣是無法化為恐懼的。"
Johanna	ヨハナ	まぁーねぇー、うふふ	Johanna	Guess that's true. Hehe.	约翰娜	也还好啦，嘿嘿。	約翰娜	還好啦～呵呵。
	オリバー	"だから仮面を被るといい。
名前も印象的なものにしよう"	Oliver	So, you'll wear a mask and we'll give you a more imposing name.	奥利弗	"所以我希望你戴上面具，
还要取一个有冲击力的名字。"	奧利弗	"所以妳就戴上面具吧。
還要取個令人印象深刻的名字。"
Johanna	ヨハナ	――会の掟に背く者には……鴉の罰を与える	Johanna	Those who break the organization's rules...will face the punishment of Crow.	约翰娜	——违背会规之人……将由鸦给予惩处。	約翰娜	──違反會規者……烏鴉將給予懲罰。
	オリバー	"いいぞ、鴉。それでいい。
誰もがお前を恐怖するだろう"	Oliver	Excellent, Crow. That's perfect. Everyone will fear you.	奥利弗	"很好，鸦，这就对了。
无人不会对你心生畏惧。"	奧利弗	很好，烏鴉，就是這樣。我想任誰都會懼怕妳的。
Resna	レスナ	ヨハナ……それがあなたの本当の名前	Resna	Johanna? That's your real name?	蕾斯娜	约翰娜……这才是你的真名啊。	蕾斯娜	約翰娜……那就是妳真正的名字。
Crow	鴉	……忘れろ。今は捨てた名前だ	Crow	Forget it. That name is no more.	鸦	忘了它吧……我已经丢掉了那个名字。	烏鴉	……忘了吧，那是已被捨棄的名字。
Resna	レスナ	オリバーは、あなたのおじい様だったんですね	Resna	So Oliver is your grandfather?	蕾斯娜	奥利弗是你的爷爷啊。	蕾斯娜	原來奧利弗是妳的爺爺啊。
Crow	鴉	そうだ。あの方は私にすべてを与えてくれた	Crow	Yes. He gave me everything.	鸦	是的。我的一切都是那位大人赐予的。	烏鴉	沒錯，那位大人給予了我一切。
Resna	レスナ	"（前に海辺で戦った時に見せた、仮面の下の素顔。
　まるでわがままな子どもみたいだった）"	Resna	(When we fought by the sea and I got a look beneath the mask, she just looked like a wayward child.)	蕾斯娜	"（那次在海边战斗时，我看到了她面具下的真容。
　那时她看上去完全就是一个任性的孩子。）"	蕾斯娜	"（之前在海邊戰鬥時看到她面具底下的真面目，
　就像個任性的孩子一樣。）"
Resna	レスナ	"（鴉は……いや。「ヨハナ」は、根っからの悪人じゃ
　ないのかもしれない）"	Resna	(Perhaps Crow—or rather, Johanna—isn't as inherently evil as we thought.)	蕾斯娜	"（鸦……
　不，“约翰娜”或许并不是彻头彻尾的坏人。）"	蕾斯娜	"（烏鴉……不對，
　「約翰娜」的本性或許並不壞。）"
Resna	レスナ	"（この人はただ、オリバーという人の言うことを
　聞いているだけで……）"	Resna	(I think she's just following this Oliver's orders...)	蕾斯娜	（她只是在听那个奥利弗的命令行事……）	蕾斯娜	（這個人只是聽從那個叫奧利弗的人的指示而已。）
