romanized	name_jp	text_jp	name_en	text_en	name_zh-CN	text_zh-CN	name_zh-TW	text_zh-TW
Saskia	ザスキア	"ジュゲル州での活躍聞いたわよ。
頑張ったわね、レスナ"	Saskia	I heard about your success in Yuggel. You did well, Resna.	萨丝琪亚	"蕾斯娜，我听说了你在尤格鲁州的活跃表现。
干得漂亮。"	薩絲琪亞	"我聽說了妳在朱格爾州的表現喔。
妳很努力呢，蕾斯娜。"
Resna	レスナ	"師匠！
ありがとうございます！"	Resna	Miss Saskia! Thank you!	蕾斯娜	"师父！
谢谢师父鼓励！"	蕾斯娜	師父！多謝誇獎！
Valeria	ヴァレリア	"レスナね、めちゃくちゃ頑張ってたわよ！
苦手な虫だって克服しようとして……"	Valeria	Resna really gave it her all! She even tried to face her fear of bugs...	瓦莱莉娅	"蕾斯娜这次真的非常努力了！
她还逼着自己去面对最害怕的虫子……"	瓦萊莉婭	"蕾斯娜她真的很拚命喔！
甚至還試著努力克服自己討厭的蟲子……"
Resna	レスナ	"あー！　虫の話はもうやめてぇ！
思い出すと、背中がゾワゾワしちゃうよぉ！"	Resna	Ah! No more talking about bugs! Just thinking about them gives me the creeps now!	蕾斯娜	"啊——！不要再提虫子啦！
想想就浑身发毛！"	蕾斯娜	啊～！別再提蟲子了！想起來就背後發毛！
Resna	レスナ	"（ジュゲル州の密林で大量発生した魔物の
　討伐依頼を受けた私……）"	Resna	(I accepted a request to exterminate the massive plague of monsters in the jungles of Yuggel.)	蕾斯娜	"（听闻尤格鲁州密林里出现大量魔物后，
　我接受了讨伐它们的委托……）"	蕾斯娜	"（我接到委託，
　前往朱格爾州密林討伐大量湧現的魔物……）"
Resna	レスナ	"（密林には虫も大発生していると聞いて、初めは
　悩んだけれど、苦手を克服するために頑張った）"	Resna	(I was worried at first because I heard there were also swarms of insects in the jungle, but I decided to face my fear.)	蕾斯娜	"（得知那里的虫子也急剧增加后，
　我一开始很为委托犯愁，但还是努力克服了弱点。）"	蕾斯娜	"（聽說密林裡也出現了很多蟲子，一開始我相當猶豫。
　但是為了克服弱點，我還是接受了。）"
Resna	レスナ	"（そんな中、密林では思いがけない事件が発生。
　この頃、勢力を増している月影の会との遭遇……）"	Resna	(While in the jungle, an unexpected incident occurred: we encountered the Moonlight Society, which had been expanding its influence.)	蕾斯娜	"（在解决委托的过程中，发生了意想不到的状况——
　我们在密林里跟最近势力大增的月影会不期而遇……）"	蕾斯娜	"（就在這時，密林發生了意想不到的事件。
　我遇到了勢力日漸茁壯的月影會……）"
Resna	レスナ	"（リラさんが調査している極夜の錬金党の不穏な動きも
　並行して追ってみることになった）"	Resna	(At the same time, we decided to keep an eye on the suspicious activities of the Polar Night Alchemists that Lila was investigating.)	蕾斯娜	"（同时，我们也对莉拉小姐正在调查的
　极夜的炼金党的可疑动向展开了追踪。）"	蕾斯娜	"（於是我決定和莉拉小姐一樣，
　試著同時調查極夜的鍊金黨的可疑舉動。）"
Resna	レスナ	"（結果……極夜の錬金党は、赤のほうき星について
　調査をしているという新たな情報を得た）"	Resna	(And in the end, we learned that the Polar Night Alchemists were investigating the Red Comet.)	蕾斯娜	"（通过追踪，我们了解到极夜的炼金党正在调查
　红色彗星的相关事宜。）"	蕾斯娜	"（結果……我得到了新的情報，
　極夜的鍊金黨正在調查有關紅色彗星的事。）"
Saskia	ザスキア	"……赤のほうき星。かつて、ジュゲル州に
落ちたといわれているわね"	Saskia	The Red Comet... It is said to have fallen in Yuggel a very long time ago.	萨丝琪亚	"红色彗星……
那是相传很久以前坠落在尤格鲁州的星星。"	薩絲琪亞	……據說紅色彗星曾墜落在朱格爾州，對吧？
Resna	レスナ	"密林の奥に何もない場所がありました。
……本当に、何もなかったんです"	Resna	We found a place deep in the jungle where there was nothing left. Really, there was just nothing there.	蕾斯娜	"在密林深处有一片空无一物的地方……
那里是真的什么都没有。"	蕾斯娜	"密林深處有一片荒蕪的土地。
……真的，那裡什麼都沒有。"
Valeria	ヴァレリア	"あれには驚いたわよね。
あんな景色、今まで見たことないわ"	Valeria	It was quite the sight. Never seen anything quite like it.	瓦莱莉娅	"我们当时都惊呆了。
从来没见过那样的场面。"	瓦萊莉婭	那畫面真的很驚人，我至今從未見過那樣的景象。
Saskia	ザスキア	"あなたたちは、赤のほうき星が
落ちた場所を見たのね"	Saskia	So, you saw the place where the Red Comet fell.	萨丝琪亚	你们看到的是红色彗星坠落的地点。	薩絲琪亞	看來妳們已經看過紅色彗星墜落的地方了。
Saskia	ザスキア	"……白きほうき星は赤く変心し、
様々な災厄をもたらした"	Saskia	The White Comet turned Red and brought forth disaster.	萨丝琪亚	"白色彗星变为赤红色，
带来了诸多灾祸。"	薩絲琪亞	……白色彗星變心為紅色，帶來了各種災厄。
Saskia	ザスキア	だが、九人の偉人の奇跡によって世界は救われた	Saskia	However, the world was saved by the miracles of nine great heroes.	萨丝琪亚	但是，有九位伟人创造奇迹，拯救了世界。	薩絲琪亞	不過，有九位偉人創造奇蹟，拯救了世界。
Resna	レスナ	"恵みを与えてくれるほうき星とは違う
赤のほうき星の存在……"	Resna	A comet very different from the one that brings blessings... The Red Comet.	蕾斯娜	"除了带给世间恩泽的彗星，
还有带来灾祸的红色彗星……"	蕾斯娜	與帶來恩惠的彗星完全不同的紅色彗星……
Resna	レスナ	"実際にこの目で見るまで確信は持てませんでしたが……
やっぱり、あの伝承は本当なのかもって思うんです"	Resna	I wasn't sure it existed until I saw it with my own eyes, but now I believe those legends might be true.	蕾斯娜	"因为没有亲眼见到，我至今将信将疑……
不过这样看来，那个传说又多了几分真实性啊。"	蕾斯娜	"在親眼看到之前我還不太相信……
但是，現在我覺得那個傳聞可能是真的。"
Saskia	ザスキア	"レスナも気付いていると思うけれど、
この伝承には果ての大陸の名が出てくるわ"	Saskia	As I'm sure you've noticed, Resna, the legend also mentions the World's End.	萨丝琪亚	"蕾斯娜，相信你也注意到了，
这个传说还提到了终极大陆。"	薩絲琪亞	蕾斯娜妳應該也有注意到，這個傳聞提到了終極大陸。
Saskia	ザスキア	"これは、果ての大陸を見つける
重要な手掛かりの１つだと思うの"	Saskia	I believe this might be an important clue to finding the World's End.	萨丝琪亚	所以我认为它是寻找终极大陆的重要线索之一。	薩絲琪亞	我認為這是找到終極大陸的一項重要線索。
Resna	レスナ	"果ての大陸と赤のほうき星……そして、九偉人。
いったいどんな関係があるんでしょうか"	Resna	The World's End, the Red Comet, and the Miraculous Nine. What could the connection be?	蕾斯娜	"终极大陆、红色彗星、九伟人……
这些事物之间究竟有着怎样的关联？"	蕾斯娜	"終極大陸和紅色彗星……還有九偉人。
這之間究竟有什麼關聯呢？"
Valeria	ヴァレリア	…………	Valeria	...	瓦莱莉娅	…………	瓦萊莉婭	…………
Valeria	ヴァレリア	……くっ！　痛……	Valeria	Ugh! My head...	瓦莱莉娅	啊！好疼……	瓦萊莉婭	……唔！好痛……
Resna	レスナ	ヴァレリア？	Resna	Valeria?	蕾斯娜	瓦莱莉娅？	蕾斯娜	瓦萊莉婭？
Valeria	ヴァレリア	"ええ、大丈夫……ちょっと頭痛がしただけ。
柄にもなく、難しいこと考えてたからかしら"	Valeria	I'm fine... Just a little headache. I guess I'm not used to thinking so hard.	瓦莱莉娅	"啊，我没事……只是头突然疼了一下。
大概要怪我反常地思考了这些复杂的事情吧。"	瓦萊莉婭	"嗯，我沒事……只是有點頭痛。
大概是因為做了不擅長的腦力活吧。"
Valeria	ヴァレリア	っ……	Valeria	Ugh...	瓦莱莉娅	唔……	瓦萊莉婭	唔……
