file	id	romanized_name	localized_name	text	localized_name_en	text_en	localized_name_zh-CN	text_zh-CN	localized_name_zh-TW	text_zh-TW
TalkEvent_15_031ID	26	Ludmila	ルドミラ	だから、今のままの状態であなたが誕生したのなら\n子供の頃の記憶なんていうのも、ない	Ludmila	Beings birthed in such a way would have no recollection of how they came to be nor any memory of a childhood.	露德米拉	所以，若你自诞生之时起便是现在这个状态的话，\n就不可能拥有什么童年的记忆了。	露德米拉	因此，如果妳誕生時就是現在這樣的狀態，\n那當然就不會有小時候的記憶。
TalkEvent_15_031ID	27	Valeria	ヴァレリア	私が「ホムンクルス」……？	Valeria	I'm a homunculus?	瓦莱莉娅	我是“荷蒙克鲁斯”……？	瓦萊莉婭	我是「荷蒙克魯斯」……？
TalkEvent_15_031ID	28	Valeria	ヴァレリア	確かに、私は子供の頃の記憶がない。\n親の顔だって分からない。でも、だからって……	Valeria	Sure, I don't know what I was like as a kid, and I can't remember what my parents looked like, but...	瓦莱莉娅	我确实没有童年的记忆，\n也不记得父母的长相。但这并不意味着……	瓦萊莉婭	我的確沒有小時候的記憶，也不知道父母的長相。\n可是，就算這樣……
TalkEvent_15_031ID	29	Ludmila	ルドミラ	ホムンクルスには、他にも人間との差異があるわ	Ludmila	Homunculi are not like most people.	露德米拉	荷蒙克鲁斯和人类还有其他不同之处。	露德米拉	荷蒙克魯斯還有其他跟人類不同的地方。
TalkEvent_15_031ID	30	Ludmila	ルドミラ	造られた存在だからこそ成し得る、\n人間離れした身体能力	Ludmila	They are capable of physical feats that normal humans could only dream of achieving.	露德米拉	它们是人造的生命体，\n因此拥有远超常人的身体能力……	露德米拉	正因為是創造出來的身體，\n才有辦法擁有超乎常人的體能。
TalkEvent_15_031ID	31	Ludmila	ルドミラ	そして、超人的な回復力	Ludmila	They also have extraordinary healing abilities.	露德米拉	以及非凡的自愈能力。	露德米拉	還有超人般的回復力。
TalkEvent_15_031ID	32	Valeria	ヴァレリア	――！	Valeria	...!	瓦莱莉娅	――！	瓦萊莉婭	──！
TalkEvent_15_031ID	33	Ludmila	ルドミラ	環境への適応力も高い。普通の人間にとっては過酷な\n場所でも、平然と活動することができる	Ludmila	They adapt well to changes in their environments, too. Moving about in a harsh location would be a walk in the park for a homunculus.	露德米拉	它们对环境的适应能力也极强，\n能在对常人而言恶劣的环境下依旧活动自如。	露德米拉	對環境的適應力也很強，即使身處對一般人來說\n很嚴酷的地方，也能面不改色地四處行動。
TalkEvent_15_031ID	34	Ludmila	ルドミラ	ホムンクルスは錬金術が生んだ産物だから、\nあるいは、錬金術に適性を示すこともあるかもしれない	Ludmila	Oh, and most have an aptitude for alchemy, I might add. Given the circumstances of their creation and all.	露德米拉	荷蒙克鲁斯身为炼金术的产物，\n因此有时还会在炼金术上展现出一定的天赋。	露德米拉	荷蒙克魯斯是鍊金術創造出的產物，\n所以說不定還具備鍊金術的才能。
TalkEvent_15_031ID	35	Valeria	ヴァレリア	…………	Valeria	...	瓦莱莉娅	……	瓦萊莉婭	…………
TalkEvent_15_031ID	36	Ludmila	ルドミラ	いくつか思い当たる節があるんじゃないかしら？\nそれに	Ludmila	Do any of those points ring true for you? Although, more importantly...	露德米拉	你是不是想起了许多与我的描述相符的经历？\n除此之外……	露德米拉	妳應該有些頭緒了吧？\n再者……
TalkEvent_15_031ID	37	Valeria	ヴァレリア	な、なに？	Valeria	Wh-What?	瓦莱莉娅	你、你还想说什么？	瓦萊莉婭	什、什麼？
TalkEvent_15_031ID	38	Ludmila	ルドミラ	やっぱり感じるわ。私になら分かる……	Ludmila	I can feel it.	露德米拉	我还感知到一件事，也只有我能感知……	露德米拉	果然有那種感覺。我察覺得到……
TalkEvent_15_031ID	39	Ludmila	ルドミラ	ヴァレリアの中には生命を動かしている\n核とも言える道具が埋まっている	Ludmila	Within you lies a tool—a core, as it were—that propels your very existence.	露德米拉	瓦莱莉娅，在你的体内埋藏着某种道具，\n那个道具可以说是驱动你生命活动的核心。	露德米拉	瓦萊莉婭體內埋藏著催動生命的道具，\n也可以說是核心。
TalkEvent_15_031ID	40	Ludmila	ルドミラ	その核が無事なら、あなたは何度でも立ち上がれる。\nもちろん適切な治療は必要でしょうけど	Ludmila	This enables you to rise again and again, so long as it remains intact. Of course, some level of maintenance is required as well.	露德米拉	只要那颗核心安然无恙，你便能无数次起死回生。\n不过当然还是需要一定程度的治疗。	露德米拉	只要那個核心沒事，妳就可以站起來無數次。\n當然還是需要適當的治療就是了。
TalkEvent_15_031ID	41	Ludmila	ルドミラ	あなたの言葉で言うと、体内に「オートマタ」の\n仕組みも一部入ってる、といったところね	Ludmila	To borrow your own words, part of you is automaton.	露德米拉	用你的话来说，\n你的体内有一部分“自动人偶”的构造。	露德米拉	用妳剛才提到的詞，\n就是體內有著一部分「自動人偶」的構造吧。
TalkEvent_15_031ID	42	Ludmila	ルドミラ	推察するに、あなたは戦闘用に造られたホムンクルス。\nあなたの好戦的な性格も、そう設計されたものでしょう	Ludmila	If I had to guess, you were built specifically for combat. Your belligerent nature is likely by design.	露德米拉	根据我的推测，你是被创造出来用于战斗的荷蒙克鲁斯。\n你那好战的天性也正是为此而设计的。	露德米拉	根據我的推測，妳是為戰鬥而造的荷蒙克魯斯。\n妳的好戰性格應該也是依如此需求設計的吧。
TalkEvent_15_031ID	43	Valeria	ヴァレリア	私が、造られた存在……	Valeria	I was...built?	瓦莱莉娅	我是……人造的生命……	瓦萊莉婭	我是創造出來的存在……
TalkEvent_15_031ID	44	Ludmila	ルドミラ	あなたも言っていたように、異邦人の中には\n特殊な生命の者達もいる	Ludmila	Now, that's nothing to be concerned about, Valeria.	露德米拉	如你先前所说，异邦人之中也存在特殊生命体。	露德米拉	就像妳剛才說過的，\n異邦人裡面也存在著特殊的生命體。
TalkEvent_15_031ID	45	Ludmila	ルドミラ	自分だけが違うと気に病む必要はないわ\nヴァレリア	Ludmila	You said it yourself—some wanderers have peculiar origins. You wouldn't be alone in this.	露德米拉	所以你无需为自己的特殊而介怀，瓦莱莉娅。	露德米拉	沒必要覺得只有自己不一樣而放在心上，\n瓦萊莉婭。
TalkEvent_15_031ID	46	Ludmila	ルドミラ	ただ問題は、自分がホムンクルスであること\nそのものじゃないのよね？	Ludmila	Oh, but that isn't the real issue, is it?	露德米拉	但问题不在于你是不是荷蒙克鲁斯，对吧？	露德米拉	只不過，問題不在於妳是荷蒙克魯斯\n這件事本身吧。
TalkEvent_15_031ID	47	Valeria	ヴァレリア	もしそうなら、私のやりたいことって……	Valeria	But then...my desires, what I want to do... They're...	瓦莱莉娅	如果真是你说的那样，那我想做的事……	瓦萊莉婭	如果是這樣的話，那我想做的事……
TalkEvent_15_031ID	48	Ludmila	ルドミラ	そう……	Ludmila	Yes, precisely.	露德米拉	没错……	露德米拉	沒錯……
TalkEvent_15_031ID	49	Ludmila	ルドミラ	友達を助けたいというあなたの想いも、\nそうなるように設計されたものに過ぎない	Ludmila	Your desire to help your friend is merely a manifestation of your innate programming.	露德米拉	你想帮助朋友的愿望，\n也不过是被设计出来的罢了。	露德米拉	妳想要幫助朋友的想法，\n也不過是設計而成的罷了。
TalkEvent_15_031ID	50	Valeria	ヴァレリア	嘘……！　嘘よ！	Valeria	No! You're lying!	瓦莱莉娅	不……！不可能！	瓦萊莉婭	不可能……！不會的！
TalkEvent_15_031ID	51	Valeria	ヴァレリア	そんなことって……	Valeria	That can't be true...	瓦莱莉娅	不可能是这样……	瓦萊莉婭	這種事……
TalkEvent_15_031ID	52	Ludmila	ルドミラ	でもね、ヴァレリア。\n私ならあなたを定められた道から解き放つことができる	Ludmila	But, Valeria... It doesn't need to be this way.	露德米拉	但是，瓦莱莉娅。\n我能让你脱离既定的道路，获得自由。	露德米拉	不過呢，瓦萊莉婭。\n我可以幫助妳脫離既定的道路。
TalkEvent_15_031ID	53	Ludmila	ルドミラ	それが、私の成すべきことだから	Ludmila	I can release you from those shackles—no, I must.	露德米拉	因为那便是我的职责。	露德米拉	因為這是我的使命。
TalkEvent_15_031ID	54	Valeria	ヴァレリア	え……	Valeria	Huh?	瓦莱莉娅	咦……	瓦萊莉婭	咦……
TalkEvent_15_031ID	55	Criselda	クリセルダ	私はクリセルダ――極夜の解放者よ	Criselda	I am Criselda, the Polar Night Liberator.	克莉赛尔达	我的名字是克莉赛尔达――极夜的解放者。	克莉賽爾達	我是克莉賽爾達──極夜的解放者。
TalkEvent_15_side_001ID	0	Ayesha	アーシャ	ふぅ……ほっとしますね。帰ってきたって気がします	Ayesha	Phew... There's something relieving about settling in back at home.	爱夏	嗯……真让人放松。有种家一般的感觉。	愛夏	呼……真舒服。終於感覺到自己回家了。
TalkEvent_15_side_001ID	1	Roman	ロマン	休暇は楽しめたかい？	Roman	Did you have fun on your trip?	罗曼	有好好享受休假吗？	羅曼	休假過得還開心嗎？
TalkEvent_15_side_001ID	2	Ayesha	アーシャ	はい。ソフィーちゃんとベルク州の高地まで採取に\n行ったんですけど、星空がすごく綺麗でしたよ！	Ayesha	Oh, yes! Sophie and I went to do some gathering on the plateau in Berg Province. The stars at night were just breathtaking!	爱夏	嗯。我和苏菲一起去了贝尔克州的高地采集素材，\n那里的星空真是太漂亮了！	愛夏	很開心哦。我和蘇菲一起去了貝魯克州的高地採集素材，\n那裡的星空非常漂亮！
TalkEvent_15_side_001ID	3	Roman	ロマン	それは何よりだよ。\nあそこは国内でも有数の景勝地だからね	Roman	I'm glad to hear it. That region has some of the best scenery in the country.	罗曼	真是太好了。\n那里可是国内数一数二的旅游胜地。	羅曼	那真是太好了，畢竟貝魯克州可是國內\n為數不多的觀光景點啊。
TalkEvent_15_side_001ID	4	Roman	ロマン	ちょうどレスナたちと行き違いになったのかな	Roman	It's a shame you just missed Resna and the others, though.	罗曼	不过你们好像正好和蕾斯娜她们错过了。	羅曼	不過妳們好像沒碰到蕾斯娜她們呢。
TalkEvent_15_side_001ID	5	Ayesha	アーシャ	え、レスナさんたちもベルク州に行っていたんですか	Ayesha	Hm? Did they head off to Berg too?	爱夏	嗯？蕾斯娜小姐她们也去了贝尔克州吗？	愛夏	咦？蕾斯娜小姐她們也去了貝魯克州嗎？
TalkEvent_15_side_001ID	6	Roman	ロマン	そうさ。しかも、そこで極夜の錬金党と\n戦いになったらしい	Roman	Indeed they did. And apparently, they got into a fight with the Polar Night Alchemists while they were at it.	罗曼	是啊。而且还在那里和极夜的炼金党打了一场。	羅曼	是啊，而且她們好像還在那裡\n與極夜的鍊金黨交戰。
TalkEvent_15_side_001ID	7	Ayesha	アーシャ	えっ、またですか？\nこのところ、動きが活発になってるような……	Ayesha	What, again? They certainly seem to be getting bolder by the day.	爱夏	什么，又来了？\n最近那些人好像越来越嚣张了……	愛夏	咦？又是他們？\n總覺得這陣子對方的行動越來越頻繁了……
TalkEvent_15_side_001ID	8	Roman	ロマン	その上、極夜の錬金党、ララが\nレスナに対して完全決着の場を設けると宣言したそうだ	Roman	Not to mention, Lara—another of their outspoken members—said that she'd settle things with Resna once and for all.	罗曼	而且极夜的炼金党的拉拉还告诉蕾斯娜，\n他们已经准备好了决战的场所。	羅曼	不僅如此，聽說隸屬極夜的鍊金黨的拉拉\n還表明要與蕾斯娜徹底做個了結。
TalkEvent_15_side_001ID	9	Ayesha	アーシャ	宣戦布告、ってことですか！？\nそんな、どうして……	Ayesha	Isn't that a blatant declaration of war?! Why would she go that far?	爱夏	是正式宣战的意思吗？！\n这是为什么……	愛夏	這是宣戰的意思嗎！？\n為什麼要這樣……？
TalkEvent_15_side_001ID	10	Roman	ロマン	彼女らにとってみれば、\n我々は邪魔者ということなのだろう	Roman	Well, I'd presume that both ladies see the other as a hindrance.	罗曼	对他们来说，我们可能很碍事吧。	羅曼	看來在她們眼中，\n我們幾個都是礙事的存在吧。
TalkEvent_15_side_001ID	11	Roman	ロマン	レスナは話し合いで和解したいと思っているだろうけど\nそれで済むような相手とも思えない	Roman	To be fair, Resna would much rather sort things out through a civilized discussion, but that only works when the other party is willing to listen.	罗曼	蕾斯娜一定希望能通过对话来解决问题，\n但对方应该不会理她。	羅曼	蕾斯娜大概想與對方好好談談並和解，\n但我不認為她會就此善罷干休。
TalkEvent_15_side_001ID	12	Ayesha	アーシャ	そうですね……。また戦いになるかも	Ayesha	I suppose so. There's likely going to be another battle, then.	爱夏	是啊……恐怕又不得不战斗了。	愛夏	是啊……或許之後又要開戰了。
TalkEvent_15_side_001ID	13	Roman	ロマン	そこでアーシャ、次の仕事を依頼したい。極夜の錬金党\nとの対決に備えて、治療薬を作ってほしいんだ	Roman	To that end, I have a request for you, Ayesha. I'd like you to make some restorative medicines in preparation for a showdown against the Polar Night Alchemists.	罗曼	所以爱夏，我想委托你一件事。\n为了准备和极夜的炼金党作战，请你做一些治疗药剂。	羅曼	所以愛夏，我想委託妳下一份工作。\n為了與極夜的鍊金黨對決，我希望妳幫忙做一些治療藥。
TalkEvent_15_side_001ID	14	Ayesha	アーシャ	治療薬、ですね。また、ウェルテックスの時のように\nたくさんの人が傷ついてしまうんでしょうか……	Ayesha	Ah, like healing salves and such. So many people were injured in the battle against Weltex... Does that mean you're anticipating another encounter like that?	爱夏	治疗药剂？\n又会有许多人受伤吗，像威尔特克斯之战那样……	愛夏	治療藥是嗎？會不會又有許多人在戰鬥中受傷呢？\n就像威爾特庫斯那時一樣……
TalkEvent_15_side_001ID	15	Roman	ロマン	極夜の錬金党は、そのウェルテックスの骸を奪い去った\n危険な存在だ。何を企んでいるか分かったものじゃない	Roman	They're a dangerous bunch, and they snatched up Weltex's remains for who knows what reason. Surely they must be scheming something.	罗曼	极夜的炼金党是一个危险的组织，\n他们夺走了威尔特克斯的遗骸，不知在谋划些什么。	羅曼	極夜的鍊金黨可是奪走了威爾特庫斯的遺骸，非常危險。\n也不曉得他們到底有何企圖。
TalkEvent_15_side_001ID	16	Roman	ロマン	当然、戦いを避けるために手は尽くすが、\n最悪の場合を考えておきたい	Roman	As much as I'd rather settle things without a fight, I'd like to be prepared for the worst.	罗曼	我们当然还是希望尽力避免战斗，\n但也要做好最坏的打算。	羅曼	當然，我會極力避免戰鬥，\n但我們也得做好最壞的打算。
TalkEvent_15_side_001ID	17	Ayesha	アーシャ	は、はい……！	Ayesha	R-Right!	爱夏	我、我知道了……！	愛夏	好、好的……！
TalkEvent_15_side_001ID	18	Roman	ロマン	まあ、戦いにならなかったとしても、治療薬なら\n備蓄としてあって困ることはないからね	Roman	Besides, it's never a bad idea to stock up on medicine.	罗曼	就算不会真的发生战斗，\n储备一点治疗药剂总也没坏处。	羅曼	不過，就算沒有與他們交戰，\n多備一些治療藥也不是什麼壞事。
TalkEvent_15_side_001ID	19	Ayesha	アーシャ	はい。それもそうですね。頑張ります！	Ayesha	Yes, that's true. I'll work my hardest at it!	爱夏	说得对。我会加油做的！	愛夏	好的，說得也是呢。那我會加油的！
TalkEvent_15_side_001ID	20	Roman	ロマン	ただ、君一人だとなかなか大変だろうから、\nもう一人くらい協力者を募りたい	Roman	That being said, it's a lot for just one person. I was thinking of asking someone else to lend a hand.	罗曼	不过一个人做起来恐怕会非常辛苦。\n我准备找个人来帮你的忙。	羅曼	不過，只有妳一個人準備應該會很辛苦，\n所以我想再找一個幫手。
TalkEvent_15_side_001ID	21	Roman	ロマン	私のほうで手配してもいいけれど、\nもし心当たりがあれば、指名してくれても構わないよ	Roman	I don't mind making the arrangements, but if there's an alchemist who you'd like to nominate for the position, that's fine by me.	罗曼	没问题的话我会自行安排，\n不过如果你心中有人选也可以跟我说。	羅曼	我能幫妳安排人手，但如果妳有合適的人選，\n也可以直接提出來沒關係。
TalkEvent_15_side_001ID	22	Ayesha	アーシャ	ええと、そうですね。それなら……	Ayesha	Oh, hm. In that case...	爱夏	嗯，那我想找……	愛夏	嗯，我想想哦。既然這樣的話……
TalkEvent_15_side_002ID	0	Ayesha	アーシャ	というわけで、ソフィーちゃんにお手伝いを\nお願いしたいんだ	Ayesha	So, I was hoping that you'd be able to help me with that, Sophie.	爱夏	事情就是这样，\n所以苏菲，我请罗曼先生安排你来帮我了。	愛夏	就是這麼一回事，\n所以我希望蘇菲妳可以協助我。
TalkEvent_15_side_002ID	1	Sophie	ソフィー	極夜の錬金党との対決に備えて……\nそんな大役、あたしでいいんですか？	Sophie	Stocking up for a showdown with the Polar Night Alchemists? Are you sure you want me working on a job that important?	苏菲	要为和极夜的炼金党对决备战了啊……\n这么重大的任务，找我真的合适吗？	蘇菲	為了與極夜的鍊金黨對決做準備……\n這麼重要的工作找我沒問題嗎？
TalkEvent_15_side_002ID	2	Ayesha	アーシャ	うん。ソフィーちゃんは極夜の錬金党とも\n戦ったことがあるしね	Ayesha	Of course! You've fought them before, haven't you?	爱夏	嗯，你和极夜的炼金党交过手对吧。	愛夏	嗯，畢竟蘇菲妳也曾經與極夜的鍊金黨交手過。
TalkEvent_15_side_002ID	3	Ayesha	アーシャ	この間、ベルク州に一緒に行った時も大活躍だったし！	Ayesha	And you were such a big help when we were out touring Berg!	爱夏	而且上次去贝尔克州的时候你也表现得很出色！	愛夏	還有前陣子一起去貝魯克州時，妳的表現也非常出色！
TalkEvent_15_side_002ID	4	Sophie	ソフィー	えへへ……ありがとうございます	Sophie	Ehehe, aw... thank you!	苏菲	嘿嘿……谢谢夸奖。	蘇菲	嘿嘿……謝謝妳。
TalkEvent_15_side_002ID	5	Sophie	ソフィー	あたしもアーシャさんとの採取や調合、\nすっごく楽しかったですよ	Sophie	I had a great time gathering materials and synthesizing with you too, Ayesha!	苏菲	那次和爱夏小姐一起采集调合，\n真是非常开心。	蘇菲	和愛夏小姐一起採集素材與調合時，\n我也覺得很開心哦。
TalkEvent_15_side_002ID	6	Ayesha	アーシャ	それに、ソフィーちゃんは錬金術でみんなを幸せに\nしたい、っていう夢があるんでしょ？	Ayesha	Besides, your dream is to make people happy through alchemy, right?	爱夏	而且苏菲你还有个梦想，\n要用炼金术为大家带来幸福，对吧？	愛夏	而且，蘇菲的夢想是用鍊金術\n讓大家獲得幸福對吧？
TalkEvent_15_side_002ID	7	Ayesha	アーシャ	だから、今回のお仕事にぴったりだと思って	Ayesha	That makes this a perfect task for you.	爱夏	所以我认为这次的工作很适合你。	愛夏	所以我覺得妳一定能勝任這份工作。
TalkEvent_15_side_002ID	8	Sophie	ソフィー	はい！　ご期待に添えるよう頑張りますね！	Sophie	Okay! Don't worry, I'll do my best to not let you down!	苏菲	好的！我会努力不辜负期待！	蘇菲	好的！我一定會努力不辜負妳的期待！
TalkEvent_15_side_002ID	9	Ayesha	アーシャ	ありがとう！　このお仕事を通して、\nもっとソフィーちゃんと仲良くなれたら嬉しいな	Ayesha	That's great! I was hoping we could get to know each other better, and this job is the perfect opportunity.	爱夏	谢谢你！而且我还想通过这次合作，\n和苏菲增进感情。	愛夏	謝謝！如果能透過這份工作與妳變得感情更好，\n那我會很高興的。
TalkEvent_15_side_002ID	10	Sophie	ソフィー	はい、あたしもアーシャさんともっと仲良くなりたい！	Sophie	Ooh, me too!	苏菲	嗯，我也想和爱夏小姐变得更亲近！	蘇菲	沒錯，我也想與愛夏小姐成為更要好的朋友！
TalkEvent_15_side_002ID	11	Sophie	ソフィー	そうと決まったらまずは……何からやれば？	Sophie	So, now that that's all settled... What do we do first?	苏菲	既然决定了那就开工吧……我们先做什么好呢？	蘇菲	既然決定了，那我們……要先做什麼呢？
TalkEvent_15_side_002ID	12	Ayesha	アーシャ	あ、それなんだけど。ロマンさんが、このお仕事の\nために準備したものがあるから待っててほしいって	Ayesha	Oh, about that. Roman said that there was something he was going to put together for us, so he'd like us to hold off until then.	爱夏	啊，关于这个，罗曼先生说，\n他为这个委托准备了一些东西，让我们等等。	愛夏	啊，關於這點，其實羅曼先生說\n他準備了這次工作所需的物品，所以要我們等一下。
TalkEvent_15_side_002ID	13	Sophie	ソフィー	え、なんだろう？	Sophie	Really? What is it?	苏菲	咦，会是什么呀？	蘇菲	咦？會是什麼呢？
TalkEvent_15_side_002ID	14	Ayesha	アーシャ	それがわたしも知らなくて……。明日持ってきてくれる\nみたいだから、お仕事はそれからだね	Ayesha	I wish I could tell you, but I'm honestly not sure myself. We won't have to wait long, though—it should be ready by tomorrow.	爱夏	我也不知道……他说明天会带过来。\n所以我们要等他把东西带来才能开工。	愛夏	這我也不清楚……他好像明天會拿來，\n工作就等那之後再開始吧。
TalkEvent_15_side_002ID	15	Sophie	ソフィー	はい、分かりました！	Sophie	Good, that's great!	苏菲	好的，我知道了！	蘇菲	好的，我明白了！
TalkEvent_15_side_003ID	0	Sophie	ソフィー	ロマンさんが準備したものって、\nこの制服だったんですね！	Sophie	So this is what you were preparing—uniforms!	苏菲	罗曼先生原来是在为我们准备制服啊！	蘇菲	原來羅曼先生準備的是這身制服啊！
TalkEvent_15_side_003ID	1	Roman	ロマン	制服ってほど、堅苦しいものじゃないけどね	Roman	They're official, but they shouldn't be too stiff or formal.	罗曼	也没有制服那么一本正经啦。	羅曼	倒也不是制服那種太過拘謹的東西啦。
TalkEvent_15_side_003ID	2	Roman	ロマン	少しでも仕事をしやすいように、\nこちらで用意させてもらったんだ。どうかな？	Roman	I was hoping they'd help make your work a little easier. But what do you think?	罗曼	我想让你们工作起来更方便些，\n就准备了这个。怎么样？	羅曼	只是想讓妳們工作起來更方便才準備的，\n穿起來感覺如何呢？
TalkEvent_15_side_003ID	3	Ayesha	アーシャ	とっても着心地がいいです。ありがとうございます！	Ayesha	They're a perfect fit! Thank you very much!	爱夏	穿着非常舒服！谢谢你！	愛夏	我覺得非常舒適，謝謝您！
TalkEvent_15_side_003ID	4	Sophie	ソフィー	お似合いですよ、アーシャさん！\nなんだか妖精さんみたいでかわいいですね	Sophie	It really suits you, Ayesha! You look just like a pretty fairy.	苏菲	好适合你啊，爱夏小姐！\n像妖精一样可爱。	蘇菲	愛夏小姐穿起來非常漂亮哦！\n看上去好像可愛的妖精一樣。
