romanized	name_jp	text_jp	name_en	text_en	name_zh-CN	text_zh-CN	name_zh-TW	text_zh-TW
Izana	イザナ	ふぅ。ここまでは順調だね	Izana	Phew. So far, so good.	伊札娜	呼，到这里一路还算顺利。	伊札娜	呼。到目前為止都很順利呢。
Resna	レスナ	"そうだね。初めましての場所だし、
まだまだ何があるか分からないけどね"	Resna	Yes, but it's our first time here, so we still have no idea what to expect.	蕾斯娜	"是啊。不过我们是第一次来这里，
说不准可能会发生什么事。"	蕾斯娜	"是啊。不過我們第一次來這裡，
還不清楚會出現什麼呢。"
Kortes	コルテス	"レスナもイザナも、なかなか旅慣れてるよな。
この様子じゃ、俺までいらなかったんじゃないか？"	Kortes	You and Izana are pretty experienced travelers. Looks like you didn't even need me.	寇尔提斯	"蕾斯娜、伊札娜，你们好像都是经常旅行的人啊。
看样子其实不需要我帮忙吧？"	寇爾提斯	"蕾斯娜和伊札娜都很習慣旅行了吧。
照這情況看來，說不定根本不需要我？"
Resna	レスナ	"い、いいえ！　コルテスさんがご一緒してくださって
とても心強いです！"	Resna	N-No, not at all! Having you with us is very reassuring, Kortes!	蕾斯娜	"不不不！寇尔提斯先生，
有你在我们比往常安心了许多！"	蕾斯娜	"不、不會的！
有寇爾提斯先生同行，讓我們感到非常安心！"
Resna	レスナ	"今は少し慣れてきたかもしれませんが、
少し前までは本当に何も分からなくて……"	Resna	We might be getting used to it now, but not long ago, we were really clueless.	蕾斯娜	"我们现在算是对旅途中的情况有所准备了，
但不久前还纯属外行呢……"	蕾斯娜	"雖然現在可能稍微適應了，
但不久之前真的都還一無所知……"
Resna	レスナ	"そんな時、シャリステラ先輩には
どれだけ助けられたことか！"	Resna	That was when Shallistera helped us out more than you can imagine!	蕾斯娜	当时夏莉丝堤拉前辈真是帮了我们太多太多！	蕾斯娜	當時都不知道夏莉絲堤菈前輩幫了我多少忙啊！
Kortes	コルテス	シャリーに？	Kortes	Shallie did?	寇尔提斯	夏莉吗？	寇爾提斯	妳說夏莉？
Resna	レスナ	"はい。自信が持てない私を見守って
導いてくださって……"	Resna	Yes. She watched over and guided me when I lacked confidence.	蕾斯娜	"是的。是她陪伴着失去自信的我，
帮我指引方向……"	蕾斯娜	對。她守護著沒有自信的我，並引導著我……
Kortes	コルテス	"……そうか。
以前に比べたら、あいつもずいぶん成長したな"	Kortes	That's good. I guess she's grown a lot since way back when.	寇尔提斯	"这样啊……
看来她也比以前进步了不少。"	寇爾提斯	"……這樣啊。
她和以前相比也成長不少了呢。"
Izana	イザナ	前はどんな感じだったの？	Izana	What was she like before?	伊札娜	那她以前是什么样的呀？	伊札娜	她以前是什麼樣子呢？
Kortes	コルテス	"故郷の里から出たことがない箱入りでな。
俺や親父が色々世話を焼きながら旅をしたんだ"	Kortes	She was a sheltered girl who'd never left her village. My dad and I had to help her with everything when we traveled.	寇尔提斯	"她以前是个不谙世事的大小姐，从未离开过家乡。
我和老爹在旅途中还要照顾她。"	寇爾提斯	"她是個從未離開過故鄉的千金小姐。
在旅途中很多事都需要我和老爸照料。"
Kortes	コルテス	"村の水涸れを解決したくて長旅をしたのに
行く先で観光気分だとか言われたこともあってなぁ"	Kortes	We traveled far to solve our village's water shortage, but people accused her of being a sightseer...	寇尔提斯	"她踏上漫长旅途明明是为了解决村庄水源干涸的问题，
但在所到之处偶尔会有人说她像是在观光。"	寇爾提斯	"明明是為了解決村子裡的旱災才踏上長途旅程，
有時候卻在目的地被人說像是來觀光的。"
Jurie	ユリエ	見た目がそれを助長してたわね	Jurie	Her appearance didn't help that, either.	尤莉耶	她的外表会加强这种印象呢。	尤莉耶	外表也助長了這點吧。
Kortes	コルテス	"俺たち一族の服は、都会だと珍しかったからな。
ま、それだけが理由でもなかったが"	Kortes	No doubt our clan's attire was unusual in the city, but that wasn't the only reason.	寇尔提斯	"因为我们一族的服饰在城市里比较罕见。
不过肯定不止这个原因就是了。"	寇爾提斯	"畢竟我們這一族的服裝在大城市裡很少見。
不過，原因也不只是這樣。"
Kortes	コルテス	"あいつはあれで頑固で使命感だけは強いもんだから、
焦りも強くて、肩に力が入りっぱなしでな"	Kortes	She might not look it, but she was stubborn and had a strong sense of duty, which made her anxious and tense all the time.	寇尔提斯	"与外表给人的印象不同，她其实性格固执，
有着强烈的使命感，所以心情急切，精神总是紧绷着的。"	寇爾提斯	"那傢伙其實很固執，使命感又很強，
所以也很急躁，總是緊張兮兮的無法放鬆下來。"
Resna	レスナ	"そういえば、シャリステラ先輩も色々
失敗をしてきたって話してくださいました"	Resna	Now that you mention it, she did tell me that she made a lot of mistakes herself.	蕾斯娜	"说起来，我也听夏莉丝堤拉前辈提起过，
她以前搞砸了许多事。"	蕾斯娜	"這麼說來，夏莉絲堤菈前輩
也曾對我說她失敗過不少次。"
Kortes	コルテス	"初めは誰でもそんなもんだ。
けど、あいつはあいつなりに成長していった"	Kortes	Everyone starts out making mistakes. But she's managed to grow in her own way.	寇尔提斯	"任何人在起步阶段都会那样啊。
但她也以她的方式取得了进步。"	寇爾提斯	"一開始任誰都是如此。
不過，那傢伙還是照自己的方式成長了。"
Kortes	コルテス	"年相応に友達とケンカしたりもしたが、
ちゃんと仲直りして……"	Kortes	Like most kids her age, she used to fight with her friends, but always managed to make up...	寇尔提斯	"她跟年纪相仿的朋友也有过分歧，
所幸后来又和好如初了……"	寇爾提斯	年齡到了會和朋友吵架，當然也會和好……
Kortes	コルテス	"はは。気が付いたら、兄貴分の俺の行く末まで
心配できるほどになってた"	Kortes	Haha. Before I knew it, she even started to worry about my future.	寇尔提斯	"哈哈，没想到的是她后来还操心起了
我这个大哥的前途。"	寇爾提斯	"哈哈。等回神過來才發現，
她已經成長到可以擔心我這個大哥的前途了。"
Kortes	コルテス	あいつ、今じゃ立派な「先輩」になったんだな	Kortes	She really grew into an amazing person.	寇尔提斯	如今她已经是一个有模有样的“前辈”了啊。	寇爾提斯	那傢伙如今已經是個出色的「前輩」了。
Jurie	ユリエ	ふふ。妹が独り立ちしたみたいで寂しい？	Jurie	Haha. I guess it feels like you had to let your little sister go?	尤莉耶	呵呵，因为妹妹的独立感到孤单了吧？	尤莉耶	呵呵。看到妹妹可以自立了，很落寞嗎？
Kortes	コルテス	それは……お互い様だろ	Kortes	I think that goes for the both of us.	寇尔提斯	这……你也一样吧。	寇爾提斯	這……我們半斤八兩吧。
Jurie	ユリエ	ミルカは昔からしっかりしてた……から、別に	Jurie	Miruca has always been pretty independent, so not really.	尤莉耶	我不会啊……毕竟米尔卡她从小就非常懂事。	尤莉耶	米爾卡從以前就很獨立……所以根本沒差。
Resna	レスナ	（ふふ。きょうだいって……いいなあ）	Resna	(Hehe. It must be so nice to have siblings!)	蕾斯娜	（呵呵……感觉有兄弟姐妹真好啊。）	蕾斯娜	（呵呵，有兄弟姊妹……真好啊。）
