romanized	name_jp	text_jp	name_en	text_en	name_zh-CN	text_zh-CN	name_zh-TW	text_zh-TW
Resna	レスナ	"クア州が生まれ故郷で、そこには家族がいる。
そしてあなたは……そこが壊れてしまえばいいと言う"	Resna	You were born and raised in the Kur Province, and your family lives there too. And yet you wish it had been destroyed...	蕾斯娜	"库亚州是你的故乡，那里有你的家人。
你却说……那里破坏得更严重才好？"	蕾斯娜	"庫厄州是妳生長的故鄉，妳的家人都在那裡。
而妳……卻說希望那裡可以毀滅。"
Escha	エスカ	どうして、故郷をそんな風に言うんですか？	Escha	Why would you say something like that about your hometown?	爱丝卡	为什么要这样说你的故乡呢？	愛絲卡	為什麼要這麼說自己的故鄉呢？
Lara	ララ	"わたくしにとって家族とは、唾棄すべき存在。
情など湧くはずもない、最も醜悪なものの寄せ集め"	Lara	"For me, my ""family"" is nothing but a scourge. A gathering of repulsive individuals and ideals which don't even deserve my contempt, let alone my affection."	拉拉	"对我来说，家人是应当唾弃的。
那些丑恶无比的家伙不配让我同情。"	拉拉	"我打從心裡唾棄所謂的家人。
他們是極為醜陋的一群人，我對他們毫無情感可言。"
Lara	ララ	"ですから、壊れてしまえばいいと思うのは
至って当然のことですわ"	Lara	Is it not natural, then, that I would wish for their ruin?	拉拉	"所以我觉得那个地方被破坏了才好，
这是再自然不过的事吧。"	拉拉	所以我希望那裡毀滅也是理所當然的。
Izana	イザナ	わ、分かんないよ。なんで、そんな……	Izana	I don't understand at all! How could you think that?	伊札娜	我、我不明白，你为什么能说得那么……	伊札娜	我、我不懂。怎麼會這麼說……
Lara	ララ	"トロッケル家は代々、錬金術士の家系でしたの。
時代と共に錬金術の力は手放しましたけれど"	Lara	The Trockel family used to be a line of alchemists, you see...although they abandoned its formal practice generations ago.	拉拉	"特洛克尔家代代都是炼金术士。
虽然随着时代的发展，他们早就放弃了炼金术之力……"	拉拉	"特羅克爾家是代代相傳的鍊金術士世家。
雖然隨著時代變遷，家族已經放棄鍊金術的力量了。"
Lara	ララ	"家には長年かけて収集された多くの文献があり、
そしてわたくしには兄姉の誰よりも優れた才があった"	Lara	The family house was nevertheless a trove of alchemic literature, painstakingly collected over the years. And out of all my siblings, I was by far the most adept in the art.	拉拉	"但家中保存着长年收集来的诸多文献，
而我也拥有超越所有哥哥姐姐的天赋。"	拉拉	"但我家中藏有多年來收集的許多文獻，
而我擁有比所有哥哥姊姊都還要優秀的才能。"
Lara	ララ	"愚かな者どもは異物を排除したがるもの。兄姉は妹の
才を妬み、わたくしへ酷い扱いをし続けたのですわ"	Lara	Of course, the ignorant are wont to try to hammer down the nail that sticks out. My siblings, jealous of my talent, spared no effort in making my life miserable.	拉拉	"愚昧者总想排除异己，哥哥姐姐们
妒忌我这个妹妹的天赋，日日毫不留情地打压我。"	拉拉	"愚昧之人總會排擠異類。哥哥姊姊嫉妒我的才能，
一直很殘酷地對待我。"
Lara	ララ	"父の関心を得ていなかった母も、助けるどころか
一緒になってわたくし相手にうっぷんを晴らしていた"	Lara	My mother, stung by my father's lack of interest in her, was no help. On the contrary, she saw me as the perfect target to vent her frustrations on.	拉拉	"被父亲冷落的母亲也从不保护我，
反而跟他们一起拿我泄愤。"	拉拉	"母親因為得不到父親的關愛，不僅沒有幫我，
反而一起拿我當出氣筒。"
Lara	ララ	"そして、あの連中はある日、
劇薬を用いて、わたくしの顔を……"	Lara	One day, those brutes thought it would be amusing to test out some chemicals they had concocted on my face.	拉拉	后来有一天，他们用毒药毁了我的容貌……	拉拉	然後就在某一天，他們使用劇藥把我的臉……
Lara	ララ	"当時の腕力では、逃げることもできず。
わたくしの顔は、二目と見られない有様に……"	Lara	Weak as I was at the time, I was unable to escape, and my face was left a scarred mess.	拉拉	"凭我当时的力量根本不足以逃跑。
我的脸变成了难以直视的丑陋模样……"	拉拉	"以我當時的力氣根本無法掙脫。
我的臉因此成了讓人避之唯恐不及的模樣……"
Lara	ララ	"それでもわたくしは勉学に打ち込みました。貴族の
子息が受ける教育を修めて、錬金術の知識も深めた"	Lara	And yet I continued to diligently focus on my studies. I excelled in every aspect of my aristocratic education and continued to hone my understanding of alchemy.	拉拉	"但我依旧发奋学习，接受了贵族子女教育，
加深了对炼金术的理解。"	拉拉	"即使如此，我仍然勤於學習。
接受貴族子弟應受的教育，並加深鍊金術的知識。"
Lara	ララ	"すべては、わたくしが政をするため。この才を
活かすのにあれ以上ふさわしい場所はありません"	Lara	All of this to ensure I would be one day be ready to do my part in governing the province. Surely there would be no better application of my talents, I thought.	拉拉	"我做这一切都是为了步入政坛，
因为那是最适合我发挥才华的舞台。"	拉拉	"這一切都是為了從政。
沒有什麼領域比這更適合讓我發揮才能了。"
Lara	ララ	"けれど、年頃になったわたくしは、この家には
もっと愚かな者がいたのだと思い知らされました"	Lara	But all that changed when I came of age. You see, I unfortunately came to learn that there was one member of the family more witless than even my mother or siblings.	拉拉	"但是，随着我到了适婚的年纪，
我发现那个家里还有更愚昧的人。"	拉拉	"但是，當我到了適婚年齡時，
我才知道原來這個家裡還有個更愚昧的人。"
Lara	ララ	"その者こそ、我が父アブラハム・トロッケルですわ。
わたくしは父から政略結婚を命じられたのです"	Lara	That was my father, Abraham Trockel. Imagine my shock when I learned that the only worth he saw in me was a pawn in some diplomatic marriage.	拉拉	"那个人正是我的父亲，亚伯拉罕·特洛克尔。
我的父亲命令我进行一场政治联姻。"	拉拉	"那個人正是我的父親，亞伯拉罕‧特羅克爾。
他命令我接受一場政治婚姻。"
Lara	ララ	……わたくし、心底呆れてしまいましたわ	Lara	My disgust and disappointment were overwhelming.	拉拉	……由此，我对家人彻底死心了。	拉拉	……我打從心底感到無言。
Lara	ララ	"わたくしの価値に気付けず、さらには無能な兄に
跡を継がせる、とても為政者とは思えない暗愚ぶり"	Lara	And then, as if turning a blind eye to my true worth wasn't enough, he named my incompetent brother as his successor. I have never known a man more unfit to be a politician.	拉拉	"父亲看不出我的能力，还让无能的兄长当继承人，
他的愚蠢做法实在不像是个执政者。"	拉拉	"他沒有意識到我的價值，甚至讓無能的哥哥繼承後位，
愚蠢到簡直令人難以相信他是個為政之人。"
Resna	レスナ	だから……ララさんは家族を	Resna	So that's why you hate your family so much...	蕾斯娜	所以……拉拉小姐才会对家人……	蕾斯娜	所以……拉拉小姐和家人……
Lara	ララ	"そんな父は、今ではわたくしを存在していない
人間として扱っているようですわね"	Lara	From what I hear, it seems my father no longer even deigns to acknowledge my existence. Is that not so?	拉拉	我的父亲现在就当我完全没存在过呢。	拉拉	如此愚昧的父親現在似乎把我當作不存在一般。
Resna	レスナ	"（トロッケル卿……
　前に会った時は、いい人そうに見えたのに）"	Resna	(Lord Trockel seemed so nice when we met him before...)	蕾斯娜	"（特洛克尔卿……
　我之前见到他的时候，还觉得他是个温厚的人。）"	蕾斯娜	（特羅克爾……之前見面時感覺是個好人啊。）
Lara	ララ	……クリセルダに会ったのはそんな時でしたわ	Lara	...It was around that time that I met Criselda.	拉拉	……我就是在那时遇到克莉赛尔达的。	拉拉	……我就是在那個時候遇到克莉賽爾達的。
Resna	レスナ	"（クリセルダ……確か、前にアンペル先輩が
　言っていた。極夜の錬金党の、党首の名前だ）"	Resna	(Criselda... I know that name. Empel mentioned that she leads the Polar Night Alchemists.)	蕾斯娜	"（克莉赛尔达……我听安佩尔前辈提过，
　那是极夜的炼金党党首的名字。）"	蕾斯娜	"（克莉賽爾達……我記得之前安佩爾前輩說過。
　那是極夜的鍊金黨黨首的名字。）"
Lara	ララ	"クリセルダはわたくしの顔を錬金術で治し、
錬金術の可能性と、新しい世界を見せてくれた"	Lara	Criselda healed my face using her alchemy and opened my eyes to alchemy's endless possibilities. A whole new world of opportunity, ready for the taking.	拉拉	"克莉赛尔达用炼金术治好了我的脸，
让我看到了炼金术的可能性，还有崭新的世界。"	拉拉	"克莉賽爾達用鍊金術治好了我的臉，
讓我見識到鍊金術的可能性與全新的世界。"
Lara	ララ	"わたくしは改めて錬金術の力に惚れ込み、
家を捨て、その足で極夜の錬金党に入りましたわ"	Lara	Once again I found myself enchanted by its power. And so I threw my old life away and joined the Polar Night Alchemists.	拉拉	"我再一次为炼金术的力量折服，
便抛弃家族，加入了极夜的炼金党。"	拉拉	"我再次迷上了鍊金術的力量，於是離開那個家，
就這樣加入了極夜的鍊金黨。"
Lara	ララ	"そして、わたくしは誓ったのです。
トロッケル家とは真逆の美しい生き方をしようと"	Lara	I swore to myself then and there that I would live life on my own terms—beautifully, in a way completely unlike that of my former family.	拉拉	"于是我便立下誓言，
要过上与特洛克尔家完全相反的优雅活法。"	拉拉	"接著，我在心裡發誓，
我要過上和在特羅克爾家時全然相反的美好生活。"
Lara	ララ	"州を治める立場でありながら身勝手な行為を重ねる
愚か者には決して作れない、理想の王国を作ると"	Lara	And that I would found a magnificent kingdom, the sort a self-centered fool unfit to rule even the province entrusted to him could never begin to conceive of.	拉拉	"我要缔造一个王国、
让坐拥一州却肆意妄为的愚者望尘莫及的，一个理想的王国。"	拉拉	"我要打造出身為一州之長卻任性妄為的愚者
永遠打造不出來的理想王國。"
Resna	レスナ	それが、ララ・キングダム……なんですか？	Resna	And that would be the Kingdom of Lara?	蕾斯娜	那就是拉拉王国……对吗？	蕾斯娜	也就是拉拉王國……是嗎？
Lara	ララ	"昔話はこれでおしまいですわ。あの愚物どもの悪評、
どんどん広めてくれて構いませんわよ？"	Lara	Well, I think that's quite enough reminiscing for now. Do feel free to spread the rotten truth about those imbeciles, by the way.	拉拉	"过去的事就先说到这里。
我不介意你帮我传播那些蠢货们的恶名哦？"	拉拉	"往事就談到這裡為止。
妳們要把那些蠢貨的壞話傳出去也無妨喔。"
	アブラハム	"失礼。錬金術士レスナ・シュテルネンリヒト
というのは君のことかね？"	Abraham	Pardon me, but might you be the alchemist Resna Sternenlicht?	亚伯拉罕	"打扰了，请问你就是
炼金术士蕾斯娜·修特涅利希特吧？"	亞伯拉罕	"打擾了，
鍊金術士蕾斯娜‧修特涅利希特就是妳嗎？"
Resna	レスナ	"は、はい！　クア州長のトロッケル卿……ですよね？
どうして私のことを？"	Resna	Th-That's me! And you're...Lord Trockel, right? The minister of Kur Province? Is there something you need from me?	蕾斯娜	"是、是的！您是库亚州的州长特洛克尔卿……？
您为什么会认识我？"	蕾斯娜	"是、是的！您是庫厄州長特羅克爾……對吧？
您怎麼會找我？"
	アブラハム	"君たちのおかげで我々の州が救われたからね。
心から感謝するよ"	Abraham	I wanted to personally thank those who helped save the province.	亚伯拉罕	"多亏了你们，我们库亚州才幸免于难。
我打心底里感谢你们。"	亞伯拉罕	"多虧有各位，我們的州才能得救，
我打從心底感激各位。"
