romanized	name_jp	text_jp	name_en	text_en	name_zh-CN	text_zh-CN	name_zh-TW	text_zh-TW
Regina	レジナ	いやー、思い返すとハラハラしたよねえ！	Regina	Wow! Just thinking back on that whole thing is enough to make my heart pound!	瑞吉娜	唉，回过头来想想真叫人心惊胆战啊！	瑞吉娜	哎呀～回想起來還真是膽戰心驚啊！
Wilbell	ウィルベル	もう！　上手く行ったんだからいいじゃない	Wilbell	Let it go, would you?! It worked out, so things are fine!	薇尔贝儿	好啦！结果一切顺利不就行了嘛。	薇爾貝兒	真是的！反正都成功了，別在意！
Resna	レスナ	"依頼を解決する方針も決まったし、
ハイネの炎石も見つけられたし……"	Resna	We worked out a solution to the request, and we even found a Haine Fire Stone...	蕾斯娜	"定下了解决委托的方针，
也找到了海涅炎石……"	蕾斯娜	"解決委託的方針已經確定了，
也找到海涅炎石了……"
Resna	レスナ	皆さん、本当にありがとうございます！	Resna	Thank you so much for your help, everyone!	蕾斯娜	这都要谢谢大家！	蕾斯娜	真的非常謝謝大家！
Nio	ニオ	はい。力になれてよかったです！	Nio	No problem! Glad we could lend a hand!	妮欧	嗯，能帮上你就好！	妮歐	嗯，有幫上忙真是太好了。
Resna	レスナ	"あの、皆さんはこの後どうするんですか？
引き続き火山の調査を？"	Resna	Um, what are you going to do next? Keep surveying the volcanoes?	蕾斯娜	"你们接下来打算做什么呢？
要继续调查火山吗？"	蕾斯娜	"那大家今後有什麼打算？
要繼續調查火山嗎？"
Nio	ニオ	"さっき話してたんですけど、
わたしたち、また別の州に行こうって思ってるんです"	Nio	We were just talking about it, but I think we'll move on to another province.	妮欧	"我们刚才也商量了这件事，
接下来我们打算去别的州看看。"	妮歐	"剛才我們討論了一下，
目前打算造訪其他州。"
Valeria	ヴァレリア	どこへ行くの？	Valeria	Which one?	瓦莱莉娅	去哪个州？	瓦萊莉婭	妳們要去哪裡？
Nio	ニオ	"ここから東にあるガルネ州って場所です。
噂では、「秘境」と呼ばれている山があるとか"	Nio	There are rumors of a secluded mountain in Galne, over to the east.	妮欧	"去东边的加尔内州。
听说那里有座人称“秘境”的山峰。"	妮歐	"從這裡往東走，有個叫做加爾內州的地方。
聽說那裡有一座被稱為「秘境」的山。"
Wilbell	ウィルベル	"ここの火山を調べてて、もしかしたら他の山にも
何かあるんじゃないかと思ったのよ"	Wilbell	We were thinking that we might be able to find something notable on other mountains, now that we've seen the volcanoes here.	薇尔贝儿	"调查了这里的火山之后，
我想到说不定其他山里也会有值得调查的东西。"	薇爾貝兒	"調查過這裡的火山後，
我開始思考，也許其他山區也蘊藏了一些……"
Regina	レジナ	ハイネの炎石みたいに、その土地固有の鉱物とかね	Regina	Ores that are unique to the area, like the Haine Fire Stone. That sort of thing.	瑞吉娜	比如海涅炎石这种当地特有的矿物。	瑞吉娜	像海涅炎石那種當地特有的礦物。
Resna	レスナ	"なるほど！
何か見つかったら、ぜひ教えてください！"	Resna	Oh! Please let me know if you find anything interesting!	蕾斯娜	"这样啊！
那你们要是找到了什么，还请务必告诉我们！"	蕾斯娜	"原來如此！
如果發現了新東西，請務必告訴我！"
Valeria	ヴァレリア	残念。せっかく仲良くなれたのに	Valeria	It's too bad that you're leaving, though, since we're friends now.	瓦莱莉娅	好遗憾啊，我们好不容易交上朋友。	瓦萊莉婭	好可惜，明明才剛認識沒多久而已。
Wilbell	ウィルベル	"大丈夫、きっとまたそのうち会えるわよ。
ていうか、アトリエで会えるでしょ"	Wilbell	Don't worry, we'll definitely see each other again. Probably back at the atelier.	薇尔贝儿	"没事，将来肯定会再见面的。
而且想见在炼金工房就能见吧！"	薇爾貝兒	"放心，之後一定會再相見的。
而且，我們可以在鍊金工房見面吧？"
Valeria	ヴァレリア	あ、そういえばそうね	Valeria	Oh, right.	瓦莱莉娅	啊，这么说也是。	瓦萊莉婭	啊，這麼說也沒錯。
Wilbell	ウィルベル	ま、土産話を楽しみにして待ってなさいって	Wilbell	Well, we'll tell you all about our latest adventures when that happens.	薇尔贝儿	你们就期待着下次见面听我们讲旅途上的新鲜事吧。	薇爾貝兒	那就好好期待我們的旅行經驗分享吧！
Valeria	ヴァレリア	ええ。楽しみにしてるわ	Valeria	Sounds good. I'll be looking forward to it!	瓦莱莉娅	嗯，我很期待。	瓦萊莉婭	嗯，我很期待。
Nio	ニオ	"それじゃ、レスナさん、皆さん、
ありがとうございました！"	Nio	Thanks, everyone! We'll see you around!	妮欧	"那么，蕾斯娜小姐，还有各位，
谢谢你们！"	妮歐	"蕾斯娜小姐、還有各位，
非常謝謝妳們！"
Nio	ニオ	依頼、頑張ってくださいね！	Nio	Good luck with the request!	妮欧	要加油完成委托哦！	妮歐	要努力完成委託喔！
Resna	レスナ	それじゃ、私たちも次の目的地に出発しよう！	Resna	Okay! It's time for us to head to our next destination, too!	蕾斯娜	那我们就朝着下一个目的地出发吧！	蕾斯娜	那我們也前往下一個目的地吧！
Valeria	ヴァレリア	うん。次の目的は確か「翡翠の煌水」よね！	Valeria	Yep. Next up is the Jade Water, right?	瓦莱莉娅	嗯，我记得接下来要找的是“翡翠煌水”吧！	瓦萊莉婭	嗯，下一個目標是「翡翠煌水」沒錯吧？
Heidi	ハイディ	おっ、ちゃんと覚えてたね	Heidi	Whoa, you actually remembered that?	海蒂	哦，你还记得啊。	海蒂	哦，記得很清楚嘛。
Valeria	ヴァレリア	ふっふーん。で、どこに行けば採れるのかしら	Valeria	Heh heh! So, where do we need to go to gather something like that?	瓦莱莉娅	哼哼，那要去哪里才能采集到这个水？	瓦萊莉婭	嗯哼～那要去哪裡尋找它呢？
Resna	レスナ	"ハイネ州のどこかで採れるはずなんだけど、
実は詳しい場所は分かってなくて……"	Resna	There should be some in Haine, but I don't know exactly where.	蕾斯娜	"在海涅州的某处应该能采集到，
但我也不清楚具体位置在哪里……"	蕾斯娜	"應該在海涅州的某處，
但我不清楚詳細地點……"
Heidi	ハイディ	そこは私に任せといてよ。バッチリ調査しとくからさ	Heidi	You can leave those details to me. I'll do a full investigation!	海蒂	那就交给我吧，我会调查个清楚的。	海蒂	這部分就交給我好好調查吧！
Valeria	ヴァレリア	頼もしいわね、さすが相棒	Valeria	You're too good at this, partner.	瓦莱莉娅	真可靠，不愧是我的搭档。	瓦萊莉婭	不愧是我的搭檔，真可靠。
Resna	レスナ	はい、よろしくお願いします！	Resna	That's for sure. Thanks in advance, Heidi!	蕾斯娜	好的，麻烦你了！	蕾斯娜	好，那就拜託妳了！
Heidi	ハイディ	んじゃ早速、行動開始と行きますか	Heidi	Right, then I'm going to get straight on that!	海蒂	那事不宜迟，我这就出发了。	海蒂	那就立刻動身吧。
Resna	レスナ	"ふう、これで依頼もようやく半分。
この後も頑張ろうね、イザナちゃん！"	Resna	Phew. That's half of the request settled. Let's keep this energy going, Izana!	蕾斯娜	"呼，这下委托完成了一半。
后半程也要加油哦，伊札娜！"	蕾斯娜	"呼……如此一來，委託終於完成一半了。
我們繼續加油吧，伊札娜！"
Resna	レスナ	イザナちゃん？	Resna	Izana?	蕾斯娜	伊札娜？	蕾斯娜	伊札娜？
Izana	イザナ	"……あはは！　そうだね！
頑張っていこうね！"	Izana	Haha! Yep! We'll give it our all!	伊札娜	"……哈哈！没错！
我们要继续加油！"	伊札娜	"……啊哈哈！沒錯！
一起加油吧！"
Izana	イザナ	…………	Izana	...	伊札娜	……	伊札娜	…………
