romanized	name_jp	text_jp	name_en	text_en	name_zh-CN	text_zh-CN	name_zh-TW	text_zh-TW
Valeria	ヴァレリア	よっ！　はぁっ！	Valeria	Hup! Haaah!	瓦莱莉娅	嘿！喝！	瓦萊莉婭	嘿！喝啊！
Heidi	ハイディ	おおっと！　絶好調だね、相棒！	Heidi	Whoa, yeah! Nice form, partner!	海蒂	哎哟！搭档你状态绝佳啊！	海蒂	哦哦！我的搭檔，妳看起來狀況真不錯！
Valeria	ヴァレリア	ふふ！　果物でお腹膨れたからね！　はっ！	Valeria	Heheh! You can thank the fruit that filled up my stomach for that! Hiyah!	瓦莱莉娅	哼哼！吃了水果有力气了嘛！喝！	瓦萊莉婭	哼哼！畢竟已經用水果填飽肚子了！喝！
Valeria	ヴァレリア	あれ？　もう終わり？	Valeria	Huh? Was that the last of them?	瓦莱莉娅	嗯？这就没了？	瓦萊莉婭	奇怪？結束了？
Heidi	ハイディ	いや、魔物にずっと出てこられても困るでしょ	Heidi	I hope so. Never-ending monsters would not be a good thing.	海蒂	没了才好，魔物源源不断地冒出来也太头疼了。	海蒂	要是魔物一直冒出來也很傷腦筋啊。
	星廟のシスター	"ごきげんよう。冒険者さんですね。
魔物を退治してくださってありがとうございます"	Star Shrine Sister	Good day to you, adventurers. Thank you very much for disposing of those creatures.	星庙的修女	"你们好，请问是冒险者对吧。
谢谢你们帮忙消灭了魔物。"	星廟的修女	"兩位好，妳們是冒險者吧。
非常感謝妳們協助消滅魔物。"
Valeria	ヴァレリア	あれだけ魔物がいたら困るわよねぇ	Valeria	It's nothing. There really were too many of them hanging around.	瓦莱莉娅	有那么多的魔物，你们也很困扰吧。	瓦萊莉婭	魔物多成那樣很令人困擾吧。
	星廟のシスター	"きっとお疲れでしょう。
……よろしければこちらをどうぞ"	Star Shrine Sister	You must be quite worn out. Here, please take these.	星庙的修女	"你们一定累坏了吧。
不嫌弃的话还请收下这个。"	星廟的修女	"想必妳們都很疲憊。
不介意的話……請享用這個。"
Valeria	ヴァレリア	わぁ！　お弁当！？　いいの？	Valeria	Ooh, lunch boxes? For us?!	瓦莱莉娅	哇！便当？！可以吗？	瓦萊莉婭	哇！便當！？給我們吃的嗎？
Heidi	ハイディ	"え、ええと……あんたはひょっとして、
そこの星廟の……"	Heidi	U-Uh, you wouldn't happen to be, um, the nun who...	海蒂	"请、请问……你难道是
那边那座星庙的……"	海蒂	"呃，那個……
妳該不會是那間星廟的……"
	星廟のシスター	はい。シスターです。星に祈りを捧げております	Star Shrine Sister	Yes, I preside over that star shrine.	星庙的修女	是的，我是那里的修女。向星星祈祷正是我的职责。	星廟的修女	沒錯，我是修女。負責向星星祈禱。
Valeria	ヴァレリア	えっ。あそこの星廟の！？	Valeria	You do?!	瓦莱莉娅	什么，你是那边那座星庙的？！	瓦萊莉婭	咦，那間星廟的！？
	ふたり	あ、あの！	Both	U-Um!	二人	听、听我解释！	兩人	其、其實！
Valeria	ヴァレリア	"さっき、木に成ってた果物を勝手に
食べちゃって……ごめんなさいっ！"	Valeria	I'm sorry, I ate some of the fruit that was sitting there!	瓦莱莉娅	"对不起！
刚才我擅自吃了树上结的果实……"	瓦萊莉婭	"我剛才擅自摘了樹上的果實吃……
真的很對不起！"
Heidi	ハイディ	この子、悪気はなくてですね！	Heidi	She really didn't mean anything bad by it!	海蒂	她真的没有恶意的！	海蒂	她其實沒有惡意啦！
	星廟のシスター	"ふふ。気にしなくていいのですよ。皆を守るために
こうして魔物と戦ってくださっているのでしょう？"	Star Shrine Sister	*Chuckle* Oh, that's quite all right. After all, you've been fighting those monsters to keep everyone safe, haven't you?	星庙的修女	"呵呵，不用在意。
你是和魔物战斗是为了保护大家对吧？"	星廟的修女	"呵呵，別放在心上。妳們是為了保護大家，
才在這裡對抗魔物吧？"
	星廟のシスター	"それはお腹も空かせるでしょうから。
こちらも、たくさん召し上がってくださいね"	Star Shrine Sister	I would imagine that made you work up a considerable appetite. Go ahead, take as many of these as you care to.	星庙的修女	"战斗之后肚子饿了也是情有可原。
这边这些也请多多享用。"	星廟的修女	"肚子餓是人之常情。
這些也給妳們，別客氣。"
Valeria	ヴァレリア	うぅっ……こんなにいっぱい……ありがとう！	Valeria	Wow, that's so much food...! Thanks a ton!	瓦莱莉娅	呜呜……居然有这么多……谢谢你！	瓦萊莉婭	唔唔……居然給了這麼多……謝謝妳！
Heidi	ハイディ	流れ星が貴女に良き導きを示しますよう	Heidi	May the stars ever brighten your way.	海蒂	愿流星给予你指引。	海蒂	願流星為妳指引明路。
	星廟のシスター	"あら。貴女がたにも流れ星が良き導きを示しますよう。
では私はこれで"	Star Shrine Sister	My goodness! And yours as well, ladies. Well then, if you'll excuse me.	星庙的修女	"哎呀，也愿流星给予二位指引。
那我就先失陪了。"	星廟的修女	"哎呀，也願流星為妳們指引明路。
那我先告辭了。"
Valeria	ヴァレリア	気を付けてね～！	Valeria	Stay safe out there!	瓦莱莉娅	路上小心～！	瓦萊莉婭	路上小心喔～！
Heidi	ハイディ	はぁ……叱られなくてよかったね	Heidi	Phew... I'm so glad she didn't yell at us.	海蒂	呼……还好没有被骂。	海蒂	呼……幸好沒挨罵。
Valeria	ヴァレリア	"うん。それにしても、ハイディは随分ちゃんとした
挨拶ができるのね！"	Valeria	No kidding. And you even knew the proper way to thank her!	瓦莱莉娅	"是啊。话说回来，
海蒂你刚才的祝福说得真得体啊！"	瓦萊莉婭	"嗯。話說回來，
原來海蒂妳懂那種體面的問候啊！"
Heidi	ハイディ	そりゃ、元シスターだからね	Heidi	Well, sure. I used to be a nun, you know.	海蒂	因为我之前也当过修女嘛。	海蒂	當然啦，我以前可是修女耶。
Valeria	ヴァレリア	そうなんだ……ええっ！　そうなの！？	Valeria	Right, right... Wait, what?!	瓦莱莉娅	这样啊……咦！还有这事？！	瓦萊莉婭	原來如此……咦！真的嗎！？
Valeria	ヴァレリア	それが、どうしてまたあんな場所なんかにいたのよ！？	Valeria	Then how did you end up living in the slums?!	瓦莱莉娅	那你一个修女又为什么会在遗迹那种地方啊？！	瓦萊莉婭	那妳為什麼會出現在那種地方！？
Heidi	ハイディ	"いやぁ、まあ……逃げたんだよ。
シスターの仕事は堅苦しくてキツかったからさ"	Heidi	I mean, to put it simply... I ran away. Life as a sister was way too strict for me.	海蒂	"哎呀……因为我逃走了嘛。
毕竟修女的活又死板又辛苦。"	海蒂	"呃，就……逃走了。
修女的工作太過乏味，令人難以忍受。"
Valeria	ヴァレリア	はぁ……初めて知ったわ～！	Valeria	Huh! I had no idea!	瓦莱莉娅	这样啊……我还是第一次知道～！	瓦萊莉婭	這樣啊……我還是第一次聽說呢～！
Heidi	ハイディ	話したことなかったしね……それより	Heidi	How could you? It's not like I've ever talked about it. But more importantly...	海蒂	因为我没跟你说过啊……现在先别聊天了。	海蒂	因為我沒提過嘛……不談這個了。
Valeria	ヴァレリア	……また魔物が集まってきたわね	Valeria	Yeah. We've got more monsters to deal with.	瓦莱莉娅	……又有魔物聚过来了。	瓦萊莉婭	……魔物又聚集過來了呢。
Heidi	ハイディ	私はそろそろ、この戦場からも逃げ出したいわ～	Heidi	You know, I'm starting to feel like just running away too.	海蒂	我已经受够这个战场了，又想逃跑了呢～	海蒂	我也想逃離這個戰場了～
Valeria	ヴァレリア	ふふ。それは禁止！　行きましょ！	Valeria	Heh! You know we can't do that! Come on, let's do this!	瓦莱莉娅	呵呵，那可不行！我们上吧！	瓦萊莉婭	呵呵，那可不行！我們走！
