file	id	romanized_name	localized_name	text	localized_name_en	text_en	localized_name_zh-CN	text_zh-CN	localized_name_zh-TW	text_zh-TW
TalkEvent_15_020ID	25	Lara	ララ	これで二度と会うこともありませんわね。\nごきげんよう	Lara	I highly doubt we shall be seeing each other again. Good day to you.	拉拉	这样一来便是后会无期了呢。\n失陪了。	拉拉	這樣就不會再遇見妳們了呢。\n永別了。
TalkEvent_15_020ID	26	Resna	レスナ	ララさん！　ジェロンさん！	Resna	Lara! Geron!	蕾斯娜	拉拉小姐！杰隆先生！	蕾斯娜	拉拉小姐！傑隆先生！
TalkEvent_15_020ID	27	Izana	イザナ	レスナちゃん！\nとにかくこいつを倒そう！	Izana	Resna, wait! We've got to take this guy down first!	伊札娜	蕾斯娜！\n我们先打倒它！	伊札娜	蕾斯娜！\n現在先打倒這傢伙吧！
TalkEvent_15_020ID	28	Johanna	ヨハナ	ふん！　こんな魔物なんか、楽勝よっ！	Johanna	Hmph! Piece of cake!	约翰娜	哼！对付这种魔物简直小菜一碟！	約翰娜	哼！這種魔物小意思啦！
TalkEvent_15_020ID	29	Johanna	ヨハナ	……っ！　な、なんで……！	Johanna	What the...?!	约翰娜	……唔！怎、怎么会……！	約翰娜	……唔！為、為什麼……！
TalkEvent_15_020ID	30	Izana	イザナ	いくら硬くたって、ハンマーーーーッ！	Izana	It doesn't matter how hard it is, my hammer'll crush it!	伊札娜	管你再怎么结实，吃我一锤——！	伊札娜	就算皮再怎麼硬，來吃我一錘────！
TalkEvent_15_020ID	31	Sterk	ステルク	加勢する！　はぁぁぁっ！	Sterk	I've got your back! Hrah!	史特尔克	我也来帮忙！喝——！	史特爾克	我來幫忙！喝啊啊啊！
TalkEvent_15_020ID	32	Izana	イザナ	つ、強い……！	Izana	I-It's so strong!	伊札娜	好、好强……！	伊札娜	好、好強……！
TalkEvent_15_020ID	33	Sterk	ステルク	くっ……！　これは一筋縄ではいかなそうだ	Sterk	Ngh! This isn't going to be easy.	史特尔克	唔……！看来寻常手段行不通啊。	史特爾克	唔……！看來這傢伙不好對付啊。
TalkEvent_15_020ID	34	Johanna	ヨハナ	押し留めるのが精一杯だなんてっ！	Johanna	We're barely holding it back as is!	约翰娜	敌人太强悍了，我们耗尽全力也只能钳制它的行动！	約翰娜	光是制住行動就用盡全力了！
TalkEvent_15_020ID	35	Resna	レスナ	こんな魔物、見たことありません！\nこれはいったい……	Resna	I've never seen a monster like this before! What is this?!	蕾斯娜	这种魔物根本前所未见！\n这究竟是……	蕾斯娜	我沒見過這種魔物！\n這究竟是……
TalkEvent_15_020ID	36	Saskia	ザスキア	恐らく、錬金術で改造を施したのでしょう。\nそれくらいのことはやってもおかしくはない	Saskia	In all likelihood, it was augmented with alchemy. Those sorts of practices aren't entirely unheard of.	萨丝琪亚	恐怕是用炼金术改造的吧。\n那些家伙干得出来。	薩絲琪亞	這恐怕是用鍊金術改造而成的吧。\n他們會做出這種事也不意外。
TalkEvent_15_020ID	37	Resna	レスナ	そ、そんな使い方って……	Resna	B-But that's so...	蕾斯娜	怎、怎么会用炼金术做这种事……	蕾斯娜	竟、竟敢這樣濫用……
TalkEvent_15_020ID	38	Saskia	ザスキア	生物の本質から外れた行い。許すわけにはいかないわ	Saskia	Indeed. It upsets the natural balance, which we cannot let stand.	萨丝琪亚	我绝不容许这种有违自然法则的行径。	薩絲琪亞	偏離生物本質的行為，絕對不可饒恕。
TalkEvent_15_020ID	39	Saskia	ザスキア	みんな、退きなさい！	Saskia	Step aside, everyone!	萨丝琪亚	各位，退后！	薩絲琪亞	大家退開！
TalkEvent_15_020ID	40	Johanna	ヨハナ	え……今の	Johanna	What...was that?	约翰娜	刚才那是……	約翰娜	咦……剛才那是……
TalkEvent_15_020ID	41	Saskia	ザスキア	ふぅ。あんなものは存在させてはおけないものね	Saskia	Phew. Well, we could not let that creature continue to roam around.	萨丝琪亚	呼，毕竟不能让那种生物存在于世啊。	薩絲琪亞	呼……可不能讓那種東西存在這個世上。
TalkEvent_15_020ID	42	Resna	レスナ	すごい！　すごいです、師匠！	Resna	Wow! Miss Saskia, that was incredible!	蕾斯娜	好厉害！太厉害了，师父！	蕾斯娜	好厲害！太厲害了，師父！
TalkEvent_15_020ID	43	Saskia	ザスキア	いえーい。まぁ相性もあったのかもね	Saskia	Oh, hardly. I simply chose the most effective attack.	萨丝琪亚	很棒吧～不过也可能是因为我刚好克制它。	薩絲琪亞	耶～！不過，可能是我剋牠吧。
TalkEvent_15_020ID	44	Izana	イザナ	ザスキアさんって強いんだね。\nさすがレスナちゃんの師匠っ！	Izana	You sure are strong, Miss Saskia! Not that Resna's teacher would be anything less than amazing!	伊札娜	萨丝琪亚小姐太强了。\n真不愧是蕾斯娜的师父！	伊札娜	薩絲琪亞小姐真強呢。\n不愧是蕾斯娜的師父！
TalkEvent_15_020ID	45	Sterk	ステルク	あ、ああ。驚いたな	Sterk	Yeah. That certainly was something else.	史特尔克	是、是啊。真是惊人。	史特爾克	是、是啊，太驚人了。
TalkEvent_15_020ID	46	Johanna	ヨハナ	み、認めない……\n私のほうがすごいに決まってるのに	Johanna	W-Well, I don't think so! I'm the best! Obviously!	约翰娜	我、我不承认……\n明明我才更厉害。	約翰娜	我、我不承認……\n明明絕對是我比較厲害。
TalkEvent_15_020ID	47	Johanna	ヨハナ	錬金術なんかより、私のほうが……\nだって、おじいちゃんが、私は最強だって……！	Johanna	I'm better than any of you alchemists! Because my grandpa said so!	约翰娜	什么炼金术，怎么比得上我……\n爷爷说过，我才是最强的……！	約翰娜	跟那什麼鍊金術相比，我更厲害……\n因為，爺爺說過我是最強的……！
TalkEvent_15_021ID	0	Resna	レスナ	いったん、なんとかなりましたけど……\n師匠、このまま探索を続けて大丈夫でしょうか？	Resna	I'm glad that everything worked out, but is it safe to keep exploring?	蕾斯娜	总之眼前的问题是解决了……\n师父，我们继续探索下去没问题吗？	蕾斯娜	雖然事情暫時是解決了……\n師父，我們繼續下去探索沒問題嗎？
TalkEvent_15_021ID	1	Izana	イザナ	向こうはあからさまに\n敵意を持ってるみたいだったもんね	Izana	Yeah, those guys didn't look too happy that we're here.	伊札娜	毕竟对方明显对我们抱有敌意啊。	伊札娜	畢竟對方明顯對我們懷有敵意。
TalkEvent_15_021ID	2	Saskia	ザスキア	彼らが目的を果たすまで待つという手も\nあると思うけれど。さて、どうしようかしらね	Saskia	I suppose we could wait until they finish whatever it is that they came here for. Though, what do you think?	萨丝琪亚	我们也可以等他们达成目的收工后再前进。\n嗯，怎么办好呢？	薩絲琪亞	也是可以等他們達成目的以後再行動。\n那麼，大家想怎麼做呢？
TalkEvent_15_021ID	3	Resna	レスナ	うーん……早く帰ってくれたらいいんですけど\nそもそも素材を根こそぎ持っていく人たちですから	Resna	Hmm... As much as I'd like to hurry on home, they're the sort of people to pick everything they can get their hands on.	蕾斯娜	唔……要是他们能早点离开就好了。\n但他们所到之处，素材都会被搜刮得一干二净。	蕾斯娜	嗯……如果他們能快點回去就好了。\n但說起來他們本來就是會把素材全部拿光的那種人。
TalkEvent_15_021ID	4	Johanna	ヨハナ	そんなにあいつらが目障りなら、\n私が捕まえてきてあげる	Johanna	I'll just go and capture those jerks. Problem solved.	约翰娜	既然那些家伙有那么碍事，\n我去帮你们把他们统统抓起来。	約翰娜	如果那些傢伙那麼礙眼，\n我就去把他們抓來吧。
TalkEvent_15_021ID	5	Johanna	ヨハナ	あんたたちは、そこで待ってて！	Johanna	You're not getting away from me!	约翰娜	你们就在这等着吧！	約翰娜	你們在這裡等著！
TalkEvent_15_021ID	6	Resna	レスナ	え？　ヨハナさん、待って！	Resna	Huh? Johanna, wait!	蕾斯娜	什么？约翰娜小姐，等一下！	蕾斯娜	咦？約翰娜小姐，等等！
TalkEvent_15_021ID	7	Sterk	ステルク	あいつらって……一人で極夜の錬金党を追うつもりか	Sterk	She intends to chase down those Polar Night alchemists on her own, I take it?	史特尔克	“那些家伙”……难道她打算以一敌多？	史特爾克	那些傢伙……她是打算一個人去追極夜的鍊金黨嗎？
TalkEvent_15_021ID	8	Resna	レスナ	待って！　一人じゃ危険すぎます！	Resna	Don't! They're too dangerous to confront by yourself!	蕾斯娜	等一下！一个人去太危险了！	蕾斯娜	等等！妳一個人去太危險了！
TalkEvent_15_021ID	9	Resna	レスナ	戻ってきてください、ヨハナさん！\nヨハナさんっ！	Resna	Johanna! Please, come back! Johanna!	蕾斯娜	快回来，约翰娜小姐！\n约翰娜小姐！	蕾斯娜	約翰娜小姐，請回來吧！\n約翰娜小姐！
TalkEvent_15_021ID	10		オリバー	――いいかヨハナ、よく覚えておけ。\n弱い奴は使えない、弱い奴はいらない	Oliver	Remember, Johanna. Weaklings are useless. They are worthless.	奥利弗	――记住，约翰娜。\n我手下不需要百无一用的弱者。	奧利弗	──聽好了約翰娜，妳要好好記住，\n弱小的傢伙毫無用處，我不需要。
TalkEvent_15_021ID	11		オリバー	だからお前は\n誰にも負けてはならない	Oliver	You cannot afford to lose to anyone, Johanna. Do not be a weakling. Do not be worthless.	奥利弗	所以，你绝不可输给任何人。	奧利弗	所以妳不能輸給任何人。
TalkEvent_15_021ID	12		オリバー	力こそが、お前のすべてだ。その身をもって、\nお前の存在意義を示しなさい	Oliver	Your strength is everything. Use it. Carve out your own place in this world.	奥利弗	力量，即为你的一切。\n用你自身的力量来证明你存在的意义吧。	奧利弗	力量才是妳的全部。\n用妳的身軀展現自身的存在意義吧。
TalkEvent_15_021ID	13		オリバー	儂が認めたお前ならば、できるはずだ。天才だからな	Oliver	I know you can—you're a prodigy.	奥利弗	你是我认可之人，你一定能做到。因为你是天才。	奧利弗	受我認可的妳，應該做得到才對，因為妳是天才。
TalkEvent_15_021ID	14	Johanna	ヨハナ	……そうだ、私は強い。\nそして、誰よりも天才なんだ	Johanna	Yeah. I'm strong. I'm better than anyone else.	约翰娜	……没错，我很强。\n我是最厉害的天才。	約翰娜	……沒錯，我很強。\n而且是無與倫比的天才。
TalkEvent_15_021ID	15	Johanna	ヨハナ	あの変な魔物との戦いならともかく、\n人と人との戦いで負けるはずがない	Johanna	Weird monsters don't count. When I'm up against people, I can't lose!	约翰娜	和那种奇怪的魔物打成什么结果另说，\n但人与人之间的战斗我绝不会输。	約翰娜	和那隻詭異的魔物戰鬥就算了，\n人與人之間的對戰，我是不可能輸的。
TalkEvent_15_021ID	16	Johanna	ヨハナ	月影の会の秩序の番人……最強の戦士！\nそれが、私なんだからっ！	Johanna	I'm the best fighter the Moonlight Society has! I maintain order! That's who I am!	约翰娜	因为我是月影会秩序的守护者……\n我是最强的战士！	約翰娜	因為月影會的秩序守護者……最強的戰士！\n就是我！
TalkEvent_15_021ID	17	Saskia	ザスキア	……ダメね、もう姿が見えないわ	Saskia	Oh dear. I don't see her anywhere.	萨丝琪亚	……拦不住啊，这么快就没影了。	薩絲琪亞	……不行，已經看不見她的身影了。
TalkEvent_15_021ID	18	Izana	イザナ	もう、好きに動いてくれちゃって！	Izana	Ugh, why'd she have to run off like that?!	伊札娜	真是的，她总是这么自作主张！	伊札娜	真是的，竟然擅自行動！
TalkEvent_15_021ID	19	Resna	レスナ	私たちもヨハナさんを追いかけましょう！	Resna	We've got to go after her!	蕾斯娜	我们也快去追约翰娜小姐吧！	蕾斯娜	我們也去追約翰娜小姐吧！
TalkEvent_15_022ID	0	Valeria	ヴァレリア	レスナ来てる？	Valeria	Hey, is Resna here?	瓦莱莉娅	蕾斯娜在吗？	瓦萊莉婭	蕾斯娜有來嗎？
TalkEvent_15_022ID	1	Rorona	ロロナ	あ、ヴァレリアさん！　惜しいです！\nレスナちゃんはちょうど依頼で出かけちゃったんですよ	Rorona	Oh, Valeria! Long time no see! You just missed her, actually. She's out on a request!	萝乐娜	啊，瓦莱莉娅小姐！真不巧！\n蕾斯娜现在出去处理委托了。	蘿樂娜	啊，瓦萊莉婭小姐！太不巧了！\n蕾斯娜正好出去處理委託工作了。
TalkEvent_15_022ID	2	Valeria	ヴァレリア	え、そうなの？　近く？	Valeria	She is? Is it something nearby?	瓦莱莉娅	咦，这样啊。是在这附近吗？	瓦萊莉婭	咦，這樣啊？在附近嗎？
TalkEvent_15_022ID	3	Ryza	ライザ	それがね、ベルク州まで行ってるんだよね	Ryza	Actually, she's gone off to Berg.	莱莎	不，她和同伴们去了贝尔克州。	萊莎	這個啊，她去了貝魯克州囉。
TalkEvent_15_022ID	4	Valeria	ヴァレリア	ええっ。私、ちょうどベルク州から帰ってきた\nところなのに。行き違っちゃったわ	Valeria	You don't say. I just got back from there. We must've just missed each other.	瓦莱莉娅	什么，我就是从贝尔克州回来的啊。\n看来和她们在途中错过了。	瓦萊莉婭	什麼？我才剛從貝魯克州回來耶。\n和她錯過了。
TalkEvent_15_022ID	5	Roman	ロマン	やあ、ヴァレリア。ちょうど広場にいるのを\n見かけたから、追いかけてきてしまったよ	Roman	Hey, Valeria. We saw you in the square, so we figured we'd stop in and say hi.	罗曼	你好啊，瓦莱莉娅。\n正好我们在广场看到你，就追过来了。	羅曼	嗨，瓦萊莉婭。我剛好看到妳在廣場，\n就追過來了。
TalkEvent_15_022ID	6	Valeria	ヴァレリア	ロマン！　ユナ！\nレスナが、ベルク州に出かけたんだって	Valeria	Roman! Juna! Resna's in Berg right now, though.	瓦莱莉娅	罗曼！尤娜！\n我听说蕾斯娜去了贝尔克州。	瓦萊莉婭	羅曼！尤娜！\n聽說蕾斯娜去了貝魯克州。
TalkEvent_15_022ID	7	Juna	ユナ	ヨハナも一緒か？	Juna	Was Johanna with her?	尤娜	约翰娜也一起去了吗？	尤娜	約翰娜也一起去了？
TalkEvent_15_022ID	8	Ryza	ライザ	はい。あの子、ちゃんと言うこと聞いてるかなあ	Ryza	Yep. I wonder how well she's listening to Resna.	莱莎	是的。不知道她有没有好好听话。	萊莎	是的，不知道她有沒有乖乖聽話。
TalkEvent_15_022ID	9	Valeria	ヴァレリア	ちょ、ちょっと待って。\nヨハナが一緒ってどういうこと？	Valeria	W-Wait, what's all this about Johanna?	瓦莱莉娅	等、等等。\n约翰娜也一起去了？什么情况？	瓦萊莉婭	等、等一下。\n妳說約翰娜一起去是怎麼回事？
TalkEvent_15_022ID	10	Roman	ロマン	更生の機会を与えるために、\nレスナの依頼を手伝ってもらうことになったんだ	Roman	She's been given a chance at rehabilitation, so she's currently helping Resna fulfill a request.	罗曼	为了给她一个改过自新的机会，\n我派她去帮蕾斯娜一起完成委托了。	羅曼	為了給她一個改過自新的機會，\n我們讓她去幫忙蕾斯娜處理委託了。
TalkEvent_15_022ID	11	Valeria	ヴァレリア	ええっ！？　それ、大丈夫なの？	Valeria	What?! Is that really okay?	瓦莱莉娅	什么？！那真的没问题吗？	瓦萊莉婭	咦──！？那樣沒問題嗎？
TalkEvent_15_022ID	12	Roman	ロマン	同志たっての願いだからね。心配ではあるけど	Roman	Well, I couldn't turn down an entreaty from a kindred spirit, even if I do have some reservations about it.	罗曼	我的同志她本人是如此希望的。不过我其实也不太放心。	羅曼	因為那是同伴的強烈請求，我也有點擔心就是了。
TalkEvent_15_022ID	13	Juna	ユナ	はい。年相応の側面も見られたとはいえ、\nついこの間まで鴉であった存在ですから	Juna	Agreed. She may be young, but we can't forget that she used to be the Crow.	尤娜	是啊。她虽说也有孩子气的一面，\n但毕竟不久前还是那个鸦啊。	尤娜	是啊。雖然她表現出來的樣子也有符合她年齡的一面，\n但不久前她的身分都還是烏鴉。
TalkEvent_15_022ID	14	Roman	ロマン	そうだ。仕事も片付いたところだし、\n私たちも様子を見に行ってみないか、ユナ	Roman	The only thing we can really do is wait and see how she adjusts. Now that work's died down, why don't we pay her a visit?	罗曼	对了，如今工作正好告一段落，\n我们也跟过去看看情况怎么样，尤娜？	羅曼	對了尤娜，反正工作也差不多搞定了，\n我們要不要也去看看情況呢？
TalkEvent_15_022ID	15	Juna	ユナ	経過観察という意味では、妥当なご判断かと	Juna	That sounds reasonable enough. It's only fitting that we should observe the proceedings.	尤娜	若是所谓的跟踪调查，我认为十分合理。	尤娜	就觀察狀況的意義上來看，我認為是適當的判斷。
TalkEvent_15_022ID	16	Valeria	ヴァレリア	それなら私も行くわ！	Valeria	I'm going with you!	瓦莱莉娅	我也要去！	瓦萊莉婭	那我也要去！
TalkEvent_15_022ID	17	Valeria	ヴァレリア	レスナと行き違っちゃったってがっかりしたけど、\nそういうことならちょうどよかったわ	Valeria	I was feeling down about missing Resna, so this is perfect timing.	瓦莱莉娅	我本来很遗憾路上没碰到蕾斯娜，\n不过能去跟踪调查也正合我意。	瓦萊莉婭	錯過和蕾斯娜碰面的機會，我還滿失望的，\n你們要去的話正好。
TalkEvent_15_022ID	18	Roman	ロマン	分かった。同行頼んだよ、ヴァレリア	Roman	We'd be happy to have you with us, Valeria.	罗曼	好。那就拜托你同行了，瓦莱莉娅。	羅曼	知道了。那就請妳一起同行了，瓦萊莉婭。
TalkEvent_15_022ID	19	Valeria	ヴァレリア	よーし、行きましょ！	Valeria	Okay, let's head out!	瓦莱莉娅	好！我们走吧！	瓦萊莉婭	好──我們走吧！
TalkEvent_15_023ID	0	Johanna	ヨハナ	見つけた、極夜の錬金党――！	Johanna	Found you, Polar Night Alchemists!	约翰娜	找到了，极夜的炼金党――！	約翰娜	找到了，極夜的鍊金黨──！
TalkEvent_15_023ID	1	Johanna	ヨハナ	あの獣人のほうは……どこかに隠れてるの？	Johanna	Wait... Where is that beast-man hiding?	约翰娜	那个兽人……是躲起来了吗？	約翰娜	那個獸人……躲起來了嗎？
TalkEvent_15_023ID	2	Johanna	ヨハナ	……まあいい。どこから出てきても、\n私なら対処できる	Johanna	Well, whatever. He shows up when he shows up. I'll survive.	约翰娜	……算了。\n反正不管从哪现身我都能应付。	約翰娜	……算了，不管牠從哪裡冒出來，\n我都有辦法對付。
TalkEvent_15_023ID	3	Johanna	ヨハナ	まずは、あいつをやる――！	Johanna	In the meantime, I'll take that lady out!	约翰娜	首先就从那家伙下手――！	約翰娜	先從這傢伙開始解決──！
TalkEvent_15_023ID	4	Johanna	ヨハナ	ふっ――！	Johanna	Hff!	约翰娜	呼——！	約翰娜	呼──！
TalkEvent_15_023ID	5	Lara	ララ	っ……！？	Lara	Hm?!	拉拉	唔……？！	拉拉	唔……！？
TalkEvent_15_023ID	6	Lara	ララ	あら、こんな所まで追ってきましたのね。\nしつこいお子様ですこと	Lara	Goodness, chasing us all the way to a location like this? Aren't you a stubborn one.	拉拉	哎呀，居然追到了这里。\n真是个执着的小朋友。	拉拉	哎呀，妳追到了這種地方來啊。\n真是個糾纏不休的孩子。
TalkEvent_15_023ID	7	Johanna	ヨハナ	うるさい。あんたは私が倒す！　さもあっさりとね	Johanna	Shut up! You're going down, plain and simple!	约翰娜	闭嘴。我会不费吹灰之力地解决你！	約翰娜	少囉嗦，我會打倒妳的！而且是輕輕鬆鬆地打倒。
TalkEvent_15_023ID	8	Lara	ララ	あなたには無理ですわ、てんで無理	Lara	Oh, that will not happen. It's utterly impossible.	拉拉	你做不到哦，绝对做不到。	拉拉	妳做不到的，絕對做不到。
TalkEvent_15_023ID	9	Johanna	ヨハナ	――――！　これは、霧……？	Johanna	Is that...fog?	约翰娜	——唔！这是、雾……？	約翰娜	────！這是，霧……？
TalkEvent_15_023ID	10	Lara	ララ	ジェロン！　出番ですわよ！	Lara	Geron! Time to take to the stage!	拉拉	杰隆！该你上场了！	拉拉	傑隆！該你出場了！
TalkEvent_15_023ID	11	Johanna	ヨハナ	！？	Johanna	?!	约翰娜	？！	約翰娜	！？
TalkEvent_15_023ID	12	Geron	ジェロン	ほう、見えていたか？	Geron	Huh. Didn't expect you to see me coming.	杰隆	哦？你看得见啊？	傑隆	哦，妳看得見？
TalkEvent_15_023ID	13	Johanna	ヨハナ	そのくらい、音で分かるわよ。\n不意打ちしたつもりでしょうけど、残念だったわね	Johanna	All the noise you were making gave you away. Sorry, but you wasted the element of surprise.	约翰娜	这点小把戏，我靠耳朵就听出来了。\n本打算出其不意是吧？真为你们遗憾。	約翰娜	這點攻擊，我聽聲音就知道了。\n你本來應該是想突襲吧，真可惜。
TalkEvent_15_023ID	14	Geron	ジェロン	ならばこれはどうだ？	Geron	You speak too soon.	杰隆	那这样如何？	傑隆	那麼這樣如何？
TalkEvent_15_023ID	15	Johanna	ヨハナ	…………	Johanna	...	约翰娜	……	約翰娜	…………
TalkEvent_15_023ID	16	Johanna	ヨハナ	そこっ！	Johanna	There!	约翰娜	看招！	約翰娜	在那裡！
TalkEvent_15_023ID	17	Geron	ジェロン	っ！	Geron	...!	杰隆	唔！	傑隆	唔！
TalkEvent_15_023ID	18	Johanna	ヨハナ	逃がさないっ！	Johanna	You're not getting away from me!	约翰娜	休想逃！	約翰娜	別想逃！
TalkEvent_15_023ID	19	Johanna	ヨハナ	はあっ！	Johanna	Hah!	约翰娜	喝啊！	約翰娜	喝啊！
TalkEvent_15_023ID	20	Geron	ジェロン	くっ	Geron	Ngh!	杰隆	唔！	傑隆	唔。
TalkEvent_15_023ID	21	Johanna	ヨハナ	言ったでしょ。霧に隠れても音で分かるって	Johanna	You make too much noise. There's no way you can hide in this fog.	约翰娜	我说过的吧。即使你躲在雾里，我也听得出你在哪。	約翰娜	我說過了吧，就算躲在霧中，我也能聽出你的方位。
TalkEvent_15_023ID	22	Geron	ジェロン	分かるから、なんだ？	Geron	Who said I was trying to?	杰隆	听得出又如何？	傑隆	聽得出來又怎樣？
TalkEvent_15_023ID	23	Johanna	ヨハナ	え？	Johanna	Huh?	约翰娜	咦？	約翰娜	咦？
TalkEvent_15_023ID	24	Johanna	ヨハナ	なに……身体が、痺れ……	Johanna	Huh? My body feels numb...	约翰娜	什么……身体麻痹了……	約翰娜	什麼……身體，麻痺了……
TalkEvent_15_023ID	25	Johanna	ヨハナ	（まさか、この霧――！）	Johanna	(It's that fog again!)	约翰娜	（难道是……因为这片雾――！）	約翰娜	（難道說，是這陣霧──！）
TalkEvent_15_023ID	26	Johanna	ヨハナ	ぐぅっ……	Johanna	Ngh...	约翰娜	唔……	約翰娜	唔……
TalkEvent_15_023ID	27	Lara	ララ	いかがだったかしら？　毒の霧のお味は	Lara	How are you enjoying my poison mist?	拉拉	毒雾的体验可还舒适？	拉拉	毒霧的滋味如何呀？
TalkEvent_15_023ID	28	Johanna	ヨハナ	こいつ……かはっ	Johanna	You lousy... *Cough*	约翰娜	你这家伙……呜啊……	約翰娜	妳這傢伙……咳呃！
TalkEvent_15_023ID	29	Lara	ララ	腕が立つとはいっても、考え無しのお馬鹿さんが\n相手なら、やりようはいくらでもありますわ	Lara	No matter how capable you might be, a gullible moron will always be a gullible moron.	拉拉	不论敌人的四肢再怎么发达，\n只要头脑简单，制敌手段就信手拈来。	拉拉	就算對手身手了得，但如果是個不會思考的笨蛋，\n對付的方法還是要多少有多少。
TalkEvent_15_023ID	30	Lara	ララ	しばらく、じっとしていなさいな	Lara	You just sit right there, hm?	拉拉	你就暂时乖乖呆着吧。	拉拉	妳就暫時乖乖待著吧。
TalkEvent_15_023ID	31	Geron	ジェロン	ララ。解毒薬をよこせ。\n……俺もきつくなってきた	Geron	Fork over the antidote, Lara. I'm not doing much better.	杰隆	拉拉，给我解药……我也开始难受了。	傑隆	拉拉，解毒藥拿來。\n……我也開始不舒服了。
