romanized	name_jp	text_jp	name_en	text_en	name_zh-CN	text_zh-CN	name_zh-TW	text_zh-TW
Izana	イザナ	アーラルさん！　いーますかー！！	Izana	Allar! Is there a Mr. or Mrs. Allar here?!	伊札娜	阿拉尔——！你在吗——！！	伊札娜	亞～拉爾先生！您——在嗎——！！
Resna	レスナ	"ちょ、ちょっとちょっと！
何してるの？"	Resna	Whoa, whoa, whoa! What are you doing?	蕾斯娜	"等、等等！
你在干嘛啦？"	蕾斯娜	"等、等一下！
妳在做什麼呀？"
Izana	イザナ	もしこの辺りにいたら反応してくれるかなーって	Izana	I figured they'd speak up if they were around here somewhere.	伊札娜	因为这样他要是在附近的话说不定会回答我啊。	伊札娜	我想說如果他就在這附近，應該會回答我啊。
Resna	レスナ	やめてよ恥ずかしいよ！	Resna	Well, stop it! That's so embarrassing!	蕾斯娜	别这样，好丢人！	蕾斯娜	別這樣啦，好丟人！
Izana	イザナ	えー、これが手っ取り早いじゃん	Izana	What do you mean? This is definitely the quickest way!	伊札娜	咦～这样不是效率比较高嘛。	伊札娜	咦～這樣不是比較快嗎？
Resna	レスナ	それはそうだけど……でもダメ！	Resna	That may be true, but that's not how we're doing this!	蕾斯娜	你说得没错啦……但还是不行！	蕾斯娜	話是這麼說沒錯啦……但還是不行！
Izana	イザナ	はぁーい	Izana	Fiiine.	伊札娜	知道啦～	伊札娜	好吧～
