romanized	name_jp	text_jp	name_en	text_en	name_zh-CN	text_zh-CN	name_zh-TW	text_zh-TW
Linca	リンカ	"あ、あの、リラ！
リラの鉤爪での戦い方、実に見事ですね！"	Linca	Um, Lila! I just wanted to say I find the way you fight with those claws really impressive!	琳卡	"莉、莉拉！
你用钩爪战斗的样子实在是厉害！"	琳卡	"那、那個，莉拉！
妳使用鉤爪的戰鬥方式真是出色！"
Lila	リラ	"リンカこそ見事な大剣さばきだ。
細身の身体でよく使いこなしている"	Lila	Your skill with the sword is also very impressive. You handle it well for someone with such a slender build.	莉拉	"琳卡你的大剑招式才威风呢。
看你这么小巧，居然能自如地使用那么大一把武器。"	莉拉	"妳才是，那個揮舞大劍的動作才出色，
即使身形纖細，動作依然流暢。"
Linca	リンカ	"あ、ありがとうございますっ！
それから……ええと、どう話したものか……"	Linca	Th-Thank you! Also, um... How should I put this...	琳卡	"谢、谢谢你。
然后……唔，该怎么说呢……"	琳卡	"謝、謝謝妳！
然後……我想想，該怎麼說才好呢……"
Lila	リラ	まだ何かあるのか？	Lila	Is there something else?	莉拉	还有别的事吗？	莉拉	還有什麼事嗎？
Linca	リンカ	いえ、大したことではないのですが……	Linca	Ah, it's nothing important, but...	琳卡	不不，也不是什么大事……	琳卡	不，不是什麼大不了的事……
Lila	リラ	"そうか。
では、私は少し先の様子を見てくる"	Lila	Okay. I'll go scout ahead then.	莉拉	"是吗？
那我就先去前面看看情况。"	莉拉	這樣啊。那麼，我先去看一下前方的情況。
Linca	リンカ	あ、はい……お気を付けて	Linca	Ah, all right... be careful.	琳卡	啊，好的……请小心。	琳卡	啊，好的……路上小心。
Linca	リンカ	……はあぁぁ、また上手く言えなかった	Linca	*Sigh* I just can't find the words...	琳卡	……唉，又没能好好说出口。	琳卡	……唉～又沒能好好說出口。
Valeria	ヴァレリア	ねえ、なんの話してたの？	Valeria	Hey, what were you talking about?	瓦莱莉娅	嗨，你们聊了些什么？	瓦萊莉婭	妳們剛才在聊什麼？
Linca	リンカ	"……以前、友達を作るという任務を受けて
いるという話はしましたよね"	Linca	As I mentioned before, I was given a mission to make friends.	琳卡	"……我跟你说过吧，
我以前接受过一个交朋友的任务。"	琳卡	……以前，我說過我接了一個交朋友的任務對吧？
Valeria	ヴァレリア	ああ、今度はリラと友達になろうとしてたのね	Valeria	Aha. So you're trying to be friends with Lila.	瓦莱莉娅	哦，你这次是想跟莉拉当朋友啊。	瓦萊莉婭	喔，所以妳這次打算跟莉拉成為朋友啊。
Linca	リンカ	"はい。でも、ヴァレリアの時みたいに
なかなか自分から言えなくて……"	Linca	Yes, but unfortunately I can't just run out and say it like I know you would...	琳卡	"是的，但是我没法像对瓦莱莉娅那样
主动说出口……"	琳卡	"是的。
可是，我一直沒辦法像當時面對妳那樣說出來……"
Valeria	ヴァレリア	そんなに難しく考えなくても大丈夫よ	Valeria	You're just thinking about it too much!	瓦莱莉娅	你不用顾虑那么多的啦。	瓦萊莉婭	不必想得這麼困難啦。
Valeria	ヴァレリア	"私、リンカに友達になりたいって言われて
嬉しかったもん！"	Valeria	I mean, I was so happy when you said you wanted to be friends with me.	瓦莱莉娅	"你说想跟我交朋友的时候，
我可开心了！"	瓦萊莉婭	當時聽到妳說想和我成為朋友，我很高興啊！
Linca	リンカ	"ほ、本当ですか！？　ヴァレリアが
そう言うのなら、もう一度挑戦してみます！"	Linca	You were?! Hearing you say that really inspires confidence! I'm going to try again!	琳卡	"真、真的吗？！
既然瓦莱莉娅这么说，那我就再挑战试试！"	琳卡	"真、真的嗎！？
既然妳這麼說了，我會再挑戰一次的！"
Valeria	ヴァレリア	"よく言ったわ。それでこそリンカ。
頑張って！　見守ってるからさ"	Valeria	Excellent! That's the Linca I want to see. Good luck! I'll be watching!	瓦莱莉娅	"不错，这才是琳卡嘛。
加油啊，我会在一边给你力量的。"	瓦萊莉婭	"說得好，這樣才像妳。
加油！我會看著妳的。"
Linca	リンカ	はい！　ありがとうございます！	Linca	Yes! Thank you!	琳卡	嗯！谢谢你！	琳卡	好的！謝謝妳！
Linca	リンカ	"リラ、待ってください！
実は、あなたにお願いがあるんです"	Linca	Lila, wait a second! I have something to ask you!	琳卡	"莉拉，请等一下！
其实我有事想拜托你。"	琳卡	"莉拉，請等一下！
老實說，我有個請求。"
Lila	リラ	お願い？　言ってみろ	Lila	Something to ask? Go ahead.	莉拉	有事？说来听听。	莉拉	請求？妳說說看。
Linca	リンカ	じ、自分と友達になってもらえませんか！？	Linca	W-Would you be willing to be my friend?!	琳卡	你、你能做我的朋友吗？！	琳卡	請問妳、妳能跟我做朋友嗎！？
Lila	リラ	いや、その必要はない	Lila	No need.	莉拉	不，没必要。	莉拉	不，沒那個必要。
Linca	リンカ	……っ！！	Linca	Wha—?!	琳卡	……！！	琳卡	……唔！！
Valeria	ヴァレリア	"瞬殺！？　リンカ、落ち着いて。息を吸う時間に
対して２倍かけて息を吐くのよ！"	Valeria	Shot down?! Linca, calm down. Take a deep breath and exhale slowly.	瓦莱莉娅	"秒杀？！琳卡，冷静点，
先吸气，再用2倍的时间缓缓吐气！"	瓦萊莉婭	"秒殺！？琳卡，冷靜下來，
用吸氣的兩倍時間吐氣！"
Lila	リラ	"ふっ。もうすでに戦友なのだから、
改めて友になる必要はないはずだ"	Lila	We're already comrades-in-arms, there is no need to renew that friendship.	莉拉	"呵。我们已经是战友了，
没必要再去做朋友啊。"	莉拉	"呵，我們已經是戰友了，
應該沒必要再重新結為朋友吧。"
Linca	リンカ	"せ、戦友……！　はい、そうですね！
共に戦った仲間ですから！"	Linca	C-Comrades! Yes! Of course! Companions who have fought together!	琳卡	"战、战友……！对，没错！
我们是共同战斗的伙伴！"	琳卡	"戰、戰友……！對，妳說得對！
我們是並肩作戰過的夥伴嘛！"
Lila	リラ	"ああ。
これからも、よろしく頼むぞ"	Lila	Correct. I'll always be counting on you.	莉拉	"是啊。
今后也请多关照。"	莉拉	是啊。今後也請多關照。
Valeria	ヴァレリア	はーっ。ホッとした	Valeria	Phew. What a relief.	瓦莱莉娅	呼，总算松了一口气。	瓦萊莉婭	呼～總算鬆了口氣。
Marion	マリオン	ふふふ。よかったわね、リンカ	Marion	Hehe. Glad it all worked out, Linca.	玛丽翁	呵呵，太好啦，琳卡。	瑪麗翁	呵呵呵，太好了呢，琳卡。
Linca	リンカ	"はい！
また１つ、任務達成です！"	Linca	True! Another mission accomplished!	琳卡	"是啊！
我又完成了一个任务！"	琳卡	是的！我又達成一項任務了！
Marion	マリオン	"じゃあ、こっちの任務にも集中できるわね。
ここから先は今以上に気を引き締めてちょうだい"	Marion	Now let's focus on our primary mission. We need to stay more vigilant than ever.	玛丽翁	"那就该专心做手头这个任务了。
接下来要严加防范啊。"	瑪麗翁	"這樣妳也能專注於這邊的任務了吧。
接下來要比現在更認真哦。"
Marion	マリオン	"この奥には、月影の会だけじゃなく
極夜の錬金党もいるはずだから"	Marion	The Moonlight Society and Polar Night Alchemists could be up ahead.	玛丽翁	"毕竟密林深处不仅有月影会，
还有极夜的炼金党。"	瑪麗翁	"畢竟深處應該不只有月影會，
還會有極夜的鍊金黨。"
Linca	リンカ	はい！　行きましょう、皆さん！	Linca	Yes! Onward, everyone!	琳卡	好的！各位，我们走吧！	琳卡	好的！各位，我們走吧！
