romanized	name_jp	text_jp	name_en	text_en	name_zh-CN	text_zh-CN	name_zh-TW	text_zh-TW
Resna	レスナ	皆さん、あっちにも色々と素材がありそうですよ	Resna	Look over there! That looks like a promising spot for materials!	蕾斯娜	各位，那边好像也有很多素材哦。	蕾斯娜	各位，那邊好像也有各種素材呢。
Firis	フィリス	"あれ？　誰かいる……。
わたしたち以外にもここに入る人がいるなんて"	Firis	Huh? Someone's there. I wasn't expecting anyone else to be here.	菲利丝	"嗯？有人在……
没想到这里除了我们还有别人。"	菲莉絲	"咦？是誰……
沒想到這裡除了我們之外，還有其他人。"
Izana	イザナ	あっ！？　あいつ、まさか！	Izana	Oh! No way, not that guy!	伊札娜	啊？！我好像见过那家伙！	伊札娜	啊！？那傢伙該不會是……！
Resna	レスナ	極夜の錬金党の！	Resna	He's a Polar Night Alchemist!	蕾斯娜	是极夜的炼金党！	蕾斯娜	極夜的鍊金黨！
Geron	ジェロン	お前は……あの時の錬金術士か	Geron	You're...the alchemist from the cave.	杰隆	你是……之前遇到过的炼金术士。	傑隆	妳是……那時候的鍊金術士啊。
Juna	ユナ	極夜の錬金党。こんな所で遭遇するとは	Juna	Of all the places to encounter one of their members...	尤娜	没想到会在这里碰上极夜的炼金党。	尤娜	竟然會在這種地方遇上極夜的鍊金黨。
Resna	レスナ	"確か名前は……ジェロン。
以前、素材を無理矢理、奪っていったことがあって……"	Resna	I'm pretty sure his name was...Geron. The last time we met, he stole a bunch of our materials by force.	蕾斯娜	"我记得……他叫杰隆。
曾经不由分说地抢走了我们的素材……"	蕾斯娜	"我記得你叫做……傑隆。
曾強行奪走素材……"
Juna	ユナ	"極夜の錬金党は騎士団としても要警戒対象だ。
お前、ここで何をしていた"	Juna	The knighthood has also been keeping a close watch on that particular group. You there. What are you doing here?	尤娜	"极夜的炼金党也是骑士团的主要防备目标。
你在这里做什么？"	尤娜	"身為騎士團的一員，極夜的鍊金黨是必須警戒的對象。
你在這裡做什麼？"
Geron	ジェロン	……白夜の騎士か	Geron	A Knight of the Midnight Sun, huh?	杰隆	……是白夜骑士啊。	傑隆	……是白夜騎士啊。
Juna	ユナ	質問に答えてもらおう	Juna	Answer the question.	尤娜	回答我的问题。	尤娜	請你回答問題。
Geron	ジェロン	お前たちに話す必要はない	Geron	I have no reason to speak with any of you.	杰隆	和你们无关。	傑隆	我沒必要告訴妳們。
Izana	イザナ	"きっとまた素材を独り占めする気だよ！
目的のためなら、なんだってする連中だもん"	Izana	I'll bet he's here to nab all the materials again! Those guys will do anything to further their selfish goals!	伊札娜	"你又打算独占素材了对吧！
毕竟你们都是些为了目的不择手段的败类。"	伊札娜	"他肯定是打算獨占素材啦！
畢竟都是些為了目的會不擇手段的傢伙。"
Geron	ジェロン	だとしたらどうする？　またここで剣を交えるか？	Geron	What of it? Are you planning to cross swords with me again?	杰隆	是又如何？你们打算在这里再和我交手吗？	傑隆	若是如此，妳們打算怎麼辦？在這裡再次交手嗎？
Firis	フィリス	うーん、なんか穏やかじゃないですね	Firis	Um, that sounded an awful lot like a threat.	菲利丝	唔——有点剑拔弩张呢。	菲莉絲	唔……氣氛好像有點緊張呢。
Juna	ユナ	邪魔するならば私が相手だ	Juna	If you plan on getting in our way, then you'll have to face me.	尤娜	你若是想碍事，就要先过我这一关。	尤娜	你要來礙事的話，我會負責對付你。
Resna	レスナ	"待ってください！
今はこんなところで争ってる場合じゃありません！"	Resna	Please, just wait! This really isn't the time for fighting!	蕾斯娜	"请等一下！
现在不是在这里争吵的时候！"	蕾斯娜	"請等一下！
現在不是在這種地方起衝突的時候！"
Resna	レスナ	"私は頂獣――ウェルテックスと戦うための手段を
少しでも増やすために、ここに来ています"	Resna	We came here to see if we could find anything to help us fight Weltex—the Apexi.	蕾斯娜	"我来这里，是为了尽可能多地增加
对抗顶兽——威尔特克斯的手段。"	蕾斯娜	"我之所以來到這裡，
是為了尋找對抗頂獸──威爾特庫斯的方法。"
Geron	ジェロン	…………	Geron	...	杰隆	……	傑隆	…………
Resna	レスナ	今は一刻も早く、あの頂獣を止めなくちゃいけない	Resna	We have to stop it as fast as we possibly can.	蕾斯娜	眼下必须尽早阻止那只顶兽才行。	蕾斯娜	現在得盡快阻止那頭頂獸才行。
Resna	レスナ	"そのために、錬金術が必要なんです！
人々を幸せにする、錬金術の力が――"	Resna	And to do that, we'll need to use alchemy! It's meant to make people happy...	蕾斯娜	"为此，需要炼金术的力量！
能带给人们幸福的炼金术的力量——"	蕾斯娜	"為了達成這個目的，鍊金術正是關鍵！
鍊金術是能讓人們獲得幸福的力量──"
Geron	ジェロン	お前は、まだそんな甘いことを言っているのか	Geron	Hmph. So you're still spouting that nonsense.	杰隆	你怎么还在说那些天真话。	傑隆	妳還在講這種天真的話啊？
Resna	レスナ	えっ？	Resna	Huh?	蕾斯娜	什么？	蕾斯娜	咦？
Geron	ジェロン	"これ以上話していても時間の無駄だ。
今の俺の相手はお前たちではない"	Geron	There's no need to drag this conversation out. For now, you aren't my opponent.	杰隆	"再说下去也不过是浪费时间。
我现在的目标不是你们。"	傑隆	"再多費唇舌也只是浪費時間。
我現在該對付的不是妳們。"
Resna	レスナ	行っちゃった？	Resna	He just...left?	蕾斯娜	他走了？	蕾斯娜	他走了？
Firis	フィリス	ふう……戦いにならなくてよかった	Firis	Phew... I'm glad that didn't end in a brawl.	菲利丝	呼……还好没有打起来。	菲莉絲	呼……沒大打出手真是太好了。
Izana	イザナ	うん。意外とあっさり引き下がったね	Izana	Yeah. He left a lot more willingly than I thought he would.	伊札娜	是啊，没想到他真的什么都没做就离开了。	伊札娜	嗯，沒想到他會走得如此乾脆。
Juna	ユナ	結局、何が目的だったのだ？	Juna	I wonder what he was after.	尤娜	他到底有什么目的呢？	尤娜	所以他到底是來做什麼的？
Resna	レスナ	とにかく、今は急いで素材を集めましょう！	Resna	Anyway, let's hurry up and get those materials!	蕾斯娜	总之我们还是赶快去收集素材吧！	蕾斯娜	總之，我們現在趕緊蒐集素材吧！
