romanized	name_jp	text_jp	name_en	text_en	name_zh-CN	text_zh-CN	name_zh-TW	text_zh-TW
	旅人	はあ、はあ、はあ……	Traveler	*Huff* *Huff*	旅人	呼、呼、呼……	旅人	呼、哈、呼……
	旅人	はあ、はあ、はあ……！	Traveler	*Huff* *Huff*	旅人	呼、呼、呼……！	旅人	呼、哈、呼……！
	旅人	だ、誰か！　助けてくれ！　魔物だ！	Traveler	Someone, help! Monsters are after me!	旅人	来、来人啊！救命！有魔物啊！	旅人	有、有人嗎！快來救救我！是魔物！
Resna	レスナ	大変！　イザナちゃん、助けに行かなきゃ！	Resna	Oh no! Izana, we have to help!	蕾斯娜	不好了！伊札娜，我们快去救人！	蕾斯娜	不好了！伊札娜，我們得去救他才行！
Izana	イザナ	ハンマーの出番だね、レスナちゃん！	Izana	It's hammer time, Resna!	伊札娜	我的锤子又可以大显身手了，对吧，蕾斯娜！	伊札娜	是錘子出場的時候了吧，蕾斯娜！
