romanized	name_jp	text_jp	name_en	text_en	name_zh-CN	text_zh-CN	name_zh-TW	text_zh-TW
Escha	エスカ	"この辺りって元々は港だったんですよね。
どうして使われなくなっちゃったんでしょう"	Escha	This area used to be a harbor, right? I wonder why people stopped using it.	爱丝卡	"这一带过去曾经是港口吧？
为什么现在荒废了呢？"	愛絲卡	"這一帶以前是港口吧。
為什麼會荒廢掉了呢？"
Esty	エスティ	"うーん。交易に使っていたんだとしたら、
交易相手がいなくなって使う必要がなくなったとか"	Esty	Hmm... If it was mostly for commerce, you wouldn't need it if, say, you lost all your trade partners.	艾丝缇	"这个嘛，可能这里过去是个交易场所，
后来不再和人交易，所以就不需要了吧。"	艾絲緹	"唔～如果原本是一個商港的話，
可能是沒有可以交易的對象，所以就沒有使用的必要了。"
Esty	エスティ	もしくは、何か船を出せない事情があるか、かしらね	Esty	Or if something was keeping you from sending boats out.	艾丝缇	也可能是有什么原因导致船只无法出航。	艾絲緹	又或者是有什麼內情，導致沒辦法讓船出航。
Escha	エスカ	"後で調べてみましょうか。
何か新しい発見があるかもしれませんし"	Escha	Let's look it up later. Who knows? It might lead to some sort of new discovery!	爱丝卡	之后调查一下吧，说不定会有新发现。	愛絲卡	"之後來調查看看好了。
搞不好會有什麼新發現呢。"
Esty	エスティ	"そうね。
でも、先にまずお使いを済ませないと"	Esty	Good idea. But we've got to finish what we came here for first.	艾丝缇	好呀。不过得先跑完腿再说。	艾絲緹	"對呀，
不過得先辦完交代我們的事情才行。"
Escha	エスカ	"はい、そうですね。
急がないとマリオンさんに怒られちゃいます"	Escha	Right, of course. If we don't hurry, Marion's not going to be happy.	爱丝卡	"嗯，说得对。
不快点的话会被玛丽翁小姐骂的。"	愛絲卡	"嗯，說得也是。
不快點的話，瑪麗翁會生氣的。"
