romanized	name_jp	text_jp	name_en	text_en	name_zh-CN	text_zh-CN	name_zh-TW	text_zh-TW
Izana	イザナ	さーて、あとは報告するだけだね	Izana	All-righty! Now we just have to report back in.	伊札娜	那么，之后只要回去报告就结束啦。	伊札娜	那麼，接下來只要回去報告就結束了。
Roman	ロマン	ああ、無事に終わってよかったよかった	Roman	And thank goodness for that. All's well that ends well, right?	罗曼	嗯，能顺利完成真是太好了。	羅曼	嗯，能順利解決，真是太好了。
Resna	レスナ	……あれ？　広場のほうが騒がしいような……	Resna	...Huh? There's a ton of noise coming from the square.	蕾斯娜	……咦？广场那边好像很热闹的样子……	蕾斯娜	……奇怪？廣場那邊好像很熱鬧的樣子……
Marion	マリオン	人だかりができてるわね。何かしら？	Marion	My, there's a whole crowd gathered. Whatever for?	玛丽翁	聚了好多人呢。发生什么事了？	瑪麗翁	聚集了好多人呢，是發生什麼事了？
Izana	イザナ	あーー！　あれって！！	Izana	Ahhh! Isn't that...?!	伊札娜	啊——！那是！！	伊札娜	啊──！那是！！
Resna	レスナ	騎士隊の行進だ！	Resna	It's the knight's procession!	蕾斯娜	是骑士队的游行！	蕾斯娜	是騎士隊的遊行！
Izana	イザナ	先頭にいるの、白夜の騎士だ！	Izana	And the Knights of the Midnight Sun are leading them!	伊札娜	走在最前面的是白夜骑士！	伊札娜	領頭的是白夜騎士！
Marion	マリオン	白夜の騎士？	Marion	Sorry, who is that?	玛丽翁	白夜骑士？	瑪麗翁	白夜騎士？
Resna	レスナ	"この国の騎士団の中で、最高位の騎士たちのことです。
私も初めて見ました……！"	Resna	Out of all the knights in the country, they're the very best ones! I've never seen them before!	蕾斯娜	"他们是这个国家的骑士团里地位最高的骑士。
我也是第一次见到……！"	蕾斯娜	"就是這個國家的騎士團裡地位最高的一群騎士。
我也是第一次見到他們……！"
Izana	イザナ	"かーっこいー！！　今からお城に戻るところかな！
こんな近くで見られるなんて！　感動～～～～！"	Izana	They're all sooo cool! They must be heading back to the castle! Ahhh! I got to see them up close!	伊札娜	"好——帅——啊！！是要回城了吗！
居然能这么近距离地看到他们！我好感动～～～～!"	伊札娜	"好──帥──喔──！！現在是要回城堡了嗎！
居然能這麼近距離地看到他們！好感動～～～～！"
Resna	レスナ	ふふっ。イザナちゃんの憧れだもんね	Resna	Hehe! Izana's over the moons!	蕾斯娜	呵呵。毕竟他们是伊札娜的偶像嘛。	蕾斯娜	呵呵，畢竟他們是伊札娜憧憬的目標嘛。
Resna	レスナ	……あれ？	Resna	...Hm?	蕾斯娜	……嗯？	蕾斯娜	……咦？
Resna	レスナ	ロマンさん？　一緒に前で見ましょうよ	Resna	Roman? Don't you want to get a better look?	蕾斯娜	罗曼先生？不一起站到前面看吗？	蕾斯娜	羅曼先生？你一起到前面來看嘛。
Roman	ロマン	"いや。ここでいいよ。私が前にいると、
君たちがよく見えないからね"	Roman	No thanks, I'm fine back here. Besides, if I moved, I'd block your view.	罗曼	"不了，我在这儿看就好。
我要是站到前面去，会挡住你们视线的。"	羅曼	"不，我在這裡看就好。
我要是站到前面，妳們就看不見了。"
Resna	レスナ	そんなに屈まなくても大丈夫ですよ！	Resna	You really don't need to squat that low, though!	蕾斯娜	你不用缩那么低啦！	蕾斯娜	你也不必蹲得這麼低啊！
Roman	ロマン	"後ろの人が見えないと気の毒だろう？
私は気遣いのロマンともいわれていてね"	Roman	Well, I'd rather not be THAT person. Not when I have a reputation as a gentleman to uphold.	罗曼	"后面的人要是看不见就太可怜了吧？
我可是以体贴著称的罗曼哦。"	羅曼	"後面的人看不到不是很可憐嗎？
大家都稱我為善解人意的羅曼呢。"
Marion	マリオン	"どっちかと言うと、隠れてるようにしか
見えないんだけど"	Marion	If you ask me, it looks like you're trying to hide.	玛丽翁	我倒觉得怎么看都是因为你想藏起来吧。	瑪麗翁	"真要說的話，
你看上去只是躲起來了而已。"
Roman	ロマン	"え！？　そ、そんなことはないとも！
いくら私でもあまり疑われると傷つくよ？"	Roman	Huh?! O-Of course not! Honestly, that level of mistrust is devastating.	罗曼	"咦？！怎、怎么会呢！
就算是我，被你这样怀疑也很受伤啊！"	羅曼	"咦！？哪、哪有這回事！
就算是我，被妳這樣懷疑也會覺得很受傷哦。"
Marion	マリオン	"もしかして、姿を見られたら困ることでも
あるのかしら？"	Marion	There wouldn't happen to be any issue if someone saw your face now, would there?	玛丽翁	难道被他们看到的话你会有麻烦？	瑪麗翁	"難不成你被他們看到的話
會有麻煩？"
Roman	ロマン	いや、ないよ	Roman	What? No.	罗曼	不不，才没那种事。	羅曼	不，沒有的事。
Marion	マリオン	急に真顔！	Marion	And yet, you suddenly look so serious!	玛丽翁	怎么突然这么认真否定！	瑪麗翁	怎麼突然板起臉來了！
Roman	ロマン	それじゃあ、私は先にカフェに行っているよ！	Roman	Well, I'm going to head to the cafe. See you!	罗曼	那我就先去咖啡厅了！	羅曼	那就這樣，我先去咖啡廳了！
Izana	イザナ	"いやー、いいもの見たなー！　騎士って本当に
かっこいい！"	Izana	Wooow, that was the best thing ever! They're just so cool!	伊札娜	"哈～大饱眼福！
骑士真是太帅啦！"	伊札娜	"哎呀～大飽眼福了～！
騎士真的好帥喔！"
Resna	レスナ	"よかったね、イザナちゃん。
……あれ、ロマンさんは？"	Resna	That sure was good timing! ...Huh? Where'd Roman go?	蕾斯娜	"真为你开心，伊札娜。
……咦，罗曼先生去哪了？"	蕾斯娜	"真為妳開心呢，伊札娜。
……奇怪，羅曼先生呢？"
Marion	マリオン	先にカフェに行ってるそうよ	Marion	Ahead to the cafe, it seems.	玛丽翁	说是先去咖啡厅了。	瑪麗翁	說是先去咖啡廳了。
Izana	イザナ	そういえば、依頼の報告に行く途中だった！	Izana	Right, we were supposed to be reporting back about the request!	伊札娜	这么说起来，我们刚才也正要回去报告！	伊札娜	差點忘了，我們還要回去報告！
Resna	レスナ	そうだった！　私たちも行こう！	Resna	Oh, yeah! We'd better get going!	蕾斯娜	啊，对哦！我们也快过去吧！	蕾斯娜	對哦！我們也快去吧！
