romanized	name_jp	text_jp	name_en	text_en	name_zh-CN	text_zh-CN	name_zh-TW	text_zh-TW
Rorona	ロロナ	"次に入れるのは……多分、この薬だよね。
わたしが知ってるのとはちょっと違う気もするけど"	Rorona	It's different from what I know, but... I'm guessing this medicine goes in next?	萝乐娜	"接下来……应该放这个药对吧。
感觉和我认识的药有点不太一样。"	蘿樂娜	"接下來要放的……大概是這個藥吧。
儘管和我知道的藥有點不太一樣。"
Marie	マリー	"見たことない素材ばかりね。
ねえレスナ、これってなあに？"	Marie	I don't think I've ever seen any of these materials before. Hey, Resna, what is this?	玛莉	"都是我没见过的素材呢。
蕾斯娜，这个是什么呀？"	瑪莉	"都是些我沒見過的素材呢。
蕾斯娜，這個是什麼呀？"
Resna	レスナ	"あ、それは素材同士を混ぜ合わせた時の反応を
中和するためのものです！"	Resna	Oh, that's used to neutralize the reaction produced by the materials mixed together.	蕾斯娜	"啊，这个是用来中和
混合素材时产生的反应的！"	蕾斯娜	"啊，那個是混合素材時，
用來中和反應的東西！"
Marie	マリー	"ああ、なるほど！　あたしの世界でも
同じようなものを使ったことがあるよ！"	Marie	I see! I use something similar in my world too.	玛莉	"哦哦，原来如此！
我在原来的世界也用过差不多的东西！"	瑪莉	哦，原來如此！我在原來的世界也用過類似的東西！
Rorona	ロロナ	"わたしも！　ということはマルローネさん、
こういう手順で進めれば……"	Rorona	Same here! Which means that if we keep following these procedures...	萝乐娜	"我也是！玛洛娜，那也就是说，
只要按这个顺序来的话……"	蘿樂娜	"我也是！瑪洛娜，
那就是說只要照這個步驟來的話……"
Marie	マリー	うん。ようやく先輩らしいところを見せられそう	Marie	We'll finally be able to showcase our skills!	玛莉	嗯。终于能展现我们的前辈风范了呢。	瑪莉	嗯，看來總算能展現我身為前輩的風範了。
Judie	ユーディー	なんとなく分かってきたかも……！	Judie	I think I'm finally starting to get the hang of things.	优蒂	我好像有点明白了……！	優蒂	總覺得我好像有點懂了……！
Shallistera	シャリステラ	"これならみんなで力を合わせれば
なんとか調合できそうです！"	Shallistera	We should be able to synthesize something if we work together!	夏莉丝堤拉	"这样的话，只要大家齐心协力
应该就能成功调合！"	夏莉絲堤菈	"這樣的話只要大家同心協力，
應該就能調合成功！"
Saskia	ザスキア	"へえ。途中までしか教えてないのに
もう理解したみたい"	Saskia	Oh? I've only shown you a little of what you need to do, but you all seem to have it figured out.	萨丝琪亚	"厉害啊，虽然才教了一部分，
但她似乎已经理解了。"	薩絲琪亞	"哦，我才教了一半而已，
但妳們看起來似乎都已經理解了。"
Resna	レスナ	す、すごい……私なんかどれだけかかったか	Resna	Whoa... That took me ages to learn.	蕾斯娜	好、好厉害……不像我，花了不知道多少时间……	蕾斯娜	好、好厲害……哪像我都不知道花了多少時間。
Saskia	ザスキア	"ほら、ボーっとしてない！
レスナの商品を作ってるんだから！　集中！"	Saskia	Stop getting distracted! We're all trying to make things for you to sell, you know. Concentrate!	萨丝琪亚	"蕾斯娜，别发呆了！
这可是在做你的商品！集中注意力！"	薩絲琪亞	"嘿，別發呆了！
這可是在製作妳的商品！專心一點！"
Resna	レスナ	は、はい！　集中集中！	Resna	Okay! Focus, focus!	蕾斯娜	好、好的！专心专心！	蕾斯娜	好、好的！專心專心！
Resna	レスナ	できた……！　できました！	Resna	It's done! We did it!	蕾斯娜	好了……！做好了！	蕾斯娜	好了……！完成了！
Resna	レスナ	"こんなに完成度が高いものを作れたのは初めてです！
これがみんなでする調合なんですね"	Resna	I've never created something this high quality before! I guess this is the power of synthesizing with friends.	蕾斯娜	"我还是第一次制作出这么完善的商品！
这就是大家一起调合的力量啊。"	蕾斯娜	"我第一次製作出完成度這麼高的東西！
這就是和大家一起調合的成果吧。"
Rorona	ロロナ	"レスナちゃんありがと～！
おかげで、なんとなくやり方が分かってきたよ！"	Rorona	Thank you so much, Resna. You're such a good teacher!	萝乐娜	"谢谢你蕾斯娜～！
多亏了你，我大概知道调合的方法了！"	蘿樂娜	"蕾斯娜，謝謝妳～！
多虧了妳，我好像搞清楚調合的方法了！"
Resna	レスナ	"いえ、そんな！　皆さん、すごく手際が良くて
むしろ私が足を引っ張っていたような……"	Resna	No way! All of you are so skilled. If anything, it feels like I was the one holding you back.	蕾斯娜	"不不，不用谢！大家动作都好利落，
我倒像是拖后腿的那个……"	蕾斯娜	"不，哪裡哪裡！大家的動作都好俐落，
我反而像在扯後腿呢……"
Saskia	ザスキア	"そこは錬金術士としての経験の差かもしれないわね。
多少やり方が違っても、通じるところがあるんでしょう"	Saskia	I suppose you might say that's the difference experience with alchemy makes. The method may be different, but some things are surely the same.	萨丝琪亚	"那或许是因为作为炼金术士的经验有差距吧。
尽管做法有些差异，但还是有共通之处的。"	薩絲琪亞	"也許這就是身為鍊金術士的經驗差距吧。
即使做法多少有些不同，也還是有著共通之處的。"
Rorona	ロロナ	"また一緒に調合しようね！
今度はパイとか作ってみたいなあ"	Rorona	We should do this again sometime! I'd love to make some pies with you all.	萝乐娜	"下次再一起调合吧！
下次我想试着烤点派。"	蘿樂娜	"之後我們再一起調合吧！
下次我想試著做點派什麼的。"
Resna	レスナ	は、はいっ！　ぜひっ！	Resna	M-Me too! That sounds fun!	蕾斯娜	好、好的！请务必让我加入！	蕾斯娜	好、好的！請務必再來！
Marie	マリー	"でも、まさか錬金術がこんなに大変だなんて
思ってもみなかったよ"	Marie	Phew, I never thought I'd struggle with alchemy so much.	玛莉	"不过，真没想到，
使用炼金术居然这么困难。"	瑪莉	"不過，我根本沒想到原來使用鍊金術
居然會這麼費勁。"
Saskia	ザスキア	"昔はこうじゃなかったそうよ。
一人でも簡単に錬金術が使えたの"	Saskia	It wasn't always like this. Long ago, any alchemist could have handled this alone.	萨丝琪亚	"以前似乎不是这样的。
听说那时就算只有一个人也可以轻松使用炼金术。"	薩絲琪亞	"聽說過去並不是這樣的，
那時一個人好像也能輕鬆使用鍊金術。"
Saskia	ザスキア	"彗星から降り注ぐ星の恵み……
大量のマナを使うことでね"	Saskia	The comets rained the blessing of the stars upon us. It used incredible amounts of mana.	萨丝琪亚	"那需要借助大量的玛那……
也就是从彗星上降下的星之恩赐。"	薩絲琪亞	"因為當時擁有來自彗星的星之恩惠……
大量的瑪那得以使用。"
Saskia	ザスキア	"でも、いつしか彗星の数が減って、マナが枯渇の危機に
瀕してしまった。だから錬金術は衰退していったの"	Saskia	But as the number of comets decreased, we were brought to the verge of a mana drought. Which is what led to the decline of alchemy.	萨丝琪亚	"然而随着彗星的数量减少，玛那濒临枯竭的危机。
炼金术因此逐渐衰退了。"	薩絲琪亞	"但不知何時彗星的數量減少，瑪那瀕臨枯竭的危機，
因此鍊金術才會逐漸走向衰落。"
Saskia	ザスキア	"そうして長い時間が経って……今はもう
錬金術自体、覚えている人はほとんどいない"	Saskia	Much time has passed since then... Now, few remain who are even aware of the existence of alchemy.	萨丝琪亚	"就这样，经过了漫长的岁月……
如今连记得炼金术的人都寥寥无几。"	薩絲琪亞	"就這樣，經過了一段漫長的歲月……
如今，幾乎已經沒人記得鍊金術了。"
Judie	ユーディー	"あのマナってそんなに貴重なものだったんだ……
じゃあ、あまり無闇に調合はできないってこと？"	Judie	Wow, mana is that precious, huh? Does that mean you can't just synthesize as much as you want?	优蒂	"玛那原来是这么珍贵的东西……
那就是说，不能随随便便调合吗？"	優蒂	"原來那個瑪那是如此珍貴的東西……
那也就是說，我們不能隨便進行調合嗎？"
Saskia	ザスキア	"その点は心配いらないわ。
このアトリエはちょっと特別なの"	Saskia	That's not a problem here. This atelier is special, you see.	萨丝琪亚	"这一点你们不用担心。
这个炼金工房比较特殊。"	薩絲琪亞	"這一點妳們用不著擔心，
這個鍊金工房比較特別一些。"
Saskia	ザスキア	"ここでは、錬金術士たちが力を合わせることで
マナを増幅することができるのよ"	Saskia	When multiple alchemists bring their powers together in this place, it has the ability to amplify mana.	萨丝琪亚	"在这里，只要炼金术士齐心协力，
就可以增强玛那的效果。"	薩絲琪亞	"在這裡，只要鍊金術士同心協力，
就能夠增強瑪那的力量喔。"
Shallistera	シャリステラ	"そんなものが作れるなら、
錬金術は廃れずに済んだのでは……"	Shallistera	In that case, could it not have been used to prevent alchemy from dying out?	夏莉丝堤拉	"既然能创造出这种地方，
炼金术应该不会荒废才是……"	夏莉絲堤菈	"既然都能建造出這種地方，
那鍊金術應該不至於如此沒落吧……"
Saskia	ザスキア	"残念ながら、そう簡単に作れるものでもなくてね。
ほとんど偶然、奇跡の産物なの"	Saskia	Unfortunately, creating a place like this is not as simple as it seems. This atelier is truly the result of fortuity and miracles.	萨丝琪亚	"很遗憾，这里并不是想造就造的。
可以说完全出自巧合，是奇迹的产物。"	薩絲琪亞	"可惜這裡也不是那麼容易就能建造出來的。
它幾乎能說是偶然，是奇蹟下的產物。"
Saskia	ザスキア	"このアトリエができた頃には、
すでに錬金術は過去のものだった"	Saskia	When it was finally completed, alchemy had already become a thing of the past.	萨丝琪亚	"在这个炼金工房建成的时候，
炼金术已经是过时的技术。"	薩絲琪亞	"在這個鍊金工房建好的時候，
鍊金術早已淪為過去式了。"
Saskia	ザスキア	"昔のように誰もが錬金術を学び、取り組む……
というのは、やはり難しいでしょうね"	Saskia	Getting people to learn and advance alchemy like they did in the olden days... Well, it would be quite difficult now.	萨丝琪亚	"像过去一样人人学习、钻研炼金术……
应该很难实现吧。"	薩絲琪亞	"像從前那般人人學習鍊金術、用心鑽研的情景……
或許已經很難再見到了。"
Resna	レスナ	"……でも、そんなのもったいない！
錬金術は、とっても素晴らしいものなのに"	Resna	But that's such a shame! Alchemy is such a wonderful thing!	蕾斯娜	"……可是这样也太可惜了！
明明炼金术这么神奇。"	蕾斯娜	"……不過，這樣就太可惜了！
明明鍊金術這麼美好。"
Resna	レスナ	"だから私、果ての大陸を見つけて、
錬金術を復活させたいんです！"	Resna	That's why I'm going to find the World's End. I want to restore alchemy to its former glory!	蕾斯娜	"所以我想找到终极大陆，
然后复活炼金术！"	蕾斯娜	"所以我才想找到終極大陸，
讓鍊金術復活！"
Shallistera	シャリステラ	果ての大陸……？	Shallistera	What's the World's End?	夏莉丝堤拉	终极大陆……？	夏莉絲堤菈	終極大陸……？
Resna	レスナ	"たくさんのマナが眠ってるといわれている場所です。
遥か海の向こうにあるといわれています"	Resna	It's a place rumored to be a rich source of mana. They say it's all the way across the wide ocean.	蕾斯娜	"说是一片蕴藏着大量玛那的陆地，
位于遥远的大海对面。"	蕾斯娜	"據說那裡位於遙遠的大海彼端，
是個蘊藏著許多瑪那的地方。"
Saskia	ザスキア	"伝説、おとぎ話の類だけどね。昔、国中の錬金術士が
総出で探したけど結局見つからなかった"	Saskia	It's much closer to fiction than fact. Long ago, alchemists throughout the country went in search of it, but it was never found.	萨丝琪亚	"不过这只是传说和童话里的说法。过去，全国的炼金术士
曾经发起总动员去寻找，结果也没有找到。"	薩絲琪亞	"不過，那只能算是個傳說或童話故事。過去，曾經出動
全國上下的鍊金術士去尋找，但最後仍是無功而返。"
Resna	レスナ	でも！　きっとあるはずです！	Resna	But...I just know it exists!	蕾斯娜	但是！那个地方一定存在！	蕾斯娜	可是！我相信一定有那個地方。
Resna	レスナ	"果ての大陸を見つけて、マナの問題を解決して……。
みんなが錬金術で幸せになれるようにしたい"	Resna	I want to find the World's End and solve the mana shortage... And make everyone's lives better through alchemy!	蕾斯娜	"我想找到终极大陆，解决玛那的问题……
通过炼金术让大家获得幸福。"	蕾斯娜	"我想找到終極大陸，解決瑪那的問題……
讓大家都能透過鍊金術獲得幸福。"
Resna	レスナ	"だから立派な錬金術士になって、
果ての大陸を探しに行きたいと思ってます！"	Resna	That's why I'm going to become a full-fledged alchemist. I'm going to go look for the World's End!	蕾斯娜	"所以我才要成为厉害的炼金术士，
去寻找终极大陆！"	蕾斯娜	"因此我才要成為出色的鍊金術士，
去尋找終極大陸！"
Shallistera	シャリステラ	……すごい。そんなこと考えてるんですね	Shallistera	Wow. It looks like you have put a lot of thought into this, Resna.	夏莉丝堤拉	……了不起。你原来在想这些事呀。	夏莉絲堤菈	……真了不起，原來妳是這麼想的啊。
Marie	マリー	いい夢じゃない。夢は大きいほうがいいわよ	Marie	I think that's a fantastic goal to have. The bigger the dream, the better!	玛莉	你的梦想好棒。梦想就是要远大才好。	瑪莉	很不錯的夢想，夢想就是要遠大一點才好。
Rorona	ロロナ	同じ錬金術士として応援するよ！	Rorona	You have my support as a fellow alchemist.	萝乐娜	同为炼金术士，我支持你！	蘿樂娜	同樣身為鍊金術士，我支持妳！
Judie	ユーディー	あたしたちにできることなら、なんでも言ってね	Judie	Let us know if there's anything we can do to help you out.	优蒂	要是有什么我们帮得上忙的，你尽管说。	優蒂	如果有什麼我們能幫上忙的，妳儘管開口。
Resna	レスナ	はい！　ありがとうございます！	Resna	I will! Thank you!	蕾斯娜	好！谢谢你们！	蕾斯娜	好的！謝謝妳！
Saskia	ザスキア	"そのためには、まずは私が出した課題をこなして、
見習いを卒業してもらわないとね"	Saskia	That is why you must complete my assignment and graduate from the role of apprentice.	萨丝琪亚	"为了实现梦想，你得先完成我出的课题，
从见习炼金术士毕业才行哦。"	薩絲琪亞	"為了實現夢想，妳得先完成我出的課題，
從見習鍊金術士的身分畢業才行哦。"
Saskia	ザスキア	"前にも言ったと思うけど、今のままじゃ
果ての大陸を探す旅なんて許可できないわよ"	Saskia	I've told you this before, but I cannot permit you to go on a journey to find the World's End as you are now.	萨丝琪亚	"我以前也说过，以你现在的水平，
我还不会允许你出发去寻找终极大陆。"	薩絲琪亞	"我之前應該也說過，以妳目前的程度，
我還不會允許妳踏上尋找終極大陸的旅程。"
Resna	レスナ	"はい、分かってます！
師匠に認めてもらえるよう頑張ります！"	Resna	I know! I'm working really hard to do that. I promise I won't let you down!	蕾斯娜	"嗯，我明白！
为了让师父认可，我会努力的！"	蕾斯娜	"嗯，我明白！
我會努力讓師父認可我的實力的！"
Shallistera	シャリステラ	"あの……果ての大陸を探すにあたって、
どうするかってもう決めているんですか？"	Shallistera	Um... Have you decided what it is you need to do in order to find the World's End?	夏莉丝堤拉	"那个……你已经想好
要如何寻找终极大陆了吗？"	夏莉絲堤菈	"請問……妳已經想好在尋找終極大陸時
該做些什麼了嗎？"
Resna	レスナ	"まだ場所の見当もついていない状態なので……。
まずは錬金術の素晴らしさを広めたいって思ってます"	Resna	Well, I still don't know where to begin looking for it... So, I'm going to start with spreading the wonders of alchemy first.	蕾斯娜	"毕竟现在还完全不知道在哪里……
所以我想先去普及炼金术的厉害之处！"	蕾斯娜	"因為現在都還不知道那在哪裡……
所以我想先去推廣鍊金術的美好之處。"
Resna	レスナ	"そうすれば、一緒に果ての大陸を探してくれる人が
出てきてくれないかなー……なんて思ったり"	Resna	If I do that, I might be able to meet someone willing to come look for it with me... Or, at least, that's what I hope.	蕾斯娜	"这样说不定就会遇到愿意和我一起
去寻找终极大陆的人……我是这么想的。"	蕾斯娜	"想說這麼一來，或許就會出現願意跟我一起
去尋找終極大陸的人了……這樣。"
Resna	レスナ	"その前に、師匠の課題をこなして、一人前の
錬金術士だって認めてもらわなきゃなんですけどね"	Resna	But before all of that, I need to complete Miss Saskia's assignment and become a full-fledged alchemist.	蕾斯娜	"不过在那之前，我得完成师父的课题，
让师父认可我是可以独当一面的炼金术士。"	蕾斯娜	"不過在那之前，我得完成師父的課題，
讓師父認可我是個獨當一面的鍊金術士才行。"
Shallistera	シャリステラ	"……レスナさん。
わたしもついていってはいけませんか？"	Shallistera	If you don't mind, Resna, I would love to accompany you.	夏莉丝堤拉	"……蕾斯娜，
我可以和你一起去吗？"	夏莉絲堤菈	"……蕾斯娜，
我可以跟妳一起去嗎？"
Resna	レスナ	え？	Resna	Huh?	蕾斯娜	咦？	蕾斯娜	咦？
Shallistera	シャリステラ	"マナが枯渇してしまうという話……。実は、わたしの
故郷でも似たような問題に直面しているんです"	Shallistera	My village is also facing a similar problem, so the story of the mana drought resonated with me.	夏莉丝堤拉	"关于玛那的枯竭……
其实我的故乡也面临着类似的问题。"	夏莉絲堤菈	"關於瑪那枯竭一事……
其實，我的故鄉也面臨著類似的問題。"
Shallistera	シャリステラ	"わたしも錬金術士としてその解決方法を探していて。
レスナさんのやりたいこととちょっと近いなって"	Shallistera	As an alchemist, I also think it's my duty to look for a solution to that problem. We seem to have that in common.	夏莉丝堤拉	"作为炼金术士，我也在寻找解决的办法。
感觉和你想做的事情有点相通的地方。"	夏莉絲堤菈	"我身為鍊金術士，也在尋找解決的方法，
感覺和蕾斯娜妳想做的事有點接近。"
Resna	レスナ	そうだったんですね！	Resna	Oh, I see!	蕾斯娜	原来是这样！	蕾斯娜	原來是這樣啊！
Shallistera	シャリステラ	"だから、レスナさんについていけば、
わたしも何か得るものがあるかなって思うんです"	Shallistera	If I go with you, I think it may bring me closer to the answer I need.	夏莉丝堤拉	"所以我想，如果能和你一起去的话，
我说不定也能获得些启发。"	夏莉絲堤菈	"所以我想，如果跟著妳一起去，
或許我也能有所收穫。"
Shallistera	シャリステラ	"それに……頑張ってるレスナさんを、
なんだか放っておけなくて"	Shallistera	And besides, seeing you try so hard makes me feel like I can't just leave you.	夏莉丝堤拉	"而且……看到你这么努力，
我也不由得想要支持你。"	夏莉絲堤菈	"而且……看到妳如此努力，
總覺得無法丟下妳不管。"
Resna	レスナ	"むしろいいんですか！？
ぜひよろしくお願いします！　シャリステラ先輩！！"	Resna	Are you sure that's all right?! Oh my gosh, I'd love to have you come with me! Please, Miss Shallistera!	蕾斯娜	"你真的愿意和我一起去吗？！
那就拜托了！夏莉丝堤拉前辈！"	蕾斯娜	"這樣真的好嗎！？
那就拜託妳了！夏莉絲堤菈前輩！！"
Shallistera	シャリステラ	せ、先輩……なんだかむず痒いですね	Shallistera	M-Miss...? It feels strange hearing you call me that.	夏莉丝堤拉	前、前辈……感觉有点不好意思呢。	夏莉絲堤菈	前、前輩……感覺有點難為情呢。
Resna	レスナ	"（錬金術士の先輩と一緒に旅ができるなんて……。
　夢じゃないよね！？）"	Resna	(I can't believe I get to travel with a veteran alchemist! Am I dreaming?!)	蕾斯娜	"（居然能和炼金术士前辈一起旅行……
　我不是在做梦吧？！）"	蕾斯娜	"（居然能和鍊金術士前輩一起旅行……
　這不是在作夢吧！？）"
