romanized	name_jp	text_jp	name_en	text_en	name_zh-CN	text_zh-CN	name_zh-TW	text_zh-TW
Wilbell	ウィルベル	はあ、はあ……。なかなか手ごわい山道ね	Wilbell	*Huff* *Huff* This mountain pass sure is a rough one.	薇尔贝儿	呼……呼……这山路可真不好走啊。	薇爾貝兒	呼、呼……這山道真是不容小覷。
Valeria	ヴァレリア	"そう？
戦闘の前の準備運動にはちょうどいいくらいだけど"	Valeria	Really? I was thinking it was making for a nice pre-battle warmup.	瓦莱莉娅	"有吗？
我觉得用来当战前热身正合适啊。"	瓦萊莉婭	"是嗎？
我覺得當作戰鬥前的熱身剛剛好。"
Heidi	ハイディ	"まったく頼もしい限り。
一応、これでもマシな道を選んだんだけどね"	Heidi	Well, you're dependable like that. Seriously though, this really was the best possible route.	海蒂	"真是没人比你更可靠了。
这已经是我挑选出来的比较好走的路了哦。"	海蒂	"真是太可靠了。
其實我已經挑了一條相對好走的路了。"
Izana	イザナ	"レスナちゃん、さっきからずっと下向いてるけど
大丈夫？　疲れちゃった？"	Izana	Resna, you've been keeping your head down for a while now. Are you okay? Are you running out of steam?	伊札娜	"蕾斯娜，看你这段路上一直都低着头，
没事吧？累到了？"	伊札娜	"蕾斯娜，妳從剛才就一直低著頭，
還好嗎？是不是累了？"
Resna	レスナ	"ううん、大丈夫。
ちょっと足元が気になっちゃって"	Resna	No, I'm fine. I just thought it would be smart to watch my step.	蕾斯娜	"没有，我不累。
只是总不放心脚边的情况。"	蕾斯娜	"不，我沒事。
只是想注意腳下。"
Regina	レジナ	"ただの山道じゃないしね。
溶岩とかにも気を付けて進まないと"	Regina	This isn't your average mountain path. There's lava and other things to look out for.	瑞吉娜	"毕竟这不是普通的山路，
行走时还得当心熔岩。"	瑞吉娜	"畢竟這不是普通的山道，
前進時得小心熔岩之類的東西。"
Valeria	ヴァレリア	レスナ、そこ気を付けて。岩が飛び出てるわ	Valeria	Careful, Resna. There's a rock sticking out there.	瓦莱莉娅	蕾斯娜，当心前面，有支棱出来的岩石。	瓦萊莉婭	蕾斯娜，小心那裡。有岩石掉落。
Resna	レスナ	"ん……あ、ホントだ。
やっぱり下ばっか見ててもダメだね"	Resna	Hm? Oh, whoops. I guess only looking down has its own problems, too.	蕾斯娜	"嗯……啊，还真是。
还是不能光看脚边啊。"	蕾斯娜	"嗯……啊，對耶。
果然不能只看著下方。"
Valeria	ヴァレリア	"この先は私が見張っててあげる。
レスナは私の後をついてきたらいいわ"	Valeria	I'll keep an eye out for what's up ahead, so you just have to stick behind me, Resna.	瓦莱莉娅	"我会看着前面的情况，
蕾斯娜就跟在我身后吧。"	瓦萊莉婭	"前面交給我來注意吧！
蕾斯娜只要跟在後面走就好了。"
Resna	レスナ	そんな、大丈夫だって	Resna	I'll be okay, really!	蕾斯娜	那怎么好意思，我没事的。	蕾斯娜	沒關係的，就說我沒事了。
Resna	レスナ	"こんなことで音を上げてたら……
果ての大陸なんか目指せない。でしょ？"	Resna	I mean, if I gave up here, then I might as well stop setting my sights on the World's End entirely. Right?	蕾斯娜	"要是因为这种小事就叫苦……
可去不了终极大陆，对吧？"	蕾斯娜	"如果因為這點小事喊苦……
就無法以終極大陸為目標了，不是嗎？"
Valeria	ヴァレリア	それは、そうかもしれないけど……	Valeria	Well, I...can't really argue with that, no.	瓦莱莉娅	或许是这样……	瓦萊莉婭	或許是這樣沒錯……
Wilbell	ウィルベル	"こんな山道だもん。無理しないで
休み休み進んだっていーんじゃないかしら？"	Wilbell	Still, this is one tough trail. There's no shame in taking it at a nice, leisurely pace.	薇尔贝儿	"这山路这么险，别勉强自己。
劳逸结合，休息一下再前进也没事吧？"	薇爾貝兒	"但畢竟是崎嶇不平的山道，
偶爾休息一下應該沒關係吧？"
Nio	ニオ	レスナさん、少し休憩しましょう	Nio	Resna, let's take a quick break.	妮欧	蕾斯娜小姐，稍微休息一会儿吧。	妮歐	蕾斯娜小姐，我們休息一下吧。
Resna	レスナ	で、でも	Resna	But...	蕾斯娜	可、可是……	蕾斯娜	可、可是……
Nio	ニオ	そんなに焦ってもいいことないですよ	Nio	We're not going to gain anything from rushing.	妮欧	太着急可不会发生什么好事。	妮歐	太心急也沒用喔。
Nio	ニオ	……わたしと同じような失敗、してほしくないですし	Nio	I don't...want you to make the same mistake I did.	妮欧	……我也不希望你跟我犯一样的错误。	妮歐	而且……我不希望妳犯下和我相同的失敗。
Resna	レスナ	え？　それって……	Resna	Huh? What do you mean?	蕾斯娜	咦？什么意思……	蕾斯娜	咦？什麼意思……
Nio	ニオ	"わたし、以前おねーちゃんと離れ離れになったことが
あったんです"	Nio	There was a time when I was separated from my sister.	妮欧	我之前跟姐姐分开过一段时间。	妮歐	"我曾經和姊姊
分隔兩地。"
Nio	ニオ	"再会した頃には、おねーちゃんはわたしが知ってるより
ずっと大人になっていて……"	Nio	When we were finally reunited, she'd grown up into an adult that I barely recognized.	妮欧	"再见面的时候，
姐姐已经变得特别成熟了……"	妮歐	"當我們重逢時，
姊姊變得比之前成熟許多……"
Nio	ニオ	"それで、おねーちゃんに置いてかれそうな気がして、
とっても焦ってたんです"	Nio	I was all worked up and convinced that I had to do whatever I could before I got left behind.	妮欧	"所以我觉得自己好像被姐姐远远甩下了，
特别着急。"	妮歐	"所以我感到十分焦急，
覺得自己好像是被姊姊拋下了一般。"
Wilbell	ウィルベル	"で、確か頑張りすぎてぶっ倒れて、
アーシャに介抱されたのよね？"	Wilbell	Didn't you end up burning out and having to get nursed back to health by your big sis?	薇尔贝儿	"结果你努力过头累垮了，
不得不麻烦爱夏来照顾你了是吧？"	薇爾貝兒	"我記得妳那時把自己的身體搞壞了，
最後還讓愛夏照顧了一陣子，對吧？"
Regina	レジナ	"ニオちゃんはしっかりしてるようで、
かなり無茶するよねー！"	Regina	Nio, you've got a good head on your shoulders, but that doesn't sound very smart!	瑞吉娜	"妮欧看似沉稳，
其实还挺鲁莽的呢！"	瑞吉娜	"妮歐看起來很穩重，
其實很亂來呢！"
Resna	レスナ	だ、大丈夫だったんですか！？	Resna	Did everything turn out all right?!	蕾斯娜	你、你那时候不要紧吧？	蕾斯娜	結、結果妳還好嗎！？
Nio	ニオ	"はい。でも、おねーちゃんには
すっごく心配かけちゃった"	Nio	Yeah, but it made Ayesha super worried about me.	妮欧	我没事，可是我害姐姐特别劳心劳力。	妮歐	"嗯。不過，
我讓姊姊非常擔心。"
Nio	ニオ	"その時おねーちゃんに言われたんです。頑張るのは
分かる。でも、身体を壊したら意味がないって"	Nio	She told me that she understood how hard I was working, but it wasn't going to mean anything if I ruined my health in the process.	妮欧	"当时姐姐对我说，她明白我想要努力的心情，
但累垮了身体就没有意义了。"	妮歐	"姊姊對我說，她明白我想努力的心。
但連健康都失去的話，就前功盡棄了。"
Nio	ニオ	"だから、レスナさん。
まだ先があるんですから、無理しすぎちゃダメです"	Nio	Resna, you've still got a ways to go, so don't run yourself into the ground trying to get there.	妮欧	"所以，蕾斯娜小姐。
之后还有好长的路要走，不可以乱逞强。"	妮歐	"蕾斯娜小姐，旅途還沒結束。
別太勉強自己。"
Nio	ニオ	"自分の限界って、
意外と自分では分からないものだから……"	Nio	The hardest thing is figuring out your own limits.	妮欧	因为人有时候可能意识不到自己的极限在哪里……	妮歐	"其實，
自己的極限反而很難察覺……"
Resna	レスナ	"……そうですね。私、初めての体験ばかりで
熱くなりすぎていたのかもしれません"	Resna	You're right. I think I was getting too worked up since this has been a bunch of firsts for me.	蕾斯娜	"……也对。我一路上遇到的都是新鲜事物，
可能有点兴奋过头了。"	蕾斯娜	"……說得沒錯。這一切對我來說都是新體驗，
也許我太過急躁了。"
Resna	レスナ	一度足を止めて、冷静になってみます	Resna	Let's take a moment here, and I'll do my best to calm down.	蕾斯娜	我会停下脚步，冷静看看现状的。	蕾斯娜	我會暫時停下腳步，試著讓自己冷靜下來。
Regina	レジナ	うん。素直でよろしい！	Regina	Good call. Keep those smart decisions coming!	瑞吉娜	嗯，老实承认就好！	瑞吉娜	嗯，我欣賞妳這率直的個性！
