romanized	name_jp	text_jp	name_en	text_en	name_zh-CN	text_zh-CN	name_zh-TW	text_zh-TW
Resna	レスナ	――うん。できましたよ！	Resna	Yep, it's finished!	蕾斯娜	——嗯，做好了！	蕾斯娜	──嗯，完成囉！
Marie	マリー	いいねいいね！　この調子でどんどん作っちゃおう！	Marie	Great job! Let's keep this up!	玛莉	真不错啊！就这样继续做吧！	瑪莉	很好很好！就照這個步調繼續做下去吧！
Saskia	ザスキア	"悪いんだけど、私はここで抜けさせてもらうわね。
これから村の寄合があるのよ"	Saskia	Sorry, but I have to take my leave. There's an assembly in the village that I have to attend.	萨丝琪亚	"抱歉，我就先到这里了。
之后还得去参加村里的集会。"	薩絲琪亞	"不好意思，我到這裡要先離開了。
等一下村裡還有集會呢。"
Resna	レスナ	そうなんですか。師匠も結構忙しいんですね	Resna	Oh, okay. You sure are busy, Miss Saskia.	蕾斯娜	这样啊。原来师父这么忙啊。	蕾斯娜	這樣呀，看來師父也很忙呢。
Resna	レスナ	"錬金術を教えてもらう時以外は、
寝たり食べたりしてる印象しかないので……"	Resna	Outside of teaching me alchemy, I've never been able to picture you doing anything but sleeping and eating.	蕾斯娜	"除了教我炼金术的时候之外，
其他时候我对师父的印象只有吃了睡……"	蕾斯娜	"除了教我鍊金術的時候以外，
我印象裡師父不是在睡覺，就是在吃東西……"
Saskia	ザスキア	むっ。貴様、人聞きの悪いこと言わないでよ	Saskia	Hmph! The utter nonsense that comes out of your mouth sometimes.	萨丝琪亚	喂喂，你这家伙，说这种话也太损了吧。	薩絲琪亞	唔！妳這傢伙，不要把我說得那麼難聽啦。
Resna	レスナ	貴様！？	Resna	Um?!	蕾斯娜	你这家伙？！	蕾斯娜	妳這傢伙！？
Saskia	ザスキア	"あなただったわね。ごめんごめん。なんか気の利いた
こと言おうとすると言葉遣いが変になるのよねー"	Saskia	No, I'm sorry. I was trying to counter that with something witty, but it fell short.	萨丝琪亚	"应该说“你”对吧。抱歉啊，
我想说点乐子话的时候语气就会变。"	薩絲琪亞	"是「妳」才對，抱歉抱歉。
當我想要幽默一下，措辭就會變得怪怪的～"
Saskia	ザスキア	"これでもフリーゲンでは
それなりに偉い立場なのよ"	Saskia	In any case, Friegen certainly is a splendid place.	萨丝琪亚	在弗里根我也算是有点地位。	薩絲琪亞	"就算這樣，
我在弗里岡還算是滿有威望的喔。"
Resna	レスナ	師匠の錬金術のおかげで村も助けられましたしね	Resna	That's because your alchemy helped make it that way!	蕾斯娜	因为师父的炼金术帮了村子不少忙啊。	蕾斯娜	畢竟也是師父的鍊金術造福了村子嘛。
Saskia	ザスキア	"そうそう。だから色々やることもあるのよ。
あなたたちも、今日の調合はこのへんにしておいたら？"	Saskia	Well, I can't argue with that. But there's still so much left to be done. Will you be stopping your synthesis here for today?	萨丝琪亚	"是啊，所以我有许多事要忙。
你们今天也先调合到这里吧？"	薩絲琪亞	"沒錯，所以我還有很多事情要忙。
妳們今天差不多也調合到這裡怎麼樣？"
Totori	トトリ	まあ、結構いっぱい作れましたよね？	Totori	Probably? I mean, we did end up making an awful lot.	托托莉	好吧，已经做了很多了。	托托莉	好呀，我們已經做了很多吧？
Resna	レスナ	"そうですね。
師匠、手伝ってくれてありがとうございます！"	Resna	Good point. Thank you for all your help, Miss Saskia!	蕾斯娜	"是呀。
师父，谢谢你来帮我们！"	蕾斯娜	"說得也是。
師父，謝謝妳的幫忙！"
Saskia	ザスキア	いいのよ。それじゃ、行ってくるわね	Saskia	Oh, it was nothing. Well then, I'll see you later.	萨丝琪亚	不客气。那我走了。	薩絲琪亞	沒什麼。那我走了。
Resna	レスナ	"うーん。でもやっぱりもう少し作っちゃおうかな……
先輩たちと、もっともっと調合したいし"	Resna	Hmm... I wouldn't mind doing a little more synthesizing with you veterans, though.	蕾斯娜	"嗯……不过还是再多做一点比较好吧……
而且我也想再和前辈们一起调合一会。"	蕾斯娜	"唔～不過還是再做一點好了……
我想和前輩們再多調合一些。"
Valeria	ヴァレリア	"それ、ランツェ用の薬を作ってるのよね？
そんなにたくさん必要なくらい重症なの？"	Valeria	You're going to make even more medicine for Lanze? Is he really that sick?	瓦莱莉娅	"这个药是做给兰泽的吧？
他伤得有那么重吗，需要做那么多？"	瓦萊莉婭	"妳那是在製作藍澤的藥吧？
他的症狀有嚴重到需要做得這麼多嗎？"
Resna	レスナ	"あ、ううん。必要な分は作り終わったんだけど、
作り置きしておいて後で売ろうかなーって"	Resna	Oh! No, we've got what we need already. I was thinking it might be nice to make some to sell later.	蕾斯娜	"倒也不是，必需的量已经做完了。
想多做一点之后也可以卖。"	蕾斯娜	"啊，不是的。我已經做完需要的量了，
但想說多做一些備用，之後可以拿去賣。"
Resna	レスナ	"今は王都で依頼も受けられないし、
ちゃんと稼ぐ手段を考えておかないとね"	Resna	Since we can't take on requests from the capital, I figured I should give more thought to earning a living.	蕾斯娜	"现在在王都都接不了委托，
得考虑一下怎么赚钱才行。"	蕾斯娜	"現在也沒辦法在王都接委託，
得好好思考一下賺錢的方法才行。"
Valeria	ヴァレリア	"……ねえねえ。一人分、手が足りなくなったんでしょ？
私、やってみてもいい？
"	Valeria	Hey, Resna? You're short a person now, right? Do you think I could give it a shot?	瓦莱莉娅	"我说……你们现在是不是正好差了一人？
我能不能也来试试？"	瓦萊莉婭	"……話說，現在少了一個人手吧？
可以讓我試試看嗎？"
Flocke	フロッケ	ヴァレリアさんが調合ですか！？　ご、ごくり	Flocke	Valeria, you want to synthesize something?! U-Ulp...	芙洛可	瓦莱莉娅要来调合吗？！好、好担心……	芙洛可	瓦萊莉婭小姐要調合嗎！？（吞、吞口水）
Lanze	ランツェ	"お、お前……やめといた方がいいんじゃねぇか。
釜を破裂させる未来が視えるぞ"	Lanze	L-Look kid, you might wanna rethink that. I could definitely see you blowin' up that poor cauldron.	兰泽	"你……还是算了吧。
我怕你过会把炼金釜打碎了。"	藍澤	"妳、妳……還是打消這個念頭吧。
我已經能看到釜破裂的畫面了。"
Valeria	ヴァレリア	"やっぱり無理かしら。私、不器用だし……
錬金術って、生まれつきの才能が必要みたいだしね"	Valeria	Maybe that IS asking too much. I'm pretty clumsy, and I probably wasn't born with any knack for that kind of thing.	瓦莱莉娅	"你们也觉得我不行吧，毕竟我手脚那么笨……
而且听说炼金术还需要与生俱来的才华。"	瓦萊莉婭	"果然不行嗎？誰叫我笨手笨腳的……
而且鍊金術好像需要與生俱來的才能吧。"
Resna	レスナ	ううん！　やってみようよヴァレリア！	Resna	No, it's fine! You should try it, Valeria!	蕾斯娜	不会啊！试一试吧，瓦莱莉娅！	蕾斯娜	不不不！來試試看吧，瓦萊莉婭！
Resna	レスナ	"才能があるかどうかなんて、
やってみないと分からないよ！"	Resna	If you don't, then you'll never know!	蕾斯娜	有没有才华，不试试怎么知道！	蕾斯娜	"要試過之後，
才會知道有沒有才能呀！"
Resna	レスナ	"私も初めの頃はたくさん失敗したんだもん。
やりたいと思ったなら、やらなきゃ損だよ！"	Resna	Besides, I messed up tons when I first started. If you really want to try, then it'd be a shame not to!	蕾斯娜	"我一开始也总是失败。
但既然你想试试，那不试白不试嘛！"	蕾斯娜	"我剛起步的時候也失敗了很多次。
既然妳有這份心，不試試看就太吃虧了。"
Valeria	ヴァレリア	……うん。ありがとう、レスナ！	Valeria	Okay. Thanks, Resna!	瓦莱莉娅	嗯……谢谢你，蕾斯娜！	瓦萊莉婭	……嗯，謝謝妳，蕾斯娜！
Valeria	ヴァレリア	でき、た……？	Valeria	That's...it?	瓦莱莉娅	完成……了吗？	瓦萊莉婭	完成、了……？
Resna	レスナ	うん！　ちゃんと成功したよ、ヴァレリア！	Resna	Yep! Valeria, you did it!	蕾斯娜	嗯！没问题，成功了！瓦莱莉娅！	蕾斯娜	嗯！妳確實成功了喔，瓦萊莉婭！
Valeria	ヴァレリア	ほ、本当に？	Valeria	I-I did?	瓦莱莉娅	真、真的吗？	瓦萊莉婭	真、真的嗎？
Ayesha	アーシャ	"ばっちりです！
ヴァレリアさん、錬金術の素質があったんですね"	Ayesha	It's practically perfect! It looks like you have some alchemic talent, Valeria.	爱夏	"做得很好啊！
看来瓦莱莉娅有炼金术的资质啊。"	愛夏	"做得非常好！
瓦萊莉婭小姐，看來妳有鍊金術的資質呢。"
Valeria	ヴァレリア	"素質ってのはよく分かんないけど……
なんとなくやってることは理解できるっていうか"	Valeria	I don't know about that, but...it felt like I more or less understand how to do it.	瓦莱莉娅	"算不算资质倒不知道……
不过我似乎能理解自己在做什么。"	瓦萊莉婭	"資質什麼的我不太清楚……
但下意識能夠理解現在所做的事情。"
Marie	マリー	それが素質なんじゃないかしら	Marie	"I would say that counts as ""talent."""	玛莉	那应该就是资质哦。	瑪莉	那就是所謂的資質吧？
Resna	レスナ	私もそう思うよ、ヴァレリア！	Resna	I think so, too!	蕾斯娜	我也这么觉得，瓦莱莉娅！	蕾斯娜	我也這麼認為喔，瓦萊莉婭！
Valeria	ヴァレリア	…………	Valeria	...	瓦莱莉娅	…………	瓦萊莉婭	…………
