romanized	name_jp	text_jp	name_en	text_en	name_zh-CN	text_zh-CN	name_zh-TW	text_zh-TW
Totori	トトリ	今日はごちそうさまでした！	Totori	Thanks for the food!	托托莉	多谢款待！	托托莉	今天謝謝妳的款待！
Ayesha	アーシャ	フロッケちゃんの料理、どれも美味しかったよ	Ayesha	Everything you made was absolutely delicious, Flocke.	爱夏	芙洛可做的料理真好吃啊。	愛夏	芙洛可做的每一道菜都很好吃呢。
Flocke	フロッケ	皆さんが喜んでくれたみたいでフロッケも嬉しいです	Flocke	I'm just glad you enjoyed it! That's what makes me the happiest.	芙洛可	能让大家这么高兴，我也很开心。	芙洛可	能讓大家喜歡，芙洛可也覺得很開心。
Lanze	ランツェ	これで、あとは美味い酒でもありゃあ完璧なんだが……	Lanze	Some tasty booze would've really hit the spot, though.	兰泽	要是接下来能再来点美酒就更完美了……	藍澤	要是接下來再來一點美酒就完美了……
Heidi	ハイディ	"おい、おっさん。
そんなことばっかり言ってるとフロッケが悲しむぞ"	Heidi	Watch it, old man. Grumbling like that's just going to make Flocke sad.	海蒂	"喂，大叔，
你总说这种话，芙洛可会伤心的。"	海蒂	"喂，大叔。
老說這種話，芙洛可會傷心的喔。"
Valeria	ヴァレリア	"いつもあんたのことを一番心配してくれてるのにね。
ねえ、フロッケ"	Valeria	She's the one who worries about you the most. Right, Flocke?	瓦莱莉娅	"明明她一直以来都最关心你了。
对吧，芙洛可。"	瓦萊莉婭	"明明她一直以來都是最擔心你的呢。
對吧，芙洛可？"
Flocke	フロッケ	"ごめんなさい……。フロッケは、ランツェさんの
お身体が心配で、お酒はご用意しなかったんです……"	Flocke	I'm sorry. I didn't get any alcohol because I didn't think it would do your health any good...	芙洛可	"对不起……我担心兰泽先生的身体，
所以没有准备酒……"	芙洛可	"對不起……芙洛可擔心藍澤先生的身體，
所以沒有準備酒……"
Flocke	フロッケ	でも、もしどうしてもと仰るなら……	Flocke	But, if you really do need some...	芙洛可	但如果你坚持要喝的话……	芙洛可	可是，如果你無論如何都想喝的話……
Lanze	ランツェ	"い、いや大丈夫！　問題ない！
気遣ってくれてありがとな！　な！"	Lanze	N-No, it's all good! Thanks for thinkin' about me! I mean it!	兰泽	"没、没关系！我不喝也行！
谢谢你这么关心我！"	藍澤	"不、不要緊！沒問題的！
謝謝妳為我著想啊！真的！"
Valeria	ヴァレリア	フロッケは優しいね～	Valeria	You're way too nice, Flocke.	瓦莱莉娅	芙洛可真是温柔啊～	瓦萊莉婭	芙洛可真是溫柔啊～
Flocke	フロッケ	"……ふふ。はい。
ランツェさんには、ずっと元気でいてほしいですから"	Flocke	Aw, thanks. I just want Lanze to stay in good shape, after all.	芙洛可	"……呵呵。没什么。
我只是希望兰泽先生能健健康康的。"	芙洛可	"……呵呵，沒事的。
我只是希望藍澤先生能一直健健康康的。"
Lanze	ランツェ	お、おう……いつも心配かけて悪いな	Lanze	Oh, uh... I'm sorry for always bein' a bother.	兰泽	哦、哦……抱歉啊，一直让你这么担心。	藍澤	喔、喔……抱歉啊，老是讓妳操心。
Heidi	ハイディ	相変わらず天使ですな～フロッケは	Heidi	See? She's such a precious li'l angel!	海蒂	芙洛可果然像天使一样啊～	海蒂	芙洛可還是一如往常地是個天使啊～
Flocke	フロッケ	そんな、天使だなんて……	Flocke	A-Angel? I don't know about that...	芙洛可	天、天使什么的也太夸张了……	芙洛可	什麼天使，沒有這回事啦……
Ayesha	アーシャ	フロッケちゃん、寝ちゃいましたね	Ayesha	Flocke's already fast asleep.	爱夏	芙洛可好像睡着了。	愛夏	芙洛可睡著了呢。
Valeria	ヴァレリア	"今日も早起きして仕事してたみたいだしね。
いつもありがと、フロッケ"	Valeria	Well, she was up early for work as usual. We owe her a lot.	瓦莱莉娅	"她今天也很早就起来工作了吧。
真是辛苦她了。"	瓦萊莉婭	"她今天好像也很早就起床工作了。
謝謝芙洛可總是忙裡忙外的。"
Heidi	ハイディ	"ご飯の後片付けくらいはやらないとね。
相棒、ゴミ捨ててこよう"	Heidi	We can at least tidy things up for her. C'mon, partner. Let's take out the trash.	海蒂	"得收拾一下餐桌呢。
我们去把垃圾丢了吧，搭档。"	海蒂	"至少飯後收拾這種小事就由我們來做吧。
搭檔，一起去丟垃圾吧。"
Valeria	ヴァレリア	"はいはい。
みんな、ちょっとフロッケのこと見ててもらえる？"	Valeria	Yeah, all right. Would you guys mind watching Flocke while we're out?	瓦莱莉娅	"知道啦。
那芙洛可就拜托大家照看啦？"	瓦萊莉婭	"好啦好啦。
大家，可以稍微幫我們照顧一下芙洛可嗎？"
Totori	トトリ	あ、はい。分かりました	Totori	Oh, sure. No problem.	托托莉	好的，交给我们吧。	托托莉	啊，好的。我知道了。
Lanze	ランツェ	"……自分らの生活だけで手いっぱいだろうに。
いつも俺なんかのために気ぃ遣ってよ"	Lanze	They're all so busy dealin' with their own problems, but they're always lookin' out for me.	兰泽	"……她明明每天忙自己的生活已经很辛苦了，
还总是为我操心。"	藍澤	"……她明明光是自己的生活就已經忙得焦頭爛額了，
還處處為我這種人著想。"
Lanze	ランツェ	……俺も、このままじゃいけねえよな	Lanze	I can't keep goin' on like this.	兰泽	……我也不能一直这样下去了啊。	藍澤	……我也不能再這樣下去了吧。
Lanze	ランツェ	……なあ。トトリ、アーシャ	Lanze	Hey, Totori. Ayesha.	兰泽	……托托莉、爱夏。	藍澤	……那個，托托莉、愛夏。
Lanze	ランツェ	ちと相談したいことがあるんだが……いいか？	Lanze	Mind if I get your opinion on somethin'?	兰泽	我有点事想和你们聊聊……可以吗？	藍澤	我有點事想跟妳們商量……可以嗎？
	トトリ/アーシャ	…………？	Totori/Ayesha	...?	托托莉/爱夏	…………？	托托莉/愛夏	…………？
Ayesha	アーシャ	…………？	Ayesha	...?	爱夏	…………？	愛夏	…………？
