romanized	name_jp	text_jp	name_en	text_en	name_zh-CN	text_zh-CN	name_zh-TW	text_zh-TW
	男性A	"聞いたか？　街道にいる物売りの少女の話。
怪しげな道具を売り歩いてるっていう"	Man A	You hear about that weird merchant girl hanging around? They say she's got all these weird items.	男人A	"你听说了吗？在街道上有个卖东西的姑娘。
听说她在到处兜售可疑的道具。"	男性A	"你聽說了嗎？在街上有個賣東西的少女，
據說她在四處兜售可疑的道具。"
	男性B	"その話か。俺の知り合いが実際に商品を
買ったらしいぞ"	Man B	Yeah, a buddy of mine actually bought something from her.	男人B	"这件事啊。
我有个熟人好像买了她卖的东西。"	男性B	"那件事啊。我有個朋友好像
真的買下她的商品了呢。"
	男性A	"手遅れだったか……。
あれ、錬金術で作った商品だって噂だぜ"	Man A	Too late for him, I guess. Rumor has it that stuff was made with alchemy.	男人A	"看来我说晚了啊……
有传言说她的东西是用炼金术做的。"	男性A	"我晚了一步嗎……
有傳言說，那些商品是用鍊金術做出來的。"
	男性B	"本当か！？　じゃあアイツ、
ガラクタ掴まされたのか？"	Man B	Really?! So that poor guy got scammed with a bunch of junk?	男人B	"真的吗？！
那我的熟人岂不是花钱买了破烂？"	男性B	"真的嗎！？
那我朋友豈不是被騙去買了個破爛？"
	男性A	"かもな。今の時代に錬金術を語る奴は、
時代に取り残された奴か、詐欺師くらいさ"	Man A	Probably. Only people that talk about alchemy nowadays are old folks and scam artists.	男人A	"有可能。毕竟现如今还把炼金术挂在嘴边的人，
要么是没跟上时代的人，要么是骗子。"	男性A	"有可能。現在這年頭還把鍊金術掛在嘴邊的人，
不是個沒跟上時代的傢伙，就是個騙子吧。"
	男性B	"いいものを買ったと喜んでたんだがな。
一度のぞいてみようと思ってたが、やめておくよ"	Man B	He was so happy with what he bought, too. I was thinking of going to check out her stuff, but not anymore.	男人B	"可是他说买到好东西了，还挺高兴的呢。
我本来想去看一眼，还是算了吧。"	男性B	"不過我朋友還很高興自己買到了好東西呢。
我本來想去瞧一瞧的，還是算了吧。"
Resna	レスナ	……こんな風に思われてたんだ	Resna	That's what people think of me...?	蕾斯娜	……大家原来是这么想的。	蕾斯娜	……原來大家是這麼想的。
Resna	レスナ	ううん、大丈夫。負けるな、レスナ！	Resna	No, don't let them get you down, Resna!	蕾斯娜	不，别在意。不要认输啊，蕾斯娜！	蕾斯娜	不，不要緊的。別認輸啊，蕾斯娜！
