romanized	name_jp	text_jp	name_en	text_en	name_zh-CN	text_zh-CN	name_zh-TW	text_zh-TW
Plachta	プラフタ	"ハロウィンぷにの言うことが確かなら、
あれを倒すことで呪いは解けるはずです"	Plachta	If what the Halloween Puni said is true, defeating it should break the curse.	普拉芙妲	"如果万圣节噗尼没有说谎的话，
只要打倒它应该就能破解诅咒了。"	普拉芙妲	"如果萬聖節噗尼說的是真的，
那打倒牠，詛咒應該就會解除。"
Sophie	ソフィー	"なるほど……じゃあ、そのハロウィンぷにを
早く見つけなくちゃ！"	Sophie	All right, then let's head out and find it as quickly as we can!	苏菲	"这样啊……
那我们得快点找到那只万圣节噗尼！"	蘇菲	"原來如此……那麼，
我們得快點找到那隻萬聖節噗尼！"
Plachta	プラフタ	"ええ。
ですが、今はどこにいるのか……"	Plachta	Yes, but we have no idea where it is...	普拉芙妲	"是的。
但是它现在会在哪里呢……"	普拉芙妲	"是啊。
但是，牠現在在哪裡呢……"
Sophie	ソフィー	"うーん……そもそも、どうして
うちのお店にやって来たんだろう"	Sophie	Hmm. Why did it come to our shop in the first place?	苏菲	"唔……首先，
它为什么会跑到我们店里来呢？"	蘇菲	"嗯……說起來，
牠為什麼會來我們店裡呢？"
Plachta	プラフタ	"そういえば、甘いお菓子はここか、と
言いながら店に飛び込んできました"	Plachta	Now that you mention it, it said something about sweet treats when it barged in.	普拉芙妲	"我记起来了，它闯进店里的时候说，
“这里有甜甜的点心是吗”……"	普拉芙妲	"對了，牠闖進店裡時，
嘴上還說著「甜甜的點心在這裡嗎？」。"
Sophie	ソフィー	"もしかして、お菓子の匂いに
つられてやって来たのかも？"	Sophie	Maybe it was attracted by the smell of the treats?	苏菲	难不成它是被点心的香气吸引过来的？	蘇菲	"搞不好，
牠是被點心的氣味給吸引過來的？"
Plachta	プラフタ	"だとすると、あのぷにをおびき出す方法は
１つだけですね"	Plachta	If that's the case, there's only one way to lure it out again.	普拉芙妲	"如果是这样，
把它引出来就只有一个办法了。"	普拉芙妲	"這樣的話，要引出那隻噗尼的方法
就只有一個了。"
Sophie	ソフィー	"分かった！
お菓子をたくさん用意するんだね"	Sophie	Yep! We need to prepare more treats!	苏菲	"明白了！
看来需要准备很多很多点心了啊。"	蘇菲	"我知道了！
要準備很多點心對吧。"
Plachta	プラフタ	"はい。ハロウィンぷにが飛びついてくるような
最高のお菓子が必要です"	Plachta	Agreed. We need to best treats possible to make sure the Halloween Puni can't resist.	普拉芙妲	"是的。要准备最好吃的点心，
让万圣节噗尼急不可耐地扑过来。"	普拉芙妲	"是的，必須準備會讓萬聖節噗尼衝來的
最棒的點心。"
Sophie	ソフィー	"最高のお菓子かぁ。おばあちゃんのお菓子は
どれも美味しいからなぁ"	Sophie	The best treats possible? But everything in Grandma's recipes is already so delicious...	苏菲	"最好吃的点心啊……
奶奶做的点心每样都很好吃嘛。"	蘇菲	"最棒的點心啊～但奶奶的點心，
每樣都很好吃耶……"
Plachta	プラフタ	"そういえば、先代が特別な時にだけ作っていた
お菓子のレシピがあるはずです"	Plachta	If I remember correctly, there was one recipe that she only ever made on special occasions.	普拉芙妲	"对了，上代主人有一份特殊的点心配方，
那是一种专为特殊的日子制作的点心。"	普拉芙妲	"這麼說來，上一代主人好像有只在特別的日子
才會做的點心的配方。"
Plachta	プラフタ	私も何度か、手伝わせていただきました	Plachta	I remember helping her make it a number of times.	普拉芙妲	我也曾经协助她做过好几次。	普拉芙妲	我也幫忙做過好幾次。
Sophie	ソフィー	"あっ！　確かに、おばあちゃんが特別な日に
作ってくれたお菓子があったね"	Sophie	Oh, yes! There were those amazing treats she would only make on the most special of days.	苏菲	"啊！对对，我记得奶奶在特殊的日子
给我做过一种点心。"	蘇菲	"啊！對耶，奶奶的確有那種在特別的日子
才會做給我的點心。"
Sophie	ソフィー	そのレシピなら、どこかにしまったはずだよ	Sophie	I definitely saw the recipe somewhere...	苏菲	那份配方应该放在了某个地方。	蘇菲	那份配方應該是收在某個地方。
Plachta	プラフタ	"どこか、というのは……
この片付いてない家の中のことですか？"	Plachta	Somewhere...in this messy house?	普拉芙妲	"某个地方……
是放在这个乱糟糟的房子里了吗？"	普拉芙妲	"某個地方……
是指這個沒整理的家中某處嗎？"
Sophie	ソフィー	あはは……その通りです	Sophie	Ahaha... Yes.	苏菲	哈哈哈……你说得对。	蘇菲	啊哈哈……正是如此。
Plachta	プラフタ	"まったく……普段から掃除をしていれば、
探す手間も省けたというのに"	Plachta	You know, if you kept things tidy, you wouldn't have to spend so much time looking for things.	普拉芙妲	"唉……要是平时定期收拾打扫，
现在找起来一定会轻松不少。"	普拉芙妲	"真是的……妳要是平時有在打掃，
就不必花工夫去找了。"
Sophie	ソフィー	ううっ、返す言葉もないよ	Sophie	Ouch, I can't argue with that...	苏菲	呜呜，您批评得是。	蘇菲	嗚嗚，無法反駁。
Sophie	ソフィー	"あった！
これだよ、おばあちゃんのレシピ！"	Sophie	Here it is! Grandma's recipe!	苏菲	"找到了！
就是这份，是奶奶写的配方。"	蘇菲	"找到了！
就是這個，奶奶的配方！"
Plachta	プラフタ	作れそうですか、ソフィー	Plachta	Do you think you can you make it, Sophie?	普拉芙妲	苏菲，你做得出来吗？	普拉芙妲	做得出來嗎，蘇菲？
Sophie	ソフィー	"うん、この素材なら近くのお店で揃うと思う。
早速、買いに行こう！"	Sophie	Yes, all these ingredients should be available at the nearby shop. Let's go grab them!	苏菲	"嗯，看样子素材都能在附近的店里买到。
我这就去买！"	蘇菲	"嗯，我想這些素材大概在附近的店可以買到。
我們現在就去買吧！"
Sophie	ソフィー	コルちゃん、こんにちは！	Sophie	Hello, Cory!	苏菲	小柯柯，你好！	蘇菲	小柯柯，妳好！
Corneria	コルネリア	"ソフィーさん、いらっしゃいです。
いつもの仕入れに来たですか？"	Corneria	Sophie, welcome. Here for your usual supplies?	柯尔涅莉雅	"苏菲小姐，欢迎光临。
你是来进货的吗，按老样子？"	柯爾涅莉雅	"蘇菲小姐，歡迎光臨。
妳是來進平常的貨嗎？"
Sophie	ソフィー	"ううん、今日は別のお買い物！
この素材が欲しいんだけど……"	Sophie	Nope, we're here for some different shopping today! I'm looking for these ingredients.	苏菲	"不，我今天想买别的东西！
你看，就是这种素材……"	蘇菲	"不是，今天要買別的東西！
我想要這個素材……"
Corneria	コルネリア	"これならすぐに用意できるです。
少しお待ちください……です"	Corneria	I can get these together for you in no time. Just...give me a sec.	柯尔涅莉雅	"这个啊，我马上就能备好，
请稍候……"	柯爾涅莉雅	"這個我馬上就能準備好。
請稍待片刻……"
Sophie	ソフィー	"うん！
よろしくね、コルちゃん！"	Sophie	Great! Thanks, Cory!	苏菲	嗯！麻烦你了，小柯柯！	蘇菲	"嗯！
麻煩妳囉，小柯柯！"
Corneria	コルネリア	"ソフィーの友人で、やり手の行商人。
お菓子の材料だけでなく色んなものを売ってくれる"	Corneria	A skilled merchant and a friend of Sophie. She sells baking ingredients along with a variety of other items.	柯尔涅莉雅	"苏菲的朋友，精明能干的旅行商人。
除了点心材料，也贩卖许多其他商品。"	柯爾涅莉雅	"蘇菲的朋友，能幹的旅行商人。
除了點心材料外，也販賣各式各樣的東西。"
