romanized	name_jp	text_jp	name_en	text_en	name_zh-CN	text_zh-CN	name_zh-TW	text_zh-TW
Ryza	ライザ	"いらっしゃいませー！
この海で、贅沢なひと時を過ごしませんかー！"	Ryza	Step right up! Treat yourself to a relaxing moment on the beach!	莱莎	"欢迎光临！
要在海边享受一段奢华时光吗——！"	萊莎	"歡迎光臨～！要不要在這片海灘
享受一下奢侈的時光呢～？"
	客A	"あれ？　ここって魔物が出て海の家も
閉まっちゃったんじゃ？"	Customer A	Wait a minute... Didn't they close the beach because of the monster attacks?	客人A	"咦？这里不是有魔物出没，
海边小屋也关门了吗？"	顧客A	"奇怪？這裡之前不是出現魔物，
海之家也因此關門了嗎？"
Ryza	ライザ	"魔物なんて平気、平気！
こうして海の家も開いてるよ！"	Ryza	As you can see, our beach house is open for business! We've got it covered, so don't you worry about any monsters!	莱莎	"魔物的事无需担心！
你们看，海边小屋不也开着吗！"	萊莎	"魔物什麼的，不用擔心！
海之家也會像這樣繼續營業喔！"
	客B	"そうなのか！　それなら寄っていこうかな。
特製錬金術かき氷３つお願いします！"	Customer B	That's great! Why don't we get something? Three orders of Deluxe Alchemical Shaved Ice, please!	客人B	"这样啊！那我们来坐坐吧。
我要三份特制炼金术刨冰！"	顧客B	"是這樣啊！那我們等等也過去看看吧。
麻煩給我們3份特製鍊金術刨冰！"
Ryza	ライザ	はーい！　ご注文承りました！	Ryza	Thank you! Coming right up!	莱莎	好的！收到您的点单了！	萊莎	好的～！訂單已收到！
Klaudia	クラウディア	"食べ物を用意して正解でしたね。
観光客が戻ってきているみたい"	Klaudia	Serving food was a great idea. People are starting to come back to the beach!	科洛蒂娅	"看来准备食物的决定很明智啊。
客流开始慢慢恢复了。"	科洛蒂婭	"準備食物果然是對的，
遊客好像正在回流。"
Resna	レスナ	"はい！　それにしても炎天下の中でも、
機敏で力強い動き、さすがライザ先輩です！"	Resna	I'm impressed. Not even the sweltering heat can stop Ryza from innovating and conquering!	蕾斯娜	"嗯！不过真不愧是莱莎前辈，
这么热的天也干劲十足，毫不拖泥带水。"	蕾斯娜	"是啊！話說回來，即使在大熱天下
行動依然快狠準，真不愧是萊莎前輩！"
Resna	レスナ	"これが接客……王都に来るまでものを
売り歩いていた時の私とは大違いです……"	Resna	When it comes to sales, she's in a league of her own. Especially compared to me before I made it to the capital...	蕾斯娜	"这才是“接待”……
和来王都之前沿路摆摊的我天差地别啊……"	蕾斯娜	"這就是待客之道……和我來王都之前
四處叫賣東西的感覺完全不一樣……"
Klaudia	クラウディア	売り込むのも上手で、お客さんからも人気みたい	Klaudia	Not only is she a good salesperson, but the customers seem to love her too.	科洛蒂娅	莱莎推销也很有技巧，顾客反响极佳。	科洛蒂婭	妳既擅長推銷，又很受客人歡迎的樣子。
Klaudia	クラウディア	"やっぱりライザに任せてよかった。
最高の看板娘だよ"	Klaudia	We were right to put our faith in her. She's the best poster girl we could ask for!	科洛蒂娅	"交给她真是太对了。
她是最棒的招牌女店员。"	科洛蒂婭	"交給萊莎果然是對的。
妳是最棒的招牌姑娘。"
Ryza	ライザ	"さ、最高の看板娘って……
そんなにほめられたら照れるよ"	Ryza	Heh, I don't know about the best, but... Keep up the compliments and I'll be too red in the face to keep going!	莱莎	"什么最棒的招牌女店员呀……
你这么夸我我会不好意思的。"	萊莎	"最、最棒的招牌姑娘……
妳這樣稱讚我，我會害羞的。"
Klaudia	クラウディア	"とはいえ、そろそろ交代したほうがいいかな。
そのかき氷、私が持っていくね"	Klaudia	Speaking of which, I think you could use a break. I'll tag you out, so let me handle that shaved ice for you!	科洛蒂娅	"不过也该换人让你休息了吧。
这份刨冰我端过去。"	科洛蒂婭	"不過，也差不多該換班了吧。
那碗刨冰我來送吧。"
Klaudia	クラウディア	"お待たせいたしました。
特製錬金術かき氷です"	Klaudia	Thank you for waiting. Here you are, our special! The Deluxe Alchemical Shaved Ice.	科洛蒂娅	久等了。您的特制炼金术刨冰。	科洛蒂婭	"讓您久等了。
這是特製鍊金術刨冰。"
	客A	"わあ、美味しそう！
このシロップは自家製なの？"	Customer A	Wow, it looks so good! Is the syrup homemade too?	客人A	"哟，看上去很好吃啊！
这糖浆是你们自己做的？"	顧客A	"哇，好像很好吃！
這糖漿是自製的嗎？"
Klaudia	クラウディア	"ええ、もちろんです。氷から器まで、
すべて当店の錬金術士たちが作り出したものです"	Klaudia	Of course! Everything is handcrafted by alchemists—from the shaved ice right down to the cup it's served in!	科洛蒂娅	"嗯，当然。从冰块到盘子，
都是本店的炼金术士们亲手制作的。"	科洛蒂婭	"是的，那當然。從刨冰到容器，
全都是由本店的鍊金術士們製作出來的。"
	客A	"錬金術士が！？　かき氷まで作れるのね……
不作を解決しただけでも、十分すごいのに"	Customer A	Alchemists again?! First they saved the crops, now they're making shaved ice... What can't they do?	客人A	"炼金术士？！竟然还会做刨冰啊……
之前解决歉收已经很厉害了，没想到啊。"	顧客A	"鍊金術士做的！？他們連刨冰都會做啊……
明明光是解決歉收的問題，就已經很厲害了。"
Klaudia	クラウディア	こちらの人面魚焼きも、おすすめですよ	Klaudia	Our other special is our Fishy Face Fry.	科洛蒂娅	这边还有烤人面鱼，也推荐各位品尝哦。	科洛蒂婭	我也很推薦這道烤人面魚喔。
Klaudia	クラウディア	"錬金術でしか調理できない特別な方法で
骨まで柔らかく食べられるようにしてあります"	Klaudia	Using a special alchemical technique, we prepare the dish so that the whole fish is super soft. You can eat it bones and all!	科洛蒂娅	"我们用了只有炼金术才能做到的特殊烹饪方式，
连骨头都酥得可以嚼烂。"	科洛蒂婭	"採用了唯獨鍊金術才能做到的特別調理方法，
所以連骨頭都柔軟到能夠食用。"
	客A	じゃあ、人面魚焼きももらおうかしら！	Customer A	That sounds great! I'll try one of those too!	客人A	好，那给我来一份烤人面鱼！	顧客A	那我也點一道烤人面魚吧！
Klaudia	クラウディア	はい、ありがとうございます！	Klaudia	Of course, coming right up!	科洛蒂娅	好的，谢谢惠顾！	科洛蒂婭	好的，謝謝您！
Resna	レスナ	"わあ、クラウディアさんの接客もすごい。
さすが商家の生まれ……"	Resna	Wow, Klaudia's great with customers. You can tell that she comes from a long line of merchants.	蕾斯娜	"哇，科洛蒂娅小姐也这么会接待顾客。
真不愧是商人世家的后代……"	蕾斯娜	"哇啊，科洛蒂婭小姐也好會接待客人。
真不愧是商人家庭出身……"
Valeria	ヴァレリア	"なんだか普段の印象とぜんぜん違うわね。
もしかして、これがギャップってやつ？"	Valeria	Somehow, I didn't quite expect that. I'm seeing a whole new side of her.	瓦莱莉娅	"和平时给人的印象大不一样啊。
这难道就是反差萌吗？"	瓦萊莉婭	"感覺和平時給人的印象完全不同呢。
這難道就是所謂的反差？"
Resna	レスナ	"うん、クラウディアさんもライザ先輩も
すごくかっこいいよね！"	Resna	Yeah. Klaudia and Ryza are both adorable, but they're also really cool too!	蕾斯娜	嗯，科洛蒂娅小姐和莱莎前辈都好有型！	蕾斯娜	嗯，科洛蒂婭小姐和萊莎前輩都超帥氣的！
Resna	レスナ	"私もかき氷作り頑張ろう！
ついでに新しい味も作れないかな……"	Resna	I'm going to make the best shaved ice I can! And maybe I'll think up a new flavor while I'm at it...	蕾斯娜	"我也加油做刨冰吧！
让我想想还能做什么新口味……"	蕾斯娜	"我也要努力做刨冰！
能不能也順便做出新口味呢……"
Valeria	ヴァレリア	"……むう、私もいいところ見せたい。でも、
かき氷が美味しくて食べるのやめられないのよね"	Valeria	I want to show off a little, too, but this shaved ice is so good that all I can do is eat!	瓦莱莉娅	"唔……我也想表现一下。
不过刨冰太好吃了，停不下来。"	瓦萊莉婭	"……唔，我也想好好表現一下。
但刨冰太好吃了，我停不下來。"
Valeria	ヴァレリア	"くうっ、手伝うべきか食べるべきか。
難しい問題だわ……"	Valeria	Ergh... I should help, but... To eat? Or not to eat? That is the question...	瓦莱莉娅	"呜，是去帮忙还是接着吃，
真是个艰难的抉择……"	瓦萊莉婭	"呃，該幫忙還是該吃呢？
真是個難題……"
Ryza	ライザ	ヴァレリアはそのまま食べ続けていいよ！	Ryza	Don't worry about it, Valeria. Just keep eating!	莱莎	瓦莱莉娅，没关系，你就接着吃吧！	萊莎	瓦萊莉婭，妳可以繼續吃沒關係喔！
Valeria	ヴァレリア	私にだって、接客できるわよ？	Valeria	B-But I can help out with the customers, too!	瓦莱莉娅	我也是会干活的啦。	瓦萊莉婭	接待客人，我也做得到喔？
Ryza	ライザ	"ううん。ヴァレリアが美味しそうに食べるから
かき氷の注文が、どんどん入ってくるの"	Ryza	You're a big help already. People are seeing how much you're enjoying the shaved ice, so orders are flooding in!	莱莎	"不不，因为看到瓦莱莉娅吃得满足的模样，
点刨冰的人越来越多了，所以这样就好。"	萊莎	"不，是因為妳吃得津津有味，
刨冰的訂單才會源源不絕啊。"
Valeria	ヴァレリア	"そういうことなら任せて。
食べるのは得意だもの！"	Valeria	In that case, eating is what I do best! I've got you covered!	瓦莱莉娅	那就交给我吧。论吃我可在行了！	瓦萊莉婭	"既然如此就交給我吧。
我最擅長吃東西了。"
Resna	レスナ	"（この調子で売り物を増やしたら、
　もっとお客さんを増やせるかな）"	Resna	(If we expand our menu, that might bring in even more customers!)	蕾斯娜	"（继续一鼓作气增加商品，
　会不会吸引到更多游客呢。）"	蕾斯娜	"（照這樣繼續增加商品，
　就會有更多顧客上門了吧？）"
Resna	レスナ	"（かき氷以外で、海にぴったりな食べ物……
　うーん……）"	Resna	(We already have shaved ice. What's another food people can enjoy at the beach?)	蕾斯娜	"（除了刨冰，还有什么适合海边吃的食物……
　唔……）"	蕾斯娜	"（除了刨冰以外，很適合海邊的食物……
　唔……）"
