romanized	name_jp	text_jp	name_en	text_en	name_zh-CN	text_zh-CN	name_zh-TW	text_zh-TW
Resna	レスナ	"くうっ……
ダメ、ぜんぜん歯が立たない……！"	Resna	Urk... It's no use. We don't stand a chance!	蕾斯娜	"唔……
不行，完全敌不过……！"	蕾斯娜	"唔呃……
不行，完全敵不過他……！"
Tess	テス	"はあ、はあ……
こんなに強いなんて反則だよー！"	Tess	*Gasp* *Huff* No one should be this strong!	缇丝	"呼……呼……
强成这样也太不讲道理了！"	緹絲	"呼、呼……
竟然這麼強，根本就是犯規──！"
Roze	ロゼ	くそ、甘く見すぎたか……	Raze	Curses. We weren't ready...	罗杰	啧，小看它了……	羅傑	可惡，我們太小看他了嗎……
	魔王	"もう終わりか、つまらん。
ならば、このまま楽になるがいい――！"	Demon King	Finished so soon? A shame. Prepare to meet your end!	魔王	"就这么结束了吗，真无趣。
好，给你们一个解脱——！"	魔王	"已經結束了嗎？真無趣。
那麼，就這樣給你們一個痛快吧──！"
Lent	レント	"ちくしょう、
負けるわけには、いかねえってのに……！"	Lent	This can't be. We can't lose here!	兰托	该死，不能败在这里啊……！	蘭托	"可惡，
明明我們不能輸的……！"
Rorona	ロロナ	どうしよう、このままじゃ……	Rorona	What are we supposed to do?	萝乐娜	怎么办，再这么下去……	蘿樂娜	怎麼辦？再這樣下去……
Meruru	メルル	"まだ、魔力が足りてない……！
だけど、諦めちゃダメだよ！　みんな！"	Meruru	I don't have enough magic yet...! Don't give up, all of you!	梅露露	"魔力还不够……
但大家千万不能放弃啊！"	梅露露	"魔力還不夠……！
可是，不能放棄啊！各位！"
Resna	レスナ	メルル、姫……？	Resna	Lady Meruru?	蕾斯娜	梅露露……公主……？！	蕾斯娜	梅露露、公主……？
Meruru	メルル	"思い出して、ここまでの道のりを。
わたし、ずっと見守ってきたんだから！"	Meruru	Remember what you went through to get here! I've been watching over you this entire time!	梅露露	"你们一定都还记得旅途中的种种。
我可是看着你们一路走来的！"	梅露露	"回想起來吧，你們這一路是怎麼走來的。
因為我一直看在眼裡啊！"
Meruru	メルル	"どんなに辛いことがあったって、
みんなで力を合わせて乗り越えてきたでしょ？"	Meruru	No matter what obstacles you faced, you worked together to overcome them. Remember?	梅露露	"无论遇到怎样的难关，
大家都齐心协力跨越过来了不是吗？"	梅露露	"無論遭遇多麼困難的事，
大家都同心協力克服了對吧？"
Meruru	メルル	"今回だってそう！
きっと乗り越えられるはずだよ！"	Meruru	This, too! You can overcome this, together!	梅露露	"这次也一定可以！
你们一定能够赢过魔王！"	梅露露	"這次也一樣！
我們一定能夠克服的！"
Meruru	メルル	"それに、戦っているのは、
ここにいるわたしたちだけじゃないから――！"	Meruru	And we aren't the only ones in this fight!	梅露露	"而且正在战斗的，
并不是只有在场的我们——！"	梅露露	"而且，正在戰鬥的，
並不僅僅是在這裡的我們──！"
Meruru	メルル	"みんなの応援が聞こえる……
力が集まってくる、これなら！"	Meruru	I can hear everyone's voices. They're cheering us on... I can feel my power surging!	梅露露	"我能听到国民们的助威声……
感受到汇聚而来的力量。一定能行！"	梅露露	"我可以聽見大家在為我們加油……！
力量正匯集而來，這樣的話！"
Meruru	メルル	"ここまで来てくれたみんなの努力を、
みんなの思いを、無駄にはさせない――！"	Meruru	I won't let everyone's help go to waste!	梅露露	"我绝不会让大家走到这一步所付出的
努力和心意白白浪费——！"	梅露露	"我不會讓來到這裡的大家的努力、
以及大家的意念白費的──！"
	魔王	くっ！　小癪な真似を！	Demon King	Gah! You insolent little pest!	魔王	啧，自作聪明！	魔王	唔！自作聰明！
	魔王	"だが、多少の力を削がれたに過ぎぬ……！
貴様らはすでに満身創痍、この戦況を覆せはしまい！"	Demon King	I still possess most of my power! You, on the other hand, are all but spent. You have failed to turn the tide!	魔王	"但也只能消耗我力量的一点皮毛……！
你们这群遍体鳞伤的蝼蚁妄想扭转局势也没戏！"	魔王	"但我也不過是力量稍微被削弱了一些罷了……！
你們早已滿身瘡痍，無法改變戰況了！"
Resna	レスナ	くぅ……！	Resna	Ugh...!	蕾斯娜	唔……！	蕾斯娜	唔……！
???	？？？	なーにへばってるのよ、レスナ！	???	Tired already, Resna? Come on!	？？？	这就气馁了吗，蕾斯娜！	？？？	蕾斯娜，妳怎麼一副累癱的樣子啊！
Resna	レスナ	ヴァレリア！？	Resna	Valeria?!	蕾斯娜	瓦莱莉娅？！	蕾斯娜	瓦萊莉婭！？
	魔王	"ふん……虫が数匹増えたところで、
所詮は雑魚の寄せ集め。私の勝利は揺るがん！"	Demon King	Bah. What are a few more insects going to do? Your combined powers are no match for mine!	魔王	"哼……就算多几只小虫，
也还是乌合之众，我的胜利不可动摇！"	魔王	"哼……就算多了幾隻螻蟻，
也只不過是群蝦兵蟹將，我的勝利無可動搖！"
Valeria	ヴァレリア	"言ってくれるじゃない。
油断してると痛い目見るわよ"	Valeria	That is quite the bold statement. Underestimate us, and you will regret it.	瓦莱莉娅	"真敢说啊。
这么轻敌可是会吃苦头的。"	瓦萊莉婭	"你很敢說嘛。
一不留神可是會嚐到苦頭的喔。"
Valeria	ヴァレリア	"ほら、レスナ。いつまでへばってるの？
私が先に倒しちゃうわよ"	Valeria	Come now, Resna. Stand strong, or we'll end up defeating him before you.	瓦莱莉娅	"蕾斯娜，你要气馁到什么时候？
再不振作起来我就比你先打倒它了哦。"	瓦萊莉婭	"好了，蕾斯娜，妳要休息到什麼時候？
我要先打倒他了喔。"
Resna	レスナ	"ふふ……させないよ。
魔王を倒すのは、私たちなんだから……！"	Resna	Heh... I won't let that happen. I will be the one to defeat the Demon King!	蕾斯娜	"呵呵……才不会呢。
打倒魔王的，会是我们……！"	蕾斯娜	"呵呵……不會讓妳搶先的。
因為要打倒魔王的是我們啊……！"
Valeria	ヴァレリア	それでこそ、張り合いがあるってものよ！	Valeria	Now that's what I call a challenge!	瓦莱莉娅	这才有劲敌的感觉嘛！	瓦萊莉婭	就是要這樣才會有幹勁嘛！
	魔王	"どこまでも目障りな……
まとめて潰してくれるわ！！"	Demon King	Enough of this. I shall crush you all into oblivion!	魔王	"真是碍眼……
看我一并干掉你们！！"	魔王	"盡是礙眼的蟲子……
我要把你們全都一起碾死！！"
Meruru	メルル	"みんな！　今度こそ……
これが、最後の戦いだよ！"	Meruru	Everyone, this is it! This is the final battle!	梅露露	"各位！把握机会……
这是最后的战斗了！"	梅露露	"各位！這次一定要……
這是最後的戰鬥了！"
Meruru	メルル	"わたしの力で魔王に隙を作るから、
みんなは思いっきりやっちゃって！"	Meruru	I will create an opening with my powers! Use it, and throw everything you have against him!	梅露露	"我会用我的力量让魔王露出破绽，
大家就尽全力上吧！"	梅露露	"我會用力量使魔王露出破綻，
大家就盡情攻擊吧！"
Resna	レスナ	"メルル姫、
ありがとうございます！"	Resna	Thank you, Lady Meruru!	蕾斯娜	"梅露露公主，
谢谢你！"	蕾斯娜	"梅露露公主，
謝謝妳！"
Resna	レスナ	"絶対に負けない……
みんなで、勝利を掴むんだ！！"	Resna	I cannot lose... We're going to win this, together!	蕾斯娜	"我绝对不会输……
我们会一起赢得这场战役！！"	蕾斯娜	"絕對不會輸給你……
大家會一起取得勝利的！！"
