romanized	name_jp	text_jp	name_en	text_en	name_zh-CN	text_zh-CN	name_zh-TW	text_zh-TW
Resna	レスナ	"最後の素材、
聖銀石はここにあるはず……！"	Resna	There should be a Celestial Silver Stone around here somewhere!	蕾斯娜	最后的素材圣银石应该就在这里……！	蕾斯娜	"最後的素材聖銀石
應該就在這裡……！"
Resna	レスナ	"洞窟の天井からわずかに差し込む聖なる星の光を
何千年と浴び、あらゆる邪悪を払う力が宿った石――"	Resna	After basking in the light of a holy star for a thousand years, this rare stone was imbued with the sacred power to defeat all evil.	蕾斯娜	"神圣的星光偶尔会钻过洞窟顶部的缝隙洒落进来，
圣银石沐浴微光几千年，拥有能祛除一切邪恶的力量——"	蕾斯娜	"那塊石頭數千年來沐浴著洞窟頂部微微照射進來的
神聖星光，擁有驅除一切邪惡的力量──"
Resna	レスナ	"そこから精錬された銀はまさに聖なる輝きそのもの！
とこしえの霊剣の根幹を成す絶対不可欠の素材です！"	Resna	It's said that its silver shines a pure, magnificent light! We simply cannot forge the Eternal Sword without one!	蕾斯娜	"精炼这石头得来的银块充满了神圣光辉！
是作为悠久灵剑根基必不可少的素材！"	蕾斯娜	"從那當中所提煉出來的銀正是它長期積累的神聖光輝！
是打造永恆靈劍基礎絕對不可或缺的素材！"
Rorona	ロロナ	"聖銀石を見つけたら、いよいよとこしえの霊剣が
作れるんだね！　なんとしても見つけなきゃ……あれ？"	Rorona	Once we find this Celestial Silver Stone, we'll finally be able to make the sword! Now let's...huh?	萝乐娜	"只要找到圣银石，就终于能锻造悠久灵剑了！
一定要找到它……咦？"	蘿樂娜	"找到聖銀石後，就可以打造永恆靈劍了！
我們無論如何都要找到才行……奇怪？"
Tess	テス	"な、何これ！？
石を掘るくらいじゃ、こんなに荒れたりしないよね？"	Tess	Wh-What is this?! These don't come from simple mining, do they?	缇丝	"怎、怎么回事？！
光是挖石头不会乱成这样吧？"	緹絲	"這、這是怎麼回事！？
只是挖個石頭，應該不至於弄得這麼雜亂的吧？"
Roze	ロゼ	"爪や牙の跡が残っている。
魔物の仕業だろう"	Raze	There are teeth and claw marks. Must be monsters.	罗杰	"这里还看得出爪痕和咬痕，
应该是魔物干的。"	羅傑	"上頭還有利爪和尖牙的痕跡，
大概是魔物幹的好事。"
Rorona	ロロナ	"もしかして、魔王の配下が
聖銀石を狙ってきたのかも……！"	Rorona	Maybe the Demon King's pawns are going after the Celestial Silver Stone!	萝乐娜	难道魔王的部下也盯上了圣银石……！	蘿樂娜	"難道說魔王的部下
也來尋找聖銀石了……！"
Resna	レスナ	急いで聖銀石を探しましょう！	Resna	We should find it, quickly!	蕾斯娜	我们赶快去找圣银石吧！	蕾斯娜	我們趕緊去找聖銀石吧！
Roze	ロゼ	ここは……随分ひどく荒らされてるな	Raze	This place... It's particularly messy.	罗杰	这里……还真是被弄得一团糟啊。	羅傑	這裡……也被弄得亂七八糟啊。
Resna	レスナ	"伝承ではこの辺りに、闇にかき消されることのない
銀の煌めきが眠っていた、と……"	Resna	The legends say that there should be a bright, silvery light that cannot be extinguished by darkness...	蕾斯娜	"传说中这附近沉睡着一缕银光，
不会被任何黑暗所遮蔽……"	蕾斯娜	"傳說在這一帶，
沉睡著一道不會被黑暗吞噬的白銀光輝……"
Lent	レント	"これっぽっちも見当たらねえな……。
遅かったってわけか、くそっ！"	Lent	I don't see that anywhere. Curses, we must be too late!	兰托	"但一丁点也看不到啊……
是来晚了吗，可恶！"	蘭托	"但這裡一點光也沒見著……
是我們晚了一步嗎？可惡！"
Rorona	ロロナ	"洞窟の中は全部探したよね？
だとしたら、聖銀石は……"	Rorona	We checked the entire cave, right? If that's the case, the Celestial Silver Stone must be...	萝乐娜	"洞窟里都找遍了吧？
那圣银石……"	蘿樂娜	"洞窟裡都找過了吧？
這樣的話，聖銀石應該……"
Resna	レスナ	"この洞窟では見つけられない、ですね……
これじゃ、メルル姫を助けることは……"	Resna	It must not be in the cave. How are we supposed to rescue Lady Meruru now?	蕾斯娜	"在个这洞窟里是没希望了吧……
这样就没法救出梅露露公主……"	蕾斯娜	"這個洞窟裡都找不到聖銀石……
這麼一來，拯救梅露露公主就……"
Meruru	メルル	……様、勇者様……！	Meruru	...ro! Hero!	梅露露	……大人、勇者大人……！	梅露露	……大人、勇者大人……！
Resna	レスナ	"メルル姫！？　
あ、迷いの森で手に入れた石……！"	Resna	Lady Meruru?! Oh, it's that stone we found in the forest!	蕾斯娜	"梅露露公主？！
啊，这是在迷踪森林找到的石头……！"	蕾斯娜	"梅露露公主！？
啊，是在迷途之森拿到的石頭……！"
Meruru	メルル	"霊剣の素材、集めてくれてるんだね！
……みんな暗い顔して、どうしたの？"	Meruru	You're gathering the materials to make the sword? Wonderful! But...why the sad faces?	梅露露	"你们在为了救我寻找灵剑的素材吧！
怎么了……一个个都愁眉苦脸的？"	梅露露	"妳們在蒐集靈劍的素材吧！
……怎麼大家的臉色都這麼難看呢？"
Resna	レスナ	"その……残りは聖銀石だけなんですけど、
魔王の配下に先回りされてしまったようで……"	Resna	Well...we just need a Celestial Silver Stone now, but it seems the Demon King got ahead of us.	蕾斯娜	"因为……还剩下圣银石没找到，
但好像被魔王的部下抢了先……"	蕾斯娜	"因為……我們只差聖銀石這個素材了，
但好像被魔王的部下給搶先一步……"
Meruru	メルル	"そっか……。でも大丈夫、諦めるのはまだ早いよ！
「大陸一の鍛冶屋」なら、何か知ってるかも！"	Meruru	"I see... But it's too early to quit now! I'm sure the ""World's Greatest Blacksmith"" will know what to do!"	梅露露	"这样啊……没关系，先别急着放弃！
“大陆第一铁匠”应该知道些什么！"	梅露露	"這樣啊……不過沒關係，現在放棄還太早了！
「大陸第一的鐵匠鋪」說不定會知道些什麼！"
Meruru	メルル	"とこしえの霊剣を鍛えたのもその鍛冶屋さんでね、
聖銀石のこともきっと――"	Meruru	The one that forged the Eternal Sword...should know about the Celestial Silver—	梅露露	"那位铁匠也是悠久灵剑的锻造者，
一定知道圣银石的线索——"	梅露露	"也是那間鐵匠鋪鍛造了永恆靈劍，
他們肯定也知道聖銀石的事──"
Resna	レスナ	メルル姫！？	Resna	Lady Meruru?!	蕾斯娜	梅露露公主？！	蕾斯娜	梅露露公主！？
Meruru	メルル	"うう……！
魔王が、また……！"	Meruru	Ugh...! It's the Demon King again!	梅露露	"唔……！
魔王又……！"	梅露露	"嗚嗚……！
魔王又……！"
Tess	テス	"き、消えちゃった……まさか、魔王が
またメルル姫の魔力を奪おうとしたんじゃ！？"	Tess	She's gone... Do you think the Demon King came to steal the princess's magic again?!	缇丝	"消、消失了……
难道魔王又从梅露露公主身上抽取魔力了？！"	緹絲	"消、消失了……難道說，
魔王又打算奪取梅露露公主的魔力嗎！？"
Lent	レント	急がねえと、いよいよヤバそうって感じだな……	Lent	Sounds like we need to hurry. Things are getting really dangerous now.	兰托	感觉再不快点就危险了啊……	蘭托	看來我們不加快腳步，事態就危急了……
Resna	レスナ	"そうですね……。一刻も早く、大陸一の鍛冶屋に
お話を聞いてみましょう"	Resna	"You're right... We should go visit this ""World's Greatest Blacksmith"" as soon as possible."	蕾斯娜	是啊……快去找大陆第一铁匠打听消息吧。	蕾斯娜	"是啊……那我們盡快去問問
那間大陸第一的鐵匠鋪吧。"
Rorona	ロロナ	"あれ……でも、その鍛冶屋さんって
どこにあるんだろう？"	Rorona	But...does anyone know where this blacksmith is?	萝乐娜	等等……那位铁匠到底住在哪里啊？	蘿樂娜	"咦……？不過，
那間鐵匠鋪在哪裡啊？"
Tess	テス	"ああ、それなら大丈夫！
場所は聞いたことあるから、あたしにお任せ！"	Tess	Oh, no need to worry about that! I know exactly where they are!	缇丝	"哦，不用担心！
我听说过那位铁匠在哪，交给我吧！"	緹絲	"啊，這一點不用擔心！
我有聽說過位置，交給我吧！"
Roze	ロゼ	……本当に大丈夫か？	Raze	Really? No need to worry?	罗杰	真的没问题吗……？	羅傑	……真的沒問題嗎？
Tess	テス	"こ、今度は迷わないってば！
ほら、早く行くよー！"	Tess	T-Trust me, we won't get lost again! Now follow me!	缇丝	"这、这次不会迷路啦！
好了，快出发吧——！"	緹絲	"這、這次我不會迷路了啦！
好了，我們快出發吧～！"
