romanized	name_jp	text_jp	name_en	text_en	name_zh-CN	text_zh-CN	name_zh-TW	text_zh-TW
Resna	レスナ	"うーん、推進力を生み出すには
何を使えばいいんだろう……"	Resna	Hm... What's the best thing to propel a rocket with, I wonder?	蕾斯娜	唔——用什么才能产生推动力呢……	蕾斯娜	嗯～要用什麼來產生推力才好呢……
Resna	レスナ	"マルローネ先生の得意な爆弾を
応用するっていうのも１つの手だよね"	Resna	Miss Marlone's really good with bombs, so that might be one way to go...	蕾斯娜	运用玛洛娜老师最擅长的炸弹也是一种方法。	蕾斯娜	也許可以運用瑪洛娜老師擅長的炸彈來做。
Mimi	ミミ	錬金祭の準備ですか？	Mimi	Are you talking about the Alchemy Festival?	敏敏	你在为炼金庆典做准备吗？	敏敏	妳在為鍊金祭做準備嗎？
Resna	レスナ	"あ、ミミちゃん！
先生から錬金祭の話聞いた？"	Resna	Oh, Mimi! Did Miss Marlone tell you about it?	蕾斯娜	"啊，是敏敏呀！
老师和你说过炼金庆典了？"	蕾斯娜	"啊，敏敏！
妳有聽老師說鍊金祭的事了嗎？"
Mimi	ミミ	"ええ。
今年の新入生のテーマはミニロケットだそうですね"	Mimi	Yes. She said we're supposed to be making mini rockets.	敏敏	"嗯。
今年新生的主题好像是迷你火箭吧。"	敏敏	"嗯。
聽說今年給新生的題目是迷你火箭。"
Resna	レスナ	"どうしたら高く飛ぶんだろう……考えることが
いっぱいだよ"	Resna	I was wondering which method would send them the highest, but...there's a lot to think about.	蕾斯娜	"要怎样才能飞得高呢……
需要考虑的实在太多了。"	蕾斯娜	"該怎麼做才能飛得高呢……
要考慮的事情好多喔。"
Resna	レスナ	"各競技の優勝者がいるチームには
食堂無料クーポンっていうし"	Resna	Also, did you hear that the winning team gets meal vouchers for the dining hall?	蕾斯娜	"老师说各项比赛冠军所属的小队
可以获得食堂的免费饭票。"	蕾斯娜	"聽說各項比賽中冠軍的所屬隊伍
能獲得食堂的免費餐券。"
Resna	レスナ	ミミちゃん、一緒に優勝目指して頑張ろうね！	Resna	Mimi! Let's work hard together and get first place!	蕾斯娜	敏敏，我们一起去努力夺得冠军吧。	蕾斯娜	敏敏，我們一起努力拿下冠軍吧！
Mimi	ミミ	勝利を目指すのは当然ですわね	Mimi	Well, who wouldn't enter with the intent to win? Putting in the effort is only natural.	敏敏	我自然是以夺得冠军为目标的。	敏敏	本來就該以奪冠為目標。
Resna	レスナ	"優秀なミミちゃんがいたら、絶対勝てるよね。
早速、一緒に作戦会議しようよ"	Resna	You're so capable, I'm sure we'll have no problem either way! So let's sit and talk strategy!	蕾斯娜	"有这么优秀的敏敏在，一定能赢的。
我们赶快来开个作战会议吧。"	蕾斯娜	"我們隊裡有優秀的敏敏在，肯定會贏的。
那就趕快來開作戰會議吧。"
Mimi	ミミ	"ごめんなさい。
ちょっとやることがあるから、席を外すわね"	Mimi	Sorry, there's something that I have to do, so I'll be excusing myself.	敏敏	"不好意思，
我还有事要做，先走了。"	敏敏	"抱歉。
我還有點事要處理，先離席了。"
Resna	レスナ	あ、ミミちゃん……	Resna	Oh. Um... Okay.	蕾斯娜	啊，敏敏……	蕾斯娜	啊，敏敏……
Resna	レスナ	"（ミミちゃん、忙しいんだなぁ。
　無理に誘って悪いことしちゃったかな）"	Resna	(Mimi's always so busy. I guess I shouldn't bother her with this kind of stuff.)	蕾斯娜	"（敏敏好忙啊。
　强行邀请她是不是不太好呢。）"	蕾斯娜	"（敏敏好像很忙的樣子，
　我這樣勉強她參加是不是不太好啊？）"
Resna	レスナ	"（……あれ？　そういえば、エレンちゃんって
　どうしてるんだろう？）"	Resna	(Come to think of it... What ever happened to Eren?)	蕾斯娜	（……咦？说起来艾莲在做什么呢？）	蕾斯娜	"（……咦？話說回來，
　不知道艾蓮她過得怎麼樣？）"
Resna	レスナ	ロロナせんぱーい	Resna	Roronaaa!	蕾斯娜	萝乐娜前辈。	蕾斯娜	蘿樂娜學姐～
Rorona	ロロナ	レスナちゃん、どうしたの？	Rorona	What's wrong, Resna?	萝乐娜	是蕾斯娜呀，有事吗？	蘿樂娜	蕾斯娜，怎麼了？
Resna	レスナ	"エレンちゃんってねこさんチームに入った
わけじゃないんですか？"	Resna	Eren still hasn't joined the Kitty Cat team yet, right?	蕾斯娜	艾莲是没有加入猫猫小队吗？	蕾斯娜	艾蓮她不是也加入貓咪隊了嗎？
Rorona	ロロナ	あー……そうだね。入ってないんだ	Rorona	Uh... No. She hasn't.	萝乐娜	啊……对。她没有加入。	蘿樂娜	呃……這個嘛，其實她沒加入。
Resna	レスナ	"じゃあ、くまさんチームかへびさんチームに
入ったんですか？　すごいなあ"	Resna	So she went with either the Bears or the Snakes? Wow, that's some determination!	蕾斯娜	"那她是加入了熊熊小队或蛇蛇小队吗？
也太厉害了吧。"	蕾斯娜	"那她加入熊熊隊或蛇蛇隊了嗎？
真厲害。"
Rorona	ロロナ	"ううん、そうでもなくて……
錬金術部自体に入ってないみたいなんだ"	Rorona	Actually, she's not with either of them. She didn't join the Alchemy Club at all.	萝乐娜	"不，也没有……
她压根就没加入炼金术社团。"	蘿樂娜	"嗯……也不是……
她好像連鍊金術社都沒加入的樣子。"
Resna	レスナ	え？　それって、いいんですか？	Resna	Huh? That was an option?	蕾斯娜	咦？可以不加入吗？	蕾斯娜	咦？這樣沒關係嗎？
Rorona	ロロナ	"錬金術部に入るのは強制じゃないから、
違反ではないよ。家庭の事情とかで入れない人もいるし"	Rorona	Sure. It's not a course requirement, so there's no penalty for not joining. Besides, some students' circumstances mean that they can't stay after school.	萝乐娜	"学生并不是必须加入炼金术社团，所以她没有违规。
也有些同学因为家庭原因没有加入。"	蘿樂娜	"畢竟學園沒有強制規定要加入鍊金術社，不加也不違規。
況且也有人是因為家裡情況之類的才沒參加社團。"
Resna	レスナ	"そうなんですね。当たり前に入るものだと
思っていました"	Resna	That's fair. I just assumed that joining the club was the obvious thing to do.	蕾斯娜	这样啊。我还以为是必须加入的呢。	蕾斯娜	"原來是這樣，
我還以為大家都一定會加入鍊金術社呢。"
Rorona	ロロナ	うーん、でも、入らないと不便だと思うんだけどなあ	Rorona	Well, not joining definitely won't make things any easier, at least.	萝乐娜	唔——不过，不加入社团会很不方便呢。	蘿樂娜	嗯～不過我覺得沒入社應該會有些不方便就是了。
