romanized	name_jp	text_jp	name_en	text_en	name_zh-CN	text_zh-CN	name_zh-TW	text_zh-TW
Resna	レスナ	"（快晴！　心地のいい風！　まるで今日という日を
　祝福してくれているかのよう！）"	Resna	(Clear skies! A refreshing breeze! Today's definitely going to be a lucky day, I can feel it!)	蕾斯娜	"（万里的晴空！怡人的微风！
　仿佛在为今天这个日子送上祝福！）"	蕾斯娜	"（萬里晴空！舒適的風！
　簡直就像在祝福今天這個好日子一樣！）"
Resna	レスナ	"（今日から錬金術部での活動が始まる……
　いよいよ、本格的な錬金術の勉強が始まるんだ！）"	Resna	(Alchemy Club activities start today, too. I'm finally going to start studying for real!)	蕾斯娜	"（从今天起就要开始在炼金术社团活动了……
　终于要开始正式学习炼金术了！）"	蕾斯娜	"（鍊金術社的社團活動即將從今天開始……
　我終於要正式開始學習鍊金術了！）"
Resna	レスナ	"（きっと錬金術部で教われば、今までできなかった
　調合もできるようになるはず！）"	Resna	(I'm sure that whatever I learn there will help me get over whatever hurdle's been keeping me from a successful synthesis!)	蕾斯娜	"（在炼金术社团学习过后，
　过去连战连败的调合也一定会有进展的！）"	蕾斯娜	"（相信只要在鍊金術社學習，
　以前沒成功的調合一定也能成功的！）"
Rorona	ロロナ	あ、レスナちゃーん、おはよー！	Rorona	Oh! G'morning, Resna!	萝乐娜	啊，蕾斯娜，早呀——！	蘿樂娜	啊，蕾斯娜，早安～！
Resna	レスナ	ロロナ先輩！　おはようございます！	Resna	Rorona! Good morning to you too!	蕾斯娜	萝乐娜前辈，早上好！	蕾斯娜	蘿樂娜學姐！早安！
Rorona	ロロナ	"ごめんね、昨日は委員長の仕事で一緒に見学に
行けなくて"	Rorona	I'm sorry that I missed out on the big after-school tour yesterday. I had some council work to do.	萝乐娜	"不好意思，昨天因为有班长的工作，
没能陪你们去参观。"	蘿樂娜	"抱歉，我昨天因為有班長的工作，
沒能陪妳們一起去參觀。"
Rorona	ロロナ	聞いたよ。ねこさんチームに入ったんだよね？	Rorona	But I heard that you're going to be joining us on the Kitty Cat team?	萝乐娜	我听说了哦，你们要加入猫猫小队是吧？	蘿樂娜	我聽說了喔，妳們加入貓咪隊了對吧？
Resna	レスナ	"はい、そうなんです！
今日からよろしくお願いします！"	Resna	Yes, I am! I can't wait to work with you!	蕾斯娜	"嗯，是的！
今后还请多多关照！"	蕾斯娜	"對，沒錯！
從今天起請多指教！"
Rorona	ロロナ	"うん！　レスナちゃん、勉強ができるみたいだから
すっごく頼もしいよ！"	Rorona	Great! You seem like you're a really good student, so that probably means you're super reliable, too!	萝乐娜	"嗯！蕾斯娜好像学习也很好，
有你加入简直如虎添翼！"	蘿樂娜	"嗯！妳好像很會讀書，
感覺很可靠呢！"
Resna	レスナ	えへへ……そんなことないですよ	Resna	Ehehe... Um, I wouldn't go that far.	蕾斯娜	嘿嘿嘿……没那回事啦。	蕾斯娜	嘿嘿……沒這回事啦。
Marion	マリオン	"……気持ちは分かるけど、なるべく授業には出てね？
そうじゃないと……"	Marion	While I do understand your feelings, please be sure that you attend class. If you don't, then...	玛丽翁	"……我理解你的想法，但还是要尽量来上课哦。
不然的话……"	瑪麗翁	"……我懂妳的心情，但妳還是要盡量來上課喔。
不然的話……"
???	？？？	……申し訳ございません。すべて承知の上です	???	Sorry. I'll be more careful in the future.	？？？	……非常抱歉。我明白。	？？？	……非常抱歉。這些我都明白。
Resna	レスナ	……どちら様でしょう？	Resna	Who's that?	蕾斯娜	……那是谁呀？	蕾斯娜	……她是誰呢？
Rorona	ロロナ	昨日、欠席してた子かな	Rorona	Hm, maybe yesterday's missing student?	萝乐娜	是昨天缺席的同学吧？	蘿樂娜	是昨天缺席的同學嗎？
Marion	マリオン	"はあ……これ以上はうるさく言わないけど。
何が自分のためなのか、よく考えて"	Marion	*Sigh* Well, I won't harp on you for much longer. I trust that you'll do what's best for you.	玛丽翁	"唉……我也不会再对你啰嗦了。
但你要想清楚什么才是对自己好的。"	瑪麗翁	"唉……我不會再多說什麼，
但妳好好思考一下怎樣才是為自己好吧。"
Eren	エレン	はい	Eren	Yes, Miss.	艾莲	我知道了。	艾蓮	好的。
Marion	マリオン	"ああ、委員長、ちょうどよかった。
こちら、エレンさん"	Marion	Oh, Class President. Perfect timing. This is Eren.	玛丽翁	"哦，班长，你来得正好。
这位是艾莲同学。"	瑪麗翁	"啊，班長，妳來得正好。
這位是艾蓮同學。"
Marion	マリオン	"昨日、欠席してた新入生の子よ。
今日から授業に参加するから、面倒を見てあげて"	Marion	She's the new student who was absent yesterday. She'll be joining us from today onwards, so please look after her.	玛丽翁	"她是昨天缺席的新生。
今天开始会来上课的，你照顾一下吧。"	瑪麗翁	"她是昨天缺席的新生，
今天開始會一起上課，妳好好照顧她吧。"
Rorona	ロロナ	分かりました。それじゃあレスナちゃん、また放課後に	Rorona	Of course! Resna, I'll see you after school, okay?	萝乐娜	我知道了。蕾斯娜，我们放学再聊。	蘿樂娜	我知道了，那蕾斯娜，我們放學後見。
Resna	レスナ	はい、それではまた！	Resna	Sure! See you later!	蕾斯娜	好的，之后再见！	蕾斯娜	好的，晚點見！
Resna	レスナ	"（エレンちゃんかあ。どんな子なんだろう。
　エレンちゃんもねこさんチームに入るのかな？）"	Resna	(So, her name's Eren? I wonder what she's like. Maybe she'll join the Kitty Cats too?)	蕾斯娜	"（她叫艾莲啊，不知是个什么样的人呢？
　她也会加入猫猫小队吗？）"	蕾斯娜	"（艾蓮啊～她是怎樣的人呢？
　她也會加入貓咪隊嗎？）"
Resna	レスナ	（……あれ？　あの子、どこかで見たような）	Resna	(I get the feeling I've seen her somewhere before, though.)	蕾斯娜	（……咦？我是不是在哪里见过她？）	蕾斯娜	（……奇怪？我總覺得她很眼熟。）
Resna	レスナ	（……思い出せない。きっと気のせいだよね）	Resna	(Hm, but nothing's coming to mind. Maybe it's just my imagination.)	蕾斯娜	（……想不起来了。可能是错觉吧。）	蕾斯娜	（……想不起來，一定是我的錯覺吧。）
	エレン	"錬金術科の新入生。レスナと同じく推薦で入学した。
寡黙で単独行動を好む"	Eren	Another new alchemy student who entered the academy on recommendation. A lone wolf who would prefer to engage in as little conversation as possible.	艾莲	"炼金术科新生。和蕾斯娜一样是通过推荐入学的。
沉默寡言，喜欢单独行动。"	艾蓮	"鍊金術科新生，和蕾斯娜一樣透過推薦入學，
沉默寡言且喜歡單獨行動。"
