romanized	name_jp	text_jp	name_en	text_en	name_zh-CN	text_zh-CN	name_zh-TW	text_zh-TW
Marie	マリー	あっ、ザスキアさん！						
Saskia	ザスキア	あら、マルローネさん。奇遇ね						
Marie	マリー	"それ、新年の挨拶用の衣装ですか？
似合ってますね！"						
Saskia	ザスキア	"そう？　ありがとね。
まじまじと見つめられるほど
じゃないと思うのだけれど"						
Marie	マリー	"そんなに謙遜しないでくださいよ。
綺麗なのは本当なんですから"						
Saskia	ザスキア	"もう、口が上手なんだから。
それよりあなたその衣装って……"						
Marie	マリー	"あ、やっぱり覚えてます？
去年ザスキアさんからもらった衣装ですよ。
あたしのお気に入りなんです"						
Saskia	ザスキア	"ふふ、嬉しいわ。見立てには自信あるのよ。
大事だからね、見立て"						
Marie	マリー	"これからも大切に着させてもらいますよ。
ところでザスキアさんは……"						
	選択肢	今年１年はどうでした？						
Marie	マリー	今年１年はどうでした？						
Saskia	ザスキア	"そうねぇ、一言でいえば激動の１年。
ってところかしら？"						
Marie	マリー	激動の１年……						
Saskia	ザスキア	"そうよ。
だって色々なことがあったじゃない？"						
Saskia	ザスキア	"頂獣と戦ったり、
極夜の錬金党を追い詰めたり。
大変だったわ"						
Marie	マリー	"そう言われれば１年間だけで
とんでもないことばかり起こりましたね……"						
Saskia	ザスキア	"だから激動の１年。
私にとっても、レスナにとっても、ね"						
	選択肢	何かやり残したことは？						
Marie	マリー	今年何かやり残したことってあります？						
Saskia	ザスキア	色々あるわよ？						
Marie	マリー	"えっ、そうなんですか？
意外な事実だわ……！"						
Saskia	ザスキア	"当たり前じゃない。
もっとレスナの頭を撫でたりとか、
一緒にお茶したりとかね"						
Marie	マリー	"あ～、なんだそういうことかぁ……。
てっきりやり残して後悔してるとか、
そういうものだと思ったじゃないですか"						
Saskia	ザスキア	"ふふふ、そうね。
もしかしたら忘れているだけで
そういうのもあるかもしれないわね"						
	選択肢	あたしの１年の評価は？						
Marie	マリー	あたしの１年の評価は？						
Saskia	ザスキア	もちろんサイッコーよ						
Marie	マリー	"あたしそこまでザスキアさんに
してあげられたことあったっけ……？"						
Saskia	ザスキア	"いつもレスナの支えになってくれたり、
錬金術について教えてくれてるじゃない"						
Saskia	ザスキア	"それだけで十分助かってるわ。
ありがとうね、マルローネさん"						
Marie	マリー	"い、言い出しっぺのあたしがいうのも
少し変だけど、なんだか照れくさいなぁ……"						
Saskia	ザスキア	うふふっ						
Saskia	ザスキア	"そうだ。あなたの手が空いていたら、
去年に続いてちょっとお手伝いを
頼みたいのだけれど、いいかしら？"						
Saskia	ザスキア	"といっても私じゃなくて、
レスナを手伝ってあげてほしいのだけど"						
	選択肢	快諾する						
Marie	マリー	"もちろんですよ！
あたしに任せちゃってください！"						
Saskia	ザスキア	"本当に？
助かるわ～、さすがマルローネさんね"						
Marie	マリー	"困ったときはお互いさまですし、
アトリエも使わせてもらってますから"						
Marie	マリー	"色々お世話になってるザスキアさんには
恩返ししないといけないですからね"						
Saskia	ザスキア	"あら、嬉しいこと言ってくれるわね。
そんなに言っても、なでなでくらいしか
できないわよ？"						
Marie	マリー	な、なでなではいいです！						
	選択肢	何かご褒美をねだる						
Marie	マリー	"いいですよ！
その代わり、何かご褒美が欲しいな～"						
Saskia	ザスキア	"ちゃっかりしてるわねぇ。
いいでしょう、終わったらご褒美に
美味しいお菓子をご馳走してあげるわ"						
Marie	マリー	本当ですか？　やったー！						
Saskia	ザスキア	"でも、その代わりちゃんとお手伝いしてね？
どこかでさぼったりなんかしたら……"						
Marie	マリー	"だ、大丈夫ですって。
ご褒美が出るなら手抜きなんかしません！"						
Saskia	ザスキア	現金な子ねぇ						
	選択肢	面倒くさがる						
Marie	マリー	"うぇ、ちょっと年末年始はゆっくりしたい
なあって……"						
Saskia	ザスキア	"そうよね～。できればこんな面倒なこと
しないでおきたいわよね"						
Saskia	ザスキア	"けどだからこそこうしてお願いしてるのよ。
お願い！　レスナのためなの"						
Marie	マリー	"まぁ……ザスキアさんがそこまでいうなら
仕方ないですね。お手伝いしますよ"						
Saskia	ザスキア	そうしてくれると助かるわ、マルローネさん						
Marie	マリー	"でも、そこまでレスナが大変なら
ザスキアさんが手伝ってあげればいいのに"						
Saskia	ザスキア	"私は私で、お守り配りに
行こうと思ってるの"						
Saskia	ザスキア	"今年も色んな人と知り合ったわ。
来年の年始から始めると遅くなってしまい
そうだから、今から始めようと思ってるの"						
	選択肢	そんなに急がなくても						
Marie	マリー	"そんなに急がなくても。
少しくらい年始から遅れたって、
気にしないですよ！"						
Saskia	ザスキア	"でも、そろそろ極夜の錬金党との
決戦に挑もうとしているじゃない？
その前に渡しておきたいって思うの"						
Saskia	ザスキア	みんなが無事に新年を迎えられるように						
	選択肢	準備万端ですね！						
Marie	マリー	"おお、準備万端ですね！
こういうの、面倒くさがって動かない
印象がありました"						
Saskia	ザスキア	"ふふ、私だってやるときはやるのよ？
始めれば早いんだから"						
Saskia	ザスキア	"でも、誰も早く動いてもほめて
くれないんだもの。
だからいつもはゆっくりしてるのよ"						
Marie	マリー	じゃあ、今日はあたしがほめてあげます！						
Saskia	ザスキア	あらあら。いいのよ？　なでなでしても						
Marie	マリー	なでなではしません！						
	選択肢	お手伝いが必要なのはザスキアさんなのでは						
Marie	マリー	"もしかして、お手伝いが必要なのは
ザスキアさんなんじゃないですか？"						
Saskia	ザスキア	"そうなのよ。たくさんの人に配る必要が
あるから、本当は手伝ってほしいところ
だけれど……"						
Saskia	ザスキア	"でも、私なんかより今はレスナを
手伝ってあげて"						
Saskia	ザスキア	"それじゃ、まずはお守りをたくさん
用意してこないと。
またね、マルローネさん"						
Marie	マリー	"（年末ってこともあって
　やっぱりみんな忙しそうにしてるなあ）"						
Marie	マリー	"（ザスキアさんは自分が忙しくても、
　レスナのことを心配して気にかけてる）"						
Marie	マリー	（いい師匠だなあ）						
Marie	マリー	"（もういくつ寝ると新年ね。
　せっかくだし、新年の衣装で
　街を歩こうかしら）"						
