romanized	name_jp	text_jp	name_en	text_en	name_zh-CN	text_zh-CN	name_zh-TW	text_zh-TW
Johanna	ヨハナ	（あーあ、レスナがいなくて、暇）	Johanna	(*Sigh* It's so boring when Resna isn't around.)	约翰娜	（唉，蕾斯娜不在真是闲得发慌。）	約翰娜	（唉──蕾斯娜不在，好閒喔。）
Johanna	ヨハナ	（もうすぐこの本も読み終わっちゃう）	Johanna	(I'm almost done with this book, too.)	约翰娜	（这本书也快要看完了。）	約翰娜	（這本書也很快就要看完了。）
Izana	イザナ	おっじゃましまーす！ ハーンーマー！	Izana	Hellooo! Hammer time!	伊札娜	我来打扰了！锤～子～！	伊札娜	打擾了！錘──子──！
Izana	イザナ	レスナちゃん、いるー？	Izana	Resna? Are you here?	伊札娜	蕾斯娜，你在吗？	伊札娜	蕾斯娜在嗎──？
Johanna	ヨハナ	（……うるさいのが来たわね）	Johanna	(Here comes the noisy one...)	约翰娜	（……怎么来了个烦人的家伙。）　	約翰娜	（……吵死人的傢伙來了。）
	選択肢	素直に答える	Selection	Answer truthfully	选项	老实回答	選項	老實回答
Johanna	ヨハナ	レスナならいないわよ	Johanna	Resna's not here.	约翰娜	蕾斯娜她不在哦。	約翰娜	蕾斯娜她不在喔。
Izana	イザナ	"あ、ヨハナ！　おはよう！
レスナちゃんいないのかー、残念"	Izana	Oh, Johanna! Good morning! No Resna, huh? Darn...	伊札娜	"啊，是约翰娜呀！早上好！
蕾斯娜不在呀，好可惜。"	伊札娜	"啊，約翰娜！早安！
蕾斯娜不在喔～？真可惜。"
Izana	イザナ	ヨハナは何してるの？	Izana	What are you up to?	伊札娜	约翰娜你在做什么？	伊札娜	約翰娜妳在做什麼？
Johanna	ヨハナ	本を読んでるのよ、ふふん、知的でしょ	Johanna	Reading a book. Heh, pretty intellectual, right?	约翰娜	我在看书哦，嘿嘿，是不是很聪明。	約翰娜	我在看書啊，哼哼，很知性吧？
Johanna	ヨハナ	"もうこの程度なら一人でも
楽の勝なんだから！"	Johanna	A simple book like this is a cakewalk for me now!	约翰娜	这种程度的书我一个人也能轻松看懂！	約翰娜	"這種程度的書，
我現在一個人也看得輕輕鬆鬆！"
Izana	イザナ	"すごい！　成長したね、ヨハナ！
レスナちゃんも喜ぶよ！"	Izana	Wow! You're really making progress, Johanna! Resna must be so proud!	伊札娜	"好厉害！约翰娜有进步了呢！
蕾斯娜也会高兴的！"	伊札娜	"好厲害！約翰娜妳進步了呢！
蕾斯娜也會很高興的！"
	選択肢	隠れて驚かす	Selection	Hide and surprise Izana	选项	藏起来吓她一跳	選項	躲起來嚇她。
Johanna	ヨハナ	"（あいつ、まだ私に気づいてないみたい。
　そうだ！　こっそり後ろから……）"	Johanna	(She hasn't noticed me yet. Time to sneak up from behind!)	约翰娜	"（她好像还没注意到我。
　对了！悄悄绕到她身后……）"	約翰娜	"（那傢伙好像還沒注意到我。
　對了！我偷偷從後面……）"
Izana	イザナ	あれ、誰もいないのかな？	Izana	Huh? No one's here?	伊札娜	咦，谁都不在吗？	伊札娜	奇怪，沒人在嗎？
Johanna	ヨハナ	わあっ！！	Johanna	Boo!!	约翰娜	哇呀！！	約翰娜	哇啊！！
Izana	イザナ	うわあああああ！！！！！	Izana	Waaah!	伊札娜	哇啊啊啊啊啊啊啊！！	伊札娜	哇啊啊啊啊啊啊！！！！！
Johanna	ヨハナ	あはは！　いい驚きっぷり！	Johanna	Haha! What a great reaction!	约翰娜	啊哈哈！把你吓了一大跳呢！	約翰娜	啊哈哈！妳嚇到的反應真棒！
Izana	イザナ	"ヨハナ！　もう、びっくりした！
驚かさないでよ！"	Izana	Johanna! Don't scare me like that!	伊札娜	"约翰娜！！吓死我了！
不要吓人家啦！"	伊札娜	"約翰娜！真是的，嚇了我一跳！
妳別嚇我啦！"
	選択肢	天才ならいるけど？	Selection	Only a genius here!	选项	她不在，但是有个天才在	選項	天才的話倒是在喔？
Johanna	ヨハナ	天才ならいるけど？	Johanna	There's only a genius here at the moment.	约翰娜	她不在，但是有个天才在。	約翰娜	天才的話倒是在喔？
Izana	イザナ	……	Izana	...	伊札娜	……	伊札娜	……
Izana	イザナ	"おーい、レスナちゃーん
……いないかあ"	Izana	Hey, Resna? Oh, guess she's not here.	伊札娜	"喂——！蕾斯娜！
不在啊……"	伊札娜	"喂──蕾斯娜，
……不在啊。"
Johanna	ヨハナ	天才を無視するんじゃないわよ！	Johanna	Stop ignoring the genius standing right in front of you!	约翰娜	不要无视天才啊！	約翰娜	不要無視天才！
Johanna	ヨハナ	……で、あんた一体何しに来たのよ	Johanna	Why are you here, anyway?	约翰娜	……所以说，你过来有何贵干？	約翰娜	……所以，妳到底來幹嘛的？
Izana	イザナ	特にこれといった用事はないんだけどね	Izana	Oh, no reason in particular.	伊札娜	没什么特别要紧的事。	伊札娜	倒也沒什麼特別的事啦。
Izana	イザナ	"新しく強い服を貰ったから、この服で何か
レスナちゃんのお手伝いをしたいと思って！"	Izana	Check out my new outfit! I feel stronger than ever wearing it, so I thought I'd put it to use helping Resna with something!	伊札娜	"我新得到了一件很厉害的新衣服，
想用这件衣服给蕾斯娜为蕾斯娜提供帮助！"	伊札娜	"因為我收到了一套強大的新衣服，
想穿這套衣服來幫忙蕾斯娜！"
Johanna	ヨハナ	ふーん	Johanna	Hmm.	约翰娜	是吗。	約翰娜	哦～
Izana	イザナ	"だってアタシは
レスナちゃんの騎士だからね！"	Izana	I'm Resna's knight, and that's what a knight is for!	伊札娜	毕竟我是蕾斯娜的骑士嘛！	伊札娜	因為我可是蕾斯娜的騎士啊！
Izana	イザナ	でもレスナちゃん、いないのかあ……	Izana	But she's not here...	伊札娜	可是蕾斯娜她不在啊……	伊札娜	不過蕾斯娜她不在嗎……
Izana	イザナ	"レスナちゃんが帰ってくる前に、
何かやっといたら
喜んでもらえるかな？"	Izana	I wonder if there is something I could do to brighten her day before she comes back.	伊札娜	"在蕾斯娜回来之前，
做些什么会让她高兴呢？"	伊札娜	"在蕾斯娜回來之前，
我先幫忙做點什麼，她會開心嗎？"
Johanna	ヨハナ	（今できる、レスナが喜ぶこと……）	Johanna	(Something that would brighten Resna's day?)	约翰娜	（现在能做到的，让蕾斯娜高兴的事……）	約翰娜	（現在能做，而且會讓蕾斯娜開心的事……）
	選択肢	食事の用意	Selection	Prepare some food	选项	准备餐食	選項	準備餐點。
Johanna	ヨハナ	"じゃあごはん作ってよ。
私お腹空いたし"	Johanna	How about making lunch? I'm hungry.	约翰娜	"那你就做饭吧。
我也饿了。"	約翰娜	那妳就做飯吧，我的肚子也餓了。
Izana	イザナ	"もー、しょうがないなー。
アタシの料理、大雑把だけどいい？"	Izana	Ugh, fine. But my cooking's not the best, just so you know!	伊札娜	"真拿你没办法。
我做饭很随意的，你能接受吗？"	伊札娜	"真是的，拿妳沒辦法耶～
我做的料理還滿粗糙的，沒關係嗎？"
Johanna	ヨハナ	見た目がどうだってお腹に入れば同じよ	Johanna	If it fills me up, I don't care what it looks like!	约翰娜	不管卖相如何，吃进肚子都是一样的。	約翰娜	外觀如何進到肚子裡都一樣啦。
Izana	イザナ	"じゃあ、折角だし
レスナちゃんの好きなもの
作ろうかなー？"	Izana	In that case, I'll make one of Resna's favorite dishes!	伊札娜	"那既然要做，
就做些蕾斯娜爱吃的菜吧。"	伊札娜	"那反正機會難得，
我就來做蕾斯娜喜歡的東西好了？"
Izana	イザナ	"……っと思ったけど何も食材がないや。
これはレスナちゃんに報告だね"	Izana	Oh wait. Looks like we're out of ingredients. Guess I'll have to report that to Resna...	伊札娜	"说是这么说，但什么食材都没有啊。
得和蕾斯娜说一声才行。"	伊札娜	"……雖然這麼想，但什麼食材都沒有嘛。
這要跟蕾斯娜說一聲才行了。"
	選択肢	アトリエの掃除	Selection	Clean the atelier	选项	打扫炼金工房	選項	打掃鍊金工房。
Johanna	ヨハナ	じゃあ掃除でもしたら？	Johanna	How about cleaning up the place?	约翰娜	那要不打扫卫生吧？	約翰娜	那打掃一下怎麼樣？
Izana	イザナ	"そうだね！　というか、
今日は本が散らかりすぎだよ！
これ、ヨハナが？"	Izana	Good idea! Just look at all these books scattered around! Did you leave these here?	伊札娜	"好主意！话说回来，
今天书也太乱了吧！
这是约翰娜你弄的？"	伊札娜	"對耶！
話說回來，今天書丟得到處都是！
這是約翰娜弄的嗎？"
Johanna	ヨハナ	"あ、後で片づけようと思ってたのよ！
この本はまだ読んでる途中だし……"	Johanna	I-I was going to put them away later! I'm still reading some of them...	约翰娜	"啊，我想着晚点再收拾的！
这本书我还在看呢……"	約翰娜	"我、我是想說等一下再收拾啊！
因為這本書我才讀到一半而已……"
Izana	イザナ	"もー。手伝ってあげるから、
後で一緒に片づけようね"	Izana	Oh, come on. Fine, I'll help, so let's get them cleaned up later, okay?	伊札娜	"真是的，一会儿一起收拾吧，
我会帮忙的。"	伊札娜	"真是的，我會幫妳啦，
晚點我們一起收拾吧。"
	選択肢	ヨハナに肩揉み	Selection	Give me a shoulder massage	选项	给约翰娜揉肩	選項	幫約翰娜按摩肩膀。
Johanna	ヨハナ	"それなら、この天才の肩を
揉ませてやってもいいけど？"	Johanna	How about giving me a shoulder massage?	约翰娜	那你给我这个天才揉揉肩吧？	約翰娜	"這樣的話，妳可以幫我這個天才
按摩肩膀喔？"
Izana	イザナ	"それ、ただヨハナが
揉んでもらいたいだけでしょ！
もー、別にいいけどさ"	Izana	That has nothing to do with Resna! You just want a massage! But fine, I'll do it.	伊札娜	"你只是想让我帮你揉肩吧！
真是的，不过揉一揉也无所谓。"	伊札娜	"那只是妳想要別人幫妳按摩而已吧！
真傷腦筋，我是可以啦。"
Johanna	ヨハナ	"ちょっ、いた、痛い！
力強すぎでしょ、あんた！"	Johanna	Ouch! That hurts! You're pushing way too hard!	约翰娜	"哎呀，疼、好疼！
你力气太大了！"	約翰娜	"等等，痛，好痛！
妳也太用力了吧！"
Izana	イザナ	"えへへ、鍛錬の成果かな？
ハンマー！！"	Izana	Hehe, must be all my training! Hammer time!	伊札娜	"嘿嘿嘿，是我锻炼有成效了吗？
锤呀！！"	伊札娜	"嘿嘿，這是鍛鍊的成果吧？
錘子！！"
Johanna	ヨハナ	"そういえばイザナって、いっつもレスナの
騎士だとかなんとか言ってるけど、
なんなのよ、それ"	Johanna	Izana, why are you always calling yourself Resna's knight? Where did that come from?	约翰娜	"说起来，你总说自己是蕾斯娜的骑士什么的，
到底是怎么回事啊？"	約翰娜	"對了，伊札娜妳老是說
自己是蕾斯娜的騎士，
那是什麼意思啊？"
Izana	イザナ	"これはね、
前に、レスナちゃんと流れ星に誓ったんだ"	Izana	Resna and I once swore under a shooting star.	伊札娜	"这个嘛，
是因为我和蕾斯娜对着流星发过誓。"	伊札娜	"這個嘛，因為我之前和蕾斯娜
一起向流星發了誓。"
Izana	イザナ	"将来、アタシは最強の騎士に、
レスナちゃんは立派な錬金術士になるって"	Izana	I swore to become the strongest knight, and Resna swore to become a full-fledged alchemist.	伊札娜	"我将来要成为最强的骑士，
蕾斯娜要成为出色的炼金术士。"	伊札娜	"將來，我會成為最強的騎士，
而蕾斯娜會成為出色的鍊金術士。"
Izana	イザナ	"そんなレスナちゃんを、アタシは
騎士としてあらゆるものから守るんだ！"	Izana	Since I swore to be her knight, I'll protect her from anything and everything!	伊札娜	"我身为骑士，
要保护蕾思娜不受任何事物伤害！"	伊札娜	"我身為騎士會保護那樣的蕾斯娜，
不讓她受到任何威脅！"
Johanna	ヨハナ	（あらゆるものから守るレスナの騎士、ね）	Johanna	(A knight protecting Resna from anything and everything?)	约翰娜	（保护蕾斯娜不受任何事物伤害的骑士啊。）	約翰娜	（保護蕾斯娜不受任何威脅的騎士啊。）
	選択肢	今は天才の私がいるから十分よ	Selection	She already has a genius by her side!	选项	如今有我这个天才在就足够了	選項	現在有我這個天才在就足夠了。
Johanna	ヨハナ	"まあ、今はレスナのそばに
天才の私がいるから十分よ！"	Johanna	Hmph, Resna already has a genius like me by her side. That's more than enough!	约翰娜	但如今蕾斯娜的身边有我这个天才在就足够了！	約翰娜	"不過，現在蕾斯娜的身邊有我
這個天才在就足夠囉！"
Izana	イザナ	"ヨハナの強さは認めてるけど……
うーん、不安だなあ"	Izana	I know you're strong, Johanna, but I still can't help but worry.	伊札娜	"虽然我认可约翰娜的强大……
唔，但让人很不安呢。"	伊札娜	"我承認約翰娜很強，但……
唔──感覺好不安喔。"
Johanna	ヨハナ	何が不安だっていうのよ！	Johanna	Worry? About what?!	约翰娜	有什么不安的！	約翰娜	有什麼好不安的啦！
Izana	イザナ	……落ち着きがないとか？	Izana	I don't know... Maybe your lack of patience?	伊札娜	……比如你太容易激动了？	伊札娜	……有種心神不寧的感覺？
Johanna	ヨハナ	大人ぶっててむかつく～！	Johanna	Ugh! Stop trying to act all mature!	约翰娜	摆出一副大人的样子真让火大！	約翰娜	裝什麼成熟，真讓人火大～！
	選択肢	騎士は常に傍にいるんじゃないの？	Selection	A knight should always be by her side, right?	选项	骑士不应该随时陪着她吗？	選項	騎士不是應該要隨侍在側嗎？
Johanna	ヨハナ	"騎士なら、常にレスナの傍に
いるもんじゃないの？"	Johanna	If you're her knight, shouldn't you always be by her side?	约翰娜	骑士不应该随时陪在蕾斯娜身边吗？	約翰娜	"既然是騎士，
就應該要隨時待在蕾斯娜身邊吧？"
Izana	イザナ	"できることならアタシだってそうしたいよ～
嬉しい時も悲しい時も、いかなる時も"	Izana	If I could, I would! In good times and in bad, I'd be with her all the time!	伊札娜	"如果可以我也想陪在她身边啊!
她开心的时候、难过的时候，任何时候。"	伊札娜	"如果可以，我也想這麼做啊～
不管是她開心的時候、悲傷的時候，任何時候都想。"
Izana	イザナ	"今はヨハナの方が隣にいられる時間
多いよね、羨ましいことハンマーの如しだよ"	Izana	But these days, you spend more time with her than I do. The jealousy's hitting me like a hammer right now!	伊札娜	"现在约翰娜陪在她身边的时间更多呢。
我羡慕得就像一把锤子。"	伊札娜	"現在反而是約翰娜更常陪在她身邊吧，
我羨慕得像根錘子一樣啊。"
Johanna	ヨハナ	"ふふん！　まぁあんたが座学とかで
不在の時は任せなさい"	Johanna	Hah! Well, when you're busy with your lessons or whatever, I've got things covered.	约翰娜	"哼哼！你参加讲座什么的
不在的时候就交给我吧。"	約翰娜	"哼哼！妳去聽講座不在的時候，
就交給我吧。"
Izana	イザナ	"うんうん。
ヨハナが傍にいるときは、
レスナちゃんのこと頼んだよ！"	Izana	Right! I'm counting on you to watch over her when I'm not around.	伊札娜	"嗯嗯。
约翰娜在蕾斯娜身边时，
她就拜托你了！"	伊札娜	"嗯嗯，
約翰娜在蕾斯娜身邊時，
她就交給妳了！"
	選択肢	私の方がレスナのことよく知ってるわ	Selection	I know Resna better than you!	选项	我更了解蕾斯娜	選項	我比妳更了解蕾斯娜。
Johanna	ヨハナ	"レスナのことなら、騎士のあんたよりも
私の方がよく知ってるわ！"	Johanna	You're supposed to be her knight, but I know Resna better than you do!	约翰娜	"比起身为骑士的你，
还是我更了解蕾斯娜！"	約翰娜	"關於蕾斯娜的事情，
我比身為騎士的妳還要了解喔！"
Izana	イザナ	えー、そう？　じゃあ例えば？	Izana	You think so? Give me an example.	伊札娜	咦，是吗？比如说呢？	伊札娜	哦，是嗎？比如說呢？
Johanna	ヨハナ	"昨日は机の脚に足をぶつけて涙目だったし、
一昨日は新しい本を買って
ずっと鼻歌を歌ってたわ！"	Johanna	Yesterday she stubbed her toe on the desk and almost cried. The day before that, she was humming all day after buying a new book!	约翰娜	"她昨天脚撞在桌腿上疼得泪眼朦胧，
前天买了本新书一直开心地哼歌来着！"	約翰娜	"昨天她踢到桌腳都痛到哭了，
還有前天她買了一本新書後，
一直在哼歌呢！"
Johanna	ヨハナ	"あんたの知らないレスナのこと、
たくさん知ってるんだから！"	Johanna	I know way more about her than you do!	约翰娜	我可了解许多你不知道的蕾斯娜哦！	約翰娜	我知道很多妳不曉得的蕾斯娜的事！
Izana	イザナ	"……それは、知ってるっていうのとは、
少し違う気がするなあ"	Izana	I don't think knowing what she did is really knowing her, though.	伊札娜	这不太能说是了解吧……	伊札娜	"……我覺得這個跟所謂的了解
又好像有點不一樣耶。"
Johanna	ヨハナ	"その内、あんたじゃなくて天才の私が
レスナの騎士になっちゃうかも
しれないわね！"	Johanna	At this rate, my genius might just replace you as Resna's knight!	约翰娜	"总有一天，说不定我这个天才
就会成为蕾斯娜的骑士，
而不是你！"	約翰娜	"搞不好在不久後，
我這個天才就會成為蕾斯娜的騎士，
而不是妳喔！"
Izana	イザナ	それはどうかな？	Izana	We'll see about that.	伊札娜	这可说不准哦。	伊札娜	那可難說喔？
Izana	イザナ	"ずーっとレスナちゃんと一緒にいた
アタシを超えられる？"	Izana	I've been by her side waaay longer than you—you really think you can top that?	伊札娜	"我可是一直和蕾斯娜在一起的哦，
你能超过我吗？"	伊札娜	"妳有辦法超越一直都跟蕾斯娜
在一起的我嗎？"
Izana	イザナ	"新しい服を手に入れたアタシは、
まだまだ成長するんだから！"	Izana	Plus, with this new outfit, I'm only going to get stronger!	伊札娜	"我获得了新的衣服，
还会继续进步的！"	伊札娜	得到新衣服的我，還會繼續成長的！
Johanna	ヨハナ	"（レスナの騎士とかいって、
　新しい服に浮かれているイザナ……）"	Johanna	(You really think that new outfit makes you a better knight?)	约翰娜	"（还说是蕾斯娜的骑士呢，
　伊札娜因为新衣服就高兴成这样……）"	約翰娜	"（說自己是蕾斯娜的騎士，
　正為新服裝而洋洋得意的伊札娜……）"
Johanna	ヨハナ	"（あんたの実力、この私が見てやるわ！
元・鴉の目は、ごまかせないのよ）"	Johanna	(I might not be Crow anymore, but my crow's eye will tell if you're worthy of being Resna's knight!)	约翰娜	"（就让我看看你的实力吧！
　虽然已经隐退了，但鸦的眼睛可没那么好糊弄。）"	約翰娜	"（就讓本人看看妳的實力吧！
　妳是瞞不過前‧烏鴉之眼的！）"
