file	id	romanized_name	localized_name	text	localized_name_en	text_en	localized_name_zh-CN	text_zh-CN	localized_name_zh-TW	text_zh-TW
Date_NPC10_04ID	59	Roman	ロマン	（ブラッドの言葉は\n　全くもってその通りだけども、）						
Date_NPC10_04ID	60	Roman	ロマン	（国のためを想う気持ちは、\n　ブラッド、君と一緒さ）						
Date_NPC10_04ID	61	Brad	ブラッド	やはり貴様は自由すぎる。\nもっと王子としての自覚を持つべきだ。\n前々から、貴様は冒険心が強すぎると――						
Date_NPC10_04ID	62	Roman	ロマン	（ブラッドは真面目で頑固だな。\n　学生時代の繰り返しになってしまった。\n　ただ今は、彼の言葉を受け止めよう）						
Date_NPC10_04ID	63	Roman	ロマン	（彼のような者たちのおかげで、\n　この国は支えられているんだ）						
Date_NPC10_04ID	64	Roman	ロマン	兄上は、そんな私の気性を理解して\n応援してくださっているんだ						
Date_NPC10_04ID	65	Brad	ブラッド	いうなれば、適材適所、か						
Date_NPC10_04ID	66	Brad	ブラッド	悪いな、その話はまた後日だ						
Date_NPC10_05ID	0	Roman	ロマン	（そろそろ今日の仕事の時間だ。\n　ブラッドは来ているだろうか）						
Date_NPC10_05ID	1	Brad	ブラッド	リヒャルト、早いな						
Date_NPC10_05ID	2	Roman	ロマン	やあブラッド。\n今日は時間に余裕を持ってこれたよ						
Date_NPC10_05ID	3	Brad	ブラッド	時間に余裕を持って行動するなど、\n大人として当たり前だろう						
Date_NPC10_05ID	4	Brad	ブラッド	今日はオルペウス殿下直々の仕事だ。\n失敗は許されない。早速調査へ向かうぞ						
Date_NPC10_05ID	5	Brad	ブラッド	予定より早く終わったな。\nこの成果なら、オルペウス殿下も\nご満足してくださるだろう						
Date_NPC10_05ID	6	Roman	ロマン	今日の私たち、いつも以上に\n息が合っていたと思わないかい？						
Date_NPC10_05ID	7	Roman	ロマン	学生の時の課題も、こうやって\n手を組んだ時は効率良かったね。\n覚えているかい？						
Date_NPC10_05ID	8	Brad	ブラッド	ああ。あの時は予想外の雨が降ったな。\n私が緊急時の対応案を用意していたことと、\nリヒャルトの臨機応変な働きで――						
Date_NPC10_05ID	9	Roman	ロマン	ブラッドが思った以上に鮮明に覚えていて\n驚いたよ……						
Date_NPC10_05ID	10	Brad	ブラッド	以前、聞いてきたな。\nなぜ私がこれまでの立場を捨て、\n錬金爵に立候補したのかと						
Date_NPC10_05ID	11	Roman	ロマン	ああ						
Date_NPC10_05ID	12	Brad	ブラッド	リヒャルトが錬金術復興計画を立て、\n果ての大陸を目指すと聞いた時、\n私は危険だと思った						
Date_NPC10_05ID	13	Brad	ブラッド	以前、マナ抽出計画と称して行った\n掘削が失敗しているのを知っていたからな						
Date_NPC10_05ID	14	Brad	ブラッド	だから私はリヒャルトを補佐するために\n錬金爵に立候補したんだ						
Date_NPC10_05ID	15	Brad	ブラッド	錬金術復興計画は実績も出している。\nリヒャルトが本気だということも分かった						
Date_NPC10_05ID	16	Brad	ブラッド	ゆえに、力を貸そう						
Date_NPC10_05ID	17	Brad	ブラッド	リヒャルト。いや、リヒャルト殿下						
Date_NPC10_05ID	18	Brad	ブラッド	錬金爵、ブラッドリー・カーン。\n錬金術復興計画にこの身を尽くすことを宣言しよう						
Date_NPC10_05ID	19	Brad	ブラッド	錬金爵として、錬金術士として、そして幼馴染として、\nリヒャルトに力を貸そう						
Date_NPC10_05ID	20	Roman	ロマン	ああ！　ありがとう、ブラッド！						
Date_NPC10_05ID	21	Roman	ロマン	錬金術の復興を目指して、共に頑張ろう！						
Date_NPC10_05ID	22	Roman	ロマン	そして、ランターナのさらなる発展を目指し、\n共に兄上を支えていこうじゃないか！						
Date_NPC10_05ID	23	Brad	ブラッド	ああ。忙しくなるな						
Date_NPC10_05ID	24	Brad	ブラッド	早速だが、錬金術復興計画に関する次の調査先について\n相談するぞ。次は――						
Date_NPC10_05ID	25	Roman	ロマン	まあまあ、まずは食事にしないかい？						
Date_NPC10_05ID	26	Roman	ロマン	（ブラッドは良き友人であり、優秀な同僚だ）						
Date_NPC10_05ID	27	Roman	ロマン	（彼と力を合わせ、より良いランターナを\n　実現してみせようじゃないか！）						
