file	id	romanized_name	localized_name	text	localized_name_en	text_en	localized_name_zh-CN	text_zh-CN	localized_name_zh-TW	text_zh-TW
Date_NPC8_02ID	35	Lara	ララ	あなたがご両親を大好きなのは\n知っていますが、それでも一人のミーケが\n心配になってしまって……	Lara	I understand you love your mother and father very much. But when I think about how lonely you must be...	拉拉	我知道你很喜欢爸爸妈妈，\n但现在却不能和他们在一起，\n所以有些担心……	拉拉	我知道妳很喜歡自己的父母，\n但還是會擔心妳一個人孤伶伶的……
Date_NPC8_02ID	36	Mieke	ミーケ	ありがとララ様！　ミーケは大丈夫だよ！\nとーちゃんもかーちゃんもばーちゃんも\n大好きだから！	Mieke	You don't need to worry about me, Your Majesty! I'm fine! I have my papa, my mama, and my granny, too!	米珂	谢谢拉拉大人！米珂不要紧的！\n米珂最喜欢爸爸妈妈和奶奶了！	米珂	拉拉大人，謝謝妳！米珂沒事的！\n因為米珂很喜歡爸爸、媽媽和奶奶啊！
Date_NPC8_02ID	37		選択肢	不満はないのかしら	Selection	Do you not feel unhappy?	选项	你不会有不满吗	選項	沒有不滿嗎？
Date_NPC8_02ID	38	Lara	ララ	あなたは半ば置いて行かれるような形で\nおばあ様に預けられて……\nなにか不満はなかったのかしら？	Lara	To be left behind in the care of your grandmother... Do you not feel unhappy?	拉拉	明面上你是被托付给奶奶照顾，\n但说是被父亲抛下也不为过……\n你不会有不满吗？	拉拉	把妳像是半拋棄的方式託付給奶奶……\n妳沒有任何不滿嗎？
Date_NPC8_02ID	39	Mieke	ミーケ	不満かー、考えたことないかも。\nむしろ、ミーケは今こうしていることが\nすっごく幸せだよ	Mieke	Unhappy? Nah, not really. Actually, I really enjoy my life right now!	米珂	不满吗？米珂从没往这方面想过。\n不如说，米珂觉得现在的生活非常幸福。	米珂	不滿嗎？好像沒想過呢。\n不如說，米珂現在這樣就覺得超級幸福了喔。
Date_NPC8_02ID	40	Mieke	ミーケ	ばーちゃんの定食屋をお手伝いするのは\n楽しかったし、\nディオちゃんやララ様と出会えたし	Mieke	It was fun helping out at my granny's restaurant, and I got to meet you and Diona.	米珂	在奶奶的餐馆帮忙的日子很快乐，\n还遇到了蒂欧和拉拉大人。	米珂	在奶奶的餐館裡幫忙得很開心，\n也遇到了蒂歐和拉拉大人。
Date_NPC8_02ID	41	Mieke	ミーケ	大きな夢を追いかけるとーちゃんは\nかっこいいし！	Mieke	Plus, I love seeing my papa chase his dreams! That's when he's the coolest.	米珂	而且努力追求梦想的爸爸也非常帅气！	米珂	而且追尋遠大夢想的爸爸也很帥！
Date_NPC8_02ID	42	Mieke	ミーケ	むしろ、とーちゃんが\n夢を諦めて帰って来た時の方が、\n不満に思っちゃうかも	Mieke	I'd be unhappy if my papa gave up on his dreams and came back home, really.	米珂	要是爸爸放弃梦想回到老家，\n米珂反而会觉得不满呢。	米珂	反倒是爸爸放棄夢想回來的話，\n說不定米珂才會感到不滿呢。
Date_NPC8_02ID	43	Mieke	ミーケ	ミーケは、とーちゃんの夢も、\nとーちゃんを追いかけていったかーちゃんの\n考えも分かってるんだ	Mieke	My papa chose to pursue his dreams, and my mama chose to follow him.	米珂	爸爸的梦想，\n还有跟着爸爸离开的妈妈的想法，\n米珂都能理解。	米珂	米珂能夠理解爸爸的夢想，\n也明白追隨爸爸而去的媽媽在想些什麼。
Date_NPC8_02ID	44	Mieke	ミーケ	大きな志！すっごくかっこいー！\nだからミーケは、それを支えたいんだ	Mieke	They're the bravest and most passionate people I know. That's why I want to help them!	米珂	胸怀大志非常帅气！\n所以米珂想支持爸爸妈妈。	米珂	偉大的志向！超級帥氣──！所以米珂想支持他們。
Date_NPC8_02ID	45	Mieke	ミーケ	そうだ、ララ様！\nとーちゃんに贈る衣装の大体の案は\nまとまってきたんだけど……	Mieke	Oh, by the way! My papa's gift is starting to come together, but I need your help.	米珂	对了，拉拉大人！\n虽然为爸爸设计的衣服\n已经大致定下来了……	米珂	對了，拉拉大人！\n要送給爸爸的那套服裝提案大致上整理好了……
Date_NPC8_02ID	46	Mieke	ミーケ	普通の服とは違って、芸人っぽさのある\n要素を取り入れたいんだ！\n何か案ないかなぁ	Mieke	I want to add something that makes it feel more specialized for a comedian. Do you have any ideas?	米珂	但米珂还想加入一些\n和普通衣服不一样的搞笑艺人要素！\n拉拉大人有什么建议吗？	米珂	和普通服裝不同，米珂想加入一些\n搞笑藝人的元素！妳有什麼想法嗎？
Date_NPC8_02ID	47	Lara	ララ	（芸人らしい衣装案ですか……）	Lara	(Specialized for a comedian, hm?)	拉拉	（搞笑艺人穿的衣服啊……）	拉拉	（搞笑藝人風格的服裝提案嗎……）
Date_NPC8_02ID	48		選択肢	小道具を隠し持てるようにするのは？	Selection	Hidden pockets for holding his props.	选项	能够藏一些小道具的设计怎么样？	選項	可以隱藏道具的衣服？
Date_NPC8_02ID	49	Lara	ララ	小道具を隠し持てるようにするのは\nいかがかしら	Lara	Perhaps he might appreciate some hidden pockets, for holding his props?	拉拉	能够藏一些小道具的设计怎么样？	拉拉	做那種可以隱藏道具的衣服如何呢？
Date_NPC8_02ID	50	Mieke	ミーケ	いいかも！　芸の幅が広がるね！\n仕込んだ小道具でお客さんを驚かせて……\nビーッグ！！	Mieke	Ooh, that's a great idea! He could use them to really wow the crowd!	米珂	不错哎！\n这样一来能表演的内容也增加了！\n用提前藏好的小道具吓客人一跳……Big！！	米珂	好像不錯！段子的種類也會更加多元！\n用隱藏的小道具嚇觀眾一跳……偉～大！！
Date_NPC8_02ID	51	Lara	ララ	驚かせるとなると、\nお父様の芸風が変わってしまいそうね	Lara	Though, I must admit, it is quite a different direction compared to your father's usual routine.	拉拉	让客人吓一跳的话，\n就不是你父亲的表演风格了吧。	拉拉	嚇到人的話，令尊的段子風格就變樣了吧。
Date_NPC8_02ID	52		選択肢	とっても丈夫にするのは？	Selection	Make it very sturdy.	选项	做得特别结实怎么样？	選項	把衣服做得非常耐穿？
Date_NPC8_02ID	53	Lara	ララ	とっても丈夫にするのはいかがかしら。\n芸人には、体を張った芸をする者も\nいますから	Lara	Why not make it very sturdy? I hear that some comedians perform stunts that are quite dangerous.	拉拉	做得特别结实怎么样？\n因为有些搞笑艺人表演时\n会配上夸张的肢体动作。	拉拉	把衣服做得非常耐穿怎麼樣？\n有些搞笑藝人會拚上性命表演段子。
Date_NPC8_02ID	54	Mieke	ミーケ	色んなことに耐えられるようになれば\nお仕事増えるかも？\n熱湯に入ったり、火の輪をくぐったり……	Mieke	Hmm. That would let him take on different jobs, too. Jumping into boiling water, leaping through rings of fire...	米珂	如果衣服很结实的话，\n说不定工作也会增加？\n比如泡热水、钻火圈之类的……	米珂	如果把衣服設計得能夠承受各種磨損，\n那工作或許也會增加吧？\n像是進到熱水裡，或跳個火圈……
Date_NPC8_02ID	55	Lara	ララ	……これにはお父様の意思確認が\n必要ですわね	Lara	...Perhaps it would be wise to consult your father first.	拉拉	关于这一点，\n还需要询问你父亲愿不愿意……	拉拉	……這部分可能就需要去跟令尊確認一下想法了。
Date_NPC8_02ID	56		選択肢	光り輝くようにするのは？	Selection	Give it a radiant finish.	选项	闪闪发光的怎么样？	選項	讓衣服閃閃發光呢？
Date_NPC8_02ID	57	Lara	ララ	光り輝く衣装というのはどうでしょう。\n芸人は視線を集めることが大事ですから	Lara	An entertainer must first grab his audiences' attention. Why not give it a radiant finish?	拉拉	做成闪闪发光的衣服怎么样？做搞笑艺人，\n吸引观众的目光很重要吧。	拉拉	讓衣服閃閃發光怎麼樣？\n畢竟吸引觀眾目光對搞笑藝人來說很重要。
Date_NPC8_02ID	58	Mieke	ミーケ	わぁ、それいいねぇ。\nララ様みたいに、光り輝くように……	Mieke	Ooh, I like that one! A sparkling, radiant finish! As radiant as you...	米珂	哇，这个不错。\n就像拉拉大人一样闪耀……	米珂	哇，這想法不錯耶。像拉拉大人一樣閃閃發光……
Date_NPC8_02ID	59	Mieke	ミーケ	って、ララ様の輝きは服じゃなく、\n自前なんだった！	Mieke	Although, your radiance is less about your clothes and more about your personality!	米珂	啊，拉拉大人之所以闪耀不是因为衣服，\n而是本人很闪耀！	米珂	對了，不是拉拉大人的衣服發光，\n而是拉拉大人本身！
Date_NPC8_02ID	60	Lara	ララ	ミーケにはわたくしが\n輝いて見えているのかしら……？	Lara	You think me a radiant person?	拉拉	在米珂眼里，我看起来很闪耀吗……？	拉拉	米珂覺得我看起來閃閃發光嗎……？
Date_NPC8_02ID	61	Lara	ララ	そうですわ、ミーケ。\nお父様の芸風に合わせるのなら、\n早着替えができる衣装というのはいかが？	Lara	Oh, I have the perfect solution. Considering your father's repertoire, why not make it so that he can change his outfit in the blink of an eye?	拉拉	对了，要适合你父亲的表演风格的话，\n做成能够快速换装的衣服怎么样？	拉拉	想到了，米珂。如果要配合令尊的段子風格，\n那可以快速更換的服裝怎麼樣？
Date_NPC8_02ID	62	Mieke	ミーケ	おお！　ビーッグに合わせて\n早着替えしたら、注目されること\n間違いなしだね！	Mieke	That's true! If Papa suddenly changed outfits in the middle of a performance, the audience would be amazed!	米珂	哦！配合Big的动作快速换装的话，\n一定能吸引观众的目光！	米珂	哦！再配合「偉～大」的口號快速換裝，\n肯定會很引人注目的！
Date_NPC8_02ID	63	Lara	ララ	もしよろしければ、わたくしが錬金術で\nお手伝いいたしますわ	Lara	If it pleases you, I can offer my expertise in alchemy to that end.	拉拉	你不介意的话，我用炼金术来帮你吧。	拉拉	要是妳不嫌棄，我可以用鍊金術幫忙喔。
Date_NPC8_02ID	64	Mieke	ミーケ	えっ、いいの？\nありがとうララ様！　大好き！	Mieke	Wait, really?! Thank you so much, Your Majesty! You're the best!	米珂	咦，可以吗？谢谢拉拉大人！\n米珂最喜欢拉拉大人了！	米珂	咦，可以嗎？拉拉大人謝謝妳！最喜歡妳了！
Date_NPC8_02ID	65	Lara	ララ	（頑張るミーケを、\n　わたくしにできることで\n　応援したいですわ）	Lara	(Mieke is working hard enough as is. I shall do anything I can to lighten her load.)	拉拉	（看到米珂这么努力，\n　我也想为她尽一份薄力了。）	拉拉	（看著努力的米珂，\n　我也想盡自己所能支持她。）
Date_NPC8_02ID	66	Lara	ララ	差し入れを持ってきましたわ	Lara	By the way, I brought you a snack.	拉拉	我带慰问品来了。	拉拉	我帶吃的過來了喔。
Date_NPC8_02ID	67	Lara	ララ	（またその道を支えるため、\n　ついていった妻……）	Lara	(The wife who chose to support her husband on his path, too...)	拉拉	（以及支持他追寻梦想，\n　陪伴在左右的妻子……）	拉拉	（還有為了支持丈夫的目標，\n　而一路相隨的妻子……）
Date_NPC8_02ID	68	Mieke	ミーケ	いつか、とーちゃんの持ち芸、ビーッグが\n王国中で流行するはず！	Mieke	My papa's show is gonna make it majorly big in this kingdom! I just know it!	米珂	爸爸的经典段子“Big”\n将来一定会流行到王国各地的！	米珂	總有一天爸爸的拿手段子「偉～大」，\n絕對會在王國中掀起流行！
Date_NPC8_03ID	0	Mieke	ミーケ	こんにちは、ララ様！	Mieke	Hello, Your Majesty!	米珂	拉拉大人好！	米珂	拉拉大人，妳好！
Date_NPC8_03ID	1	Lara	ララ	こんにちは、ミーケ。先日見せてもらった\nあなたの衣装案から素材を考えてきましたわ	Lara	Hello to you too, Mieke. I've thought of a few materials we can use in your father's outfit.	拉拉	你好啊，米珂。上一次看了你的服装设计图，\n我想了一些合适的素材。	拉拉	米珂，妳好啊。我參考前幾天妳給我看的\n服裝提案研究了幾種素材。
Date_NPC8_03ID	2	Lara	ララ	今日は滑りのいい布と、衝撃で色が変化する布を\n調合しましょう。まずはそのための素材が必要ですわ	Lara	A fabric that slips easily, and another that changes color upon the shock of impact. First, I will need to gather the materials to synthesize these.	拉拉	今天就调合丝滑的布和遇到外力会变色的布吧。\n首先要集齐所需素材。	拉拉	今天就來調合觸感光滑，和受到衝擊會變色的兩種\n布料吧。首先需要蒐集那些用來調合的素材。
Date_NPC8_03ID	3	Mieke	ミーケ	おー！　すごい！　錬金術ならではの布だね！\nそれがあれば、最強の早着替え衣装ができるよ！	Mieke	Wow! Alchemy really is incredible. We'll be able to make the perfect outfit with fabrics like those!	米珂	哇！好厉害！只有炼金术才能做出来的布！\n这样就能做出最适合快速变装的衣服了！	米珂	哇！好厲害！這是只有鍊金術才能做出來的布呢！\n有了這些，就可以製作出最強的快速換裝服了！
Date_NPC8_03ID	4	Mieke	ミーケ	それじゃ、ミーケ素材の採取に行ってくる！\nララ様のお手を煩わせられないからねぇ	Mieke	All right, I'm gonna go gather the materials you need. Can't make the queen do all the work, can I?	米珂	那么米珂去采集素材啦！\n这可不能麻烦拉拉大人。	米珂	那米珂就去採集素材回來！\n畢竟不能勞煩拉拉大人啊。
Date_NPC8_03ID	5	Mieke	ミーケ	硬貨を投げて、表が出たらディオたんを誘って一緒に、\n裏だったらミーケ一人でちゃちゃっと……そーれっ！	Mieke	I'll flip a coin. Heads, I ask Diona to come with me. Tails, I'll go by myself. Here goes nothing!	米珂	米珂扔个硬币，正面就邀请蒂欧一起去，\n反面就米珂一个人去……嘿！	米珂	擲出硬幣後，正面朝上就邀蒂歐一起，\n反面朝上的話就米珂一個人去……嘿～！
Date_NPC8_03ID	6	Mieke	ミーケ	裏だぁ！　うー、一人は寂しいけど、\nちゃちゃっと採取してくるね！　待っててララ様！	Mieke	Tails?! Aw, all alone again. Well, time to go gather some materials! See you soon, Your Majesty!	米珂	是反面！呜，虽然一个人有点寂寞，\n不过米珂会速战速决的！等我回来哦，拉拉大人！	米珂	是反面！唔～一個人採集有點寂寞，\n但米珂速去速回！拉拉大人，等等我喔！
Date_NPC8_03ID	7	Lara	ララ	待ってミーケ。わたくしもついて行っていいかしら？\nせっかくですから、ミーケと一緒に採取したいですわ	Lara	Wait, Mieke. How about I come with you? It would be a wonderful opportunity to spend some time together.	拉拉	等等，米珂。我可以和你一起去吗？\n机会难得，我想和你一起去采集。	拉拉	米珂，等一下。我也可以一起去嗎？\n機會難得，我想和妳一起採集看看。
Date_NPC8_03ID	8	Mieke	ミーケ	うん！　ララ様がいいなら！　えへへ、やったぁ！\nララ様と一緒に探索、探索！	Mieke	Of course! As long as you're okay with it! Ehehe, this must be my lucky day!	米珂	嗯！拉拉大人愿意的话当然可以！\n嘿嘿，太好啦！能跟拉拉大人一起探索！	米珂	嗯！拉拉大人願意的話！嘿嘿，太好了！\n和拉拉大人一起探索、探索！
Date_NPC8_03ID	9	Mieke	ミーケ	ララ様と一緒の時は、ディオたんもいることが多いから\n二人だけってのは新鮮だなぁ	Mieke	Diona's usually with us during things like this, isn't she? Doing something just the two of us feels so new!	米珂	米珂和拉拉大人在一起的时候，\n通常蒂欧也会在场，只有我们两个人感觉好新鲜。	米珂	和拉拉大人一起的時候，蒂歐也經常會在，\n所以只有我們兩人感覺好新鮮喔。
Date_NPC8_03ID	10	Mieke	ミーケ	今度ディオたんに自慢しちゃお！\n自慢がすぎると、結構怒るから注意！	Mieke	I've got to brag about this the next time I see her! Can't rub it in too much, though, or she'll get mad.	米珂	下次米珂要和蒂欧炫耀！但是太得意的话\n蒂欧会很生气，所以要把握好度！	米珂	下次米珂要跟蒂歐炫耀！\n但要小心別太過火，否則她可能會生氣！
Date_NPC8_03ID	11	Lara	ララ	ふふ、本当仲がいいですわね	Lara	*Chuckle* The two of you are very close.	拉拉	呵呵，你们真的关系很好呢。	拉拉	呵呵，妳們感情真的很好呢。
Date_NPC8_03ID	12		子ども	わっ……うぅ	Child	Nnh... *Sob*...	小孩子	哇……呜……	小孩	哇……嗚嗚……
Date_NPC8_03ID	13	Lara	ララ	あら、転んでしまったのね。大丈夫かしら	Lara	Oh dear. You must have fallen. Are you all right, child?	拉拉	哎呀，摔倒了吗。要不要紧？	拉拉	哎呀，跌倒了啊。沒事吧？
Date_NPC8_03ID	14	Mieke	ミーケ	大丈夫？　おっ、泣いてない！　強いね、偉いね！\n泣かない強い子は大きくなれるよ！	Mieke	You're okay, aren't you? See, you aren't crying anymore! You're a big, strong kid!	米珂	你没事吧？哇，没哭！很了不起哦！\n能忍住不哭的孩子很坚强，会快快长大哦！	米珂	沒事嗎？哦，沒有哭！好厲害，真了不起！\n不哭的堅強孩子才能長大喔！
Date_NPC8_03ID	15		子ども	お姉ちゃん、誰……？	Child	Wh-Who are you...?	小孩子	姐姐，你们是谁……？	小孩	姐姐妳是誰……？
Date_NPC8_03ID	16	Mieke	ミーケ	ビッグマンの弟子、ミーケたんだよ！\n夢はでっかく！　ビーッグ！！	Mieke	Why, I'm Mieke, apprentice to Major Big! The biggest, major-est entertainer in all the land!	米珂	我是Bigman的弟子米珂！\n有梦就要往大了做！Big！！	米珂	偉大超人的徒弟──米珂喔！\n夢想要遠大！要偉～大！！
Date_NPC8_03ID	17		子ども	ビーッグ……？	Child	Major-est...?	小孩子	Big……？	小孩	偉～大……？
Date_NPC8_03ID	18	Mieke	ミーケ	うん！　勇気が出る魔法の言葉だよ！	Mieke	Yep! Bigger than big! The biggest!	米珂	嗯！这是能让人充满勇气的咒语哦！	米珂	嗯！這是能讓人鼓起勇氣的魔法咒語喔！
Date_NPC8_03ID	19	Lara	ララ	（勇気が出る魔法の言葉……\n　きっと、この子どもの心に響いたでしょうね）	Lara	(Looks like that did the trick. Mieke sure does have a way with words.)	拉拉	（能让人充满勇气的咒语……\n　这个孩子一定会深深记住这句话吧。）	拉拉	（能鼓起勇氣的魔法咒語……\n　她肯定已經打動這孩子的心了吧。）
Date_NPC8_03ID	20	Mieke	ミーケ	お友達にも教えてあげてねー！\nビーッグ！！	Mieke	Run along and tell your friends all about it! It's gonna be a majorly big show!	米珂	把这句话也教给你朋友吧！Big！！	米珂	也要把這個魔法告訴朋友喔──！\n偉～大！！
Date_NPC8_03ID	21	Lara	ララ	見事でしたわ。お父様の宣伝にもなりましたわね	Lara	Well done. You even managed to advertise on your father's behalf.	拉拉	做得很棒。还顺便为你父亲做了宣传呢。	拉拉	妳真了不起，還成功替令尊宣傳了一番呢。
Date_NPC8_03ID	22	Mieke	ミーケ	えへへ、ばーちゃんの定食屋をお手伝いしていたから、\n初対面の人とお話しするのは得意なんだ！	Mieke	Hehe. If there's one thing I learned from working at my granny's restaurant, it's the importance of first impressions!	米珂	嘿嘿，因为以前在奶奶的餐馆帮忙，\n所以米珂很擅长和陌生人说话！	米珂	嘿嘿，畢竟米珂在奶奶的餐館幫過忙，\n所以很擅長和初次見面的人說話！
Date_NPC8_03ID	23	Mieke	ミーケ	それに、とーちゃんの芸を広めるいい機会だと\n思ったし！　世界に広まれ、ビーッグ！！	Mieke	That kid is gonna remember us for sure. And pretty soon, Papa's gonna be a big star!	米珂	而且米珂觉得这个是宣传爸爸的段子的\n好机会！走向世界吧，Big！！	米珂	而且米珂也覺得這是推廣爸爸段子的好機會！\n散播到世界各處吧，偉～大！！
Date_NPC8_03ID	24	Mieke	ミーケ	あれ、分かれ道だ！　どっちが正解？	Mieke	Oh, darn it. A fork in the road! Which is the right way?	米珂	啊，是分叉路口！要走哪边呢？	米珂	咦，是岔路！哪一條才是對的呢？
Date_NPC8_03ID	25	Lara	ララ	どっちも正解ですわ。ただ、片方は危険だけど近道で、\nもう一方は安全だけど遠回りなのです	Lara	Both lead to our destination. One is treacherous, but a shorter route. The other is longer, but far safer.	拉拉	两边都可以走，一条是近路但有点危险，\n另一条要绕远路但很安全。	拉拉	兩條路都是對的喔。只不過一邊是危險的捷徑，\n而另一邊則是安全卻需要繞道的遠路。
Date_NPC8_03ID	26	Mieke	ミーケ	うーん、近道の方がいいけど、ララ様の安全も大事……\nこーんな時こそ！　じゃじゃん、硬貨投げ！	Mieke	Hmm... I'd like to take the faster route, but your safety is important too. Time to bust out my trusty coin!	米珂	唔……走近路比较快，但也要保障拉拉大人的安全……\n噔噔，这种时候就要抛硬币！	米珂	嗯～捷徑是比較好啦，但拉拉大人的安危也很重要……\n正是這種時候！鏘鏘，擲硬幣！
Date_NPC8_03ID	27	Mieke	ミーケ	そーおれっ、と！　表だ！\nララ様、近道で行こ！　何があってもミーケが守るよ！	Mieke	And...it's tails! All right, Your Majesty. We're taking the shortcut! Don't worry, I'll protect you.	米珂	嘿咻！是正面！拉拉大人，走近路吧！\n有情况的话米珂会保护拉拉大人的！	米珂	嘿～！是正面！拉拉大人，走捷徑吧！\n無論發生什麼事，米珂都會保護妳的！
Date_NPC8_03ID	28	Lara	ララ	民を守るのが王の役目ですわ。\nでも、そう言ってくれるのならお願いしましょうかしら	Lara	It's the queen's duty to protect her citizens, not the other way around. But if you insist...	拉拉	保护国民是王的义务。\n不过既然你都这么说了，那就拜托你吧。	拉拉	守護人民可是君主的職責。\n不過，既然妳都這麼說，那就麻煩妳吧。
Date_NPC8_03ID	29	Mieke	ミーケ	ついたー！　わぁ、きれーい！\nララ様、これなんていう花？　これは？　あ、あれは？	Mieke	We're here! And wow, is it beautiful! Hey, Queen Lara, what's this flower called? Ooh! And what about this one?	米珂	到了！哇，好漂亮！拉拉大人，\n这是什么花呀？这个呢？啊，那个呢？	米珂	到了──！哇，好漂亮──！\n拉拉大人，這是什麼花？這個呢？啊，那是什麼？
Date_NPC8_03ID	30	Lara	ララ	こら、落ち着きなさい。\n全部答えますから、一つずつね	Lara	Now, now. Patience, Mieke. I'll answer each and every one of your questions, but please, one at a time.	拉拉	米珂，你冷静点。\n我会全部告诉你的，一个一个来。	拉拉	真是的，冷靜一點。\n我全都會一一告訴妳的。
Date_NPC8_03ID	31	Mieke	ミーケ	全部分かるなんて、やっぱりララ様すごい！\nあ、この配色すっごくいい！　使えそう！	Mieke	Wait, you really know all of them? That's amazing! Oh, look at the colors on this one! I think we can use this!	米珂	拉拉大人居然全都认识，真是太厉害啦！\n啊，这个颜色好漂亮！看起来能用！	米珂	竟然什麼花都知道，拉拉大人果然很厲害！\n啊，這個配色真好看！感覺用得上！
Date_NPC8_03ID	32	Lara	ララ	先に採取を済ませてしまいますわよ。\nほら、ミーケ	Lara	Come now. Let us gather what we need first, Mieke.	拉拉	要先采集需要的东西哦，米珂。	拉拉	來，米珂，我們先採集素材吧。
Date_NPC8_03ID	33	Mieke	ミーケ	はーい	Mieke	Yes, Your Majesty!	米珂	好——	米珂	好～
Date_NPC8_03ID	34	Mieke	ミーケ	……はち、きゅう、じゅう！\nララ様！　必要な分、全部採取できたよ！	Mieke	...Eight, nine, ten! That's everything we need!	米珂	……八、九、十！拉拉大人！\n需要的份全部采集完了！	米珂	……八、九、十！拉拉大人！\n需要的量全都採集到了！
