file	id	romanized_name	localized_name	text	localized_name_en	text_en	localized_name_zh-CN	text_zh-CN	localized_name_zh-TW	text_zh-TW
Date_NPC8_03ID	35	Mieke	ミーケ	素材の状態もいいと思う！　どう？　ララ様	Mieke	And they're all great quality, too! What do you think?	米珂	素材的状态也很好！拉拉大人，你看看？	米珂	素材的狀態也很棒！拉拉大人，怎麼樣？
Date_NPC8_03ID	36	Lara	ララ	ええ、完璧ですわ。さすがミーケ。\n頭を撫でてあげましょう	Lara	Indeed. Well done, Mieke. You deserve a pat on the head.	拉拉	嗯，很完美。\n米珂做得很棒喔，来摸摸头吧。	拉拉	嗯，很完美，真不愧是米珂。我就摸摸妳的頭吧。
Date_NPC8_03ID	37	Mieke	ミーケ	えへへ～	Mieke	Hehe...	米珂	诶嘿嘿～	米珂	嘿嘿～
Date_NPC8_03ID	38	Lara	ララ	さ、そろそろ暗くなってしまいますから帰りましょう。\n調合はまた後日ですわね	Lara	It's getting quite dark. We should begin making our way home. Synthesis can wait till tomorrow.	拉拉	天快黑了，我们回去吧。\n改天再调合吧。	拉拉	好，天差不多快黑了，我們回家吧。\n過兩天再來調合。
Date_NPC8_03ID	39	Mieke	ミーケ	わかった！　帰り道もお供するよ！	Mieke	Okay! I'll escort you back, then.	米珂	好的！回去的路上我也一起！	米珂	知道了！回程米珂也與拉拉大人同行！
Date_NPC8_03ID	40	Lara	ララ	よろしくお願いしますわ	Lara	I trust you'll keep me protected?	拉拉	拜托你了。	拉拉	那就拜託妳了。
Date_NPC8_03ID	41	Mieke	ミーケ	まっかせて！	Mieke	Of course, Your Majesty!	米珂	包在米珂身上！	米珂	交給我吧！
Date_NPC8_03ID	42	Lara	ララ	（ミーケは自由奔放で、素直で、\n　かわいいですわね）	Lara	(She's so earnest and carefree. How cute.)	拉拉	（米珂自由奔放又率直，真的很可爱呢。）	拉拉	（米珂自由奔放又坦率，真可愛呢。）
Date_NPC8_04ID	0	Mieke	ミーケ	完成した衣装、早くとーちゃんに\n着てほしいなぁ。\nどんな顔するかなぁ？	Mieke	Ooh, I'm so excited! Papa is gonna be so shocked when I give him the outfit!	米珂	好想让爸爸快点穿上做好的衣服啊。\n不知道他会露出什么样的表情呢？	米珂	好想早點讓爸爸穿上做好的衣服呢。\n他會露出什麼表情呢？
Date_NPC8_04ID	1	Mieke	ミーケ	ガルネ州までの道が\nいつも以上に遠く感じるよー！	Mieke	I can't wait to get to Galne. I'd run all the way there if I could!	米珂	感觉去加尔内州的路变得遥远了好多！	米珂	往加爾內州的路感覺比平時更遠了啊～！
Date_NPC8_04ID	2	Lara	ララ	お父様の反応、楽しみですわね。\nきっと喜んでくれますわ	Lara	Your father will love the gift, I'm sure of it.	拉拉	真期待你父亲的反应。一定会很高兴吧。	拉拉	真期待令尊的反應呢。他一定會很高興的。
Date_NPC8_04ID	3	Mieke	ミーケ	……あれ？	Mieke	...Huh? Look at that.	米珂	……咦？	米珂	……奇怪？
Date_NPC8_04ID	4	Mieke	ミーケ	あそこにとーちゃんの出るお笑い大会の\n広告がある！	Mieke	It's an advertisement for the competition Papa's in!	米珂	那边贴着爸爸要参加的\n搞笑艺人大赛的广告！	米珂	那邊有爸爸會出場的笑話大賽廣告！
Date_NPC8_04ID	5		選択肢	他の参加者、とても手ごわそうですわね	Selection	The other participants seem intimidating.	选项	其他选手看起来很强呢	選項	其他參賽者看起來都很強勁呢
Date_NPC8_04ID	6	Lara	ララ	他の参加者の方々、\n皆、とても手ごわそうですわね	Lara	All the other participants seem...intimidating.	拉拉	其他选手看起来都很强呢。	拉拉	其他參賽者看起來都很強勁呢。
Date_NPC8_04ID	7	Mieke	ミーケ	うん、強そう……\nでもとーちゃんだって負けてない！	Mieke	Yeah, they won't be beat that easily... But neither will my papa!	米珂	嗯，很强……但是爸爸也不比他们差！	米珂	嗯，感覺好強……但爸爸也不會輸的！
Date_NPC8_04ID	8	Mieke	ミーケ	ミーケが用意した衣装着たら最強だよ！\nビーッグ！	Mieke	And with my outfit? Papa will be too big to fail!	米珂	穿上米珂做的衣服之后，\n爸爸就是最强的！Big！	米珂	穿上米珂準備的服裝後，就是最強的了！\n偉～大！
Date_NPC8_04ID	9	Lara	ララ	ええ。最強ですわ	Lara	Indeed. Much too big.	拉拉	嗯，是最强的。	拉拉	嗯，一定最強。
Date_NPC8_04ID	10		選択肢	お父様、端っこですわね	Selection	Your father isn't exactly center stage...	选项	米珂的父亲在角落里呢	選項	令尊在角落呢
Date_NPC8_04ID	11	Lara	ララ	お父様、端っこに\n配置されていますわね	Lara	Your father appears to have been relegated to the side of the poster.	拉拉	米珂的父亲被放在了角落里呢。	拉拉	令尊被安排在角落呢。
Date_NPC8_04ID	12	Mieke	ミーケ	うん。正直とーちゃんは\nすっごい人気なわけじゃないから……	Mieke	Yeah... Probably because he isn't as famous as the other comedians.	米珂	嗯。说实话，爸爸的人气并不高……	米珂	嗯，因為米珂的爸爸其實沒有那麼受歡迎……
Date_NPC8_04ID	13	Mieke	ミーケ	今の世間評価的には妥当な位置\nなんだろうけど、悔しいなぁ	Mieke	I know it's just based on popularity, but I can't help but feel a little frustrated.	米珂	从他现在的评价来看，这个安排是妥当的，\n但是真叫人不甘心。	米珂	以目前的社會評價來看，應該是很恰當的位置吧。\n但感覺真不甘心。
Date_NPC8_04ID	14	Lara	ララ	世間を見返してやりましょう！\nミーケの用意した衣装だってありますから	Lara	Then let us show the world what it's missing! Your outfit will surely help its wearer make an impression.	拉拉	让大家刮目相看吧！\n不是还有你准备的衣服吗。	拉拉	給這個社會一點顏色瞧瞧吧！\n畢竟令尊還有米珂準備的服裝啊。
Date_NPC8_04ID	15	Mieke	ミーケ	うん！　とーちゃんは負けないよ！	Mieke	You're right! Papa's gonna win!	米珂	嗯！爸爸不会输的！	米珂	嗯！爸爸不會輸的！
Date_NPC8_04ID	16		選択肢	お父様、いい表情ですわね	Selection	Your father looks splendid.	选项	你父亲的表情很不错呢	選項	令尊的表情很棒呢
Date_NPC8_04ID	17	Lara	ララ	お父様、いい表情ですわね	Lara	Your father looks splendid.	拉拉	你父亲的表情很不错呢。	拉拉	令尊的表情很棒呢。
Date_NPC8_04ID	18	Mieke	ミーケ	うん！　並んでいる参加者の中で\n一番かっこいいよ！	Mieke	I know, right? He's the coolest out of all the people on this poster!	米珂	嗯！在所有选手里爸爸最帅气了！	米珂	嗯！他在那一排參賽者中是最帥的喔！
Date_NPC8_04ID	19	Lara	ララ	ミーケの用意した衣装を着れば、\nもはや覇者の風格ですわ	Lara	And with your outfit, he'll look the part of a champion. I'm sure of it.	拉拉	等穿上米珂的衣服，\n那气场都可以称霸群雄了呢。	拉拉	只要穿上米珂準備的服裝，\n整個人就會有冠軍的風采了。
Date_NPC8_04ID	20	Mieke	ミーケ	うんうん！　着てもらうの楽しみだよぉ	Mieke	Exactly! I can't wait to see what it looks like on him.	米珂	嗯嗯！好期待爸爸穿上这身衣服哦。	米珂	嗯嗯！好期待他穿上去啊。
Date_NPC8_04ID	21	Lara	ララ	さあ、先を急ぎましょう	Lara	Come, let's hurry home.	拉拉	那我们快走吧。	拉拉	來，我們快走吧。
Date_NPC8_04ID	22	Mieke	ミーケ	ララ様、\nミーケたちが初めて会った時のこと、\n覚えてる？	Mieke	Queen Lara, do you remember when we first met?	米珂	拉拉大人，您还记得\n我们第一次见面就是在这里吗？	米珂	拉拉大人，妳還記得和米珂第一次見面時的事嗎？
Date_NPC8_04ID	23	Lara	ララ	もちろんですわ。\nあなたは大きな夢を抱きつつも、\n窮屈な世界に囚われていた……	Lara	Of course. I remember how you held fast to your dreams, even in the midst of such stifling circumstances.	拉拉	当然记得。当时你虽然心怀远大梦想，\n却被困在狭隘的世界里……	拉拉	那當然。當時妳抱著遠大夢想，\n卻受困在狹小的世界……
Date_NPC8_04ID	24	Mieke	ミーケ	うん。服飾の仕事で知られるようになって、\nでも同時にミーケを使って\n儲けようとする人もいて……	Mieke	Yeah... I was getting recognized for my accessories, but there were also people who tried to use me for their own profit.	米珂	嗯。当时米珂因为设计服饰有了点名气，\n同时出现了想利用米珂赚钱的人……	米珂	嗯，米珂因服飾的工作廣為人知，\n但同時也有人想利用米珂賺錢……
Date_NPC8_04ID	25		選択肢	お金も時には大事ですわ	Selection	You made your money, that's what counts.	选项	有时钱也很重要	選項	錢有時也很重要
Date_NPC8_04ID	26	Lara	ララ	お金も時には大事ですわ。\n儲けられる時に稼ぐのは\n悪いことではないでしょう	Lara	You made your money, that's what counts. There's nothing to be ashamed of.	拉拉	有时钱也很重要。\n抓住机会赚钱这种想法也无可厚非。	拉拉	錢有時也很重要。\n能賺錢的時候，多賺點並不是件壞事。
Date_NPC8_04ID	27	Mieke	ミーケ	うん。でも売れるよう、儲かるように\n取り組むと、窮屈でつまらなくって	Mieke	Yeah, but when that's the only motivation you have, things get boring.	米珂	嗯。\n但脑子里净想着怎么发大财的话会很无聊。	米珂	嗯。但老是只做能大賣、能賺錢的商品，\n日子久了會覺得很拘束又無聊。
Date_NPC8_04ID	28	Mieke	ミーケ	ミーケには狭苦しくって\nダメだったねぇ	Mieke	I felt so stuck. It wasn't the life for me.	米珂	对米珂来说太郁闷了，米珂不喜欢。	米珂	對米珂來說太窒息了，受不了啊。
Date_NPC8_04ID	29		選択肢	あなたはやはり自由でないと	Selection	You're free now, just as you should be.	选项	果然你适合自由地生活	選項	果然還是要過得自由自在才行
Date_NPC8_04ID	30	Lara	ララ	あなたはやはり自由でないと。\n自由であってこそ、ミーケの良さというのは\n一等輝きますわ	Lara	You're free now, just as you should be. And you are all the more radiant for it.	拉拉	果然你适合自由地生活。\n自由能让米珂绽放更美的光芒哦。	拉拉	米珂果然還是要過得自由自在才行。\n自由才能讓妳的優點更加耀眼。
Date_NPC8_04ID	31	Mieke	ミーケ	ミーケも、自由が好き！	Mieke	Thank goodness for that!	米珂	米珂也喜欢自由！	米珂	米珂也喜歡自由！
Date_NPC8_04ID	32	Mieke	ミーケ	世間の歯車に乗っていた方が\n何事も上手くいきやすいかもしれないけれど	Mieke	I mean, sure, I might've had an easier life conforming to society or something.	米珂	也许随大流能够让生活过得很顺利。	米珂	雖然一同在社會的齒輪中運作，\n可能會讓一切進行得比較順利。
Date_NPC8_04ID	33	Mieke	ミーケ	ミーケは、難しくても\n自由の中で大きなことを成し遂げたい！	Mieke	But even if it means having to struggle a little, I want to be free. I want to do what I want to do!	米珂	但米珂宁愿走一条难路，\n也要在自由中成就大事！	米珂	但是即使很困難，\n米珂也想在自由之中成就大事！
Date_NPC8_04ID	34		選択肢	人との繋がりは持てましたの？	Selection	Did you make any good connections?	选项	你和别人搞好关系了吗？	選項	有與他人建立起往來的關係嗎？
Date_NPC8_04ID	35	Lara	ララ	そこで人との繋がりは持てましたの？\n仕事をする以上、人脈は\n欠かせませんからね	Lara	Did you make any good connections, at least? Meeting people is important for business.	拉拉	那你和别人搞好关系了吗？\n既然要做生意，搭建人脉也是必不可少的。	拉拉	妳有與他人建立起往來的關係嗎？\n既然要工作，那人脈是不可缺少的了。
Date_NPC8_04ID	36	Mieke	ミーケ	ミーケを縛り付けるような人脈はいらない！	Mieke	Ugh! I don't want friends who try to tie me down.	米珂	米珂不需要会束缚自己的人脉！	米珂	米珂不需要會受到束縛的人脈！
Date_NPC8_04ID	37	Mieke	ミーケ	今のミーケには、大好きな家族と、\nディオたんと、\n我らが王ララ様がいてくれればいいの	Mieke	All I need is my family, Diona, and you, Your Majesty!	米珂	现在米珂身边有最喜欢的家人、蒂欧\n和国王拉拉大人，这就足够了。	米珂	現在的米珂只要有最喜歡的家人、\n蒂歐和我們的君主──拉拉大人就好了。
Date_NPC8_04ID	38		設計士の男	あっ、あなたはもしや！	Architect	Wait... Could it be?	男设计师	啊，莫非你是！	男性設計師	啊，您該不會是……！
Date_NPC8_04ID	39		設計士の男	失礼ですが、あなたはヴィアベル州で\n若者に高い人気を誇るミーケさんでは\nありませんか？	Architect	Pardon me, but are you Mieke? The designer beloved by young people all across Wirbel?	男设计师	请问你是在薇亚贝尔州\n备受年轻人欢迎的米珂小姐吗？	男性設計師	抱歉打擾了，請問您是在維亞貝爾州\n那位深受年輕人歡迎的米珂小姐嗎？
Date_NPC8_04ID	40		設計士の男	私、設計士をしているものです。\n近々、若者向けの施設を設計するのですが、\nそこにあなたの意匠を取り入れたい！	Architect	I'm an architect, you see. I have plans to design a building for a youth program, and I would be eternally grateful if I could receive your input!	男设计师	我是一名设计师。\n现在正在设计面向年轻人的设施，\n希望您也能参与这个项目！	男性設計師	我是一位設計師。最近在為年輕人設計一項設施，我想在那裡頭加入您的設計！
Date_NPC8_04ID	41	Lara	ララ	ミーケの才能は、素晴らしいですものね	Lara	An unsurprising request, given Mieke's talents.	拉拉	毕竟米珂的设计能力真的很优秀呢。	拉拉	畢竟米珂擁有很棒的才華嘛。
Date_NPC8_04ID	42		設計士の男	年単位の巨大企画です！\nあなたさえよければ、\nこれも星の導きだと思ってぜひ！	Architect	Indeed! This would be a monumental project spanning years, and nothing will guarantee its resounding success more than having you on board!	男设计师	这个项目会持续好几年！\n如果您愿意的话，请务必参加，\n就当这是星星的指引！	男性設計師	這是一年一度的盛大企畫！只要您願意，\n就當作是星星的指引，務必答應下來啊！
Date_NPC8_04ID	43		選択肢	出会うのが遅かったですわね	Selection	Unfortunately, you are too late, sir.	选项	你来晚了一步	選項	相遇的時機太晚了
Date_NPC8_04ID	44	Lara	ララ	あら、素敵なお誘い。\nただ、少し出会うのが遅かったですわね？	Lara	A wonderful proposal. But unfortunately, you are too late, sir.	拉拉	哎呀，真是诱人的邀请。\n不过可惜，你来晚了一步。	拉拉	哎呀，真是不錯的邀約。\n只不過，你們相遇的時機有點太晚了呢。
Date_NPC8_04ID	45	Mieke	ミーケ	実力が認められるのは嬉しいねぇ。\nだけど、その通り。ミーケにはララ様がいる	Mieke	Yeah, Her Majesty is right. I'm flattered, but I'm serving Queen Lara now.	米珂	米珂很高兴你能认可米珂的实力。\n但很可惜，米珂已经有拉拉大人了。	米珂	很高興你能認同米珂的實力，\n但如你所見，米珂已經有拉拉大人了。
Date_NPC8_04ID	46	Mieke	ミーケ	ララ様はミーケを自由でいさせてくれる。\nミーケ、それがとっても嬉しいんだ	Mieke	She lets me have all the freedom I want. And I can't replace that.	米珂	在拉拉大人身边，米珂就是自由的。\n这让米珂非常高兴。	米珂	拉拉大人讓米珂自由自在地生活，\n米珂對此感到非常開心。
Date_NPC8_04ID	47	Mieke	ミーケ	設計士さん、せっかくだけどごめんね。\nミーケにはもう、\n一生かけてついていきたい人がいるんだ	Mieke	So, sorry, architect guy. I've already found the person I want to work for for the rest of my life.	米珂	设计师先生，谢谢你邀请米珂。但很抱歉，\n米珂已经有想要追随一生的人了。	米珂	設計師先生，抱歉了。雖然機會很難得，\n但米珂已經有想一生追隨的人了。
Date_NPC8_04ID	48		選択肢	やりたいのであれば応援しますわ	Selection	If you wish to take the offer, I will support you.	选项	如果你想做，我会支持你的	選項	如果妳想做，我會支持妳的
Date_NPC8_04ID	49	Lara	ララ	もしミーケがやりたいと思うのであれば、\nわたくしは全力で応援いたしますわ	Lara	If you wish to take the offer, Mieke, I will support you.	拉拉	如果你想做的话，我会全力支持你的。	拉拉	如果米珂想做，我會全力支持妳的。
Date_NPC8_04ID	50	Mieke	ミーケ	ララ様、それは嬉しいけど、\nもうちょっとだけ\nミーケにやきもちやいてよ	Mieke	I appreciate the gesture, Your Majesty. But you could at least act a little more sad about it!	米珂	拉拉大人，谢谢您这么说，\n但米珂好希望您能再多吃一点醋哦。	米珂	拉拉大人，聽到妳這麼說米珂很高興，\n但妳也再稍微為米珂吃醋一下嘛。
Date_NPC8_04ID	51	Mieke	ミーケ	今のミーケには\nもう一生かけてついていきたい人がいるから\nごめんね	Mieke	I've already found the person I want to work for for the rest of my life. Sorry.	米珂	现在的米珂已经有想要追随一生的人了，\n抱歉啦。	米珂	米珂現在已經有想一生追隨的人了，抱歉喔。
Date_NPC8_04ID	52		選択肢	年単位のビーッグ企画ですわよ！	Selection	"This is a ""majorly big"" project!"	选项	会持续好几年的项目，很Big呢！	選項	是一年一度的偉～大企劃喔！
Date_NPC8_04ID	53	Lara	ララ	年単位のビーッグ企画ですわよ！\nミーケ	Lara	"This is a ""majorly big"" project, Mieke!"	拉拉	会持续好几年的项目，很Big呢，米珂！	拉拉	米珂，是一年一度的偉～大企劃喔！
Date_NPC8_04ID	54	Mieke	ミーケ	ビーッグ！！　だね！	Mieke	It sure is! Super big!	米珂	很Big呢！！	米珂	偉～大！！對吧！
Date_NPC8_04ID	55	Mieke	ミーケ	大きいことを成し遂げたいとは思うけど、\n長期間縛られちゃうのはやだなぁ。\nそれに	Mieke	And while I'd love to work on something big like that, it's also a huge time commitment. Besides...	米珂	虽然米珂想做成大事，\n但不想长时间被束缚。\n而且……	米珂	米珂是很想成就偉大的事跡，\n但不想長期受到束縛。而且……
Date_NPC8_04ID	56	Mieke	ミーケ	今のミーケには\nもう一生かけてついていきたい人がいるから\nごめんね	Mieke	I've already found the person I want to work for for the rest of my life. Sorry.	米珂	现在的米珂已经有想要追随一生的人了，\n抱歉啦。	米珂	米珂現在已經有想一生追隨的人了，抱歉喔。
Date_NPC8_04ID	57		設計士の男	いえ、お話を聞いてくださり\nありがとうございました。\nまた縁がありましたらよろしくお願いします	Architect	No, no. Thank you for even considering the offer. May our paths cross again, if ever the opportunity arises.	男设计师	不，谢谢您愿意听我说。\n希望将来有缘再和您合作。	男性設計師	沒關係，謝謝您願意聽我的請求。\n若未來有緣，再請多多指教了。
Date_NPC8_04ID	58	Mieke	ミーケ	えへへ、やっぱりララ様は\nミーケのことよく分かってくれてるね！\n嬉しい！　大好き！	Mieke	Hehe. You know me too well, Your Majesty! That made me very happy.	米珂	嘿嘿，果然拉拉大人很了解米珂呢！\n米珂好高兴！最喜欢拉拉大人了！	米珂	嘿嘿，拉拉大人果然很懂米珂呢！\n好高興！最喜歡妳了！
Date_NPC8_04ID	59	Lara	ララ	当然ですわ。\nミーケはわたくしの大切な臣下ですもの	Lara	Naturally. You are my beloved retainer, after all.	拉拉	当然了。米珂可是我重要的大臣啊。	拉拉	那當然，米珂可是我重要的臣子呢。
Date_NPC8_04ID	60	Mieke	ミーケ	ミーケは、とーちゃんみたいに\n大きな夢を持って、\n大きなことをやってみせたいんだ！	Mieke	I wanna do something big. I wanna chase a big dream, just like my papa!	米珂	米珂想和爸爸一样拥有远大梦想，\n做成大事！	米珂	米珂想和爸爸一樣抱著遠大的夢想，\n做一番偉大的事業給妳瞧瞧！
Date_NPC8_04ID	61	Mieke	ミーケ	でもそれは別に、\nお金持ちになりたいとかじゃないよ。\nそのために好きじゃないことしたくないし	Mieke	But that doesn't mean I want to be rich. And I especially don't want to be forced into doing things I don't care about.	米珂	但那并不是说米珂想赚大钱什么的。\n米珂不想为此做自己不喜欢的事。	米珂	但我並不是要成為有錢人，\n所以也不想要為了錢做自己討厭的事。
Date_NPC8_04ID	62	Mieke	ミーケ	ミーケ、これからもララ様のそばに\nいていい？	Mieke	So...is it all right if I stay with you, Your Majesty?	米珂	以后米珂也可以待在拉拉大人身边吗？	米珂	米珂今後也可以待在拉拉大人身邊嗎？
Date_NPC8_04ID	63	Lara	ララ	もちろんですわ！	Lara	Of course, Mieke!	拉拉	当然可以！	拉拉	當然了！
Date_NPC8_04ID	64	Mieke	ミーケ	やたっ！\nあっ、そろそろガルネ州に着くね！	Mieke	Yay! Oh, we're almost at Galne!	米珂	太好了！啊，马上就到加尔内州了！	米珂	太好了！啊，差不多要到加爾內州了呢！
Date_NPC8_04ID	65	Lara	ララ	（私の生きざまが、\n　ミーケの心の支えになっている……\n　嬉しいことですわ）	Lara	(It seems my way of life is helping Mieke build confidence... What a lovely thought.)	拉拉	（我的生存方式变成了米珂的心灵支柱……\n　这多么令人高兴啊。）	拉拉	（我的生存之道成了米珂的心靈支柱……\n　真令人高興。）
Date_NPC8_04ID	66	Mieke	ミーケ	ミーケは、大きな夢を持つララ様に\nこれからもついていきたい	Mieke	You have big dreams and aspirations too, Your Majesty. And I want to be there for you.	米珂	米珂想要继续追随\n拥有远大梦想的拉拉大人。	米珂	米珂今後也想追隨擁有遠大夢想的拉拉大人。
Date_NPC8_04ID	67	Mieke	ミーケ	だから、もっともっとララ様に\nミーケのこと知ってもらえるように、\nミーケ頑張るね！	Mieke	You may not know everything about me just yet, but I'm gonna do my best so that you do!	米珂	所以米珂会继续努力，\n让拉拉大人更了解米珂！	米珂	所以，為了讓拉拉大人能夠更加了解米珂，\n米珂會努力的！
Date_NPC8_04ID	68	Mieke	ミーケ	あっ、そろそろガルネ州に着くね！	Mieke	Oh, we're almost at Galne!	米珂	啊，马上就到加尔内州了！	米珂	啊，差不多要到加爾內州了呢！
Date_NPC8_04ID	69	Lara	ララ	（民の心に寄り添ってきたつもりでしたが\n　……私も王としてまだまだですわね）	Lara	(I tried to be supportive of her, but... I suppose that was not what she wanted.)	拉拉	（还以为我已经很贴近民心了，\n　看来我还要继续学习为王之道啊……）	拉拉	（原以為自己已經很貼近人民的心了……\n　我身為君主還差得遠呢。）
Date_NPC8_04ID	70	Mieke	ミーケ	大会に活かすために、\n服の詳細は前もって伝えたけど、\n実際に見せるのは、はじめてだからねぇ	Mieke	I told my papa what kind of outfit I was making for him so he could prep for the contest, but...this is the first time he'll actually see it.	米珂	为了让爸爸能在大赛里好好用上，\n米珂提前说明过衣服的详细情况，\n不过实际给爸爸看还是第一次。	米珂	為了在大賽中派上用場，米珂已經提前說明了\n服裝的細節，但實際展示出來還是第一次喔。
Date_NPC8_04ID	71		設計士の男	現在、ヴィアベル州には不在と\n聞いていたのですが、\nいや、ここでお目にかかれて良かった	Architect	Oh! I heard you weren't in Wirbel at present. What luck to have found you here.	男设计师	我听说您现在不在薇亚贝尔州，\n想不到居然能在这里见到您，\n真是太好了。	男性設計師	原本就有聽說您現在不在維亞貝爾州呢。\n哎呀，能在這裡見到您真是太好了。
Date_NPC8_05ID	0	Lara	ララ	（ミーケ、どこかしら……）	Lara	(Where could Mieke be?)	拉拉	（米珂在哪儿呢……）	拉拉	（米珂在哪裡呢……）
Date_NPC8_05ID	1	Lara	ララ	ミーケ	Lara	Mieke?	拉拉	米珂。	拉拉	米珂。
Date_NPC8_05ID	2	Mieke	ミーケ	あっ、ララ様！	Mieke	Oh, Your Majesty!	米珂	啊，拉拉大人！	米珂	啊，拉拉大人！
