file	id	romanized_name	localized_name	text	localized_name_en	text_en	localized_name_zh-CN	text_zh-CN	localized_name_zh-TW	text_zh-TW
Date_NPC8_05ID	3	Lara	ララ	少し元気がないようですが……	Lara	You look rather...despondent.	拉拉	你看上去没什么精神……	拉拉	妳看起來好像沒什麼精神……
Date_NPC8_05ID	4	Mieke	ミーケ	あのね、実は……\nとーちゃん、大会ダメだったんだぁ……	Mieke	Well, the thing is...my papa lost his competition.	米珂	那个，其实……爸爸在大赛里表现不好……	米珂	我跟妳說喔，其實……爸爸在大賽上輸了……
Date_NPC8_05ID	5	Lara	ララ	そうですか……	Lara	I see...	拉拉	这样啊……	拉拉	這樣啊……
Date_NPC8_05ID	6	Mieke	ミーケ	うん。でもとーちゃんね、\nミーケたちが用意した衣装、\nすっごく良かったって言ってくれたの！	Mieke	Yeah. But he absolutely loved the outfit we made him!	米珂	嗯。但是爸爸说米珂准备的衣服非常棒！	米珂	嗯。可是，爸爸說我們幫他準備的服裝非常棒喔！
Date_NPC8_05ID	7	Mieke	ミーケ	それにね	Mieke	In fact...	米珂	爸爸还说……	米珂	而且啊……
Date_NPC8_05ID	8	Mieke	ミーケ	とーちゃんが、大好きなミーケが作ったものなら\nぼろぼろになっても着てやるって！	Mieke	He said he loves my creations so much, he'd wear them until they were tatters!	米珂	这是爸爸最喜欢的米珂做的衣服，\n就算变得破破烂烂了，他也会继续穿！	米珂	爸爸說如果是他心愛的米珂做的，\n就算變得破破爛爛也會穿！
Date_NPC8_05ID	9	Mieke	ミーケ	すっごく嬉しい！	Mieke	I'm so happy!	米珂	米珂好开心！	米珂	米珂超開心的！
Date_NPC8_05ID	10	Mieke	ミーケ	ビーッグ！！	Mieke	Majorly happy!	米珂	Big！！	米珂	偉～大！！
Date_NPC8_05ID	11	Mieke	ミーケ	これはミーケだけじゃなくて、\nララ様とミーケ、二人の成果だから！	Mieke	And it wasn't just me. We did it together!	米珂	这不是米珂一个人的功劳，\n是拉拉大人和米珂共同的成果！	米珂	因為這不只是米珂，\n而是拉拉大人和米珂兩人的成果！
Date_NPC8_05ID	12	Mieke	ミーケ	ほら、ララ様も一緒に！　ビーッグ！！	Mieke	C'mon, Your Majesty! Be majorly happy with me!	米珂	来，拉拉大人也一起！Big！！	米珂	來，拉拉大人也一起！偉～大！！
Date_NPC8_05ID	13	Lara	ララ	お父様の結果は残念でしたが、\nミーケが嬉しそうでわたくしも嬉しいですわ	Lara	It's a shame your father didn't win, but if you're happy, then I too am happy.	拉拉	你父亲输掉比赛的事很可惜。\n但既然米珂高兴，那我也很高兴哦。	拉拉	雖然令尊得到的比賽結果令人遺憾，\n但米珂好像很高興，我也就心滿意足了。
Date_NPC8_05ID	14	Lara	ララ	よくやりましたわね	Lara	You did well.	拉拉	你做得很棒。	拉拉	妳做得很棒呢。
Date_NPC8_05ID	15	Mieke	ミーケ	ララ様、ほんっとうにありがとう！\nララ様のおかげだよ！	Mieke	Thank you so much for your help, Queen Lara! I really mean it.	米珂	真的很谢谢你，拉拉大人！\n都是拉拉大人的功劳哦！	米珂	拉拉大人，真的很謝謝妳！\n這都是拉拉大人的功勞喔！
Date_NPC8_05ID	16	Mieke	ミーケ	とーちゃんに大好きって言われて、\nララ様にもほめられて、嬉しいなぁ	Mieke	I did my papa proud, and now the queen herself is praising me! I couldn't ask for more.	米珂	听到爸爸说最喜欢米珂，\n还被拉拉大人夸奖，米珂好高兴。	米珂	能被爸爸說是他心愛的米珂，\n還得到拉拉大人的稱讚，實在太開心了。
Date_NPC8_05ID	17	Mieke	ミーケ	ミーケは、自らの国を建てちゃうような\n大きな夢を持つララ様のもとで\n自由にやれる今がすっごーく楽しいんだ	Mieke	Being able to do what I want while serving someone like you, who built their own kingdom from scratch... I think I'm the happiest I've ever been.	米珂	米珂能在拥有建国这么远大理想的\n拉拉大人身边自由生活，真的很快乐。	米珂	拉拉大人有著建立自己國家的遠大夢想，\n而米珂現在能夠在這樣的妳身旁自由地生活，\n真的非常快樂。
Date_NPC8_05ID	18	Mieke	ミーケ	狭い世界で窮屈に過ごしていたミーケを、\n満たされないミーケを導いてくれたララ様	Mieke	You took this girl who was suffocating, who was unsatisfied with her life, and gave her purpose.	米珂	米珂过去在狭隘的世界里过着憋屈的生活，\n是拉拉大人指引了无法得到满足的米珂。	米珂	是拉拉大人指引了原本無趣地活在拘束的世界裡而無法得到滿足的米珂。
Date_NPC8_05ID	19	Mieke	ミーケ	これからもララ様についていく！\nララ様だーい好き！！	Mieke	I'll follow you anywhere and everywhere, Your Majesty! I love you sooo much!	米珂	今后米珂也要追随拉拉大人！\n最喜欢拉拉大人了！	米珂	米珂今後也會追隨拉拉大人！\n最～喜歡拉拉大人了！
Date_NPC8_05ID	20	Lara	ララ	（かわいいミーケ）	Lara	(She's adorable.)	拉拉	（米珂真是太可爱了。）	拉拉	（米珂真可愛。）
Date_NPC8_05ID	21	Lara	ララ	（わたくしは彼女の王として、友として、\n　その愛に報いていかなければね）	Lara	(As her liege and, more importantly, as her friend, I must ensure that her adoration does not go unrewarded.)	拉拉	（身为她的王，她的朋友，\n　我也要回报她的爱才行。）	拉拉	（身為她的君主和朋友，我必須回報她的愛才行。）
