file	id	romanized_name	localized_name	text	localized_name_en	text_en	localized_name_zh-CN	text_zh-CN	localized_name_zh-TW	text_zh-TW
Date_NPC9_01ID	67	Lara	ララ	（あらあら、歌姫だというのに\n　あんな風に駆けて行っては\n　優雅さの欠片もありませんわね）	Lara	(My goodness, that is a rather brisk stride. Far from what one might expect of a diva such as herself.)	拉拉	（哎呀，明明是歌手\n　却像风一般飞快地跑开了，\n　没有一点优雅可言呢。）	拉拉	（哎呀，明明是歌姬，卻那樣跑走了。\n　真是一點也不優雅呢。）
Date_NPC9_01ID	68	Lara	ララ	（ですが、死んだような顔で生きるよりも\n　こちらのほうが何倍もいい）	Lara	(Still, that determined expression suits her far better than the lifeless stare she was sporting before.)	拉拉	（但是，比起带着面如死灰的表情活下去，\n　还是这样子更好。）	拉拉	（但比起一臉死氣沉沉地活著，這樣好多了。）
Date_NPC9_01ID	69	Lara	ララ	（ディオーナ……本当に元気に\n　なりましたわね）	Lara	(Diona truly has become much more spirited.)	拉拉	（蒂欧娜……她真的有精神多了。）	拉拉	（蒂歐娜……她真的變得比以前有活力多了。）
Date_NPC9_01ID	70	Lara	ララ	（それ自体は嬉しいことなのですが……\n　張り切りすぎて突っ張ってしまわないかは\n　心配ですわ）	Lara	(Though, I am concerned about whether that joy is genuine or she is merely forcing herself to act that way.)	拉拉	（这本身是件令人高兴的事……\n　但好担心她会用力过头呀。）	拉拉	（雖然這是件值得欣喜的好事……\n　但我也擔心她會不會過於投入而忽略了其他事。）
Date_NPC9_01ID	71	Lara	ララ	そこまでしなくても大丈夫ですわよ	Lara	Honestly. You needn't push yourself so hard, Diona.	拉拉	可以放轻松一点的哦。	拉拉	其實妳不用做到那種地步啊。
Date_NPC9_02ID	0	Lara	ララ	ふう、着きましたわね。\n祭りで演じる音楽劇の\n台本を探しますわよ	Lara	Phew, we've arrived. Now then, let us begin our search for a suitable opera to perform at the festival.	拉拉	呼，到了。\n来找找在庆典上表演的音乐剧剧本吧。	拉拉	呼，到了呢。那就開始尋找要在祭典上表演的音樂劇劇本吧。
Date_NPC9_02ID	1	Diona	ディオーナ	わざわざありがとうございます。\n私の台本探しに付き合ってくださって	Diona	Thank you for accompanying me this far, Your Majesty.	蒂欧娜	谢谢您特意来陪我找剧本。	蒂歐娜	謝謝您特地陪我尋找劇本。
Date_NPC9_02ID	2	Lara	ララ	臣下を見守るのも王の務め。\n問題ありませんわ	Lara	Well, it is a queen's duty to watch over her subjects. It's no trouble at all.	拉拉	守护大臣也是国王的义务，\n没关系的。	拉拉	守護臣子也是君主的職責，妳不用介意。
Date_NPC9_02ID	3	Lara	ララ	それにしても……	Lara	Regardless...	拉拉	话说回来……	拉拉	話說回來……
Date_NPC9_02ID	4		選択肢	何度訪れてもいい島ですわね	Selection	I will never tire of visiting these islands.	选项	不管来几次都觉得这座岛真不错啊	選項	這座島真是不管來幾次都讓人不厭倦呢
Date_NPC9_02ID	5	Lara	ララ	何度訪れてもいい島ですわね。\n海も近いですし、創造性が刺激されますわ	Lara	I will never tire of visiting these islands. The creativity shown here is always inspiring, and it is lovely to be near the ocean.	拉拉	不管来几次都觉得这座岛真不错啊。\n离海很近，能激发创造力。	拉拉	這座島真是不管來幾次都讓人不厭倦呢。\n城鎮跟海的距離也近，有助於激發創造力。
Date_NPC9_02ID	6	Diona	ディオーナ	ああ、私、この島に生まれてよかったです！\nこうしてララ様にお褒めいただける\nなんて……！	Diona	Ah, to hear you praise the place where I grew up... I've never been so glad I was born here!	蒂欧娜	嗯，我很庆幸能出生在这座岛上！\n没想到能得到拉拉大人的表扬……！	蒂歐娜	啊啊，能得到拉拉大人如此讚賞，\n我能出生在這座島真是太好了……！
Date_NPC9_02ID	7	Diona	ディオーナ	しかし、ララ・キングダムの素晴らしさには\n及びません。豊かさも規模もいつか\n追い抜きましょう、ララ様	Diona	However, it pales in comparison to the splendor of the Kingdom of Lara. It simply lacks the scale and richness of your lands.	蒂欧娜	不过，这里远不及拉拉王国厉害。\n终有一天，拉拉王国的富饶程度和规模\n都会超过这里的，拉拉大人。	蒂歐娜	不過它還遠不及拉拉王國的美好。\n拉拉大人，我們總有一天要讓王國\n變得比這裡更加豐饒與壯大。
Date_NPC9_02ID	8	Lara	ララ	もちろん。まだまだ課題があるとはいえ、\nララ・キングダムは世界一になる国ですもの	Lara	Why, naturally. While there are still some issues that need to be resolved, my kingdom is poised to become the best in the world.	拉拉	那是当然。虽然还有很多需要解决的问题，\n但拉拉王国终将成为世界第一的国家。	拉拉	當然，雖然還有許多問題需要解決，\n但拉拉王國將來會成為世界第一的王國。
Date_NPC9_02ID	9		選択肢	ディオーナの服を着ている人がいますわ	Selection	There are quite a few people who dress like you.	选项	有人穿着蒂欧娜的衣服呢	選項	有人穿著妳製作的衣服呢
Date_NPC9_02ID	10	Lara	ララ	ディオーナの作った服を着ている人が\nいますわね。あなたの名が広まっていると\n思うと嬉しい限りですわ	Lara	There are quite a few people who have styled their outfits after yours, Diona. It pleases me to see that your fame has spread far and wide.	拉拉	有人穿着蒂欧娜制作的衣服呢。\n想到你声名远扬，\n我就好欣慰。	拉拉	有人穿著妳製作的衣服呢。\n一想到妳聲名如此遠播，\n我就覺得很開心。
Date_NPC9_02ID	11	Diona	ディオーナ	ここでは私とミーケちゃんの服が\n若い女の子を中心に\n人気になっているようでして……	Diona	While I had heard that mine and Mieke's designs had become quite popular among young women here...	蒂欧娜	我和米珂的衣服在这里的\n年轻女孩之间似乎很受欢迎……	蒂歐娜	我和米珂的衣服似乎很受到這裡年輕女孩的歡迎……
Date_NPC9_02ID	12	Diona	ディオーナ	ああやって着てもらっているのを\n実際に見ると、嬉しいものですね	Diona	Being able to see people wearing them in person does make me happy.	蒂欧娜	亲眼看到有人那么穿,\n真是太高兴了。	蒂歐娜	像這樣親眼看見人們穿著我們的衣服，\n實在很令人高興呢。
Date_NPC9_02ID	13		選択肢	あなたの出身地なのでしたわね	Selection	This is your hometown, hm?	选项	这里是你的老家对吧	選項	這裡是妳出生的地方吧？
Date_NPC9_02ID	14	Lara	ララ	あなたの出身地なのでしたわね	Lara	This is your hometown, hm?	拉拉	这里是你的老家对吧？	拉拉	這裡是妳出生的地方吧？
Date_NPC9_02ID	15	Diona	ディオーナ	はい。この島は芸術が盛んで……\nだからこそ私は歌や服を\n学べたのだと思います	Diona	Oh, yes. It's an island overflowing with culture. As a result, I was able to study music and fashion extensively.	蒂欧娜	没错。这座岛上盛行艺术……\n所以我才学会了唱歌和做衣服。	蒂歐娜	是的，這座島的藝術相當興盛……\n所以我才能學到歌唱與製作服裝的技術。
Date_NPC9_02ID	16	Diona	ディオーナ	この島に生まれていなかったらきっと……。\n今とは違う人生でしたでしょう	Diona	If I hadn't been born here, I imagine my life would have turned out very differently.	蒂欧娜	如果没有出生在这里……\n我的人生一定会不一样吧。	蒂歐娜	如果我不是在這裡出生……\n肯定會過著與現在截然不同的人生吧。
Date_NPC9_02ID	17	Diona	ディオーナ	……さて、時間を無駄にしては\n居られません。さっそく台本を\n探しに行きましょう！	Diona	Well, let's not waste any time. Let's get right to looking for the perfect script!	蒂欧娜	……好了，不能再浪费时间了。\n赶紧去找剧本吧！	蒂歐娜	……好了，不能浪費時間。趕緊去找劇本吧！
Date_NPC9_02ID	18	Lara	ララ	ええ。手分けして探すとしましょうか。\nまた後程、ここに集まりますわよ	Lara	Agreed. Perhaps we ought to split up to cover more ground. I shall meet you back here later.	拉拉	嗯，我们分头去找吧。\n晚点在这里结合。	拉拉	嗯，我們分頭去尋找吧。之後在這裡會合。
Date_NPC9_02ID	19	Diona	ディオーナ	ララ様、戻りました。\n待たせてしまいましたでしょうか……？	Diona	Queen Lara, I've returned. I hope I didn't keep you waiting long...	蒂欧娜	拉拉大人，我回来了。\n让您等了很久吗……？	蒂歐娜	拉拉大人，我回來了。您等很久了嗎……？
Date_NPC9_02ID	20	Lara	ララ	わたくしも今戻ったところですわ。\nでは、わたくしが見つけたものを\n共有しましょうか	Lara	No, I only just come back myself. Shall we compare our findings, then?	拉拉	我也刚回来。\n给你看看我找到的剧本吧。	拉拉	我也是剛剛才回到這裡。\n那麼，就先讓妳看看我找到的劇本吧。
Date_NPC9_02ID	21	Lara	ララ	中でも気になったのは……	Lara	Among these, I was most taken by...	拉拉	其中我喜欢的是……	拉拉	其中我特別喜歡的是……
Date_NPC9_02ID	22		選択肢	歌が好きなカエルの話	Selection	This tale of a frog who loves music.	选项	喜欢唱歌的青蛙的故事	選項	愛唱歌的青蛙的故事
Date_NPC9_02ID	23	Lara	ララ	歌が好きなカエルが、音を探して旅に出る\nおとぎ話ですわ	Lara	This tale of a frog who loves music so much that they go on a journey in search of new sounds.	拉拉	喜欢唱歌的青蛙为寻找声音，\n而踏上旅途的童话。	拉拉	愛唱歌的青蛙踏上尋找音樂之旅的童話故事。
Date_NPC9_02ID	24	Diona	ディオーナ	子供に人気の演目ですね。\n見逃しがちな日常の些細な音を\nカエルの視点で愉快に描いたものです	Diona	Ah, this is a popular show among children. It's a charming depiction of everyday noises that might go unnoticed, told from the frog's perspective.	蒂欧娜	是很受小朋友欢迎的剧目啊。\n用青蛙的视角，愉快地描绘了\n日常生活中容易被人忽略的声音。	蒂歐娜	這齣戲以青蛙的視角詼諧地描寫\n日常容易被忽略的瑣碎聲音，\n非常受到孩子們喜愛。
Date_NPC9_02ID	25	Diona	ディオーナ	小さな幸せを見つめるその内容は、\nララ・キングダムの子たちにも\n見せたいものではありますが……	Diona	While I would very much like to show the children of the Kingdom of Lara the beauty of small blessings...	蒂欧娜	我也很想让拉拉王国的孩子们欣赏\n寻找细微幸福的故事内容……	蒂歐娜	戲中蘊含探究渺小幸福的寓意，\n確實是值得讓拉拉王國的孩子們鑑賞……
Date_NPC9_02ID	26	Diona	ディオーナ	問題は衣装ですね。\n私にカエルの衣装を着こなすことが\nできるか……	Diona	Costumes would be an issue. I am unsure how I feel about dressing up as a frog...	蒂欧娜	但服装是个问题。\n我适合穿青蛙的衣服吗……	蒂歐娜	但問題是服裝吧。我能夠駕馭青蛙的扮相嗎……
Date_NPC9_02ID	27		選択肢	愛を歌う女性の話	Selection	This story about a woman who sings of love.	选项	歌唱爱情的女性的故事	選項	歌頌愛的女性的故事
Date_NPC9_02ID	28	Lara	ララ	愛する夫の帰りを待ち望み、\n日々歌う女性の話ですわ	Lara	This story about a woman who sings love songs every day as she waits for her beloved husband to return.	拉拉	期盼心爱的丈夫归来，\n每日歌唱的女性的故事。	拉拉	等待心愛的丈夫回家，每天唱歌的女性的故事。
Date_NPC9_02ID	29	Diona	ディオーナ	実話を基にしたという演目ですね。\n愛を歌う……素敵です	Diona	I've heard that one is based on a true story. Singing love songs would be quite nice.	蒂欧娜	这是基于真实故事的剧目。\n歌唱爱情……真美好啊。	蒂歐娜	這齣戲是改編自真人真事，歌頌愛……真美好啊。
Date_NPC9_02ID	30	Diona	ディオーナ	愛……。改めて歌詞を咀嚼すると\n恥ずかしい箇所も多いですね。\n前は平気で歌っていたのですが	Diona	Although... Thinking about it now, they have often some rather embarrassing lyrics. I was able to sing them in the past, but...	蒂欧娜	爱情……重新体会了一下歌词，\n感觉有好多让人难为情的地方啊。\n以前明明可以冷静地演唱的。	蒂歐娜	愛……重新細讀歌詞才發現有許多令人難為情的地方。\n之前明明可以心平氣和地歌唱的。
Date_NPC9_02ID	31	Lara	ララ	あら。いい傾向ではありませんか。\n人として深みが増したのでは	Lara	My, isn't that a good thing? It means that you've grown as a person.	拉拉	哎呀，这不是好事吗，\n说明你更有人情味了呀。	拉拉	哎呀，那不是挺好的嗎？\n這代表妳已經成為了一個更豐富的人了。
Date_NPC9_02ID	32		選択肢	美しいお姫様の冒険譚	Selection	This epic about a beautiful princess who goes on an adventure.	选项	美丽公主的冒险传说	選項	美麗公主的冒險故事
Date_NPC9_02ID	33	Lara	ララ	美しいお姫様が、十人の従者と共に\n旅をする話ですわ	Lara	This epic about a beautiful princess who goes on an adventure along with her ten attendants.	拉拉	美丽的公主和十名侍从\n一起旅行的故事。	拉拉	美麗的公主與十名隨從一起旅行的故事。
Date_NPC9_02ID	34	Diona	ディオーナ	……私が大好きな演目です。\n小さい頃は、このお姫様に憧れて\n歌や所作を真似ていました	Diona	I love that one. Ever since I was little, I wanted to be just like the princess. Many of my songs and performances were inspired by her.	蒂欧娜	……这是我最喜欢的剧目了。\n小时候我非常想成为公主，\n唱过里边的歌曲，也模仿过公主的举止呢。	蒂歐娜	……這是我最喜歡一齣戲，\n我從小就很憧憬故事中的公主，\n還自己模仿劇中的歌曲和動作。
Date_NPC9_02ID	35	Lara	ララ	あら、ではその夢は叶ったのではなくて？\n今では歌姫となったじゃありませんか	Lara	Goodness, isn't that just a dream come true! You've become a princess of song, as it were.	拉拉	哎呀，那你的梦想不是已经实现了吗？\n现在的你可是歌唱公主呢。	拉拉	哎呀，那妳現在成為歌姬，不就是夢想成真了嗎？
Date_NPC9_02ID	36	Diona	ディオーナ	呼ばれているだけで、\n姫などでは決して……！	Diona	I could never accept such a lofty title!	蒂欧娜	这只是个称呼而已，\n我可算不上什么公主……！	蒂歐娜	那只是對我的稱呼而已，我哪算得上是公主……！
Date_NPC9_02ID	37	Diona	ディオーナ	と、とにかく、これを演じようと思ったら\n役者がたくさん必要そうです。\n今回の祭りでは扱いきれないかと	Diona	I-In any case, if we were to perform this one, we would need a lot of cast members. It might be better to save it for another occasion.	蒂欧娜	总、总之，如果要表演这个剧目的话，\n需要许多演员。\n这次的庆典上应该应付不过来。	蒂歐娜	總、總之，演這齣戲應該會需要很多演員。\n要在這次的祭典演出恐怕有難度。
Date_NPC9_02ID	38	Diona	ディオーナ	私もいくつか見繕って来たんです。\nこちらについても相談させて\nもらえませんか？	Diona	I also selected a number of pieces. Might I be able to share them with you?	蒂欧娜	我也挑选了一些。\n您能和我一起看看吗？	蒂歐娜	我也挑選了幾個劇本，可以跟您討論看看嗎？
Date_NPC9_02ID	39	Lara	ララ	ええ。今日中に全部見ますわよ！	Lara	By all means. We'll have everything reviewed before the day is through!	拉拉	好呀，今天全都看一遍吧！	拉拉	嗯，我們今天就把所有劇本都看過吧！
Date_NPC9_02ID	40	Lara	ララ	ふむ……なかなかにしっくりくるものが\nないですわね	Lara	Hm... There doesn't seem to be anything that feels suitable.	拉拉	唔……没有能让人心动的呢。	拉拉	嗯……找不到適合的戲碼呢。
Date_NPC9_02ID	41	Diona	ディオーナ	……こうなったら、私が一から\n作ろうかと思います	Diona	At this point, it may be easier for me to write one myself.	蒂欧娜	……既然如此，那我就直接创作一出吧。	蒂歐娜	……既然如此，只能由我從頭開始創作了。
Date_NPC9_02ID	42	Lara	ララ	思い切りましたわね。\n作ったことがありまして？	Lara	That would certainly be one solution. Have you ever written an opera before?	拉拉	真大胆呢。\n你以前写过吗？	拉拉	竟然這麼大手筆啊。妳創作過音樂劇嗎？
Date_NPC9_02ID	43	Diona	ディオーナ	いえ、ありません……ですが、\n作詞も作曲も問題ありません。\n衣装だって作れます	Diona	No, I have not. However, I can write lyrics and music, and I can sew my own costumes.	蒂欧娜	不，没有写过……但是，\n作词作曲我都没问题，\n也能做衣服。	蒂歐娜	不，沒有……但作詞作曲都不是問題，\n而且我也能製作服裝。
Date_NPC9_02ID	44	Diona	ディオーナ	私が伝えたいことを伝えるには、\nこれが一番だと思うんです	Diona	Being able to tell the story that I want, in my own way, would be the best.	蒂欧娜	要向大家展示我想表达的内容，\n自己做才是最好的。	蒂歐娜	為了傳達我想傳達的想法，這應該是最好的辦法。
Date_NPC9_02ID	45	Lara	ララ	ディオーナ……	Lara	Diona...	拉拉	蒂欧娜……	拉拉	蒂歐娜……
Date_NPC9_02ID	46		選択肢	その覚悟……たしかに受け取りましたわ！	Selection	How could I put a damper on such determination?	选项	我感受到你的决心了！	選項	我確實感受到妳的決心了……！
Date_NPC9_02ID	47	Lara	ララ	その覚悟……たしかに受け取りましたわ！\nあなたが作る音楽劇、楽しみに\nしていますわよ	Lara	How could I put a damper on such determination? I would love to watch an opera that you wrote.	拉拉	我感受到你的决心了！\n我很期待你创作的音乐剧哦。	拉拉	我確實感受到妳的決心了……！\n我很期待妳創作的音樂劇喔。
Date_NPC9_02ID	48	Diona	ディオーナ	お任せください、ララ様！\nこのディオーナ、歌と劇で我が王と\nララ・キングダムを称え広めてみせます！	Diona	Then you shall, Your Majesty! Your humble servant will create a piece that extols the virtues of the Kingdom of Lara in both song and script!	蒂欧娜	交给我吧，拉拉大人！\n我会用歌曲和剧目传颂我的国王，\n还有拉拉王国的！	蒂歐娜	請交給我吧，拉拉大人！\n我──蒂歐娜一定會透過歌曲及戲劇\n宣揚我的君王與拉拉王國的美好！
Date_NPC9_02ID	49	Lara	ララ	その意気ですわ、ディオーナ。\nララ・キングダムに栄光あれ！	Lara	That's the spirit, Diona. For the glory of the kingdom!	拉拉	就是要这股干劲，蒂欧娜，\n为了拉拉王国的荣耀！	拉拉	妳有這股志氣就對了，蒂歐娜。\n願拉拉王國榮耀長存！
Date_NPC9_02ID	50	Diona	ディオーナ	栄光あれ！	Diona	Hear, hear!	蒂欧娜	荣耀！	蒂歐娜	願榮耀長存！
Date_NPC9_02ID	51		選択肢	どんな作品にするんですの？	Selection	What manner of piece would you put forward?	选项	你要创作什么样的作品呢？	選項	妳打算創作什麼樣的作品？
Date_NPC9_02ID	52	Lara	ララ	どんな作品にするんですの？	Lara	What manner of piece would you put forward?	拉拉	你要创作什么样的作品呢？	拉拉	妳打算創作什麼樣的作品？
Date_NPC9_02ID	53	Diona	ディオーナ	ララ様への想いを音楽劇にしようかと。\n音楽で表現することは私の本領ですから	Diona	Why, one that puts my feelings for you on full display. After all, expressing myself through song is what I do best.	蒂欧娜	我想把对拉拉大人的感情做成音乐剧。\n用音乐来表达可是我的特长。	蒂歐娜	我想將我對拉拉大人的心意創作成音樂劇，\n因為用音樂表達是我的專長。
Date_NPC9_02ID	54	Lara	ララ	あら、前もわたくしの歌を歌ってました\nわよね？　わたくしにこだわらなくとも\nよいですのに	Lara	Goodness, have you not already serenaded me enough already? Please, feel free to branch out to other subjects.	拉拉	咦，之前你也唱过关于我的歌吧？\n不用那么执着于我的。	拉拉	哎呀，妳之前也唱了關於我的歌吧？\n不用拘泥於我也無妨啊。
Date_NPC9_02ID	55	Diona	ディオーナ	いいえ！　まだまだララ様への想いは\n形にしつくせていませんので！	Diona	Hardly, Your Majesty! There is still so much I have left to say!	蒂欧娜	不！我对拉拉大人的感情\n还没有全都具象化呢！	蒂歐娜	不！我目前創作的作品，\n還完全不足以表達我對拉拉大人的情感！
Date_NPC9_02ID	56		選択肢	わたくしの出番はあるかしら？	Selection	Will I be making an appearance in your production?	选项	需要我出场吗？	選項	需要我上台嗎？
Date_NPC9_02ID	57	Lara	ララ	わたくしの出番はあるのかしら？\n国王自ら、出演す……	Lara	Will I be making an appearance in your production? Perhaps as the kingdom's ruler, or...	拉拉	需要我出场吗？\n国王亲自出演……	拉拉	需要我上台嗎？國王親自演出……
Date_NPC9_02ID	58	Diona	ディオーナ	ララ様の出番ですか！？	Diona	You would take to the stage, my queen?!	蒂欧娜	拉拉大人出场？！	蒂歐娜	讓拉拉大人上台！？
Date_NPC9_02ID	59	Diona	ディオーナ	すみません、申し出はありがたいのですが、\n今回は私一人で……！	Diona	As much as I appreciate your offer, I was thinking this would be a one-woman performance, so...	蒂欧娜	抱歉，我很感谢您的提议，\n但这次我想一个人表演……！	蒂歐娜	抱歉，雖然很感謝您的提議，\n但這次請讓我一個人來……！
Date_NPC9_02ID	60	Diona	ディオーナ	ララ様には観客の一人として\n私のステージを見ていただきたいのです	Diona	I would very much like you to relax and enjoy the show this time.	蒂欧娜	让拉拉大人作为观众，\n欣赏我的舞台。	蒂歐娜	希望拉拉大人您能以觀眾的身分觀賞我的舞台。
Date_NPC9_02ID	61	Lara	ララ	なるほど。よく分かりましたわ。\nわたくしに協力できることがあれば\nなんでも言いなさいな	Lara	I see. Very well. If there is anything I can do to assist you, though, be sure to let me know.	拉拉	这样呀，我知道了。\n如果有需要我帮忙的地方，\n你尽管说哦。	拉拉	原來如此，我知道了。\n如果有什麼我能幫上忙的地方就儘管說吧。
Date_NPC9_02ID	62	Diona	ディオーナ	ありがとうございます！\nこうしてはいられません、さっそく戻って\n執筆を開始します！	Diona	Thank you very much! Since there's nothing left to do here, I'll return and start writing at once!	蒂欧娜	谢谢您！\n不能再待在这里了，我要赶紧回去\n开始写剧本才行！	蒂歐娜	謝謝！既然如此我可不能浪費時間，\n得趕緊回去寫劇本！
Date_NPC9_02ID	63	Lara	ララ	ふふ、楽しみですわね。\nどんなものを書いてくるのか	Lara	*Chuckle* I can't wait to see what she creates.	拉拉	呵呵呵，真令人期待呀。\n她会写出什么样的剧本呢？	拉拉	呵呵，真令人期待。\n妳究竟會寫出什麼樣的故事呢？
Date_NPC9_03ID	0	Diona	ディオーナ	突然のお願いであったにもかかわらず、\n快諾していただきありがとうございます！	Diona	Thank you so much for agreeing to my selfish request on such short notice!	蒂欧娜	谢谢您接受我唐突的请求！	蒂歐娜	謝謝您答應我這麼突然的請求！
Date_NPC9_03ID	1	Lara	ララ	あなたはわたくしの臣下なのですから、そばに控える\nのにわざわざ伺いを立てる必要なんかありませんのに	Lara	As one of my faithful attendants, you do not need to go out of your way to solicit my company.	拉拉	你可是我的大臣，\n想待在我身边不需要特意请示的。	拉拉	妳本來就是我的臣子，\n其實根本不需要特地詢問能否隨侍在我身邊。
