file	id	romanized_name	localized_name	text	localized_name_en	text_en	localized_name_zh-CN	text_zh-CN	localized_name_zh-TW	text_zh-TW
Date_NPC9_03ID	2	Lara	ララ	で、なぜわたくしに一日密着したいのか、\nそろそろわけを聞かせてくださる？	Lara	That said, might you be able to tell me why you need to be in my presence for an entire day?	拉拉	那么，你能告诉我为什么\n想一整天都紧紧跟着我了吗？	拉拉	話說回來，妳差不多可以告訴我，\n為什麼想跟著我一整天了嗎？
Date_NPC9_03ID	3	Diona	ディオーナ	音楽劇のためです。題材として、ララ様への\n想いを描こうと決めたのですが……	Diona	It's for the opera, you see. I have already decided that it will depict my feelings for you, Queen Lara. However...	蒂欧娜	是为了音乐剧。虽然已经决定围绕\n我对拉拉大人的感情来创作了……	蒂歐娜	一切都是為了完成音樂劇。\n雖然我已經決定以我對拉拉大人的心意為主題……
Date_NPC9_03ID	4	Diona	ディオーナ	ララ様の魅力を余すことなく表現するためには、\nララ様のことをより深く知る必要があります	Diona	I would like to learn more about you, so as to better convey your charms.	蒂欧娜	但为了把拉拉大人的魅力完全展现出来，\n有必要更加深入地了解拉拉大人。	蒂歐娜	但想要一絲不漏地展現出您的魅力，\n就必須更加了解您。
Date_NPC9_03ID	5	Diona	ディオーナ	だから一日密着したいのです！	Diona	So I wish to observe you for the day!	蒂欧娜	所以我才想一整天都紧跟着您！	蒂歐娜	所以才想貼身觀察您一天！
Date_NPC9_03ID	6	Lara	ララ	あなた、すました顔をしてときどき\n突拍子もないことをしますわよね……	Lara	My word. You can say some impressively shameless things with a completely straight face.	拉拉	你会时不时一脸正经地说出些\n异想天开的话呢……	拉拉	妳有時會一臉正經地做出無厘頭的事呢……
Date_NPC9_03ID	7	Lara	ララ	（そこが魅力でもあるのですが）	Lara	(That is one of her charms, though.)	拉拉	（不过这也是她的魅力。）	拉拉	（雖然這也是她的魅力。）
Date_NPC9_03ID	8	Lara	ララ	まあ、いいでしょう。\n今日は調合の素材を採取しに行きますわよ	Lara	Very well, you may do as you please. I was planning on heading out to gather materials for today's synthesis.	拉拉	嗯，好吧。\n今天我要去采集调合用的素材。	拉拉	算了，無妨。我今天要去採集調合的素材。
Date_NPC9_03ID	9	Lara	ララ	しかとわたくしの一挙手一投足を\n見ておくことですわ！	Lara	You must be sure to watch my every move!	拉拉	你要仔细观察我的一举一动哦！	拉拉	妳可要仔細看好我的一舉一動！
Date_NPC9_03ID	10	Diona	ディオーナ	はい！　目を見開いて！	Diona	Of course, Your Majesty! I won't miss a single thing!	蒂欧娜	好！我会睁大眼睛好好看的！	蒂歐娜	是！我會睜大雙眼看的！
Date_NPC9_03ID	11	Lara	ララ	……そんな遠くで見ていて密着取材になりますの？\nもっと近くに来なさいな	Lara	Are you certain that you can see well enough from all the way over there? You're welcome to come closer.	拉拉	……你离那么远也能算紧跟着吗？\n靠近一点呀。	拉拉	……妳站在那麼遠還能算是什麼貼身觀察嗎？\n再靠過來一點吧。
Date_NPC9_03ID	12	Diona	ディオーナ	は、はい。では、お言葉に甘えて……	Diona	E-Er, if you insist...	蒂欧娜	好、好的。那我就不客气了……	蒂歐娜	好、好的，那我就恭敬不如從命……
Date_NPC9_03ID	13	Diona	ディオーナ	じー	Diona	Hmm...	蒂欧娜	盯——	蒂歐娜	（緊盯……）
Date_NPC9_03ID	14	Lara	ララ	（近くにとは言ったもののここまで……！\n　これは近すぎるというもの……！）	Lara	(I did say that she could come closer, but I was not expecting her to come quite this close...!)	拉拉	（虽然说了要靠近，但没想到会这么近……！\n　这也太近了点吧……！）	拉拉	（雖然我叫她靠近，但沒想到會這麼近……！\n　這樣實在太近了！）
Date_NPC9_03ID	15	Lara	ララ	（しかし、王に二言はありませんもの。\n　臣下のために我慢ですわ）	Lara	(However, a queen mustn't go back on her word. I shall simply have to endure.)	拉拉	（可是，国王不能食言。\n　为了臣子我就忍一忍吧。）	拉拉	（但君王說話要算話，得為了臣子忍耐才行。）
Date_NPC9_03ID	16	Diona	ディオーナ	……	Diona	...	蒂欧娜	……	蒂歐娜	……
Date_NPC9_03ID	17	Lara	ララ	（それにしても……やはり歌姫。\n　あまりに整った顔立ちですわね）	Lara	(Diona truly does have all the hallmarks of a songstress. She's so composed.)	拉拉	（话说回来……真不愧是歌手啊，\n　长得也太漂亮了。）	拉拉	（話說回來……不愧是歌姬，五官真端正啊。）
Date_NPC9_03ID	18	Lara	ララ	（一般の人間が、この距離に迫られたら\n　頭が真っ白になりそうな）	Lara	(At this distance, most people would start to panic.)	拉拉	（普通人如果离她这么近的话，\n　大脑已经一片空白了。）	拉拉	（普通人如果跟她這麼貼近，\n　腦袋可能會變得一片空白吧。）
Date_NPC9_03ID	19	Diona	ディオーナ	……っ！　魔物！	Diona	Oh no! Monsters!	蒂欧娜	……啊！有魔物！	蒂歐娜	……唔！是魔物！
Date_NPC9_03ID	20	Diona	ディオーナ	はあああああっ！！！	Diona	Hyaaah!	蒂欧娜	喝啊啊啊啊！！！	蒂歐娜	喝啊啊啊啊啊！！！
Date_NPC9_03ID	21	Diona	ディオーナ	我らが王に歯向かおうだなんて、\n許せません！	Diona	Those who threaten our queen must be struck down!	蒂欧娜	居然敢对我的国王呲牙，\n不可原谅！	蒂歐娜	竟敢攻擊我們的君王，不可原諒！
Date_NPC9_03ID	22	Diona	ディオーナ	ララ様、もう心配ありません	Diona	Queen Lara, the nuisances have been dealt with.	蒂欧娜	拉拉大人，不用担心了。	蒂歐娜	拉拉大人，已經沒事了。
Date_NPC9_03ID	23	Lara	ララ	……ええ、ありがとう。\nわたくしとしたことが油断していましたわ	Lara	Indeed. Thank you. Though, I should have been paying better attention to my surroundings.	拉拉	……嗯，谢谢你。\n是我大意了。	拉拉	……嗯，謝謝妳。我也真是的，居然大意了。
Date_NPC9_03ID	24	Lara	ララ	ん……	Lara	Mm...	拉拉	嗯……	拉拉	嗯……
Date_NPC9_03ID	25	Diona	ディオーナ	……美しい	Diona	How sublime.	蒂欧娜	……太美了。	蒂歐娜	……好美。
Date_NPC9_03ID	26	Lara	ララ	？　何がですの？	Lara	Hm? What is?	拉拉	什么美？	拉拉	嗯？妳指什麼？
Date_NPC9_03ID	27	Diona	ディオーナ	ララ様が紅茶を飲むお姿が、です	Diona	Why, the way you drink tea, my queen.	蒂欧娜	拉拉大人喝红茶的样子。	蒂歐娜	拉拉大人喝紅茶的身姿。
Date_NPC9_03ID	28	Lara	ララ	ふふ。ディオーナも美しいですわ。\n紅茶を飲む姿だけではなく、戦う姿も	Lara	*Chuckle* You are no less elegant, Diona, whether you are dining or defeating monsters.	拉拉	呵呵，你也很美哦。\n不只是喝红茶的样子，战斗的样子也是。	拉拉	呵呵，蒂歐娜妳也很美喔。\n不只是喝紅茶時，戰鬥的身姿也是。
Date_NPC9_03ID	29	Diona	ディオーナ	ララ様だって	Diona	But, Queen Lara...	蒂欧娜	拉拉大人也是啊。	蒂歐娜	拉拉大人您才是……
Date_NPC9_03ID	30	Diona	ディオーナ	泥にまみれながら採取をするお姿も、\n汗を流しながら仕事をされるお姿も……！	Diona	You could be covered in mud from gathering materials or sweating from all your hard work and you would still be absolutely radiant!	蒂欧娜	身上沾满泥土采集的样子也是，\n流汗工作的样子也是……！	蒂歐娜	無論是採集時渾身沾染泥巴的模樣，\n還是工作時汗流浹背的模樣……！
Date_NPC9_03ID	31	Diona	ディオーナ	きっと民のためというひたむきな心が\n表に現れているのでしょう！	Diona	I'm certain that is your earnest devotion to your subjects shining through!	蒂欧娜	一定是因为牵挂人民的心意展露了出来！	蒂歐娜	這些都是妳一心一意替人民著想的表現吧！
Date_NPC9_03ID	32	Lara	ララ	気恥ずかしいことを言うのはやめなさいな。\nそういうのは歌の内容だけで充分ですわ	Lara	Please, any more and you'll embarrass me. Save that sort of flowery praise for your songs.	拉拉	别再说让人难为情的话了，\n歌里有就已经足够了。	拉拉	別說這些肉麻的話，這種話寫在歌裡就夠了。
Date_NPC9_03ID	33	Lara	ララ	……まあ、だからこそ良い詩が書けているのなら\nそれも才能なのかもしれませんが	Lara	Though, I suppose that sort of effortless composition is further proof of your creative skill.	拉拉	……不过，如果这是你能写出好歌的原因，\n这或许算是一种天赋吧。	拉拉	……但正因如此，妳才能寫出優美的詞，\n這或許也是種才能吧。
Date_NPC9_03ID	34	Diona	ディオーナ	なるほど……たしかにそうなのかもしれません	Diona	I see... You might have a point.	蒂欧娜	原来如此……好像确实是这样呢。	蒂歐娜	原來如此……或許確實是這樣也說不定。
Date_NPC9_03ID	35	Diona	ディオーナ	今日はありがとうございました。\nおかげで色々と案が浮かんできました	Diona	Thank you very much for today. I have all sorts of ideas to work from now.	蒂欧娜	今天真是太感谢了。\n多亏了您，我有了很多构思。	蒂歐娜	今天非常感謝您。\n多虧您的協助，讓我想到了許多點子。
Date_NPC9_03ID	36	Diona	ディオーナ	さっそくララ・キングダムに戻って\n音楽劇の制作を……	Diona	I should hurry back to the kingdom and get straight to work on the scr—	蒂欧娜	赶快回拉拉王国\n开始制作音乐剧吧……	蒂歐娜	我得趕緊回去拉拉王國創作音樂劇……
Date_NPC9_03ID	37	Lara	ララ	ディオーナ	Lara	Diona.	拉拉	蒂欧娜。	拉拉	蒂歐娜。
Date_NPC9_03ID	38	Diona	ディオーナ	はい？	Diona	Yes?	蒂欧娜	什么事？	蒂歐娜	嗯？
Date_NPC9_03ID	39	Lara	ララ	お茶の時間ぐらいゆっくりしなさい。\nこれは王の命令ですわ	Lara	As your queen, I order you to sit and enjoy your teatime.	拉拉	喝茶时就悠闲一点吧，\n这是国王的命令。	拉拉	至少喝茶的時間好好休息吧。這是君主的命令。
Date_NPC9_03ID	40	Diona	ディオーナ	……は、はい	Diona	A-As you wish.	蒂欧娜	……遵、遵命。	蒂歐娜	……好、好的。
Date_NPC9_03ID	41	Lara	ララ	（ディオーナは本当に創作に対して真剣ですわね）	Lara	(Diona is taking this opera very seriously indeed.)	拉拉	（蒂欧娜对待创作真是非常认真呢。）	拉拉	（蒂歐娜真的很認真看待創作。）
Date_NPC9_03ID	42	Lara	ララ	（いつか彼女にも一日密着して、\n　歌に対する想いを聞いてみたいですわ）	Lara	(Perhaps one day, we can spend a similar amount of time discussing her thoughts about music.)	拉拉	（我也想找一天紧跟着她，\n　问问她对歌曲的想法啊。）	拉拉	（我也想要找個日子跟著她一整天，\n　聽聽她對歌曲的想法。）
Date_NPC9_04ID	0	Lara	ララ	（祭りの時期も近づいてきて、\n　そろそろ音楽劇の台本も\n　仕上がらないといけないころ）	Lara	(Given how close we are to the date of the festival now, surely Diona has finished the script and music for her opera.)	拉拉	（离庆典越来越近了，\n　这会儿音乐剧的剧本\n　也差不多该完成了。）	拉拉	（祭典就快到了，音樂劇的劇本\n　也差不多該完成了。）
Date_NPC9_04ID	1	Lara	ララ	（きっとディオーナも大詰めを\n　迎えていることでしょう。\n　こういう時、彼女は……）	Lara	(Everything must be in its final stages. At a time like this, she would most likely be...)	拉拉	（蒂欧娜一定创作到结局部分了。\n　这个时候她……）	拉拉	（蒂歐娜肯定也到最後階段了吧。\n在這種時候，她總會……）
Date_NPC9_04ID	2	Diona	ディオーナ	皆で歌おう　我らの～♪	Diona	O, sing, in honor of our...	蒂欧娜	大家一起歌唱吧，我们的～	蒂歐娜	大家一起唱吧！為我們的～
Date_NPC9_04ID	3	Lara	ララ	（やはり、ここにいた）	Lara	(Aha, I knew this is where I would find her.)	拉拉	（果然在这里。）	拉拉	（果然在這裡。）
Date_NPC9_04ID	4	Diona	ディオーナ	あ、ララ様！　いらしていたのですか	Diona	Oh! Queen Lara! I didn't realize you had stopped by.	蒂欧娜	啊，拉拉大人！您来了呀。	蒂歐娜	啊，拉拉大人！您來了呀。
Date_NPC9_04ID	5	Lara	ララ	素敵な曲でしたわ。祭りで披露する\n音楽劇のものですわよね？	Lara	That was a lovely song. Would it happen to be part of the festival's opera?	拉拉	这首歌真好听，\n是在庆典的音乐剧里表演的歌曲吧？	拉拉	真是美妙的歌曲。\n這是要在祭典上表演的音樂劇的內容吧？
Date_NPC9_04ID	6	Diona	ディオーナ	はい、そうです。ララ様のことを想い、\nララ様を称えるために用意した曲になります	Diona	Yes, it is! I wrote it while I was thinking of you, so it became a rather celebratory piece.	蒂欧娜	嗯，是的。这首是想着拉拉大人，\n为了称赞拉拉大人准备的曲子。	蒂歐娜	嗯，沒錯。這是我想著拉拉大人，\n為了讚頌您而準備的歌曲。
Date_NPC9_04ID	7	Lara	ララ	ということは、完成したのですね？	Lara	Does that mean everything is finished?	拉拉	那也就是说，已经完成了吗？	拉拉	所以妳已經把音樂劇完成囉？
Date_NPC9_04ID	8	Diona	ディオーナ	はい……ただ、まだ少し悩んでいるところも\nあって……	Diona	Yes, although...there are some parts that I'm concerned about.	蒂欧娜	是的…… 不过，还有些地方我不确定……	蒂歐娜	嗯……不過我還有一些地方在煩惱該怎麼處理才好……
Date_NPC9_04ID	9	Lara	ララ	なるほど。よろしければ、どんな歌なのか\n教えてもらえるかしら	Lara	I see. Would you mind telling me a little more about the songs and such?	拉拉	原来如此。如果你愿意的话，\n能告诉我那是什么样的歌吗？	拉拉	這樣啊。如果妳不介意的話，\n可以告訴我是什麼樣的歌嗎？
Date_NPC9_04ID	10	Diona	ディオーナ	もちろんです！　細かいところは当日まで\n隠しますが、全十楽章からなっていて……	Diona	Not at all! While I plan on keeping the specifics a secret until the performance, I can say that there will be ten acts.	蒂欧娜	当然了！细节的部分要等到当天才能展示，\n一共有十乐章……	蒂歐娜	當然可以！雖然細節會等到當天再公開，\n但歌曲總共有十個樂章……
Date_NPC9_04ID	11	Diona	ディオーナ	第一楽章は私とララ様との出会い、\n第二楽章はララ様の内に秘められた渇望、\n第三楽章は……	Diona	The first covers how we met, the second is your hidden desires, the third...	蒂欧娜	第一章是我与拉拉大人的邂逅，\n第二章是拉拉大人藏在心中的渴望，\n第三章是……	蒂歐娜	第一樂章是我和拉拉大人的相遇，第二樂章是\n拉拉大人內心的渴望，第三樂章是……
Date_NPC9_04ID	12	Lara	ララ	（そ、そんなにありますの！？）	Lara	(Sh-She has that much material?!)	拉拉	（有、有那么多章吗？！）	拉拉	（這、這麼長嗎！？）
Date_NPC9_04ID	13		選択肢	長すぎませんこと？	Selection	Is that not rather long?	选项	会不会太长了点？	選項	不會太長了嗎？
Date_NPC9_04ID	14	Lara	ララ	少し長すぎませんこと？\n退屈な構成になっていなければ\n良いのですが	Lara	Is that not slightly too long? Of course, that is no matter if the material is engaging, but...	拉拉	会不会太长了点呀？\n希望结构不会无聊。	拉拉	這樣不會有點太長了嗎？\n希望劇情的編排不會讓觀眾感到無聊。
Date_NPC9_04ID	15	Diona	ディオーナ	そ……そうかもしれません。\nララ様への想いを詰め込んだら\n長くなってしまいました	Diona	Y-You may have a point. Trying to fit all my feelings for you into the production just made it grow and grow...	蒂欧娜	好……好像是有点。\n我把对拉拉大人的感情都写了进去，\n变得有些太长了。	蒂歐娜	或……或許的確是如此。\n我把對您的心意全都寫進歌裡，\n結果就變得這麼長了。
Date_NPC9_04ID	16	Diona	ディオーナ	ですが、私のララ様への想いはこれだけでは\nありません！\n本当はまだまだたくさん……	Diona	And I haven't even managed to cover them all! Quite frankly, I still have a lot more to cover.	蒂欧娜	但是，我对拉拉大人的感情还远不止这些！\n还有好多好多好多……	蒂歐娜	但我對您的情感可不只這樣！\n其實我還有更多更多……
Date_NPC9_04ID	17	Lara	ララ	わ、分かりましたわ。\nとても強く思ってくださったことは	Lara	I-I see. Thank you for thinking so highly of me.	拉拉	我、我知道你的感情有多深了。	拉拉	我、我明白妳對我的情感有多麼強烈了。
Date_NPC9_04ID	18		選択肢	熱い想いが伝わってきますわ	Selection	You have certainly gotten your passion across.	选项	能感受到你的热情	選項	我感受到妳的熱情了
Date_NPC9_04ID	19	Lara	ララ	これだけの熱い想いがあなたには\nあるのですね。\nそれが十分伝わってきましたわ	Lara	You have certainly gotten your passionate feelings across. And very successfully.	拉拉	看来你的心中充满了热情。\n我已经深深地感受到了。	拉拉	這首歌就是妳熱情的展現，\n我十足感受到妳的心意了。
Date_NPC9_04ID	20	Diona	ディオーナ	嬉しいです！　ララ様に届けたくて\nこの歌を書いてましたので	Diona	Thank you so much! I wrote these songs to convey them to you, my queen.	蒂欧娜	我太开心了！这首歌就是为了\n向拉拉大人表达我的心声而写的。	蒂歐娜	您這麼說太令我高興了！\n畢竟我就是為了將心意傳達給您才會寫下這首歌。
Date_NPC9_04ID	21	Diona	ディオーナ	長いだけでなく、一つ一つの言葉にも\nララ様への想いを込めていて……。\nこの間の一日密着の成果が出ました	Diona	It isn't just the length. Each and every word contains my deep affection for you. That day we spent together was truly inspirational.	蒂欧娜	它不单是长，里边的一词一句都包含着\n我对拉拉大人的感情……\n是之前紧跟拉拉一天得出的成果。	蒂歐娜	而且這首歌並非空有長度，\n而是一句一語都蘊含了我對您的心意……\n不枉費我上次貼身跟著您觀察了一整天。
Date_NPC9_04ID	22	Lara	ララ	やはり想いを詩にする才能は\n飛びぬけていますわね。\n驚きましたわ	Lara	You truly do have a way with words. I'm shocked that you're able to articulate your feelings so effectively.	拉拉	你将想法写成歌的天赋\n果然是出类拔萃的。\n太让人吃惊了。	拉拉	妳將情感化為詩歌的才能果然出類拔萃，真是驚人。
Date_NPC9_04ID	23		選択肢	ランターナ史に残る超大作ですわね	Selection	This is a masterpiece!	选项	这将是在兰塔纳史上留名的超级大作	選項	這是能在蘭塔納歷史名的超級大作呢
Date_NPC9_04ID	24	Lara	ララ	これは……ランターナ史に残る\n超大作ですわね	Lara	This is truly a masterpiece that will remain in the annals of history.	拉拉	这将是……在兰塔纳史上留名的超级大作呢。	拉拉	這真是……能在蘭塔納歷史上留名的超級大作呢。
Date_NPC9_04ID	25	Diona	ディオーナ	そうでしょう！\nここまで長ければ皆の印象に残ること\n間違いなしです	Diona	Isn't it?! I thought that surely, such a lengthy piece would make a lasting impression on anyone who watched it.	蒂欧娜	是吧！\n写这么长一定可以给大家留下深刻的印象。	蒂歐娜	對吧！內容這麼長，肯定能讓大家印象深刻。
Date_NPC9_04ID	26	Diona	ディオーナ	これで、ララ様の偉業を皆の記憶に\n刻み付けられますね！	Diona	This will carve your grand achievements into everyone's memories!	蒂欧娜	这样一来，拉拉大人的丰功伟绩\n也会铭刻在大家的记忆中了！	蒂歐娜	這麼一來就能將拉拉大人的豐功偉業\n烙印在大家的記憶裡了！
Date_NPC9_04ID	27	Lara	ララ	長すぎて内容は覚えられないのではなくて？	Lara	Though, would the length not make the content more difficult to remember?	拉拉	这也太长了，大家不会记不住内容吗？	拉拉	不會反而因為內容太長而記不住嗎？
Date_NPC9_04ID	28	Diona	ディオーナ	……確かに……。\n申し訳ございません、盲点でした……	Diona	That is...entirely possible, yes. I apologize. I hadn't considered that aspect.	蒂欧娜	……有道理……\n实在抱歉，我没能注意到这一点……	蒂歐娜	……說的也是……抱歉，我沒想到這點……
Date_NPC9_04ID	29	Lara	ララ	一度整理したほうがよいかも\nしれないですわね	Lara	Perhaps it would be prudent to make a few edits.	拉拉	也许再理一遍会比较好。	拉拉	還是再重新編整一次會比較好吧。
Date_NPC9_04ID	30	Lara	ララ	前から聞きたかったのですが、あなたは\n歌うときや作曲する時、どのような想いを\n胸に取り組んでいるのかしら	Lara	But I had been meaning to ask you—what sort of emotions do you usually feel when you are singing or composing?	拉拉	我以前就想问了，\n你唱歌和作曲时，\n心里都在想些什么？	拉拉	我從之前就很想問了，妳在唱歌或作曲時，\n內心都是懷抱著什麼樣的想法呢？
Date_NPC9_04ID	31	Diona	ディオーナ	そうですね……はじめは歌手である\n父の勧めで歌い始めました。\nこれはララ様も知っての通りです	Diona	Well... As you know, I started by singing songs that my father suggested.	蒂欧娜	这个嘛……最初我是在\n身为歌手的父亲提议下才开始唱歌的。\n这件事拉拉大人也知道。	蒂歐娜	這個嘛……正如拉拉大人您所知，\n我的父親是一名歌手，\n而我是在他提議下開始唱歌的。
Date_NPC9_04ID	32	Diona	ディオーナ	ララ様と出会った今は、自らの意志のもと、\n大きな“芯”を持って取り組んでいます	Diona	But since meeting you, I have truly begun to bloom, and learned to exert more of my own will.	蒂欧娜	与拉拉大人相遇后，如今我做任何事\n都以自己的意志为主，拥有了坚定的信念。	蒂歐娜	和您相遇後，我開始以自己的意志，\n懷著堅定的「信念」進行歌唱活動。
Date_NPC9_04ID	33	Diona	ディオーナ	ララ様が、熱い“芯”を与えて\nくださったんです	Diona	And I have you to thank for that, Queen Lara.	蒂欧娜	是拉拉大人给了我火热的“信念”。	蒂歐娜	是您給予了我這份炙熱的「信念」。
Date_NPC9_04ID	34	Diona	ディオーナ	だからこそ、その感謝を込めてララ様の\nことを想い、ララ様を称える曲を作って、\nララ様の素晴らしさを広めたい……	Diona	So I think of how grateful I am, how wonderful you are, and how best to sing your praises to the masses...	蒂欧娜	因此，我才想要感谢拉拉大人，\n创作赞扬拉拉大人的曲子，\n宣扬拉拉大人的伟大……	蒂歐娜	所以我才會懷抱感謝\n以及對您的心意創作讚頌您的歌曲，\n向世人宣揚您是多麼出色……
Date_NPC9_04ID	35	Diona	ディオーナ	今は、そう思って取り組んでいます	Diona	And all of that works its way into my music now.	蒂欧娜	我现在就是想着这些进行创作的。	蒂歐娜	這就是我現在創作與歌唱時的想法。
Date_NPC9_04ID	36	Diona	ディオーナ	私から歌とララ様を想う気持ちを\n取り上げたら何も残りません	Diona	If you took those feelings away from me, I would have nothing left.	蒂欧娜	如果失去歌曲和我对拉拉大人的感情，\n我就什么都没有了。	蒂歐娜	如果從我的歌中奪走對拉拉大人的感情，\n那就什麼也不剩了。
Date_NPC9_04ID	37	Lara	ララ	（……なるほど）	Lara	(My goodness.)	拉拉	（……原来是这样。）	拉拉	（……原來如此。）
Date_NPC9_04ID	38	Lara	ララ	（そんなにも思われているなんて、\n　嬉しい……）	Lara	"(""I'm thrilled to have someone who thinks so fondly of me..."")"	拉拉	（没想到她这么重视我，\n　好开心……）	拉拉	（雖然我很想說，\n　我很高興妳對我的感情是如此之深……）
