file	id	romanized_name	localized_name	text	localized_name_en	text_en	localized_name_zh-CN	text_zh-CN	localized_name_zh-TW	text_zh-TW
Date_NPC9_04ID	39	Lara	ララ	（……なんて、これはそう素直に\n　思えませんわね、ディオーナ）	Lara	(Is not the reply she needs.)	拉拉	（……但是蒂欧娜，\n　我无法纯粹地为此感到欣慰。）	拉拉	（……但我可不能把事情看得這麼單純呢，蒂歐娜。）
Date_NPC9_04ID	40	Lara	ララ	いいかしら、ディオーナ。\nあなたは何も残らないと言いますが……	Lara	Now listen, Diona. Although you have said you would have nothing left...	拉拉	蒂欧娜，你听好。\n你说你什么都没有了……	拉拉	蒂歐娜，妳聽好了。雖然妳說自己什麼也不剩……
Date_NPC9_04ID	41		選択肢	周りをよく見なさい	Selection	Take a good look around you.	选项	好好看看周围吧	選項	妳好好看看周圍吧
Date_NPC9_04ID	42	Lara	ララ	周りをよく見なさいな。\nあなたはどこへやってきたのです？	Lara	Take a good look around you. Where are you currently standing?	拉拉	好好看看周围吧。\n你现在在哪里？	拉拉	但妳好好看看周圍吧。妳現在所在何處？
Date_NPC9_04ID	43	Lara	ララ	あなたは今ララ・キングダムに居るのです。\nそして、あなたを慕う多くの民がいる	Lara	Why, the Kingdom of Lara. Along with many fellow citizens who adore you.	拉拉	你现在身在拉拉王国。\n这里有许多仰慕你的国民。	拉拉	妳現在所在的地方是拉拉王國，\n而且有許多人民仰慕著妳。
Date_NPC9_04ID	44	Lara	ララ	彼らは決して歌やわたくしへの忠誠心で\nあなたを評価しているわけではありませんわ	Lara	They would never judge you based on your singing, or your devotion to me.	拉拉	他们绝不会用歌曲和\n你对我的忠心去评价你。	拉拉	他們對妳的看法，\n絕對不只是因為妳的歌或是對我的忠誠。
Date_NPC9_04ID	45	Diona	ディオーナ	……！	Diona	...!	蒂欧娜	……！	蒂歐娜	……！
Date_NPC9_04ID	46	Lara	ララ	彼らがいるではありませんか。\nそれとも、彼らが信じられないとでも？	Lara	They are here for you as well. Or do you not trust in them?	拉拉	不是还有他们吗。\n还是说你信不过他们？	拉拉	不是還有他們在嗎？\n還是妳認為他們不值得信任？
Date_NPC9_04ID	47	Diona	ディオーナ	いえ……そんなことありません！\n皆、大切な私の宝物です	Diona	No, of course I do! I treasure everyone here!	蒂欧娜	不……怎么会呢！\n大家都是我的最重要的珍宝。	蒂歐娜	不……沒有這回事！大家都是我重要的寶物。
Date_NPC9_04ID	48		選択肢	服飾の才能もある	Selection	You have your sewing skills as well.	选项	你有服装的天赋	選項	妳還有製作服飾的才能
Date_NPC9_04ID	49	Lara	ララ	服飾の才能もあるでしょう。\n何も残らないなんてことはありませんわ	Lara	You have your sewing skills as well. You will never be bereft of talent, my dear.	拉拉	你不是有服装的天赋吗。\n并不是什么都没有了。	拉拉	妳還有製作服飾的才能啊。才不是什麼也不剩。
Date_NPC9_04ID	50	Diona	ディオーナ	服は……ミーケちゃんだって作れます。\n私にしかできないことではありません	Diona	But...that's Mieke's domain. It isn't something that is unique to me.	蒂欧娜	服装……米珂也会做，\n没有什么是只有我能做的。	蒂歐娜	衣服……米珂也做得出來，並非只有我能做到。
Date_NPC9_04ID	51	Lara	ララ	ミーケが作っている服とは趣向が\n異なりますでしょう？\nあなたの服は唯一無二ですわ	Lara	Isn't it, though? Or do you think your designs and hers are alike in every way?	拉拉	你和米珂做的衣服\n风格不是不一样吗？\n你的衣服是独一无二的哦。	拉拉	但米珂做的衣服風格和妳不同吧？\n妳的衣服是獨一無二的。
Date_NPC9_04ID	52	Diona	ディオーナ	そうなのでしょうか……	Diona	I suppose not...	蒂欧娜	是吗……	蒂歐娜	是這樣嗎……
Date_NPC9_04ID	53		選択肢	私は素晴らしくなどない	Selection	I am not that magnificent.	选项	我没有那么伟大	選項	我其實一點也不出色
Date_NPC9_04ID	54	Lara	ララ	そもそもわたくしは素晴らしくなど\nないのです。わたくしはほんの少しの\nきっかけを作ったにすぎませんわ	Lara	Quite frankly, I am not that magnificent. I simply offered you a chance.	拉拉	我才没有那么伟大。\n我只是创造了一个小小的契机而已。	拉拉	其實我根本一點也不出色，\n我只不過是製造了一點契機罷了。
Date_NPC9_04ID	55	Lara	ララ	いつも言っているように、\n臣下の、そして民の頑張りがわたくしの国を\n作り上げています	Lara	As I have always said, the efforts of my retainers and subjects are what have built this country.	拉拉	就和我平时说的一样，\n多亏了大臣和国民们的努力，\n我们的国家才得以建成。	拉拉	正如我經常說的，\n是臣子和人民的努力造就了我的國家。
Date_NPC9_04ID	56	Lara	ララ	素晴らしいのはあなた。\nそうじゃなくて？	Lara	That makes you infinitely more wonderful. Wouldn't you agree?	拉拉	厉害的是你。\n不是吗？	拉拉	出色的人是妳才對，不是嗎？
Date_NPC9_04ID	57	Diona	ディオーナ	……ですが、ララ様が居なければ\n何もできなかったでしょう。\n私は素晴らしくなんかないです	Diona	But without you, we would never have accomplished all this. I couldn't claim such greatness for myself.	蒂欧娜	……可是，如果没有拉拉大人，\n不就什么都做不到吗。\n我才不厉害呢。	蒂歐娜	……但要是沒有拉拉大人，我什麼也做不到吧。\n我一點也不出色。
Date_NPC9_04ID	58	Lara	ララ	どうやら、またひとつディオーナのことが\n知れたみたいですわね	Lara	It would seem I have learned something new about you, Diona.	拉拉	我好像对蒂欧娜又了解了一点呢。	拉拉	看來我好像又多了解妳一點了呢。
Date_NPC9_04ID	59	Diona	ディオーナ	幻滅しましたか？	Diona	Has that ruined your image of me?	蒂欧娜	对我幻灭了吗？	蒂歐娜	您對我失望了嗎？
Date_NPC9_04ID	60	Lara	ララ	いいえ。嬉しくてよ？\nあなたのことを知れるのは	Lara	Of course not. It makes me happy. I want to know more about you.	拉拉	不会啊，能了解你，\n我很高兴哦。	拉拉	怎麼會呢？我很高興能了解妳。
Date_NPC9_04ID	61	Lara	ララ	ねえ、ディオーナ。私は思うのです。\nあなたの歌は、わたくしのためだけに\n作られたもののようですが……	Lara	Now, Diona... I am under the impression that your songs have all been crafted expressly for me.	拉拉	听我说，蒂欧娜。\n虽然你的歌是为我而写的，但我想……	拉拉	蒂歐娜，我是這麼想的。\n妳創作的歌曲幾乎可以說是\n完全以我為出發點……
Date_NPC9_04ID	62	Lara	ララ	このたびの祭りにおいては、\nそれは誤っているのではないかと	Lara	However, in light of this festival, I feel that you are mistaken in choosing to focus on me exclusively.	拉拉	在这次庆典上，\n这样是不对的。	拉拉	但就這次的祭典而言，\n這樣的創作方式是否其實是錯的呢？
Date_NPC9_04ID	63	Diona	ディオーナ	私のララ様に対する想いが\n重かったでしょうか……？	Diona	Are my feelings for you too ponderous, my queen?	蒂欧娜	是我对拉拉大人的感情\n太沉重了吗……？	蒂歐娜	我對您的心意太沉重了嗎……？
Date_NPC9_04ID	64	Lara	ララ	違いますわ。\nわたくしは……	Lara	Hardly. If anything, I...	拉拉	不是的。\n我……	拉拉	不是這個意思，我……
Date_NPC9_04ID	65		選択肢	あなたがもっと羽ばたく姿を見たいのです	Selection	Would like to see you spread your wings even further.	选项	想看到你展翅翱翔的样子	選項	想看到妳更加展翅高飛的樣子
Date_NPC9_04ID	66	Lara	ララ	あなたがもっと羽ばたく姿を見たいのです	Lara	Would like to see you spread your wings even further.	拉拉	想看到你展翅翱翔的样子。	拉拉	想看到妳更加展翅高飛的樣子。
Date_NPC9_04ID	67	Diona	ディオーナ	私が、羽ばたく……	Diona	You would...?	蒂欧娜	我展翅翱翔……	蒂歐娜	我展翅高飛……
Date_NPC9_04ID	68	Lara	ララ	わたくしのためだけの歌を歌うのではなく、\n皆に愛される歌姫として、\nより広い世界と人々を見て……	Lara	Rather than singing simply for my sake, you ought to see more of the world and the people who love you and your music.	拉拉	你不该只是唱为我而作的歌曲。\n身为大家喜爱的歌手，\n你应该看看更广阔的世界、更多的人……	拉拉	不是只為了我而唱歌，\n而是以眾所愛戴的歌姬之姿，\n去看看更廣闊的世界和人們……
Date_NPC9_04ID	69	Lara	ララ	たくさんの人のために歌うあなたを、\nわたくしは見たい	Lara	I want to see you perform for multitudes.	拉拉	我想看到你为众人唱歌的样子。	拉拉	並且為人們歌唱，這就是我想看到的。
Date_NPC9_04ID	70	Lara	ララ	もったいないですわよ？\nわたくしのことばかり見ていては。\nそれに……	Lara	After all, wouldn't it be a waste to sing for just one person? Besides...	拉拉	只看着我一个人的话，\n实在太浪费了。\n而且……	拉拉	光只是注視著我，可是很可惜的喔？而且……
Date_NPC9_04ID	71	Lara	ララ	あなたの歌を待っている\nたくさんの人が居るのです	Lara	So many others are waiting to hear you.	拉拉	有很多人都在等着你的歌声。	拉拉	有很多人在等著妳的歌曲。
Date_NPC9_04ID	72	Diona	ディオーナ	……！	Diona	...!	蒂欧娜	……！	蒂歐娜	……！
Date_NPC9_04ID	73		選択肢	あなたにひとり立ちしてほしいのです	Selection	Want to see you stand on your own two feet.	选项	我希望你能独立	選項	我希望妳能獨立
Date_NPC9_04ID	74	Lara	ララ	あなたにひとり立ちしてほしいのです	Lara	Want to see you stand on your own two feet.	拉拉	我希望你能独立。	拉拉	我希望妳能獨立。
Date_NPC9_04ID	75	Diona	ディオーナ	……そうですね。\n私は、ララ様に頼りっきりだったかも\nしれません	Diona	I see. I have been relying on you too much, my queen.	蒂欧娜	……说得也是。\n我可能有些太过依赖拉拉大人了。	蒂歐娜	……說得也是。我或許太依賴拉拉大人了。
Date_NPC9_04ID	76	Lara	ララ	そういうことではありませんわ。\nただ、わたくしのことばかり\n気にしなくともよいのです	Lara	That is not at all what I meant. I simply would like you to worry less about me.	拉拉	不是这样的。\n只是，你不用光顾着我。	拉拉	我不是這個意思，\n我只是覺得妳不用把所有精神都投注在我身上。
Date_NPC9_04ID	77	Diona	ディオーナ	……	Diona	...	蒂欧娜	……	蒂歐娜	……
Date_NPC9_04ID	78		選択肢	あなたを縛り付けていないかと思うのです	Selection	Do not wish to be what holds you back.	选项	我会想是不是我束缚住了你	選項	我擔心自己是不是束縛了妳
Date_NPC9_04ID	79	Lara	ララ	あなたを縛り付けていないかと思うのです。\nわたくしがあなたの王であるがゆえに	Lara	I do not wish to be what holds you back. After all, I am your queen.	拉拉	我会想是不是我束缚住了你，\n就因为我是你的国王。	拉拉	正因為我是妳的君王，\n所以我才會擔心自己是不是束縛了妳。
Date_NPC9_04ID	80	Diona	ディオーナ	そんなことはありません！\n私がララ様の歌を歌いたくて\n歌っているのです	Diona	You could never! I'm the one who wanted to sing about you!	蒂欧娜	不是那样的！\n是我想唱拉拉大人的歌，\n所以才在唱。	蒂歐娜	沒這回事！我是出於自己的意志為您歌唱的！
Date_NPC9_04ID	81	Diona	ディオーナ	……ですが、ララ様を心配させてしまって\nいたのですね。\n	Diona	Though, I see that I have worried you, Queen Lara.	蒂欧娜	……但是，却害拉拉大人担心了。	蒂歐娜	……但我讓您擔心了吧。
Date_NPC9_04ID	82	Lara	ララ	そこは気にしてはいないのですが……	Lara	That is nothing you need to concern yourself with.	拉拉	我倒是不在意这个……	拉拉	我在意的並不是這點……
Date_NPC9_04ID	83	Diona	ディオーナ	いえ、今まで気が付かず申し訳ありません。\n改めることにいたします……	Diona	No, I am sorry for not noticing sooner. I will do everything I can to change.	蒂欧娜	不，很抱歉我一直没注意到这一点。\n我会改正的……	蒂歐娜	不，實在抱歉，我至今都沒能察覺，我會改進的……
Date_NPC9_04ID	84	Diona	ディオーナ	ありがとうございます、ララ様。\n私は大切なことに\nぜんぜん気付けていませんでした	Diona	Thank you, Your Majesty. It would seem that I'd lost sight of something important.	蒂欧娜	谢谢您，拉拉大人。\n我根本没注意到重要的事物。	蒂歐娜	拉拉大人，謝謝您。我竟然忽略了如此重要的事……
Date_NPC9_04ID	85	Diona	ディオーナ	それなのに、私の成長を期待して\nここまで声をかけていただいた……。\nとても嬉しいです	Diona	And you even went out of your way to speak with me about it, to help further my growth. I couldn't be happier.	蒂欧娜	但您却还是期待着我的成长，\n并来告诉了我……\n我好开心。	蒂歐娜	但妳卻仍然期待我有所成長，\n並如此耐心地開導我……我真的非常開心。
Date_NPC9_04ID	86	Diona	ディオーナ	初めての音楽劇だと気負いすぎて、\n少しから回っていたのかもしれません	Diona	Since this is my first opera, I got so worked up that perhaps I could no longer see the forest for the trees.	蒂欧娜	这是我的第一部音乐剧，\n不由得用力过猛，有些手忙脚乱了。	蒂歐娜	我可能是因為第一次創作音樂劇，\n過度追求成功而有些迷失了方向。
Date_NPC9_04ID	87	Diona	ディオーナ	ララ様、私の悩みの種が見えた気がします。\nもう少しだけお待ちを！	Diona	I believe I see what the problem is now. Please be patient for just a little longer, Your Majesty!	蒂欧娜	拉拉大人，我好像知道我烦恼的源头是什么了。\n请再稍等等！	蒂歐娜	拉拉大人，我好像明白自己煩惱的原因了。\n請您再給我一段時間！
Date_NPC9_04ID	88	Diona	ディオーナ	ララ様の言うように、皆のことを見つめ、\n皆のための歌を作り上げてきます。\nそして必ず、祭りを成功させましょう！	Diona	As you said, I should be creating songs for all those around us. That will surely make the festival a success!	蒂欧娜	我会像拉拉大人说的那样，多关注大家，\n为大家创作歌曲，\n并且，一定会让庆典成功的！	蒂歐娜	我會照您所說，將目光放向人民，為所有人民作曲。\n並且一定會讓這場祭典成功！
Date_NPC9_04ID	89	Lara	ララ	ええ、その意気ですわ！\n期待していますわよ、ディオーナ	Lara	That's the spirit, Diona. I will be looking forward to your performance.	拉拉	嗯，就得要这股劲！\n我很看好你哦，蒂欧娜。	拉拉	嗯，這樣就對了！我很期待喔，蒂歐娜。
Date_NPC9_04ID	90	Diona	ディオーナ	はい！　それでは失礼します！	Diona	Yes, Your Majesty! Please excuse me!	蒂欧娜	嗯！那我就先告辞了！	蒂歐娜	是！那我先離開了！
Date_NPC9_04ID	91	Lara	ララ	（……きっと彼女は、大空へと\n　羽ばたいていくでしょう。\n　それでよいのですわ）	Lara	(I'm certain that Diona wants to reach out toward the heavens—as well she should.)	拉拉	（……她一定能飞向更广阔的天空。\n　这样就好。）	拉拉	（……她一定會朝向天空展翅翱翔吧。\n　這樣就好了。）
Date_NPC9_04ID	92	Lara	ララ	（わたくしだけの歌姫でなくなるのは\n　少し寂しくはありますが……）	Lara	(While it pains me slightly to lose my own personal diva...)	拉拉	（她不再是我一个人的歌手了，\n　倒是觉得有些寂寞……）	拉拉	（雖然她不再是我專屬的歌姬，\n　有點令人寂寞……）
Date_NPC9_04ID	93	Lara	ララ	（わたくしはララ・キングダムの王。\n　民の幸せのため、宝物を独占する\n　わけにはいきませんもの）	Lara	(I am the kingdom's queen. I mustn't monopolize any treasures that would bring my citizens joy.)	拉拉	（我是拉拉王国的国王，\n　为了国民的幸福，\n　我不能独占宝物。）	拉拉	（但我是拉拉王國的君王。\n　為了人民的幸福，我不能獨占寶物。）
Date_NPC9_04ID	94	Diona	ディオーナ	私、歌手としてもララ様の臣下としても\nまだまだですね……	Diona	I still have much to learn, both as a performer and as your vassal...	蒂欧娜	不管是作为歌手还是拉拉大人的大臣，\n看来我都还差得很远呢……	蒂歐娜	無論是身為歌手還是拉拉大人的臣子，\n我都還不夠成熟啊……
Date_NPC9_04ID	95	Diona	ディオーナ	もう一度鍛錬を積み直してきます。\nしばらく一人にしてください	Diona	I must redouble my training efforts. Please pardon my absence for the next while.	蒂欧娜	我会重新锻炼自己的。\n请让我自己待一会儿。	蒂歐娜	我會再重新好好修練的，請暫時讓我一個人獨處。
Date_NPC9_04ID	96	Lara	ララ	……	Lara	...	拉拉	……	拉拉	……
Date_NPC9_04ID	97	Lara	ララ	（王として彼女を導けませんでしたわ……\n　なんて、ふがいない……）	Lara	(Alas, I was not able to guide her as her queen. How shameful...)	拉拉	（身为国王却不能引导她……\n　我真没用……）	拉拉	（身為君王，我沒能成功開導她……\n　真是太沒用了……）
Date_NPC9_04ID	98	Diona	ディオーナ	～～～～～～！！！	Diona	...!!	蒂欧娜	～～～～～～！！	蒂歐娜	～～～～～～！！！！
Date_NPC9_05ID	0	Lara	ララ	（本日はいよいよ祭りの日。\n　音楽劇の準備が整い、ディオーナが\n　舞台に上がる）	Lara	(The date of the festival has finally arrived. With her preparations for the opera finished, Diona will soon take to the stage.)	拉拉	（今天终于到了举办庆典的日子。\n　音乐剧的准备已就绪，\n　蒂欧娜要登上舞台了。）	拉拉	（今天終於就是祭典了。\n　音樂劇已經準備完成，蒂歐娜將會登上舞台。）
Date_NPC9_05ID	1	Lara	ララ	（あの時、彼女は皆のための歌を作ると\n　言いました。その約束を守るべく、\n　ずっと調整を続けていたのです）	Lara	(She promised to make her songs more suitable for a wider audience, which she must have been working hard to fulfill.)	拉拉	（那时她说要为大家创作歌曲。\n　为了信守诺言，\n　她一直在进行调整。）	拉拉	（那時她說要創作獻給大家的歌，\n　為了遵守約定，她一直不斷調整內容。）
Date_NPC9_05ID	2	Lara	ララ	（そして彼女が初めて作った音楽劇が\n　始まり、今――）	Lara	(And so, the curtain rises on her first-ever opera...)	拉拉	（现在，她第一次创作的音乐剧就要开始了——）	拉拉	（而她首次創作的音樂劇終於拉開序幕，此刻──）
Date_NPC9_05ID	3	Lara	ララ	（この舞台は……いえ。\n　わたくしたちの世界は彼女の支配下にありました）	Lara	(She has the theater... No, she has our entire world under her thrall.)	拉拉	（这个舞台……\n　不，我们的世界都由她支配。）	拉拉	（這座舞台……不，我們的世界都在她的掌控中。）
Date_NPC9_05ID	4	Diona	ディオーナ	くすんだ景色を耕して　いつしか緑が溢れ出る\nそうして実るは黄金色　歌おう我らを繋ぐ音	Diona	The barren earth was tilled and tamed, soon giving way to green sprouts that matured into rich, golden hues.	蒂欧娜	耕耘于黯淡的风景，不知不觉绿色满溢，\n随后变为金色的收获，唱响连接你我的歌声。	蒂歐娜	耕耘黯淡的景色，直到綠意萌生，\n結成金黃色的果實。唱出連繫我們的歌聲吧。
Date_NPC9_05ID	5	Diona	ディオーナ	さあ、友よ！　あなたたちの声が聞こえる\n今より我が奏でるは　皆からもらい受けた音	Diona	Come, my friends! Let us sing in harmony! I have heard your voices, and will henceforth echo them in my music.	蒂欧娜	啊，朋友啊！我能听到你们的歌声，\n如今奏响的，是来自你们的歌声。	蒂歐娜	來吧，朋友們！我聽得見你們的聲音。\n此刻我所演奏的是大家給予我的聲音。
Date_NPC9_05ID	6	Lara	ララ	（この歌は、きっとディオーナ自身のことを歌った歌。\n　彼女から皆へ送る歌ですわね）	Lara	(I'm certain that this song is about Diona, giving herself to everyone through music.)	拉拉	（这首歌一定是在唱蒂欧娜自己。\n　是她送给大家的歌。）	拉拉	（這首歌唱的想必是蒂歐娜自己，\n　這是她送給大家的歌。）
Date_NPC9_05ID	7	Lara	ララ	（伝わってきますわ。あなたの、皆への想いが）	Lara	(I can hear her feelings for them quite clearly.)	拉拉	（你对大家的感情，全都传递出来了。）	拉拉	（我感受到妳對大家的心意了。）
Date_NPC9_05ID	8	Diona	ディオーナ	皆で歌おう　我らの星を～♪	Diona	O, sing, in honor of our star...	蒂欧娜	大家一起歌唱吧，我们的星星～	蒂歐娜	大家一起唱吧！為我們的星星歌唱～
Date_NPC9_05ID	9	Lara	ララ	（！　これは、先日聞いたフレーズですわね。\n　サビの繰り返し……皆で歌おう、ですか）	Lara	(Oh! This is the line she was singing the other day. I see. She turned it into the chorus to allow the audience to sing along.)	拉拉	（啊！这是前几天听到的句子。\n　副歌重复的部分，“大家一起歌唱”……）	拉拉	（啊！這是上次聽到的段落。\n　原來這段是循環的副歌……「大家一起唱」嗎……）
Date_NPC9_05ID	10	Lara	ララ	……	Lara	...	拉拉	……	拉拉	……
Date_NPC9_05ID	11	Lara	ララ	皆で歌おう　我らの星を～♪	Lara	O, sing, in honor of our star...	拉拉	大家一起歌唱吧，我们的星星～	拉拉	大家一起唱吧！為我們的星星歌唱～
Date_NPC9_05ID	12	Diona	ディオーナ	っ！	Diona	Oh!	蒂欧娜	唔！	蒂歐娜	唔！
Date_NPC9_05ID	13	Diona	ディオーナ	皆で歌おう　我らの星を～♪	Diona	O, sing, in honor of our star...	蒂欧娜	大家一起歌唱吧，我们的星星～	蒂歐娜	大家一起唱吧！為我們的星星歌唱～
Date_NPC9_05ID	14		観客A	……おい、ララ様が歌っているぞ！	Fan A	Hey! Queen Lara's singing!	观众A	……快看，拉拉大人在唱歌呢！	觀眾A	……喂，拉拉大人在唱歌耶！
Date_NPC9_05ID	15		観客B	同じフレーズを繰り返してるわ。\n私たちも続きましょう！	Fan B	I get it, it's one of those call and response things. We'd better join in too!	观众B	在重复同样的段落。\n我们也一起唱吧！	觀眾B	她不斷唱著同樣的歌詞，\n我們也跟著唱吧！
Date_NPC9_05ID	16		みんな	皆で歌おう　我らの星を～♪	Everyone	O, sing, in honor of our star...	所有人	大家一起歌唱吧，我们的星星～	大家	大家一起唱吧！為我們的星星歌唱～
Date_NPC9_05ID	17	Lara	ララ	お疲れさまですわ、ディオーナ	Lara	That was a fabulous performance, Diona.	拉拉	辛苦了，蒂欧娜。	拉拉	蒂歐娜，辛苦了。
Date_NPC9_05ID	18	Diona	ディオーナ	ララ様！　先程はありがとうございました！\nまさかララ様が私の曲を歌ってくださる\nなんて……	Diona	Queen Lara! Thank you for your earlier support! I never would have imagined that you would be singing one of my own songs...	蒂欧娜	拉拉大人，刚才真是太感谢了！\n没想到您居然会唱我的歌……	蒂歐娜	拉拉大人！剛才真是太謝謝您了！\n沒想到拉拉大人竟然會唱我的歌……
Date_NPC9_05ID	19	Lara	ララ	わたくしだけではありませんわ。\n皆が歌っておりましたもの	Lara	Why, it was not only me. The entire audience accompanied you.	拉拉	不只是我在唱，\n大家都唱了哦。	拉拉	不只是我，大家也都唱了。
Date_NPC9_05ID	20	Lara	ララ	この歌は聞きに来ていた多くの民の心に\n響いたのです。そして、わたくしたちの心が\n一つになった	Lara	Your music resonated with everyone in attendance, uniting their hearts as one.	拉拉	这首歌打动了许多来听歌的观众们，\n我们的心都连在了一起呢。	拉拉	這首歌感動了許多前來聆聽的人民，\n並且將我們的心連繫在一起。
