id	name	name_en	name_zh-CN	name_zh-TW	description	description_en	description_zh-CN	description_zh-TW
223	不思議な衝動	Mysterious Urge	奇妙的冲动	不可思議的衝動	最近は遊ぶ道具を中心に作ってたけど、海の家に飾るものを増やしてもいいんじゃない？って話になって、風鈴を作ってみたよ！\n風鈴で涼しい気分を味わってたら、なぜかクラウディアだけ着替えてきたんだ。\n「風鈴を見たら、なんだかどうしてもこの格好がしたくなっちゃって……」だって。\n確かに妙に似合ってたなぁ。\n来年はこういう格好で海に行くのもいいかもね（ライザ）	"Lately, we've been making a lot of things to play with, so after some discussion we decided to make some decorations for the Beach House instead: wind chimes!\nUpon feeling the cool breeze blow through them, Klaudia decided she had to change her outfit.\nShe said, ""When I saw the wind chimes, I just got the sudden urge to wear this...""\nIt did match the scene really well.\nMaybe next year we should all dress like that on the beach. (Ryza)"	大家提到最近做的大部分都是游乐用具，是不是也可以多做些用来装饰海边小屋的物品，于是我试着做了个风铃！\n我们正在享受风铃带来的凉爽气氛时，科洛蒂娅不知为什么去换了一身衣服。\n她还说，一看到风铃，就忍不住想换成这一身……\n说得真是没错，这一身好适合她啊。\n明年穿成这样去海边也不错吧。（莱莎）	大家談到最近主要都在製作娛樂用品，要不要也增加一些海之家的裝飾，於是我們就做了風鈴哦！\n在享受風鈴帶來的清涼感時，不知為何只有科洛蒂婭換了一套衣服。\n她說：「不知道為什麼，看到風鈴就很想穿上這身衣服……」\n確實意外地適合耶。\n明年或許可以穿上那套衣服去海邊玩！（萊莎）
224	騒ぐ昔の血	Echoes of the Past	骨子里的冒险精神	沸騰的往昔記憶	海の家に小屋を作って、だんだん賑わいも戻ってきたのですが、意外と問題は発生していないんです。なんでだろうと思ったら、鋭い視線が。確かに、あんな監視員さんがいたら誰も悪さできないよね……。\nでも、ライザは「故郷の護り手をしていた、こわ～いあの人の目をかいくぐってきたあたしなら……」となぜか対抗心を見せてました。別に何もするつもりはないそうですけど。\nあの人、か。確かにユナさんと少し雰囲気が似てるもんね（クラウディア）	"We built a little hut at the Beach House, and it's getting quite busy again. Even so, there have been no problems at all. And why is that? Because of the watchful eye of a certain knight. With someone like that watching over us, no one dares to cause trouble.\nRyza, feeling competitive, said, ""If I can sneak past the fearsome guardian of my hometown, I'm sure I can handle this..."" Not that she actually intended to do anything, though.\nBut I do remember that island guardian. Now that I think about it, she was quite similar to Juna. (Klaudia)"	建造了海边小屋，这个观光胜地也渐渐恢复了繁荣，真没想到事情会如此一帆风顺，这到底是为什么呢？正在疑惑的时候，就意识到了那股锐利的视线。是呀，有那样的监视员在，当然任谁都不敢干坏事了……\n不过莱莎却生出了对抗心理，觉得自己既然曾躲过那位可怕的故乡守护者的眼睛，现在也一定能成功……不过她好像也并没有具体想要干什么的意思。\n说起那个人……的确和尤娜小姐给人的感觉有点像呢。（科洛蒂娅）	自從我們在海之家建了小屋後，這裡也漸漸地恢復了以往的熱鬧氣氛，也意外地沒有任何騷動發生。正當我在思考原因時，突然感受到一股銳利的目光。確實，有那樣的看守人員在場，我想沒有人敢胡鬧吧……\n不過，萊莎卻莫名燃起反抗的鬥志，還說：「我在那個守護著家鄉又很～恐怖的人眼皮底下溜走過好幾次，所以我一定可以……」話是這麼說，但她似乎沒有打算做些什麼。\n那個人啊……的確和尤娜小姐的氣質有些像呢。（科洛蒂婭）
225	許容範囲	Within the Rules	容忍范围	允許範圍	いよいよビーチフラッグ大会開催！　私たちの他に、ユナやリンカ、シャルロッテ、シャリステラ、ウィルベル、ニオ、レジナも参加するんだって。ますます盛り上がっちゃうわね！\nウィルベルはホウキで飛ぶって聞いて、レスナは「私たちも錬金術で対抗したいところです」って息巻いてたわ。\n大会規則には、「持ち込み自由」って書いてあったけど、実際はどこまで許してもらえるのかしら？　乗り物を持ち込むのはダメ？　でも、ホウキだって乗り物みたいなものだし……。まぁ、私は身体一つで勝負するけど。だって、そのほうがわくわくするもの！（ヴァレリア）	"The beach flag race is finally here! Besides the four of us, Juna, Linca, Shallotte, Shallistera, Wilbell, Nio, and Regina will also be participating. It's going to be so exciting!\nWhen Resna heard that Wilbell was going to use her broom, she declared, ""We have to fight back with alchemy.""\nThe rules say you can bring whatever you want to help, but how far can we go? I guess we can't just bring some kind of vehicle to ride in, right? Isn't a broom kind of like a vehicle anyway? But I think I'll just go with my own strength! It's more exciting that way! (Valeria)"	沙滩夺旗大会终于开始了！除了我们之外，尤娜、琳卡、夏露罗蒂、夏莉丝堤拉、薇尔贝儿、妮欧和瑞吉娜也会来参加，看来会是一场激战啊！\n听说薇尔贝儿会用扫帚飞天之后，蕾斯娜就放狠话说我们也要用炼金术来对抗。\n虽然大会规则上写着可以携带任何东西，但不知具体会容忍到什么程度？总不能带载具吧？但扫帚也能算载具吧……不过我反正打算只用自身的能力来较量。这样才更让人有激情嘛！（瓦莱莉娅）	海灘奪旗大賽終於開始了！　除了我們以外，聽說尤娜、琳卡、夏露羅蒂、夏莉絲堤菈、薇爾貝兒、妮歐、瑞吉娜也會參加。氣氛越來越熱鬧了呢！\n當蕾斯娜聽說薇爾貝兒要用掃帚飛行時，氣憤地說：「我們也正想用鍊金術和妳一決勝負呢！」\n大賽規則上是寫了「可自由攜帶道具」，但實際上究竟開放到什麼程度呢？　不能攜帶交通工具嗎？　不過，掃帚好像也是交通工具……算了，反正我就赤手空拳來決勝負，因為那樣更叫人興奮嘛！（瓦萊莉婭）
226	錬金術士の意地	An Alchemist's Pride	炼金术士的求胜心	鍊金術士的志氣	ビーチフラッグ大会が終わったよ。レスナはあたしと練習した時みたいに、最後まで諦めないでフラッグに食らいついてた。身体も、錬金術も、思いっきり使って。\nレスナはよく運動が得意じゃないって言うけど、こういう根性はみんなに負けてないし、錬金術士としても大事な素質だから誇っていいと思う！\n他のみんなも頑張ってたし、大会中ずっと笑顔だったのが印象的だった。レスナも言ってた通り、みんなで参加できたのが豪華賞品だったかもね。\nそういえば、ロマンさんとユナさんたちが真剣な顔で話してたけど、何の話をしてたんだろ……？（ライザ）	The beach flag race has come to an end. Just like when she was practicing with me, Resna clung to the flag till the end, using both her own strength and alchemy.\nShe often says she's not very good at sports, but her determination really is unmatched. That's a valuable trait for an alchemist. She should be proud!\nEveryone else did their best too, and I won't forget the smiles throughout the race any time soon. As Resna said, participating together was the real fabulous prize in the end.\nBy the way, I'm still wondering what Roman and Juna were discussing so seriously... (Ryza)	沙滩夺旗大会结束了。蕾斯娜就像和我练习的时候一样，直到最后都保持着斗志，用自己的身体和炼金术等等一切可行的方式去争夺那面旗帜。\n虽然蕾斯娜总说自己不擅长运动，但论毅力可不输别人，这是作为炼金术士很重要的素质，她大可以为此自豪吧！\n其他参赛者也都很努力，比赛中所有人脸上都带着灿烂的笑容。也许如蕾斯娜所说，能和大家一起参加就是最豪华的奖品了。\n对了，之前罗曼先生和尤娜小姐一脸严肃地在交谈，到底在说些什么呢……？（莱莎）	海灘奪旗大賽結束囉。蕾斯娜就像與我練習時一樣，直到最後都拼了命地去搶旗子，並用上自己能發揮的所有體力和鍊金術。\n雖然蕾斯娜很常說自己不擅長運動，但她的毅力並不輸給他人，而且我覺得那是身為鍊金術士很重要的資質，所以她應該為自己感到驕傲！\n其他人也都非常努力，大家在比賽時都一直帶著笑容的模樣讓我印象深刻。我想就像蕾斯娜說的，或許能和大家一起參賽就是最豪華的獎品了。\n話說回來，羅曼先生和尤娜小姐她們一臉認真地在談話，他們在說些什麼呢……？（萊莎）
227	お揃いの帽子	Matching Hats	同款帽子	一樣的帽子	私のように直射日光が苦手な人にも安心して海を楽しんでもらえるように、日よけになるものを貸し出そうということになりました。宣伝がてら４人でお揃いの麦わら帽子を被ってみたのですが、少しはしゃぎすぎでしょうか？\nライザ先輩は「いいじゃない、こういうのも。次はサングラスをお揃いでかけよう」と仰っていました。\n楽しそうですけど、かなり怪しい集団に思われちゃうかも……（レスナ）	"To help people like me who struggle with direct sunlight enjoy the beach more, we decided to rent out various sun-blocking items. To promote the items, the four of us wore matching straw hats, but maybe we got a little too carried away...\nRyza said, ""Why not? Next time, let's all wear matching sunglasses.""\nIt sounds fun, but we might look a bit like a suspicious group if we all wear the same sunglasses... (Resna)"	为了让像我一样不喜欢烈日暴晒的人也能安心享受大海，我打算出租一些能遮阳防晒的东西。于是4个人戴了同样的草帽来顺便做宣传，不过我担心是不是玩得夸张了点？\n莱莎前辈倒是觉得这样很不错，还说下次想一起戴太阳眼镜登场。\n虽然感觉很有趣，但打扮成那样恐怕会惹人怀疑吧……（蕾斯娜）	我決定提供遮陽物品的租借服務，讓和我一樣不喜歡強烈日照的人也能在海邊安心玩耍。在宣傳的同時，我們4人戴上了同款的草帽，但我擔心這樣會不會有點嬉鬧過頭了呢？\n萊莎前輩說：「有什麼關係，這樣也挺好的啊。下次大家一起戴太陽眼鏡吧！」\n雖然聽起來很有趣，但感覺會被當成怪人團體……（蕾斯娜）
228	あえてここから	I'd Rather Watch from Here	从这里望着就足够了	特意從這個角度觀賞	ライザと火を囲んでいたら、元の世界にいた時のことを思い出しちゃいました。\nねえ、ライザ。冒険中の野営でもこんな風に火を囲んで、私が眠れるまでずっと話し相手になってくれたよね。きっと眠かったはずなのに。おかげでライザが隣にいるときは、外でも安心して眠れるようになったんだよ。\n……と話していたら、どこからか視線が。見ると、レスナさんが遠くから「ああ、尊い……」と言いながら眺めてました。こっちに来ませんか？と誘ったのですが、ぜんぜん動かず。交ざってもらってよかったのに……（クラウディア）	"As I sat by the fire with Ryza, I remembered some of our adventures in our original world.\n""Say, Ryza. During our travels, you kept me company by the fire until I fell asleep, right? You must have been tired yourself, but thanks to you, I was able to sleep soundly even outside. Thank you.""\nWhile we were talking, I noticed someone watching us. It was Resna from a distance, whispering, ""Ah, what a precious moment..."" I invited her to join us, but she just watched, not moving an inch. It would have been nice if she had just joined in... (Klaudia)"	我和莱莎一起坐在篝火边，回忆起了在原来世界中的一些往事。\n莱莎，记得我们出门冒险时，也曾在野外扎营，围坐在篝火旁，明明你也很累了，却还陪我说话一直到我睡着。只要莱莎你在身边，就算身在野外我也能安心入眠。\n我们聊着聊着，忽然察觉了什么人的视线。张望四周发现原来是蕾斯娜小姐在远处看着我们，一脸憧憬的样子。我们问她要不要来一起聊天，她却不肯过来。真是的，来加入我们不是更开心嘛……（科洛蒂娅）	和萊莎一起圍坐在火堆旁時，我想起了在原本的世界發生過的事。\n萊莎，妳還記得嗎？以前在冒險途中紮營時，我們也是像這樣坐在火堆旁。妳總是陪著我說話，直到我睡著為止，但妳自己一定也很睏吧。多虧了有妳在身旁，就算身在野外我也能安心睡覺了哦。\n……話說到這裡，我突然感覺到一股視線。仔細一看，才發現是蕾斯娜在遠處盯著我們，嘴裡還一邊說道：「啊──何等美好的畫面……」雖然我問她要不要過來這裡，但她卻一動也不動。其實她可以和我們一起聊天呀……（科洛蒂婭）
229	「爆弾魔」の性	The Bomber's Nature	“炸弹魔”的本性	「炸彈魔」的本性	花火の準備をしてたら、マルローネさんが遊びに来たんだけど……。「花火玉？　ようは爆弾ってこと？　あたしも手伝うよ」となぜかノリノリ。お手製の爆弾を打ち上げ筒に入れようとしたから、あたしとレスナで慌てて止めた。\n気持ちは嬉しいけど、それだけで十分！　こんな理由で花火大会が中止になったら大変だから！\nでも、大きい魔物と戦うときはこういう方法もアリかもしれないね（ライザ）	"While we were setting up the fireworks, Marlone came by and got a little too excited, saying, ""Fireworks? You mean bombs? Let me help!"" She tried to load her homemade bombs into the launchers, so Resna and I quickly stopped her.\nI appreciate the enthusiasm, but that alone is enough! We can't risk the fireworks festival getting canceled because of this!\nThat said, if there were ever a battle with a big monster, those bombs would definitely come in handy. (Ryza)"	在我们准备烟花的时候，玛洛娜小姐来玩了……听说我们要准备烟花，她说烟花和炸弹都是一回事，自告奋勇地来帮忙。我和蕾斯娜赶忙趁她把亲手做的炸弹塞进烟花筒之前阻止了她。\n你的心意我领了，你只要贡献心意就足够了！要是因为这个而导致烟花大会中止那可不得了啊！\n不过，和巨大魔物战斗的时候，这倒是个不错的方法。（莱莎）	當我們在準備煙火時，瑪洛娜小姐也來玩了。但她不知為何一臉興致勃勃地說：「煙火球？　簡單來說就是炸彈吧？　我也要來幫忙！」當她準備將親手做的炸彈放進發射筒時，我和蕾斯娜連忙阻止了她。\n我很感謝她的心意，但有那份心意就夠了！　如果因為這個原因導致煙火大會停辦，那可就糟了！\n不過和大型魔物戰鬥時，或許可以考慮用這招耶。（萊莎）
230	水浴びの利点	Refreshing Shower	冲凉的好处	沖澡的好處	ハイディが迎えに来たから、宿に帰る前に身体を水で流したの。「これがあると、すぐにさっぱりできていいわね。雨でも十分だったけど」って言ったら、「みんなあんたほど野生児じゃないの」って言われちゃった。\n「まぁ、雨は浴びたい時に浴びれないものね」って返したら、「そういうことじゃない！」って突っ込まれちゃった。後からレスナにこの話をしたら、「ハイディさんの言う通りだよ」だって。\nうーん、結構大事なことだと思うんだけど……（ヴァレリア）	"Heidi came to pick me up, so I washed off at the showers before heading back to the inn. I said, ""It's great to have this, you can get freshen up anytime! Rain is just as good though,"" and Heidi replied, ""Not everyone is wild enough to jump in the rain like you.""\nI answered, ""True. I guess you can't always get rain when you need it,"" and she replied, ""That's not the point!"" Later, when I told Resna about this, she agreed with Heidi.\nI still think it's pretty relevant, though... (Valeria)"	我去接海蒂的时候，看到她正在冲凉，之后才打算回住处。我说冲凉不错，能马上让人全身舒爽，不过淋场雨效果也是一样的。海蒂回嘴说一般人才不会像我那么野。\n我说也对，毕竟雨不是想淋就能淋到的，结果她吐槽说问题不在这里。之后我和蕾斯娜说了这件事，蕾斯娜也说海蒂说得一点没错。\n奇怪，这明明是关键问题吧……（瓦莱莉娅）	因為海蒂來接我，我在回旅館前先沖了澡。我向海蒂說：「這個真方便，一下就能把身體清乾淨。雖然我用雨水就夠了。」但她聽了以後表示：「又不是每個人都和妳一樣是個野孩子。」\n於是我回道：「也是啦，畢竟不是天天都能用雨水洗澡。」但這回又被她吐槽：「重點不是那個啦！」後來我和蕾斯娜提了這件事，她說：「海蒂小姐說的沒錯哦。」\n嗯……但我覺得那個才是重點啊……（瓦萊莉婭）
231	今後の大盛況を祈って	Wishing for Continued Success	预祝盛况空前	祝願今後遊客如織	ついに海の家が万全の形に！　クラウディアさんがみんなの労をねぎらって飲み物や食べ物を提供してくれました。\n「みんな、手伝ってくれて本当にありがとう」と言っていましたが、こちらこそですよ！\nヴァレリアは「私は食べてただけだけどね」と言いつつその口にご飯を詰め込んでいました。\nでも、実際その大食いでお客さんを呼び込んでいたので、胸を張っていいと思います。\nこの調子で浜辺全体が盛り上がって、花火大会が無事開催されますように！（レスナ）	"The Beach House is finally complete! Klaudia provided food and drink to celebrate everyone's hard work.\nShe said, ""Thank you all for your help,"" but we should be thanking her too! This was so much fun!\nValeria, stuffing her mouth, replied, ""All I really did was eat.""\nHer appetite actually helped attract customers though, so I think she can hold her head up high.\nI hope the beach continues to flourish and that the fireworks festival will go ahead without any trouble! (Resna)"	海边小屋的每个部分都筹建完毕了！科洛蒂娅小姐为了犒劳大家，拿来了饮料和食物。\n她感谢大家能够出力帮忙，但应该是我们道谢才对啊！\n瓦莱莉娅一边说“我只是在白吃白喝，没帮什么忙”，一边不停往嘴里塞着米饭。\n不过你的食量也吸引来了好多客人，我认为你也是个做出了切实贡献的帮手。\n希望海滩的火热气氛继续保持下去，烟花大会能够顺利举行！（蕾斯娜）	海之家終於大功告成了！　科洛蒂婭小姐招待了飲料和食物來慰勞大家。\n雖然她說：「真的很感謝大家的幫忙！」但我才應該謝謝她才對！\n瓦萊莉婭一邊把飯往嘴裡塞，一邊說：「我一直都只負責吃而已。」\n不過，正是她驚人的食量吸引了很多客人前來，我覺得她可以更有自信一些。\n希望整座海灘可以變得越來越熱鬧，讓煙火大會順利舉行！（蕾斯娜）
232	広がる楽しみ	Boundless Fun	传播快乐	逐漸擴散的樂趣	ロマンさんからお願いされて、錬金術で花火を作ることになったよ。\n早速レスナと話し合い。図を描きながら説明するために紙を探そうとしたんだけど、そんなことしなくても砂浜に描けばいいってことに気付いたの。それで、砂浜に指で図を描きながら相談したんだ。\nこの砂浜一面が黒板だと思ったらわくわくしない？\nずっと残しておけないのが難点だけど、話し合いをするだけなら十分だよね（ライザ）	Roman asked me to make fireworks with alchemy. I quickly started discussing it with Resna and was about to look for some paper to draw diagrams on when I realized I could just draw in the sand. We ended up drawing diagrams with our fingers in the sand while we talked.\nIsn't it exciting to think of the whole beach as one giant chalkboard?\nToo bad we can't keep the notes there forever, but it's more than enough for a brief discussion. (Ryza)	受罗曼先生所托，我要用炼金术制作烟花了。\n于是我立刻去找蕾斯娜商量做法。我想找张纸画图辅助说明，这时突然意识到可以直接画在沙滩上。于是我们就在沙滩上一边讨论，一边用手指在沙滩上写写画画。\n不觉得把一整片沙滩当作黑板讨论起来很令人振奋吗？\n虽然不能把记录留存下来，但用来临时商量事情还是非常好用的。（莱莎）	羅曼先生拜託我用鍊金術製作煙火，\n因此我立刻和蕾斯娜開始討論。為了可以一邊畫圖一邊說明，我們本來打算去找紙，但後來發現只要在沙灘上畫就好，根本不需要紙。於是，我們一邊用手指在沙灘上畫圖一邊討論了起來。\n不覺得這一整片沙灘都是我們的黑板很令人興奮嗎？\n雖然沒辦法保留太久，但如果只是拿來討論就已經很足夠了。（萊莎）
233	冒険心と出来心	Adventurous Spirit, Mischievous Spirit	冒险和捉弄之心	冒險精神和一時興起	花火の素材集めを兼ねて、近くの洞窟に肝試しに行くことになりました。中はいかにも何かいそうな、おどろおどろしい雰囲気。その上ライザ先輩が面白がって怪談話を始めたんです！　でも、ヴァレリアが「お化けが出たら私がぶっ飛ばしてあげるから」と言ってくれたおかげで、安心して進むことができました。\nライザ先輩は後から「レスナが怖がる顔がかわいくて、つい」と仰っていましたが、悪ふざけが過ぎますよ！　そういうやんちゃなところもライザ先輩の魅力ですけど……（レスナ）	"While we were gathering materials for the fireworks, we decided to take on a test of courage in a nearby cave. It was really creepy inside, as if something was going to jump out at any moment. On top of that, Ryza started telling ghost stories! But thanks to Valeria saying, ""Don't worry, if a ghost shows up, I'll just punch it away,"" I was able to keep going without getting too scared.\nLater, Ryza said, ""Your scared face was just too cute to resist,"" but I still think she went a bit too far this time! I guess that mischievous side of her is part of her charm, though... (Resna)"	大家决定在附近的洞窟里举办试胆大会，顺便收集烟花素材。洞窟里阴仄仄的，看上去就像有鬼的样子。偏偏莱莎前辈还故意讲鬼故事吓人！但瓦莱莉娅说如果有鬼怪出现，她会负责打跑它们，所以我也放心往里走了。\n莱莎前辈在我身后说“蕾斯娜害怕的样子太可爱了，忍不住就想捉弄你”，这也太过分了吧！虽然这种淘气的性格也是莱莎前辈的魅力之一……（蕾斯娜）	一行人前往附近的洞窟蒐集煙火的素材，順便舉辦試膽大會。總覺得洞窟內似乎有什麼在蠢蠢欲動。所以，興致高昂的萊莎前輩就開始說起了鬼故事！　不過，幸好瓦萊莉婭跟我說：「妖怪出現的話我會幫妳揍飛它」，我才能安心地在洞窟中前進。\n萊莎前輩後來說：「誰叫蕾斯娜害怕的表情實在太可愛了，我忍不住嘛。」她真是太過分了！　雖然這種調皮的個性也是萊莎前輩的魅力所在啦……（蕾斯娜）。
