id	name	name_en	name_zh-CN	name_zh-TW	description	description_en	description_zh-CN	description_zh-TW
234	やりすぎ注意！	Don't Overdo It!	过犹不及！	請適可而止！	花火の素材収集を終えてレスナさんとライザに合流したら、なぜか二人とも凍え死にそうな様子で震えてました。\nこんなに暑いのにどうして？と尋ねたら、「猛暑で汗が止まらないから、冷たく感じる塗り薬を全身に塗って、さらに風を起こす道具も作ったらこうなった」とのこと。やりすぎちゃったみたいです。\n冷たく感じる塗り薬……売ったらとても人気が出そう。使い方には注意が必要だけど。\nまぁ、わざわざ風を起こす道具まで用意して使うのはライザたちくらいかな……？（クラウディア）	"After gathering some materials for the fireworks, I met back up with Resna and Ryza, only to find them shivering as if they were freezing to death.\nI asked them why, since it was so hot, and they explained, ""We were so hot and sweaty in this heat, so we applied some ointment that cools you down and made a tool that blows wind, and ended up super cold instead!"" It seems they went a bit overboard.\nAn ointment that can cool you down... I bet it would be really popular if we sold it, although we would have to warn everyone about how to use it properly.\nBut honestly, only Ryza and Resna would go so far as to make a wind-generating tool to use with it... (Klaudia)"	我收集完素材后去跟蕾斯娜小姐还有莱莎汇合，却发现她们不知为何正浑身发抖，一副快要冻死的样子。\n我问她们这么热的天怎么会这样，她们告诉我是因为太热出了一身汗，于是把让人觉得凉爽的软膏涂满了全身，还做了能吹风的道具。原来是采取的纳凉措施过度了。\n让人觉得凉爽的软膏……如果拿去卖一定会畅销吧。买家一定要注意使用方法啊。\n不过会配合吹风道具使用的也只有莱莎她们了吧……？（科洛蒂娅）	蒐集完煙火素材之後，我和蕾斯娜小姐及萊莎會合，看到兩人不知為何一直在顫抖，一副快凍死的樣子。\n當我問道：「明明天氣這麼熱，妳們是怎麼了？」的時候，她們表示：「因為天氣太熱汗流不止，所以在全身塗滿會感到涼爽的藥，還做出起風的道具，就變成這樣了。」看來是做過頭了。\n會感到涼爽的藥……拿去賣的話應該會大受歡迎吧。雖然使用時得很小心就是了。\n不過，大概只有萊莎她們會特地準備能起風的道具了……吧？（科洛蒂婭）
235	禁断の味	Forbidden Delights	禁忌的味道	禁忌的味道	とある虫が花火の素材に使えそうとのことで、木に蜜を塗っておびき寄せることになりました。ですが、しばらくして現れたのは、虫ではなくヴァレリア！　空腹のあまり、甘い匂いにつられてしまったみたいです。ヴァレリアには蜜の代わりにスイカをあげましたが、その後も折に触れて「ねえ、あの蜜、やっぱり食べちゃダメ？　かき氷にかけたら美味しいと思うんだけど」と尋ねてくるんです。ヴァレリアらしいなあ。\nクラウディアさんは「食べちゃいけないものほど美味しそうに見えますよね。焼く前のケーキの生地とか」と、少し共感していました（レスナ）	"We heard that a certain bug might be useful as a material for the fireworks, so we decided to try to lure it out by spreading some honey on a tree. But after a while, it wasn't the bug that showed up—it was Valeria! She was so hungry that the sweet smell attracted her instead. We ended up giving her some watermelon in place of the honey, but even after that, she kept asking, ""Hey, can't I eat that honey too? I bet it'd be delicious on shaved ice."" That's so like Valeria.\nKlaudia even empathized a bit, saying, ""Eating things you're not supposed to eat always seems more tempting, like licking the cake batter before you bake a cake."" (Resna)"	制作烟花所需的素材里有一种虫子，于是我往树上涂了蜜糖，打算把虫子吸引过来。结果等了一会儿，虫子还没来，瓦莱莉娅倒是先来了！她似乎是因为太饿，被蜜糖的香气吸引过来了。虽然我给了她西瓜，但她还是三番两次地问我“真的不能吃那个蜜糖吗？浇在刨冰上一定会很好吃的”，真不愧是瓦莱莉娅啊。\n科洛蒂娅小姐则颇有同感地说：“就和还没烤制的蛋糕坯一样，越是不让吃的东西看起来就越好吃呢。”（蕾斯娜）	據說有一種蟲子能作為煙火的素材，於是我決定在樹上塗糖蜜吸引牠們過來。但不久後現身的竟然不是蟲，而是瓦萊莉婭！　她似乎是因為太餓了，被甜甜的味道所吸引。所以作為糖蜜的替代品，我給瓦萊莉婭吃了西瓜。但她之後還是會不時問我：「嘿，那個糖蜜真的不能讓我嘗嘗嗎？　我覺得淋在刨冰上一定很好吃。」真像是瓦萊莉婭會說的話呢。\n科洛蒂婭小姐也說過：「越是不能吃的東西，看起來就會越美味。就跟烤熟之前的蛋糕麵糊一樣。」所以我也不是不能理解。（蕾斯娜）
236	月明かりに見守られて	Watched Over by Moonlight	月光的守护	被月光守護	花火の試作を終えた後。星が綺麗なので、みんなで天体観測をすることに。この世界の星のことを楽しそうに教えてくれるレスナさんと、興味津々で聞くヴァレリアさん。そんな二人を微笑ましく眺めてたんですが、ふと横を見ると、座ったままぐっすり眠るライザが。後からレスナさんに「ごめん、あたしも興味はあったんだけど……」と謝っていました。\n昼間いっぱい遊んで、花火の試作も頑張ったから、疲れちゃったんだよね？　大丈夫、分かってるよ（クラウディア）	"After finishing our fireworks prototypes, we decided to do some stargazing because the stars were so beautiful. Resna excitedly explained all about the stars of this world, and Valeria listened with keen interest. As I watched them with a smile on my face, I noticed that Ryza had fallen asleep next to me while still sitting up. Later, she apologized to Resna, saying, ""Sorry, I was interested, but...""\nWe had been playing all day and working hard on the fireworks, so it's no wonder she was tired. Don't worry, Ryza, we understand. (Klaudia)"	烟花试做结束后，因为星空很美，大家决定一起观测星星。蕾斯娜小姐兴致勃勃地说了许多这个世界星星的知识，瓦莱莉娅小姐听得津津有味。我笑着看了她们一会儿，一转头发现莱莎已经坐着睡着了。后来她跟蕾斯娜小姐道歉说：“对不起，其实我也挺感兴趣的，只是……”\n应该是因为白天一直在闹腾，又努力找素材试做了烟花，太累了才会睡着的吧？没关系，大家能理解哦。（科洛蒂娅）	在試作煙火之後。因為夜空中的星星十分美麗，大家便一起觀星。瓦萊莉婭小姐津津有味地聽著蕾斯娜小姐興致高昂地介紹這個世界的星星知識。正當我看著這幅和樂融融的景象時，一轉頭卻發現坐在一旁的萊莎竟然睡著了。後來蕾斯娜小姐還為此道了歉：「抱歉，都是因為我一個人講個不停……」\n她大概是因為白天玩得很盡興、試作煙火時也很努力，所以累了吧？　沒關係，我都知道喔。（科洛蒂婭）
237	不変の意匠？	Unchanging Trends?	不变的设计？	不變的設計	花火大会当日の昼。花火の試し打ちをしていたら、その音で近くの遺跡で眠っていた水着ゴーレムが目覚めちゃったみたい。浜辺を荒らしだしたから、私たちで追い出しちゃった。\nゴーレムは好奇心が強い魔物で、周囲に落ちているものを拾って身につける習性があって、だから水着を着ていたんだって。\nそれにしても、どこの誰があんな大きな水着を落としたのかしら。レスナは「もしかしてあの水着は、消えてしまった古代文明の遺物？」って推理してたけど。古代文明でも、水着はあの形なのかしら（ヴァレリア）	"On the day of the fireworks festival, while we were doing a test launch, the noise woke up a Swimsuit Golem that had been sleeping in the nearby ruins. It started wreaking havoc on the beach, so we had to chase it away.\nGolems are curious creatures, and they have a habit of picking up things they find lying around and wearing them, which is why it was wearing a swimsuit.\nStill, who in the world could have left behind such a huge swimsuit? Resna mused, ""Maybe the swimsuit is a relic of an ancient civilization that's long gone now?"" I wonder if swimsuits have always been that shape, even in ancient times... (Valeria)"	烟花大会当天白天，演练燃放烟花的爆炸声似乎惊醒了附近遗迹中沉睡的泳装魔巨人。它跑来海边闹事，我们齐心协力把它赶走了。\n据说魔巨人是好奇心很强的魔物，会捡拾掉落在附近的东西并穿戴在身上，所以它才会穿着泳装。\n但是，那么大的泳装到底会是谁掉的呢？蕾斯娜猜测那件泳衣是已经消失的古代文明的遗物，但古代文明的泳装会和现在的设计一样吗？（瓦莱莉娅）	煙火大會當天白天。我們開始試放煙火時，那聲音似乎吵醒了在附近遺跡沉睡的泳裝魔巨人。因為牠讓海邊陷入混亂，我們便把牠趕了出去。\n魔巨人是擁有強烈好奇心的魔物，有著撿起掉落在四周的東西並穿在身上的習性。所以，牠才會穿著泳裝吧。\n不過，究竟是誰遺失了如此大件的泳裝呢？而蕾斯娜做出了「說不定那件泳裝來自消失的古代文明？」這樣的推論。古代文明的泳裝也是長這個樣子嗎？（瓦萊莉婭）
238	みんなへのご褒美	A Reward for Everyone	所有人努力的回馈	給大家的獎勵	ついに花火大会が始まったよ！　浜辺でレスナと見ていたら、「綺麗だね」「いい思い出になるね」って喜ぶお客さんたちの声が次々と聞こえてきて、本当に嬉しかった。頑張った甲斐があったよ……！\nクラウディアたちにもしっかり届いてたみたい。「つい得意げな顔をしちゃった」って言ってた。\nあたしたち、すっごく頑張って海の家を盛り上げて、花火大会開催にこぎつけたもんね。存分に得意げな顔しちゃおう（ライザ）	"The fireworks festival has finally begun! As I watched from the beach with Resna, we could hear the voices of guests who enjoyed the show, saying things like, ""So beautiful,"" and, ""I'll never forget this."" It made me so happy. All of our hard work paid off!\nIt seems that Klaudia and the others feel the same, as Klaudia said, ""I can't help but feel a little proud.""\nWe all worked really hard to liven up the Beach House and pull off this fireworks festival, so I think we can all be as proud as we like! (Ryza)"	烟花大会终于要开始了！我和蕾斯娜在海边看着烟花，听到游客们不断发出惊喜的赞叹，“好美啊”“会是一段美好的回忆呢”。我感到欣慰极了。努力果然是有回报的……！\n科洛蒂娅她们也听到了游客们的赞美，还“情不自禁地眉飞色舞了起来”。\n毕竟我们努力给海边小屋招揽了好多顾客，还成功举办了烟花大会，所以不必害羞，尽情眉飞色舞吧。（莱莎）	煙火大會終於開始了！　和蕾斯娜在海邊欣賞煙火時，聽到觀眾開心地讚嘆道「好美啊」、「會成為美好的回憶呢」等話語，我們真的都非常高興。一切辛苦都值得了……！\n科洛蒂婭她們似乎也都一字不漏地聽到了。還表示「一不小心就得意了起來」呢。\n畢竟我們可是用盡全力替海之家招攬客人，還辦了煙火大會啊。就讓我們盡情為自己感到驕傲吧。（萊莎）
239	夢の中でも	Even in Their Dreams	即便在梦中	即便在夢中	夜、二人とも遊び疲れて寝ちゃったみたい。海の家を作って、ビーチフラッグで遊んで、花火を打ち上げて……盛りだくさんだったものね。\n二人の寝顔を見ながら、クラウディアが「普段の仕事でハイネ州に来ても、思い出しちゃうだろうな」って呟いてた。私もきっとそう。\n二人も、楽しかった思い出を夢の中で振り返っていたのかしら。\n来年もまた、みんなでここに来たいわ。\nレスナが言ってた通り、思い出はいくつあっても嬉しいものだから（ヴァレリア）	"It was getting late, and it looks like the two of them fell asleep, exhausted from all the fun. We built the Beach House, enjoyed the beach flag race, set off some beautiful fireworks... It has been quite the adventure.\nAs Klaudia watched over the two of them sleeping, she whispered, ""Even after I'm back in Haine and working, I'm sure I'll never forget this."" I'm sure I'll be the same.\nI imagine the two of them are also reliving the fun we had in their dreams.\nI hope we can all come back here again next year!\nAs Resna said, you can never have too many good memories! (Valeria)"	晚上，蕾斯娜和莱莎都玩累睡着了。打造海边小屋、争夺沙滩旗、放烟花……玩得真的很尽兴呢。\n科洛蒂娅看着那两人的睡颜，轻声说：“今后因为工作再来海涅州的时候，也会想起这段回忆吧。”我想我也一样。\n不知道她们两个有没有在梦中回味这两天发生的事呢。\n蕾斯娜说希望明年还有机会和大家一起来这里。\n她说得没错，快乐的回忆再来多少都欢迎。（瓦莱莉娅）	晚上，那兩人似乎因為玩得太累不小心睡著了。大家除了打造海之家，還玩了海灘奪旗、放煙火……過得相當充實呢。\n看著那兩人的睡臉，科洛蒂婭喃喃地道：「之後就算因平時的工作來海涅州，也會忍不住想起這些回憶吧！」我肯定也是如此。\n那兩人是否正在夢裡回味這些美好時光呢？\n明年也想再和大家一起來這裡。\n就像蕾斯娜說的，快樂的回憶永遠不嫌多。（瓦萊莉婭）
