id	name	name_en	name_zh-CN	name_zh-TW
1	決戦！戦士の大鎧	To Battle! Heavy Warrior Armor	决战！战士的大铠	決戰！戰士的大鎧
2	ザールブルグの錬金術士 ～受け継がれる思い～	The Alchemist of Salburg: Inherited Feelings	萨尔布鲁克的炼金术士 ～思念传承～	薩爾布魯克的鍊金術士～被繼承的意念～
3	300万DL記念	5M Worldwide DL Celebration	全球500万次下载纪念	全球500萬次下載紀念
4	決戦！ハロウィンぷに	Showdown! Halloween Puni	决战！万圣节噗尼	決戰！萬聖節噗尼
5	リディー＆スールの日常 〜ふたりが描く家族の思い出〜	Lydie & Suelle's Everyday Lives ~A Shared Canvas of Memories~	莉迪＆苏瑞的日常～两人细数家人的回忆～	莉迪＆蘇瑞的日常～兩人描繪的家族回憶～
6	忘却の賢者と秘密の楽園	Sage of Oblivion & the Secret Paradise	忘却的贤者与秘密的乐园	忘卻的賢者與秘密的樂園
7	ライザからの挑戦状	Ryza's Challenge	莱莎的挑战书	萊莎的挑戰書
8	星降る夜の贈りもの	Gifts on a Starry Night	繁星之夜的礼物	繁星灑落之夜的贈禮
9	マリーの招福大作戦！	Marie's Fortune Frenzy!	玛莉的招福大作战！	瑪莉的招福大作戰！
10	大量コールを手に入れろ！ゴールドぷにチャレンジ	Get a Ton of Cole! The Gold Puni Challenge	获得大量克尔吧！金噗尼挑战	來獲得大量克隆吧！挑戰金噗尼
11	二人のシャリーと母の願い	Two Shallies and a Mother's Wish	两个夏莉与母亲的心愿	兩個夏莉與母親的願望
12	週末！クッキーミッション	Weekend! Cookie Missions	周末！曲奇任务	週末！餅乾任務
13	乙女たちのチョコレートミックス	Valentine's Chocolate Mix	少女们的混合巧克力	少女們的綜合巧克力
14	アーランドの錬金術士 〜迷子の少女と雪の帰り道〜	The Alchemist of Arland: The Lost Girl & the Snowy Road Home	亚兰德之炼金术士 ～迷路的少女和皑皑回家路～	亞蘭德之鍊金術士 ～迷路少女與雪中歸途～
15	半周年前夜祭！調合ボーナスキャンペーン	Half-Year Anniversary Prelude! Synthesis Bonus Campaign	半周年前夜祭！调合奖励活动	半週年前夜祭！調合獎勵活動
16	アイテム大戦 第1弾	Item War: Part 1	道具大战 第1弹	道具大戰 第1彈
17	半周年記念プレゼントバトル	Half-Year Anniversary Present Battle	半周年纪念赠礼战斗	半週年紀念獻禮戰鬥
18	チャレンジバトル ジェロン	Challenge Battle: Geron	挑战战斗 杰隆	挑戰戰鬥 傑隆
20	チャレンジバトル ララ	Challenge Battle: Lara	挑战战斗 拉拉	挑戰戰鬥 拉拉
21	アイテム大戦 第2弾	Item War: Part 2	道具大战 第2弹	道具大戰 第2彈
22	チャレンジバトル 鴉	Challenge Battle: Crow	挑战战斗 鸦	挑戰戰鬥 烏鴉
23	アイテム大戦 第3弾	Item War: Part 3	道具大战 第3弹	道具大戰 第3彈
24	半周年記念 目指せ100回！調合チャレンジ	Half-Year Anniversary: Aim for 100! Synthesis Challenge	半周年纪念 冲击100次！调合挑战	半週年紀念 目標100次！調合挑戰
25	全員必修！マリオン先生の特別試験！	Mandatory for All! Ms. Marion's Special Exam!	全员必修！玛丽翁老师的特别考试！	全員必修！瑪麗翁老師的特別考試！
26	レスレリ学園 ～退学！？　いきなり大ピンチ～	Resleriana Academy - Expelled?! Suddenly in Big Trouble!	蕾斯莱莉娅娜学园 ～退学？！突如其来的危机～	蕾斯萊莉婭娜學園 ～退學！？　突如其來的巨大危機～
27	マリー先生の放課後ミッション！	Ms. Marie's After-School Missions!	玛莉老师的课外任务！	瑪莉老師的課後任務！
28	ザスキア先生の新入生歓迎ミッション！	Ms. Saskia's Welcome Missions for New Students!	萨丝琪亚老师的迎新任务！	薩絲琪亞老師的迎新任務！
29	アイテム大戦 〜学園錬金祭編〜	Item War – Academy Alchemy Festival Edition	道具大战 ～学园炼金庆典篇～	道具大戰 ～學園鍊金祭篇～
30	【初級】空まで届け！ロケットコンテスト！	[Easy] To the Skies! Rocket Contest!	【初级】触摸天空！火箭大赛！	【初級】衝向高空！火箭競賽！
31	【中級】天まで届け！ロケットコンテスト！	[Normal] To the Heavens! Rocket Contest!	【中级】直冲云霄！火箭大赛！	【中級】飛向天際！火箭競賽！
32	【上級】火山まで届け！ロケットコンテスト！	[Hard] To the Volcano! Rocket Contest!	【高级】直冲火山！火箭大赛！	【上級】奔向火山！火箭競賽！
33	【超級】宇宙まで届け！ロケットコンテスト！	[Elite] Shoot for the Stars! Rocket Contest!	【超级】直冲太空！火箭大赛！	【超級】飛向宇宙！火箭競賽！
34	レスレリ学園 ～激闘の錬金祭！～	Resleriana Academy - An Intense Alchemy Festival!	蕾斯莱莉娅娜学园 ～难解难分的炼金庆典！～	蕾斯萊莉婭娜學園 ～激戰的鍊金祭！～
35	レスレリ学園 ～影より見守りし君へ～	Resleriana Academy - To My Protector among the Shadows	蕾斯莱莉娅娜学园 ～致暗中守望的你～	蕾斯萊莉婭娜學園 ～致在暗處守護我的你～
36	温泉奪還作戦！ ～ととのいと癒しを求めて～	Operation: Take Back the Hot Springs! In Search of Clarity and Comfort	夺回温泉作战！ ～陶醉与治愈之旅～	奪回溫泉作戰！ ～追求通體舒暢與治癒～
37	ランターナ建国記念杯	Lantarna Founding Anniversary Cup	兰塔纳建国纪念杯	蘭塔納建國紀念盃
38	「アトリエ」シリーズ27周年記念！クッキーミッション	Atelier Series 27th Anniversary! Cookie Missions	《炼金工房》系列27周年纪念！曲奇任务	「鍊金工房」系列27週年紀念！餅乾任務
39	竜の涙は花と散る	The Dragon's Tears Fall Like Petals	龙之泪随花凋零	龍之淚如花凋零
40	花嫁修行ミッション！	Bridal Training Missions!	新娘修行任务！	新娘修行任務！
41	事件発生！　飛び出せオフィス！	Incident Alert! Dash Out of the Office!	事件发生！出动吧，公务员！	發生事件！奔出辦公室！
43	アトリエサマー2024 水着DEリゾート！	Atelier Summer 2024 Resort Swim Time!	炼金工房盛夏2024 泳装假日！	鍊金工房盛夏2024 身穿泳裝去度假！
44	アトリエサマー2024 ミッション	Atelier Summer 2024 Missions	炼金工房盛夏2024 任务	鍊金工房盛夏2024 任務
45	【初級】夜空を彩れ！花火大会！	[Beginner] Light Up the Night Sky! Fireworks Festival!	【初级】渲染夜空！烟花大会！	【初級】彩繪夜空吧！煙火大會！
46	【中級】夜空を飾れ！花火大会！	[Normal] Adorn the Night Sky! Fireworks Festival!	【中级】装点夜空！烟花大会！	【中級】妝點夜空吧！煙火大會！
47	【上級】夜空に輝け！花火大会！	[Hard] Sparkling Night Sky! Fireworks Festival!	【高级】闪耀夜空！烟花大会！	【上級】照亮夜空吧！煙火大會！
48	【超級】夜空に咲き誇れ！花火大会！	[Elite] Dazzling Night Sky! Fireworks Festival!	【超级】绽放于夜空！烟花大会！	【超級】在夜空綻放吧！煙火大會！
49	チャレンジバトル ヨハナ	Challenge Battle: Johanna	挑战战斗 约翰娜	挑戰戰鬥 約翰娜
50	アトリエサマー2024 ザクザク！　ビーチで宝探し！	Atelier Summer 2024: Treasure Hunt at the Beach!	炼金工房盛夏2024 沙砾腾腾！沙滩寻宝！	鍊金工房盛夏2024 沙沙作響！　在海灘尋寶！
51	１周年前夜祭ボスチャレンジ	1st Anniversary Prelude Boss Challenge	一周年前夜祭头目挑战	1週年前夜祭頭目挑戰
52	チャレンジバトル ララ	Challenge Battle: Lara	挑战战斗 拉拉	挑戰戰鬥 拉拉
53	チャレンジバトル アンチュ＆ワルター	Challenge Battle: Antje & Walther	挑战战斗 安洁＆瓦尔特	挑戰戰鬥 安潔＆瓦爾特
54	匠の逸品！　ララの品評会！	Craftsman's Masterpiece! Lara's Showcase!	匠心优作！拉拉的品评会！	專家的逸品！拉拉的品評會！
55	至高の逸品！　ララの品評会！	Supreme Masterpiece! Lara's Showcase!	极致优作！拉拉的品评会！	至高的逸品！拉拉的品評會！
56	1周年記念プレゼントバトル 第1弾	1st Anniversary Present Battle Part 1	1周年纪念赠礼战斗 第1弹	1週年紀念獻禮戰鬥 第1彈
57	1周年記念 ミッション	1st Anniversary Missions	1周年纪念 任务	1週年紀念 任務
58	チャレンジバトル ジェロン	Challenge Battle: Geron	挑战战斗 杰隆	挑戰戰鬥 傑隆
59	ボスチャレンジ ウェルテックス	Boss Challenge: Weltex	头目挑战 威尔特克斯	頭目挑戰 威爾特庫斯
60	1周年記念プレゼントバトル 第2弾	1st Anniversary Present Battle Part 2	1周年纪念赠礼战斗 第2弹	1週年紀念獻禮戰鬥 第2彈
61	爆裂！！ マリーからの試練	Explosion Time!! Marie's Trial	炸裂！！玛莉的试炼	爆裂！！瑪莉給予的試煉
62	1周年記念プレゼントバトル 第3弾	1st Anniversary Present Battle Part 3	1周年纪念赠礼战斗 第3弹	1週年紀念獻禮戰鬥 第3彈
63	チャレンジバトル 錬金党	Challenge Battle: Polar Night Alchemists	挑战战斗 炼金党	挑戰戰鬥 鍊金黨
64	四元の塔クリア応援ミッション	Elemental Tower Support Missions	四元之塔通关应援任务	四元之塔通關支援任務
65	旋風！！ユーディーからの試練	Whirlwind!! Judie's Trial	旋风！！优蒂的试炼	旋風！！優蒂給予的試煉
66	HALLOWEEN2024ミッション	Halloween 2025 Missions	HALLOWEEN2025任务	HALLOWEEN2025任務
67	ボスチャレンジ コズミックシェル	Boss Challenge: Cosmic Shell	头目挑战 宇宙壳	頭目挑戰 宇宙殼
68	渇きの中で咲く花たち	Flowers That Bloom in a Drought	渴望中绽放之花	在渴望中綻放的群花
69	混沌と規律の邂逅	Convergence of Chaos and Order	混沌和规则的邂逅	混沌與規律的邂逅
70	ブラッドの実地調査	Brad's Field Investigation	布莱德的实地调查	布萊德的實地調查
71	目指せハイスコア！ラムローストくんバトル	Aim for a High Score! Ram Roast Battle	目标是获得高分！烤羊肉之战	目標獲得高分！烤羊肉戰鬥
72	キラキラセキララ星誕祭！			
73	プレゼント奪還！　星誕祭バトル！			
74	縁結ぶ者　星照らす道			
75	謹賀新年！　お宝ダンジョン！			
76	年越し！煩悩撃退バトル！			
77	親友と歩む未来			
78	ライバルと競う未来			
79	あなたと夢見るトクベツ			
80	フナを釣り上げろ！アトリエ釣り大会！			
81	ツナを釣り上げろ！アトリエ釣り大会！			
82	あなたと冒険するトクベツ			
83	チャレンジバトルクヴァレルガ			
84	アイテム大戦 なんでも屋シトリンの挑戦状			
85	踏破せよ！連続バトル βば～じょん			
86	1.5周年記念プレゼントバトル			
